[
  {
    "id": "e80108c7aa4d",
    "source_url": "https://www.houthandelonline.nl/meranti-45x68-geschaafd",
    "name": "Timmerhout Meranti 45x68mm geschaafd",
    "description": "Vierzijdig geschaafd Meranti aftimmerhout is onbehandeld. Deze schaaflat van hardhoutsoort Meranti is geschikt voor het maken van meubels, een afwerkprofiel voor het wegwerken van kieren of voor constructiewerk.",
    "brand": "HouthandelOnline",
    "category": "Douglas hout > Toon alles in Douglas hout > Douglas hout palen > Douglas hout balken > Douglas hout latten en regels",
    "price": 60.62,
    "currency": "EUR",
    "price_raw": "€24,74/m1",
    "specs": {
      "raw": {
        "Kopmaat": "45x68 mm",
        "Dikte": "45 mm",
        "Breedte": "68",
        "Materiaal": "Meranti",
        "Toepassing": "Deze 4-zijden geschaafde Meranti lat is binnen toepasbaar als aftimmerlat of constructielat. Deze schaaflat kan toegepast worden om openingen af te dekken, voor het maken van meubels of als (achter)constructie of rasterwerk voor wanden, plafonds en ander constructiewerk"
      }
    },
    "images": [
      "https://www.houthandelonline.nl/cdn/resize-extended/el:true/rs:fill/w:1500/h:1068/extend:true/background:255:255:255/path/media/catalog/product/m/e/meranti-45x68-geschaafd-v_01_main.jpg"
    ],
    "rating": null,
    "review_count": null,
    "reviews_summary": null,
    "scraped_at": "2026-02-05T16:54:37.863166Z",
    "scrape_success": true,
    "scrape_errors": [],
    "embedding_text": "Product: Timmerhout Meranti 45x68mm geschaafd\nBrand: HouthandelOnline\nCategory: Douglas hout > Toon alles in Douglas hout > Douglas hout palen > Douglas hout balken > Douglas hout latten en regels\nDescription: Vierzijdig geschaafd Meranti aftimmerhout is onbehandeld. Deze schaaflat van hardhoutsoort Meranti is geschikt voor het maken van meubels, een afwerkprofiel voor het wegwerken van kieren of voor constructiewerk.\nSpecifications: Kopmaat: 45x68 mm, Dikte: 45 mm, Breedte: 68, Materiaal: Meranti, Toepassing: Deze 4-zijden geschaafde Meranti lat is binnen toepasbaar als aftimmerlat of constructielat. Deze schaaflat kan toegepast worden om openingen af te dekken, voor het maken van meubels of als (achter)constructie of rasterwerk voor wanden, plafonds en ander constructiewerk\nPrice: EUR 60.62"
  },
  {
    "id": "99706f99e9b1",
    "source_url": "https://www.houthandelonline.nl/meranti-45x140-geschaafd",
    "name": "Timmerhout Meranti 45x140mm geschaafd",
    "description": "Vierzijdig geschaafd Meranti aftimmerhout is onbehandeld. Deze schaaflat van hardhoutsoort Meranti is geschikt voor het maken van meubels, een afwerkprofiel voor het wegwerken van kieren of voor constructiewerk.",
    "brand": "HouthandelOnline",
    "category": "Douglas hout > Toon alles in Douglas hout > Douglas hout palen > Douglas hout balken > Douglas hout latten en regels",
    "price": 121.07,
    "currency": "EUR",
    "price_raw": "€49,42/m1",
    "specs": {
      "raw": {
        "Kopmaat": "45x140 mm",
        "Dikte": "45 mm",
        "Materiaal": "Meranti",
        "Toepassing": "Deze 4-zijden geschaafde Meranti lat is binnen toepasbaar als aftimmerlat of constructielat. Deze schaaflat kan toegepast worden om openingen af te dekken, voor het maken van meubels of als (achter)constructie of rasterwerk voor wanden, plafonds en ander constructiewerk"
      }
    },
    "images": [
      "https://www.houthandelonline.nl/cdn/resize-extended/el:true/rs:fill/w:1500/h:1068/extend:true/background:255:255:255/path/media/catalog/product/m/e/meranti-45x140-geschaafd-v_01_main.jpeg"
    ],
    "rating": null,
    "review_count": null,
    "reviews_summary": null,
    "scraped_at": "2026-02-05T16:54:37.863227Z",
    "scrape_success": true,
    "scrape_errors": [],
    "embedding_text": "Product: Timmerhout Meranti 45x140mm geschaafd\nBrand: HouthandelOnline\nCategory: Douglas hout > Toon alles in Douglas hout > Douglas hout palen > Douglas hout balken > Douglas hout latten en regels\nDescription: Vierzijdig geschaafd Meranti aftimmerhout is onbehandeld. Deze schaaflat van hardhoutsoort Meranti is geschikt voor het maken van meubels, een afwerkprofiel voor het wegwerken van kieren of voor constructiewerk.\nSpecifications: Kopmaat: 45x140 mm, Dikte: 45 mm, Materiaal: Meranti, Toepassing: Deze 4-zijden geschaafde Meranti lat is binnen toepasbaar als aftimmerlat of constructielat. Deze schaaflat kan toegepast worden om openingen af te dekken, voor het maken van meubels of als (achter)constructie of rasterwerk voor wanden, plafonds en ander constructiewerk\nPrice: EUR 121.07"
  },
  {
    "id": "ff7ee96c1d73",
    "source_url": "https://www.houthandelonline.nl/meranti-28x90-geschaafd",
    "name": "Timmerhout Meranti 28x90mm geschaafd",
    "description": "Vierzijdig geschaafd Meranti aftimmerhout is onbehandeld. Deze schaaflat van hardhoutsoort Meranti is geschikt voor het maken van meubels, een afwerkprofiel voor het wegwerken van kieren of voor constructiewerk.",
    "brand": "HouthandelOnline",
    "category": "Douglas hout > Toon alles in Douglas hout > Douglas hout palen > Douglas hout balken > Douglas hout latten en regels",
    "price": 45.99,
    "currency": "EUR",
    "price_raw": "€16,72/m1",
    "specs": {
      "raw": {
        "Kopmaat": "28x90 mm",
        "Dikte": "28 mm",
        "Breedte": "90",
        "Materiaal": "Meranti",
        "Toepassing": "Deze 4-zijden geschaafde Meranti lat is binnen toepasbaar als aftimmerlat of constructielat. Deze schaaflat kan toegepast worden om openingen af te dekken, voor het maken van meubels of als (achter)constructie of rasterwerk voor wanden, plafonds en ander constructiewerk"
      }
    },
    "images": [
      "https://www.houthandelonline.nl/cdn/resize-extended/el:true/rs:fill/w:1500/h:1068/extend:true/background:255:255:255/path/media/catalog/product/m/e/meranti-28x90-geschaafd-v_01_main.jpg"
    ],
    "rating": null,
    "review_count": null,
    "reviews_summary": null,
    "scraped_at": "2026-02-05T16:54:37.863246Z",
    "scrape_success": true,
    "scrape_errors": [],
    "embedding_text": "Product: Timmerhout Meranti 28x90mm geschaafd\nBrand: HouthandelOnline\nCategory: Douglas hout > Toon alles in Douglas hout > Douglas hout palen > Douglas hout balken > Douglas hout latten en regels\nDescription: Vierzijdig geschaafd Meranti aftimmerhout is onbehandeld. Deze schaaflat van hardhoutsoort Meranti is geschikt voor het maken van meubels, een afwerkprofiel voor het wegwerken van kieren of voor constructiewerk.\nSpecifications: Kopmaat: 28x90 mm, Dikte: 28 mm, Breedte: 90, Materiaal: Meranti, Toepassing: Deze 4-zijden geschaafde Meranti lat is binnen toepasbaar als aftimmerlat of constructielat. Deze schaaflat kan toegepast worden om openingen af te dekken, voor het maken van meubels of als (achter)constructie of rasterwerk voor wanden, plafonds en ander constructiewerk\nPrice: EUR 45.99"
  },
  {
    "id": "6e97f2428af1",
    "source_url": "https://www.houthandelonline.nl/meranti-19x140-geschaafd",
    "name": "Timmerhout Meranti 19x140mm geschaafd",
    "description": "Vierzijdig geschaafd Meranti aftimmerhout is onbehandeld. Deze schaaflat van hardhoutsoort Meranti is geschikt voor het maken van meubels, een afwerkprofiel voor het wegwerken van kieren of voor constructiewerk.",
    "brand": "HouthandelOnline",
    "category": "Douglas hout > Toon alles in Douglas hout > Douglas hout palen > Douglas hout balken > Douglas hout latten en regels",
    "price": 56.64,
    "currency": "EUR",
    "price_raw": "€20,60/m1",
    "specs": {
      "raw": {
        "Kopmaat": "19x140 mm",
        "Dikte": "19 mm",
        "Breedte": "140",
        "Materiaal": "Meranti",
        "Toepassing": "Vier zijden geschaafd Meranti hout is binnen toepasbaar voor het afdekken van openingen, voor het maken van meubels of voor constructiewerk. Bij een juiste"
      }
    },
    "images": [
      "https://www.houthandelonline.nl/cdn/resize-extended/el:true/rs:fill/w:1500/h:1068/extend:true/background:255:255:255/path/media/catalog/product/m/e/meranti-19x140-geschaafd-v_01_main.jpeg"
    ],
    "rating": null,
    "review_count": null,
    "reviews_summary": null,
    "scraped_at": "2026-02-05T16:54:37.863258Z",
    "scrape_success": true,
    "scrape_errors": [],
    "embedding_text": "Product: Timmerhout Meranti 19x140mm geschaafd\nBrand: HouthandelOnline\nCategory: Douglas hout > Toon alles in Douglas hout > Douglas hout palen > Douglas hout balken > Douglas hout latten en regels\nDescription: Vierzijdig geschaafd Meranti aftimmerhout is onbehandeld. Deze schaaflat van hardhoutsoort Meranti is geschikt voor het maken van meubels, een afwerkprofiel voor het wegwerken van kieren of voor constructiewerk.\nSpecifications: Kopmaat: 19x140 mm, Dikte: 19 mm, Breedte: 140, Materiaal: Meranti, Toepassing: Vier zijden geschaafd Meranti hout is binnen toepasbaar voor het afdekken van openingen, voor het maken van meubels of voor constructiewerk. Bij een juiste\nPrice: EUR 56.64"
  },
  {
    "id": "ce600d8ed8b4",
    "source_url": "https://www.houthandelonline.nl/meranti-19x120-geschaafd",
    "name": "Timmerhout Meranti 19x120mm geschaafd",
    "description": "Vierzijdig geschaafd Meranti aftimmerhout is onbehandeld. Deze schaaflat van hardhoutsoort Meranti is geschikt voor het maken van meubels, een afwerkprofiel voor het wegwerken van kieren of voor constructiewerk.",
    "brand": "HouthandelOnline",
    "category": "Douglas hout > Toon alles in Douglas hout > Douglas hout palen > Douglas hout balken > Douglas hout latten en regels",
    "price": 42.23,
    "currency": "EUR",
    "price_raw": "€15,36/m1",
    "specs": {
      "raw": {
        "Kopmaat": "19x120 mm",
        "Dikte": "19 mm",
        "Breedte": "120",
        "Materiaal": "Meranti",
        "Toepassing": "Vier zijden geschaafd Meranti hout is binnen toepasbaar voor het afdekken van openingen, voor het maken van meubels of voor constructiewerk. Bij een juiste"
      }
    },
    "images": [
      "https://www.houthandelonline.nl/cdn/resize-extended/el:true/rs:fill/w:1500/h:1068/extend:true/background:255:255:255/path/media/catalog/product/m/e/meranti-19x120-geschaafd-v_01_main.jpeg"
    ],
    "rating": null,
    "review_count": null,
    "reviews_summary": null,
    "scraped_at": "2026-02-05T16:54:37.863268Z",
    "scrape_success": true,
    "scrape_errors": [],
    "embedding_text": "Product: Timmerhout Meranti 19x120mm geschaafd\nBrand: HouthandelOnline\nCategory: Douglas hout > Toon alles in Douglas hout > Douglas hout palen > Douglas hout balken > Douglas hout latten en regels\nDescription: Vierzijdig geschaafd Meranti aftimmerhout is onbehandeld. Deze schaaflat van hardhoutsoort Meranti is geschikt voor het maken van meubels, een afwerkprofiel voor het wegwerken van kieren of voor constructiewerk.\nSpecifications: Kopmaat: 19x120 mm, Dikte: 19 mm, Breedte: 120, Materiaal: Meranti, Toepassing: Vier zijden geschaafd Meranti hout is binnen toepasbaar voor het afdekken van openingen, voor het maken van meubels of voor constructiewerk. Bij een juiste\nPrice: EUR 42.23"
  },
  {
    "id": "28e08d9d402a",
    "source_url": "https://www.houthandelonline.nl/meranti-28x45-geschaafd-6st",
    "name": "Timmerhout Meranti 28x45mm geschaafd per 6 stuks",
    "description": "Vierzijdig geschaafd Meranti aftimmerhout is onbehandeld. Deze schaaflat van hardhoutsoort Meranti is geschikt voor het maken van meubels, een afwerkprofiel voor het wegwerken van kieren of voor constructiewerk. Verpakt per 6 stuks.",
    "brand": "HouthandelOnline",
    "category": "Douglas hout > Toon alles in Douglas hout > Douglas hout palen > Douglas hout balken > Douglas hout latten en regels",
    "price": 134.37,
    "currency": "EUR",
    "price_raw": "€8,14/m1",
    "specs": {
      "raw": {
        "Kopmaat": "28x45 mm",
        "Dikte": "28 mm",
        "Breedte": "45",
        "Materiaal": "Meranti",
        "Toepassing": "Deze 4-zijden geschaafde Meranti lat is binnen toepasbaar als aftimmerlat of constructielat. Deze schaaflat kan toegepast worden om openingen af te dekken, voor het maken van meubels of als (achter)constructie of rasterwerk voor wanden, plafonds en ander constructiewerk"
      }
    },
    "images": [
      "https://www.houthandelonline.nl/cdn/resize-extended/el:true/rs:fill/w:1500/h:1068/extend:true/background:255:255:255/path/media/catalog/product/m/e/meranti-28x45-geschaafd-6st-v_01_main.jpg"
    ],
    "rating": null,
    "review_count": null,
    "reviews_summary": null,
    "scraped_at": "2026-02-05T16:54:37.863278Z",
    "scrape_success": true,
    "scrape_errors": [],
    "embedding_text": "Product: Timmerhout Meranti 28x45mm geschaafd per 6 stuks\nBrand: HouthandelOnline\nCategory: Douglas hout > Toon alles in Douglas hout > Douglas hout palen > Douglas hout balken > Douglas hout latten en regels\nDescription: Vierzijdig geschaafd Meranti aftimmerhout is onbehandeld. Deze schaaflat van hardhoutsoort Meranti is geschikt voor het maken van meubels, een afwerkprofiel voor het wegwerken van kieren of voor constructiewerk. Verpakt per 6 stuks.\nSpecifications: Kopmaat: 28x45 mm, Dikte: 28 mm, Breedte: 45, Materiaal: Meranti, Toepassing: Deze 4-zijden geschaafde Meranti lat is binnen toepasbaar als aftimmerlat of constructielat. Deze schaaflat kan toegepast worden om openingen af te dekken, voor het maken van meubels of als (achter)constructie of rasterwerk voor wanden, plafonds en ander constructiewerk\nPrice: EUR 134.37"
  },
  {
    "id": "f19c3dc25cd9",
    "source_url": "https://www.houthandelonline.nl/meranti-45x90-geschaafd",
    "name": "Timmerhout Meranti 45x90mm geschaafd",
    "description": "Vierzijdig geschaafd Meranti aftimmerhout is onbehandeld. Deze schaaflat van hardhoutsoort Meranti is geschikt voor het maken van meubels, een afwerkprofiel voor het wegwerken van kieren of voor constructiewerk.",
    "brand": "HouthandelOnline",
    "category": "Douglas hout > Toon alles in Douglas hout > Douglas hout palen > Douglas hout balken > Douglas hout latten en regels",
    "price": 90.34,
    "currency": "EUR",
    "price_raw": "€32,85/m1",
    "specs": {
      "raw": {
        "Levertijd": "2-7 werkdagen",
        "Kopmaat": "45x90 mm",
        "Dikte": "45 mm",
        "Breedte": "90",
        "Materiaal": "Meranti",
        "Toepassing": "Deze 4-zijden geschaafde Meranti lat is binnen toepasbaar als aftimmerlat of constructielat. Deze schaaflat kan toegepast worden om openingen af te dekken, voor het maken van meubels of als (achter)constructie of rasterwerk voor wanden, plafonds en ander constructiewerk"
      }
    },
    "images": [
      "https://www.houthandelonline.nl/cdn/resize-extended/el:true/rs:fill/w:1500/h:1068/extend:true/background:255:255:255/path/media/catalog/product/m/e/meranti-45x90-geschaafd-v_01_main.jpg"
    ],
    "rating": null,
    "review_count": null,
    "reviews_summary": null,
    "scraped_at": "2026-02-05T16:54:37.863286Z",
    "scrape_success": true,
    "scrape_errors": [],
    "embedding_text": "Product: Timmerhout Meranti 45x90mm geschaafd\nBrand: HouthandelOnline\nCategory: Douglas hout > Toon alles in Douglas hout > Douglas hout palen > Douglas hout balken > Douglas hout latten en regels\nDescription: Vierzijdig geschaafd Meranti aftimmerhout is onbehandeld. Deze schaaflat van hardhoutsoort Meranti is geschikt voor het maken van meubels, een afwerkprofiel voor het wegwerken van kieren of voor constructiewerk.\nSpecifications: Levertijd: 2-7 werkdagen, Kopmaat: 45x90 mm, Dikte: 45 mm, Breedte: 90, Materiaal: Meranti, Toepassing: Deze 4-zijden geschaafde Meranti lat is binnen toepasbaar als aftimmerlat of constructielat. Deze schaaflat kan toegepast worden om openingen af te dekken, voor het maken van meubels of als (achter)constructie of rasterwerk voor wanden, plafonds en ander constructiewerk\nPrice: EUR 90.34"
  },
  {
    "id": "712862c02f23",
    "source_url": "https://www.houthandelonline.nl/meranti-45x120-geschaafd",
    "name": "Timmerhout Meranti 45x120mm geschaafd",
    "description": "Vierzijdig geschaafd Meranti aftimmerhout is onbehandeld. Deze schaaflat van hardhoutsoort Meranti is geschikt voor het maken van meubels, een afwerkprofiel voor het wegwerken van kieren of voor constructiewerk.",
    "brand": "HouthandelOnline",
    "category": "Douglas hout > Toon alles in Douglas hout > Douglas hout palen > Douglas hout balken > Douglas hout latten en regels",
    "price": 110.47,
    "currency": "EUR",
    "price_raw": "€40,17/m1",
    "specs": {
      "raw": {
        "Levertijd": "2-7 werkdagen",
        "Kopmaat": "45x120 mm",
        "Dikte": "45 mm",
        "Breedte": "120",
        "Materiaal": "Meranti",
        "Toepassing": "Deze 4-zijden geschaafde Meranti lat is binnen toepasbaar als aftimmerlat of constructielat. Deze schaaflat kan toegepast worden om openingen af te dekken, voor het maken van meubels of als (achter)constructie of rasterwerk voor wanden, plafonds en ander constructiewerk"
      }
    },
    "images": [
      "https://www.houthandelonline.nl/cdn/resize-extended/el:true/rs:fill/w:1500/h:1068/extend:true/background:255:255:255/path/media/catalog/product/m/e/meranti-45x120-geschaafd-v_01_main.jpg"
    ],
    "rating": null,
    "review_count": null,
    "reviews_summary": null,
    "scraped_at": "2026-02-05T16:54:37.863295Z",
    "scrape_success": true,
    "scrape_errors": [],
    "embedding_text": "Product: Timmerhout Meranti 45x120mm geschaafd\nBrand: HouthandelOnline\nCategory: Douglas hout > Toon alles in Douglas hout > Douglas hout palen > Douglas hout balken > Douglas hout latten en regels\nDescription: Vierzijdig geschaafd Meranti aftimmerhout is onbehandeld. Deze schaaflat van hardhoutsoort Meranti is geschikt voor het maken van meubels, een afwerkprofiel voor het wegwerken van kieren of voor constructiewerk.\nSpecifications: Levertijd: 2-7 werkdagen, Kopmaat: 45x120 mm, Dikte: 45 mm, Breedte: 120, Materiaal: Meranti, Toepassing: Deze 4-zijden geschaafde Meranti lat is binnen toepasbaar als aftimmerlat of constructielat. Deze schaaflat kan toegepast worden om openingen af te dekken, voor het maken van meubels of als (achter)constructie of rasterwerk voor wanden, plafonds en ander constructiewerk\nPrice: EUR 110.47"
  },
  {
    "id": "a290f7f49543",
    "source_url": "https://www.houthandelonline.nl/meranti-9x90-geschaafd-6st",
    "name": "Timmerhout Meranti 9x90mm geschaafd per 6 stuks",
    "description": "Vierzijdig geschaafd Meranti aftimmerhout is onbehandeld. Deze schaaflat van hardhoutsoort Meranti is geschikt voor het maken van meubels, een afwerkprofiel voor het wegwerken van kieren of voor constructiewerk. Verpakt per 6 stuks.",
    "brand": "HouthandelOnline",
    "category": "Douglas hout > Toon alles in Douglas hout > Douglas hout palen > Douglas hout balken > Douglas hout latten en regels",
    "price": 121.99,
    "currency": "EUR",
    "price_raw": "€7,39/m1",
    "specs": {
      "raw": {
        "Levertijd": "2-7 werkdagen",
        "Kopmaat": "9x90 mm",
        "Dikte": "9 mm",
        "Breedte": "90",
        "Materiaal": "Meranti",
        "Toepassing": "Deze 4-zijden geschaafde Meranti lat is binnen toepasbaar als aftimmerlat of constructielat. Deze schaaflat kan toegepast worden om openingen af te dekken, voor het maken van meubels of als (achter)constructie of rasterwerk voor wanden, plafonds en ander constructiewerk. Bij een juiste"
      }
    },
    "images": [
      "https://www.houthandelonline.nl/cdn/resize-extended/el:true/rs:fill/w:1500/h:1068/extend:true/background:255:255:255/path/media/catalog/product/m/e/meranti-9x90-geschaafd-6st-v_01_main.jpg"
    ],
    "rating": null,
    "review_count": null,
    "reviews_summary": null,
    "scraped_at": "2026-02-05T16:54:37.863304Z",
    "scrape_success": true,
    "scrape_errors": [],
    "embedding_text": "Product: Timmerhout Meranti 9x90mm geschaafd per 6 stuks\nBrand: HouthandelOnline\nCategory: Douglas hout > Toon alles in Douglas hout > Douglas hout palen > Douglas hout balken > Douglas hout latten en regels\nDescription: Vierzijdig geschaafd Meranti aftimmerhout is onbehandeld. Deze schaaflat van hardhoutsoort Meranti is geschikt voor het maken van meubels, een afwerkprofiel voor het wegwerken van kieren of voor constructiewerk. Verpakt per 6 stuks.\nSpecifications: Levertijd: 2-7 werkdagen, Kopmaat: 9x90 mm, Dikte: 9 mm, Breedte: 90, Materiaal: Meranti, Toepassing: Deze 4-zijden geschaafde Meranti lat is binnen toepasbaar als aftimmerlat of constructielat. Deze schaaflat kan toegepast worden om openingen af te dekken, voor het maken van meubels of als (achter)constructie of rasterwerk voor wanden, plafonds en ander constructiewerk. Bij een juiste\nPrice: EUR 121.99"
  },
  {
    "id": "7dd6309f0b6f",
    "source_url": "https://www.houthandelonline.nl/meranti-9x45-geschaafd-6st",
    "name": "Timmerhout Meranti 9x45mm geschaafd per 6 stuks",
    "description": "Vierzijdig geschaafd Meranti aftimmerhout is onbehandeld. Deze schaaflat van hardhoutsoort Meranti is geschikt voor het maken van meubels, een afwerkprofiel voor het wegwerken van kieren of voor constructiewerk. Verpakt per 6 stuks.",
    "brand": "HouthandelOnline",
    "category": "Douglas hout > Toon alles in Douglas hout > Douglas hout palen > Douglas hout balken > Douglas hout latten en regels",
    "price": 70.48,
    "currency": "EUR",
    "price_raw": "€4,27/m1",
    "specs": {
      "raw": {
        "Levertijd": "2-7 werkdagen",
        "Kopmaat": "9x45 mm",
        "Dikte": "9 mm",
        "Breedte": "45",
        "Materiaal": "Meranti",
        "Toepassing": "Deze 4-zijden geschaafde Meranti lat is binnen toepasbaar als aftimmerlat of constructielat. Deze schaaflat kan toegepast worden om openingen af te dekken, voor het maken van meubels of als (achter)constructie of rasterwerk voor wanden, plafonds en ander constructiewerk. Bij een juiste"
      }
    },
    "images": [
      "https://www.houthandelonline.nl/cdn/resize-extended/el:true/rs:fill/w:1500/h:1068/extend:true/background:255:255:255/path/media/catalog/product/m/e/meranti-9x45-geschaafd-6st-v_01_main.jpg"
    ],
    "rating": null,
    "review_count": null,
    "reviews_summary": null,
    "scraped_at": "2026-02-05T16:54:37.863314Z",
    "scrape_success": true,
    "scrape_errors": [],
    "embedding_text": "Product: Timmerhout Meranti 9x45mm geschaafd per 6 stuks\nBrand: HouthandelOnline\nCategory: Douglas hout > Toon alles in Douglas hout > Douglas hout palen > Douglas hout balken > Douglas hout latten en regels\nDescription: Vierzijdig geschaafd Meranti aftimmerhout is onbehandeld. Deze schaaflat van hardhoutsoort Meranti is geschikt voor het maken van meubels, een afwerkprofiel voor het wegwerken van kieren of voor constructiewerk. Verpakt per 6 stuks.\nSpecifications: Levertijd: 2-7 werkdagen, Kopmaat: 9x45 mm, Dikte: 9 mm, Breedte: 45, Materiaal: Meranti, Toepassing: Deze 4-zijden geschaafde Meranti lat is binnen toepasbaar als aftimmerlat of constructielat. Deze schaaflat kan toegepast worden om openingen af te dekken, voor het maken van meubels of als (achter)constructie of rasterwerk voor wanden, plafonds en ander constructiewerk. Bij een juiste\nPrice: EUR 70.48"
  },
  {
    "id": "0a93e50ce420",
    "source_url": "https://www.houthandelonline.nl/meranti-45x45-geschaafd",
    "name": "Timmerhout Meranti 45x45mm geschaafd",
    "description": "Vierzijdig geschaafd Meranti aftimmerhout is onbehandeld. Deze schaaflat van hardhoutsoort Meranti is geschikt voor het maken van meubels, een afwerkprofiel voor het wegwerken van kieren of voor constructiewerk.",
    "brand": "HouthandelOnline",
    "category": "Douglas hout > Toon alles in Douglas hout > Douglas hout palen > Douglas hout balken > Douglas hout latten en regels",
    "price": 44.82,
    "currency": "EUR",
    "price_raw": "€16,30/m1",
    "specs": {
      "raw": {
        "Levertijd": "2-7 werkdagen",
        "Kopmaat": "45x45 mm",
        "Dikte": "45 mm",
        "Breedte": "45",
        "Materiaal": "Meranti",
        "Toepassing": "Deze 4-zijden geschaafde Meranti lat is binnen toepasbaar als aftimmerlat of constructielat. Deze schaaflat kan toegepast worden om openingen af te dekken, voor het maken van meubels of als (achter)constructie of rasterwerk voor wanden, plafonds en ander constructiewerk"
      }
    },
    "images": [
      "https://www.houthandelonline.nl/cdn/resize-extended/el:true/rs:fill/w:1500/h:1068/extend:true/background:255:255:255/path/media/catalog/product/m/e/meranti-45x45-geschaafd-v_01_main.jpg"
    ],
    "rating": null,
    "review_count": null,
    "reviews_summary": null,
    "scraped_at": "2026-02-05T16:54:37.863323Z",
    "scrape_success": true,
    "scrape_errors": [],
    "embedding_text": "Product: Timmerhout Meranti 45x45mm geschaafd\nBrand: HouthandelOnline\nCategory: Douglas hout > Toon alles in Douglas hout > Douglas hout palen > Douglas hout balken > Douglas hout latten en regels\nDescription: Vierzijdig geschaafd Meranti aftimmerhout is onbehandeld. Deze schaaflat van hardhoutsoort Meranti is geschikt voor het maken van meubels, een afwerkprofiel voor het wegwerken van kieren of voor constructiewerk.\nSpecifications: Levertijd: 2-7 werkdagen, Kopmaat: 45x45 mm, Dikte: 45 mm, Breedte: 45, Materiaal: Meranti, Toepassing: Deze 4-zijden geschaafde Meranti lat is binnen toepasbaar als aftimmerlat of constructielat. Deze schaaflat kan toegepast worden om openingen af te dekken, voor het maken van meubels of als (achter)constructie of rasterwerk voor wanden, plafonds en ander constructiewerk\nPrice: EUR 44.82"
  },
  {
    "id": "08f6dadec090",
    "source_url": "https://www.houthandelonline.nl/meranti-28x140-geschaafd",
    "name": "Timmerhout Meranti 28x140mm geschaafd",
    "description": "Vierzijdig geschaafd Meranti aftimmerhout is onbehandeld. Timmerhout van hardhoutsoort Meranti is geschikt voor het maken van meubels, geschikt als afwerkprofiel of voor constructiewerk.",
    "brand": "HouthandelOnline",
    "category": "Douglas hout > Toon alles in Douglas hout > Douglas hout palen > Douglas hout balken > Douglas hout latten en regels",
    "price": 78.3,
    "currency": "EUR",
    "price_raw": "€28,47/m1",
    "specs": {
      "raw": {
        "Levertijd": "2-7 werkdagen",
        "Kopmaat": "28x140 mm",
        "Dikte": "28 mm",
        "Breedte": "140",
        "Materiaal": "Meranti",
        "Toepassing": "Vier zijden geschaafd Meranti hout is binnen toepasbaar voor het afdekken van openingen, voor het maken van meubels of voor constructiewerk"
      }
    },
    "images": [
      "https://www.houthandelonline.nl/cdn/resize-extended/el:true/rs:fill/w:1500/h:1068/extend:true/background:255:255:255/path/media/catalog/product/m/e/meranti-28x140-geschaafd-v_01_main.jpg"
    ],
    "rating": null,
    "review_count": null,
    "reviews_summary": null,
    "scraped_at": "2026-02-05T16:54:37.863333Z",
    "scrape_success": true,
    "scrape_errors": [],
    "embedding_text": "Product: Timmerhout Meranti 28x140mm geschaafd\nBrand: HouthandelOnline\nCategory: Douglas hout > Toon alles in Douglas hout > Douglas hout palen > Douglas hout balken > Douglas hout latten en regels\nDescription: Vierzijdig geschaafd Meranti aftimmerhout is onbehandeld. Timmerhout van hardhoutsoort Meranti is geschikt voor het maken van meubels, geschikt als afwerkprofiel of voor constructiewerk.\nSpecifications: Levertijd: 2-7 werkdagen, Kopmaat: 28x140 mm, Dikte: 28 mm, Breedte: 140, Materiaal: Meranti, Toepassing: Vier zijden geschaafd Meranti hout is binnen toepasbaar voor het afdekken van openingen, voor het maken van meubels of voor constructiewerk\nPrice: EUR 78.3"
  },
  {
    "id": "7ef9b2304898",
    "source_url": "https://www.houthandelonline.nl/meranti-28x120-geschaafd",
    "name": "Timmerhout Meranti 28x120mm geschaafd",
    "description": "Vierzijdig geschaafd Meranti aftimmerhout is onbehandeld. Timmerhout van hardhoutsoort Meranti is geschikt voor het maken van meubels, geschikt als afwerkprofiel of voor constructiewerk.",
    "brand": "HouthandelOnline",
    "category": "Douglas hout > Toon alles in Douglas hout > Douglas hout palen > Douglas hout balken > Douglas hout latten en regels",
    "price": 57.6,
    "currency": "EUR",
    "price_raw": "€20,94/m1",
    "specs": {
      "raw": {
        "Kopmaat": "28x120 mm",
        "Dikte": "28 mm",
        "Breedte": "120",
        "Materiaal": "Meranti",
        "Toepassing": "Vier zijden geschaafd Meranti hout is binnen toepasbaar voor het afdekken van openingen, voor het maken van meubels of voor constructiewerk"
      }
    },
    "images": [
      "https://www.houthandelonline.nl/cdn/resize-extended/el:true/rs:fill/w:1500/h:1068/extend:true/background:255:255:255/path/media/catalog/product/m/e/meranti-28x120-geschaafd-v_01_main.jpeg"
    ],
    "rating": null,
    "review_count": null,
    "reviews_summary": null,
    "scraped_at": "2026-02-05T16:54:37.863342Z",
    "scrape_success": true,
    "scrape_errors": [],
    "embedding_text": "Product: Timmerhout Meranti 28x120mm geschaafd\nBrand: HouthandelOnline\nCategory: Douglas hout > Toon alles in Douglas hout > Douglas hout palen > Douglas hout balken > Douglas hout latten en regels\nDescription: Vierzijdig geschaafd Meranti aftimmerhout is onbehandeld. Timmerhout van hardhoutsoort Meranti is geschikt voor het maken van meubels, geschikt als afwerkprofiel of voor constructiewerk.\nSpecifications: Kopmaat: 28x120 mm, Dikte: 28 mm, Breedte: 120, Materiaal: Meranti, Toepassing: Vier zijden geschaafd Meranti hout is binnen toepasbaar voor het afdekken van openingen, voor het maken van meubels of voor constructiewerk\nPrice: EUR 57.6"
  },
  {
    "id": "be9617d4b912",
    "source_url": "https://www.houthandelonline.nl/mdf-overzetplint-vochtw-18x90-4st",
    "name": "Overzetplint MDF 18x90mm (12x60mm uitsparing) geschaafd vochtwerend wit voorgelakt per 4 stuks",
    "description": "Deze holle MDF V313 overzetplinten zijn wit voorgelakt, hebben een afgeronde hoek en zijn vochtwerend. Deze rechte opzetplint kan eenvoudig over een bestaande plint heen geplaatst worden of biedt een grote uitsparing voor het wegwerken van veel kabels. Afmetingen uitsparing: 12x60mm. Verpakt per 4 stuks.",
    "brand": "HouthandelOnline",
    "category": "Douglas hout > Toon alles in Douglas hout > Douglas hout palen > Douglas hout balken > Douglas hout latten en regels",
    "price": 63.3,
    "currency": "EUR",
    "price_raw": "€6,49/m1",
    "specs": {
      "raw": {
        "Levertijd": "2-7 werkdagen",
        "Kopmaat": "18x90 mm",
        "Dikte": "18 mm",
        "Breedte": "90",
        "Materiaal": "MDF"
      }
    },
    "images": [
      "https://www.houthandelonline.nl/cdn/resize-extended/el:true/rs:fill/w:1500/h:1068/extend:true/background:255:255:255/path/media/catalog/product/m/d/mdf-overzetplint-vochtw-18x90-4st-v_01_main.jpg",
      "https://www.houthandelonline.nl/cdn/resize-extended/el:true/rs:fill/w:1500/h:1068/extend:true/background:255:255:255/path/media/catalog/product/m/d/mdf-overzetplint-vochtw-18x90-4st-v_02_view.jpg"
    ],
    "rating": null,
    "review_count": null,
    "reviews_summary": null,
    "scraped_at": "2026-02-05T16:54:37.863351Z",
    "scrape_success": true,
    "scrape_errors": [],
    "embedding_text": "Product: Overzetplint MDF 18x90mm (12x60mm uitsparing) geschaafd vochtwerend wit voorgelakt per 4 stuks\nBrand: HouthandelOnline\nCategory: Douglas hout > Toon alles in Douglas hout > Douglas hout palen > Douglas hout balken > Douglas hout latten en regels\nDescription: Deze holle MDF V313 overzetplinten zijn wit voorgelakt, hebben een afgeronde hoek en zijn vochtwerend. Deze rechte opzetplint kan eenvoudig over een bestaande plint heen geplaatst worden of biedt een grote uitsparing voor het wegwerken van veel kabels. Afmetingen uitsparing: 12x60mm. Verpakt per 4 stuks.\nSpecifications: Levertijd: 2-7 werkdagen, Kopmaat: 18x90 mm, Dikte: 18 mm, Breedte: 90, Materiaal: MDF\nPrice: EUR 63.3"
  },
  {
    "id": "55307e8c6e2f",
    "source_url": "https://www.houthandelonline.nl/meranti-9x68-geschaafd-6st",
    "name": "Timmerhout Meranti 9x68mm geschaafd per 6 stuks",
    "description": "Vierzijdig geschaafd Meranti aftimmerhout is onbehandeld. Deze schaaflat van hardhoutsoort Meranti is geschikt voor het maken van meubels, een afwerkprofiel voor het wegwerken van kieren of voor constructiewerk. Verpakt per 6 stuks.",
    "brand": "HouthandelOnline",
    "category": "Douglas hout > Toon alles in Douglas hout > Douglas hout palen > Douglas hout balken > Douglas hout latten en regels",
    "price": 94.44,
    "currency": "EUR",
    "price_raw": "€5,72/m1",
    "specs": {
      "raw": {
        "Kopmaat": "9x68 mm",
        "Dikte": "9 mm",
        "Breedte": "68",
        "Materiaal": "Meranti",
        "Toepassing": "Deze 4-zijden geschaafde Meranti lat is binnen toepasbaar als aftimmerlat of constructielat. Deze schaaflat kan toegepast worden om openingen af te dekken, voor het maken van meubels of als (achter)constructie of rasterwerk voor wanden, plafonds en ander constructiewerk. Bij een juiste"
      }
    },
    "images": [
      "https://www.houthandelonline.nl/cdn/resize-extended/el:true/rs:fill/w:1500/h:1068/extend:true/background:255:255:255/path/media/catalog/product/m/e/meranti-9x68-geschaafd-6st-v_01_main.jpeg"
    ],
    "rating": null,
    "review_count": null,
    "reviews_summary": null,
    "scraped_at": "2026-02-05T16:54:37.863360Z",
    "scrape_success": true,
    "scrape_errors": [],
    "embedding_text": "Product: Timmerhout Meranti 9x68mm geschaafd per 6 stuks\nBrand: HouthandelOnline\nCategory: Douglas hout > Toon alles in Douglas hout > Douglas hout palen > Douglas hout balken > Douglas hout latten en regels\nDescription: Vierzijdig geschaafd Meranti aftimmerhout is onbehandeld. Deze schaaflat van hardhoutsoort Meranti is geschikt voor het maken van meubels, een afwerkprofiel voor het wegwerken van kieren of voor constructiewerk. Verpakt per 6 stuks.\nSpecifications: Kopmaat: 9x68 mm, Dikte: 9 mm, Breedte: 68, Materiaal: Meranti, Toepassing: Deze 4-zijden geschaafde Meranti lat is binnen toepasbaar als aftimmerlat of constructielat. Deze schaaflat kan toegepast worden om openingen af te dekken, voor het maken van meubels of als (achter)constructie of rasterwerk voor wanden, plafonds en ander constructiewerk. Bij een juiste\nPrice: EUR 94.44"
  },
  {
    "id": "4265b0c5d397",
    "source_url": "https://www.houthandelonline.nl/meranti-9x18-geschaafd-6st",
    "name": "Timmerhout Meranti 9x18mm geschaafd per 6 stuks",
    "description": "Vierzijdig geschaafd Meranti aftimmerhout is onbehandeld. Deze schaaflat van hardhoutsoort Meranti is geschikt voor het maken van meubels, een afwerkprofiel voor het wegwerken van kieren of voor constructiewerk. Verpakt per 6 stuks.",
    "brand": "HouthandelOnline",
    "category": "Douglas hout > Toon alles in Douglas hout > Douglas hout palen > Douglas hout balken > Douglas hout latten en regels",
    "price": 35.54,
    "currency": "EUR",
    "price_raw": "€2,15/m1",
    "specs": {
      "raw": {
        "Kopmaat": "9x18 mm",
        "Dikte": "9 mm",
        "Breedte": "18",
        "Materiaal": "Meranti",
        "Toepassing": "Deze 4-zijden geschaafde Meranti lat is binnen toepasbaar als aftimmerlat of constructielat. Deze schaaflat kan toegepast worden om openingen af te dekken, voor het maken van meubels of als (achter)constructie of rasterwerk voor wanden, plafonds en ander constructiewerk. Bij een juiste"
      }
    },
    "images": [
      "https://www.houthandelonline.nl/cdn/resize-extended/el:true/rs:fill/w:1500/h:1068/extend:true/background:255:255:255/path/media/catalog/product/m/e/meranti-9x18-geschaafd-6st-v_01_main.jpg"
    ],
    "rating": null,
    "review_count": null,
    "reviews_summary": null,
    "scraped_at": "2026-02-05T16:54:37.863368Z",
    "scrape_success": true,
    "scrape_errors": [],
    "embedding_text": "Product: Timmerhout Meranti 9x18mm geschaafd per 6 stuks\nBrand: HouthandelOnline\nCategory: Douglas hout > Toon alles in Douglas hout > Douglas hout palen > Douglas hout balken > Douglas hout latten en regels\nDescription: Vierzijdig geschaafd Meranti aftimmerhout is onbehandeld. Deze schaaflat van hardhoutsoort Meranti is geschikt voor het maken van meubels, een afwerkprofiel voor het wegwerken van kieren of voor constructiewerk. Verpakt per 6 stuks.\nSpecifications: Kopmaat: 9x18 mm, Dikte: 9 mm, Breedte: 18, Materiaal: Meranti, Toepassing: Deze 4-zijden geschaafde Meranti lat is binnen toepasbaar als aftimmerlat of constructielat. Deze schaaflat kan toegepast worden om openingen af te dekken, voor het maken van meubels of als (achter)constructie of rasterwerk voor wanden, plafonds en ander constructiewerk. Bij een juiste\nPrice: EUR 35.54"
  },
  {
    "id": "5ffa5efa233b",
    "source_url": "https://www.houthandelonline.nl/meranti-40x195-geschaafd",
    "name": "Timmerhout Meranti 40x195mm geschaafd",
    "description": "Vierzijdig geschaafd Meranti aftimmerhout is onbehandeld. Timmerhout van hardhoutsoort Meranti is geschikt voor het maken van meubels, geschikt als afwerkprofiel of voor constructiewerk.",
    "brand": "HouthandelOnline",
    "category": "Douglas hout > Toon alles in Douglas hout > Douglas hout palen > Douglas hout balken > Douglas hout latten en regels",
    "price": 176.06,
    "currency": "EUR",
    "price_raw": "€64,02/m1",
    "specs": {
      "raw": {
        "Kopmaat": "40x195 mm",
        "Dikte": "40 mm",
        "Breedte": "195",
        "Materiaal": "Meranti",
        "Toepassing": "Vier zijden geschaafd Meranti hout is binnen toepasbaar voor het afdekken van openingen, voor het maken van meubels of voor constructiewerk"
      }
    },
    "images": [
      "https://www.houthandelonline.nl/cdn/resize-extended/el:true/rs:fill/w:1500/h:1068/extend:true/background:255:255:255/path/media/catalog/product/m/e/meranti-40x195-geschaafd-v_01_main.jpg"
    ],
    "rating": null,
    "review_count": null,
    "reviews_summary": null,
    "scraped_at": "2026-02-05T16:54:37.863381Z",
    "scrape_success": true,
    "scrape_errors": [],
    "embedding_text": "Product: Timmerhout Meranti 40x195mm geschaafd\nBrand: HouthandelOnline\nCategory: Douglas hout > Toon alles in Douglas hout > Douglas hout palen > Douglas hout balken > Douglas hout latten en regels\nDescription: Vierzijdig geschaafd Meranti aftimmerhout is onbehandeld. Timmerhout van hardhoutsoort Meranti is geschikt voor het maken van meubels, geschikt als afwerkprofiel of voor constructiewerk.\nSpecifications: Kopmaat: 40x195 mm, Dikte: 40 mm, Breedte: 195, Materiaal: Meranti, Toepassing: Vier zijden geschaafd Meranti hout is binnen toepasbaar voor het afdekken van openingen, voor het maken van meubels of voor constructiewerk\nPrice: EUR 176.06"
  },
  {
    "id": "8e6aa759b8c0",
    "source_url": "https://www.houthandelonline.nl/meranti-28x28-geschaafd-6st",
    "name": "Timmerhout Meranti 28x28mm geschaafd per 6 stuks",
    "description": "Vierzijdig geschaafd Meranti aftimmerhout is onbehandeld. Deze schaaflat van hardhoutsoort Meranti is geschikt voor het maken van meubels, een afwerkprofiel voor het wegwerken van kieren of voor constructiewerk. Verpakt per 6 stuks.",
    "brand": "HouthandelOnline",
    "category": "Douglas hout > Toon alles in Douglas hout > Douglas hout palen > Douglas hout balken > Douglas hout latten en regels",
    "price": 90.05,
    "currency": "EUR",
    "price_raw": "€5,46/m1",
    "specs": {
      "raw": {
        "Kopmaat": "28x28 mm",
        "Dikte": "28 mm",
        "Breedte": "28",
        "Materiaal": "Meranti",
        "Toepassing": "Deze 4-zijden geschaafde Meranti lat is binnen toepasbaar als aftimmerlat of constructielat. Deze schaaflat kan toegepast worden om openingen af te dekken, voor het maken van meubels of als (achter)constructie of rasterwerk voor wanden, plafonds en ander constructiewerk"
      }
    },
    "images": [
      "https://www.houthandelonline.nl/cdn/resize-extended/el:true/rs:fill/w:1500/h:1068/extend:true/background:255:255:255/path/media/catalog/product/m/e/meranti-28x28-geschaafd-6st-v_01_main.jpg"
    ],
    "rating": null,
    "review_count": null,
    "reviews_summary": null,
    "scraped_at": "2026-02-05T16:54:37.863389Z",
    "scrape_success": true,
    "scrape_errors": [],
    "embedding_text": "Product: Timmerhout Meranti 28x28mm geschaafd per 6 stuks\nBrand: HouthandelOnline\nCategory: Douglas hout > Toon alles in Douglas hout > Douglas hout palen > Douglas hout balken > Douglas hout latten en regels\nDescription: Vierzijdig geschaafd Meranti aftimmerhout is onbehandeld. Deze schaaflat van hardhoutsoort Meranti is geschikt voor het maken van meubels, een afwerkprofiel voor het wegwerken van kieren of voor constructiewerk. Verpakt per 6 stuks.\nSpecifications: Kopmaat: 28x28 mm, Dikte: 28 mm, Breedte: 28, Materiaal: Meranti, Toepassing: Deze 4-zijden geschaafde Meranti lat is binnen toepasbaar als aftimmerlat of constructielat. Deze schaaflat kan toegepast worden om openingen af te dekken, voor het maken van meubels of als (achter)constructie of rasterwerk voor wanden, plafonds en ander constructiewerk\nPrice: EUR 90.05"
  },
  {
    "id": "d9847faa5a5d",
    "source_url": "https://www.houthandelonline.nl/meranti-19x68-geschaafd-6st",
    "name": "Timmerhout Meranti 19x68mm geschaafd per 6 stuks",
    "description": "Vierzijdig geschaafd Meranti aftimmerhout is onbehandeld. Deze schaaflat van hardhoutsoort Meranti is geschikt voor het maken van meubels, een afwerkprofiel voor het wegwerken van kieren of voor constructiewerk. Verpakt per 6 stuks.",
    "brand": "HouthandelOnline",
    "category": "Douglas hout > Toon alles in Douglas hout > Douglas hout palen > Douglas hout balken > Douglas hout latten en regels",
    "price": 160.52,
    "currency": "EUR",
    "price_raw": "€9,73/m1",
    "specs": {
      "raw": {
        "Kopmaat": "19x68 mm",
        "Dikte": "19 mm",
        "Breedte": "68",
        "Materiaal": "Meranti",
        "Toepassing": "Deze 4-zijden geschaafde Meranti lat is binnen toepasbaar als aftimmerlat of constructielat. Deze schaaflat kan toegepast worden om openingen af te dekken, voor het maken van meubels of als (achter)constructie of rasterwerk voor wanden, plafonds en ander constructiewerk"
      }
    },
    "images": [
      "https://www.houthandelonline.nl/cdn/resize-extended/el:true/rs:fill/w:1500/h:1068/extend:true/background:255:255:255/path/media/catalog/product/m/e/meranti-19x68-geschaafd-6st-v_01_main.jpg"
    ],
    "rating": null,
    "review_count": null,
    "reviews_summary": null,
    "scraped_at": "2026-02-05T16:54:37.863396Z",
    "scrape_success": true,
    "scrape_errors": [],
    "embedding_text": "Product: Timmerhout Meranti 19x68mm geschaafd per 6 stuks\nBrand: HouthandelOnline\nCategory: Douglas hout > Toon alles in Douglas hout > Douglas hout palen > Douglas hout balken > Douglas hout latten en regels\nDescription: Vierzijdig geschaafd Meranti aftimmerhout is onbehandeld. Deze schaaflat van hardhoutsoort Meranti is geschikt voor het maken van meubels, een afwerkprofiel voor het wegwerken van kieren of voor constructiewerk. Verpakt per 6 stuks.\nSpecifications: Kopmaat: 19x68 mm, Dikte: 19 mm, Breedte: 68, Materiaal: Meranti, Toepassing: Deze 4-zijden geschaafde Meranti lat is binnen toepasbaar als aftimmerlat of constructielat. Deze schaaflat kan toegepast worden om openingen af te dekken, voor het maken van meubels of als (achter)constructie of rasterwerk voor wanden, plafonds en ander constructiewerk\nPrice: EUR 160.52"
  },
  {
    "id": "44c9f20a5d9e",
    "source_url": "https://www.houthandelonline.nl/meranti-19x290-geschaafd",
    "name": "Timmerhout Meranti 19x290mm geschaafd",
    "description": "Dit vierzijdig geschaafde Meranti aftimmerhout is onbehandeld. Timmerhout van hardhoutsoort Meranti is geschikt voor het maken van meubels, geschikt als afwerkprofiel of voor constructiewerk.",
    "brand": "HouthandelOnline",
    "category": "Douglas hout > Toon alles in Douglas hout > Douglas hout palen > Douglas hout balken > Douglas hout latten en regels",
    "price": 168.98,
    "currency": "EUR",
    "price_raw": "€61,45/m1",
    "specs": {
      "raw": {
        "Kopmaat": "19x290 mm",
        "Dikte": "19 mm",
        "Breedte": "290",
        "Materiaal": "Meranti",
        "Toepassing": "Vier zijden geschaafd Meranti hout is binnen toepasbaar voor het afdekken van openingen, voor het maken van meubels of voor constructiewerk"
      }
    },
    "images": [
      "https://www.houthandelonline.nl/cdn/resize-extended/el:true/rs:fill/w:1500/h:1068/extend:true/background:255:255:255/path/media/catalog/product/m/e/meranti-19x290-geschaafd-v_01_main.jpeg"
    ],
    "rating": null,
    "review_count": null,
    "reviews_summary": null,
    "scraped_at": "2026-02-05T16:54:37.863402Z",
    "scrape_success": true,
    "scrape_errors": [],
    "embedding_text": "Product: Timmerhout Meranti 19x290mm geschaafd\nBrand: HouthandelOnline\nCategory: Douglas hout > Toon alles in Douglas hout > Douglas hout palen > Douglas hout balken > Douglas hout latten en regels\nDescription: Dit vierzijdig geschaafde Meranti aftimmerhout is onbehandeld. Timmerhout van hardhoutsoort Meranti is geschikt voor het maken van meubels, geschikt als afwerkprofiel of voor constructiewerk.\nSpecifications: Kopmaat: 19x290 mm, Dikte: 19 mm, Breedte: 290, Materiaal: Meranti, Toepassing: Vier zijden geschaafd Meranti hout is binnen toepasbaar voor het afdekken van openingen, voor het maken van meubels of voor constructiewerk\nPrice: EUR 168.98"
  },
  {
    "id": "4d5ab2e4ff6b",
    "source_url": "https://www.houthandelonline.nl/meranti-19x28-geschaafd-6st",
    "name": "Timmerhout Meranti 19x28mm geschaafd per 6 stuks",
    "description": "Vierzijdig geschaafd Meranti aftimmerhout is onbehandeld. Deze schaaflat van hardhoutsoort Meranti is geschikt voor het maken van meubels, een afwerkprofiel voor het wegwerken van kieren of voor constructiewerk. Verpakt per 6 stuks.",
    "brand": "HouthandelOnline",
    "category": "Douglas hout > Toon alles in Douglas hout > Douglas hout palen > Douglas hout balken > Douglas hout latten en regels",
    "price": 60.12,
    "currency": "EUR",
    "price_raw": "€4,09/m1",
    "specs": {
      "raw": {
        "Kopmaat": "19x28 mm",
        "Dikte": "19 mm",
        "Breedte": "28",
        "Materiaal": "Meranti",
        "Toepassing": "Deze 4-zijden geschaafde Meranti lat is binnen toepasbaar als aftimmerlat of constructielat. Deze schaaflat kan toegepast worden om openingen af te dekken, voor het maken van meubels of als (achter)constructie of rasterwerk voor wanden, plafonds en ander constructiewerk"
      }
    },
    "images": [
      "https://www.houthandelonline.nl/cdn/resize-extended/el:true/rs:fill/w:1500/h:1068/extend:true/background:255:255:255/path/media/catalog/product/m/e/meranti-19x28-geschaafd-6st-v_01_main.jpeg"
    ],
    "rating": null,
    "review_count": null,
    "reviews_summary": null,
    "scraped_at": "2026-02-05T16:54:37.863408Z",
    "scrape_success": true,
    "scrape_errors": [],
    "embedding_text": "Product: Timmerhout Meranti 19x28mm geschaafd per 6 stuks\nBrand: HouthandelOnline\nCategory: Douglas hout > Toon alles in Douglas hout > Douglas hout palen > Douglas hout balken > Douglas hout latten en regels\nDescription: Vierzijdig geschaafd Meranti aftimmerhout is onbehandeld. Deze schaaflat van hardhoutsoort Meranti is geschikt voor het maken van meubels, een afwerkprofiel voor het wegwerken van kieren of voor constructiewerk. Verpakt per 6 stuks.\nSpecifications: Kopmaat: 19x28 mm, Dikte: 19 mm, Breedte: 28, Materiaal: Meranti, Toepassing: Deze 4-zijden geschaafde Meranti lat is binnen toepasbaar als aftimmerlat of constructielat. Deze schaaflat kan toegepast worden om openingen af te dekken, voor het maken van meubels of als (achter)constructie of rasterwerk voor wanden, plafonds en ander constructiewerk\nPrice: EUR 60.12"
  },
  {
    "id": "50f73ed6b0aa",
    "source_url": "https://www.houthandelonline.nl/meranti-19x190-geschaafd",
    "name": "Timmerhout Meranti 19x190mm geschaafd",
    "description": "Vierzijdig geschaafd Meranti aftimmerhout is onbehandeld. Deze schaaflat van hardhoutsoort Meranti is geschikt voor het maken van meubels, een afwerkprofiel voor het wegwerken van kieren of voor constructiewerk.",
    "brand": "HouthandelOnline",
    "category": "Douglas hout > Toon alles in Douglas hout > Douglas hout palen > Douglas hout balken > Douglas hout latten en regels",
    "price": 95.6,
    "currency": "EUR",
    "price_raw": "€34,76/m1",
    "specs": {
      "raw": {
        "Kopmaat": "19x190 mm",
        "Dikte": "19 mm",
        "Breedte": "190",
        "Materiaal": "Meranti",
        "Toepassing": "Vier zijden geschaafd Meranti hout is binnen toepasbaar voor het afdekken van openingen, voor het maken van meubels of voor constructiewerk. Bij een juiste"
      }
    },
    "images": [
      "https://www.houthandelonline.nl/cdn/resize-extended/el:true/rs:fill/w:1500/h:1068/extend:true/background:255:255:255/path/media/catalog/product/m/e/meranti-19x190-geschaafd-v_01_main.jpg"
    ],
    "rating": null,
    "review_count": null,
    "reviews_summary": null,
    "scraped_at": "2026-02-05T16:54:37.863415Z",
    "scrape_success": true,
    "scrape_errors": [],
    "embedding_text": "Product: Timmerhout Meranti 19x190mm geschaafd\nBrand: HouthandelOnline\nCategory: Douglas hout > Toon alles in Douglas hout > Douglas hout palen > Douglas hout balken > Douglas hout latten en regels\nDescription: Vierzijdig geschaafd Meranti aftimmerhout is onbehandeld. Deze schaaflat van hardhoutsoort Meranti is geschikt voor het maken van meubels, een afwerkprofiel voor het wegwerken van kieren of voor constructiewerk.\nSpecifications: Kopmaat: 19x190 mm, Dikte: 19 mm, Breedte: 190, Materiaal: Meranti, Toepassing: Vier zijden geschaafd Meranti hout is binnen toepasbaar voor het afdekken van openingen, voor het maken van meubels of voor constructiewerk. Bij een juiste\nPrice: EUR 95.6"
  },
  {
    "id": "42e570d70098",
    "source_url": "https://www.houthandelonline.nl/meranti-12x55-geschaafd-6st",
    "name": "Timmerhout Meranti 12x55mm geschaafd per 6 stuks",
    "description": "Vierzijdig geschaafd Meranti aftimmerhout is onbehandeld. Deze schaaflat van hardhoutsoort Meranti is geschikt voor het maken van meubels, een afwerkprofiel voor het wegwerken van kieren of voor constructiewerk. Verpakt per 6 stuks.",
    "brand": "HouthandelOnline",
    "category": "Douglas hout > Toon alles in Douglas hout > Douglas hout palen > Douglas hout balken > Douglas hout latten en regels",
    "price": 86.85,
    "currency": "EUR",
    "price_raw": "€5,26/m1",
    "specs": {
      "raw": {
        "Kopmaat": "12x55 mm",
        "Dikte": "12 mm",
        "Breedte": "55",
        "Materiaal": "Meranti",
        "Toepassing": "Deze 4-zijden geschaafde Meranti lat is binnen toepasbaar als aftimmerlat of constructielat. Deze schaaflat kan toegepast worden om openingen af te dekken, voor het maken van meubels of als (achter)constructie of rasterwerk voor wanden, plafonds en ander constructiewerk"
      }
    },
    "images": [
      "https://www.houthandelonline.nl/cdn/resize-extended/el:true/rs:fill/w:1500/h:1068/extend:true/background:255:255:255/path/media/catalog/product/m/e/meranti-12x55-geschaafd-6st-v_01_main.jpg"
    ],
    "rating": null,
    "review_count": null,
    "reviews_summary": null,
    "scraped_at": "2026-02-05T16:54:37.863421Z",
    "scrape_success": true,
    "scrape_errors": [],
    "embedding_text": "Product: Timmerhout Meranti 12x55mm geschaafd per 6 stuks\nBrand: HouthandelOnline\nCategory: Douglas hout > Toon alles in Douglas hout > Douglas hout palen > Douglas hout balken > Douglas hout latten en regels\nDescription: Vierzijdig geschaafd Meranti aftimmerhout is onbehandeld. Deze schaaflat van hardhoutsoort Meranti is geschikt voor het maken van meubels, een afwerkprofiel voor het wegwerken van kieren of voor constructiewerk. Verpakt per 6 stuks.\nSpecifications: Kopmaat: 12x55 mm, Dikte: 12 mm, Breedte: 55, Materiaal: Meranti, Toepassing: Deze 4-zijden geschaafde Meranti lat is binnen toepasbaar als aftimmerlat of constructielat. Deze schaaflat kan toegepast worden om openingen af te dekken, voor het maken van meubels of als (achter)constructie of rasterwerk voor wanden, plafonds en ander constructiewerk\nPrice: EUR 86.85"
  },
  {
    "id": "6c5fb95aaee2",
    "source_url": "https://www.houthandelonline.nl/meranti-12x28-geschaafd-6st",
    "name": "Timmerhout Meranti 12x28mm geschaafd per 6 stuks",
    "description": "Vierzijdig geschaafd Meranti aftimmerhout is onbehandeld. Deze schaaflat van hardhoutsoort Meranti is geschikt voor het maken van meubels, een afwerkprofiel voor het wegwerken van kieren of voor constructiewerk. Verpakt per 6 stuks.",
    "brand": "HouthandelOnline",
    "category": "Douglas hout > Toon alles in Douglas hout > Douglas hout palen > Douglas hout balken > Douglas hout latten en regels",
    "price": 44.72,
    "currency": "EUR",
    "price_raw": "€2,71/m1",
    "specs": {
      "raw": {
        "Kopmaat": "12x28 mm",
        "Dikte": "12 mm",
        "Breedte": "28",
        "Materiaal": "Meranti",
        "Toepassing": "Deze 4-zijden geschaafde Meranti lat is binnen toepasbaar als aftimmerlat of constructielat. Deze schaaflat kan toegepast worden om openingen af te dekken, voor het maken van meubels of als (achter)constructie of rasterwerk voor wanden, plafonds en ander constructiewerk"
      }
    },
    "images": [
      "https://www.houthandelonline.nl/cdn/resize-extended/el:true/rs:fill/w:1500/h:1068/extend:true/background:255:255:255/path/media/catalog/product/m/e/meranti-12x28-geschaafd-6st-v_01_main.jpg"
    ],
    "rating": null,
    "review_count": null,
    "reviews_summary": null,
    "scraped_at": "2026-02-05T16:54:37.863429Z",
    "scrape_success": true,
    "scrape_errors": [],
    "embedding_text": "Product: Timmerhout Meranti 12x28mm geschaafd per 6 stuks\nBrand: HouthandelOnline\nCategory: Douglas hout > Toon alles in Douglas hout > Douglas hout palen > Douglas hout balken > Douglas hout latten en regels\nDescription: Vierzijdig geschaafd Meranti aftimmerhout is onbehandeld. Deze schaaflat van hardhoutsoort Meranti is geschikt voor het maken van meubels, een afwerkprofiel voor het wegwerken van kieren of voor constructiewerk. Verpakt per 6 stuks.\nSpecifications: Kopmaat: 12x28 mm, Dikte: 12 mm, Breedte: 28, Materiaal: Meranti, Toepassing: Deze 4-zijden geschaafde Meranti lat is binnen toepasbaar als aftimmerlat of constructielat. Deze schaaflat kan toegepast worden om openingen af te dekken, voor het maken van meubels of als (achter)constructie of rasterwerk voor wanden, plafonds en ander constructiewerk\nPrice: EUR 44.72"
  },
  {
    "id": "4472f7df9397",
    "source_url": "https://www.houthandelonline.nl/meranti-28x290-geschaafd",
    "name": "Timmerhout Meranti 28x290mm geschaafd",
    "description": "Dit vierzijdig geschaafde Meranti aftimmerhout is onbehandeld. Timmerhout van hardhoutsoort Meranti is geschikt voor het maken van meubels, geschikt als afwerkprofiel of voor constructiewerk.",
    "brand": "HouthandelOnline",
    "category": "Douglas hout > Toon alles in Douglas hout > Douglas hout palen > Douglas hout balken > Douglas hout latten en regels",
    "price": 183.24,
    "currency": "EUR",
    "price_raw": "€66,63/m1",
    "specs": {
      "raw": {
        "Kopmaat": "28x290 mm",
        "Dikte": "28 mm",
        "Breedte": "290",
        "Materiaal": "Meranti",
        "Toepassing": "Vier zijden geschaafd Meranti hout is binnen toepasbaar voor het afdekken van openingen, voor het maken van meubels of voor constructiewerk"
      }
    },
    "images": [
      "https://www.houthandelonline.nl/cdn/resize-extended/el:true/rs:fill/w:1500/h:1068/extend:true/background:255:255:255/path/media/catalog/product/m/e/meranti-28x290-geschaafd-v_01_main.jpg"
    ],
    "rating": null,
    "review_count": null,
    "reviews_summary": null,
    "scraped_at": "2026-02-05T16:54:37.863435Z",
    "scrape_success": true,
    "scrape_errors": [],
    "embedding_text": "Product: Timmerhout Meranti 28x290mm geschaafd\nBrand: HouthandelOnline\nCategory: Douglas hout > Toon alles in Douglas hout > Douglas hout palen > Douglas hout balken > Douglas hout latten en regels\nDescription: Dit vierzijdig geschaafde Meranti aftimmerhout is onbehandeld. Timmerhout van hardhoutsoort Meranti is geschikt voor het maken van meubels, geschikt als afwerkprofiel of voor constructiewerk.\nSpecifications: Kopmaat: 28x290 mm, Dikte: 28 mm, Breedte: 290, Materiaal: Meranti, Toepassing: Vier zijden geschaafd Meranti hout is binnen toepasbaar voor het afdekken van openingen, voor het maken van meubels of voor constructiewerk\nPrice: EUR 183.24"
  },
  {
    "id": "a7aec8a144fb",
    "source_url": "https://www.houthandelonline.nl/meranti-40x290-geschaafd",
    "name": "Timmerhout Meranti 40x290mm geschaafd",
    "description": "Dit vierzijdig geschaafde Meranti aftimmerhout is onbehandeld. Timmerhout van hardhoutsoort Meranti is geschikt voor het maken van meubels, geschikt als afwerkprofiel of voor constructiewerk.",
    "brand": "HouthandelOnline",
    "category": "Douglas hout > Toon alles in Douglas hout > Douglas hout palen > Douglas hout balken > Douglas hout latten en regels",
    "price": 228.57,
    "currency": "EUR",
    "price_raw": "€83,12/m1",
    "specs": {
      "raw": {
        "Levertijd": "2-7 werkdagen",
        "Kopmaat": "40x290 mm",
        "Dikte": "40 mm",
        "Breedte": "290",
        "Materiaal": "Meranti",
        "Toepassing": "Vier zijden geschaafd Meranti hout is binnen toepasbaar voor het afdekken van openingen, voor het maken van meubels of voor constructiewerk"
      }
    },
    "images": [
      "https://www.houthandelonline.nl/cdn/resize-extended/el:true/rs:fill/w:1500/h:1068/extend:true/background:255:255:255/path/media/catalog/product/m/e/meranti-40x290-geschaafd-v_01_main.jpg"
    ],
    "rating": null,
    "review_count": null,
    "reviews_summary": null,
    "scraped_at": "2026-02-05T16:54:37.863441Z",
    "scrape_success": true,
    "scrape_errors": [],
    "embedding_text": "Product: Timmerhout Meranti 40x290mm geschaafd\nBrand: HouthandelOnline\nCategory: Douglas hout > Toon alles in Douglas hout > Douglas hout palen > Douglas hout balken > Douglas hout latten en regels\nDescription: Dit vierzijdig geschaafde Meranti aftimmerhout is onbehandeld. Timmerhout van hardhoutsoort Meranti is geschikt voor het maken van meubels, geschikt als afwerkprofiel of voor constructiewerk.\nSpecifications: Levertijd: 2-7 werkdagen, Kopmaat: 40x290 mm, Dikte: 40 mm, Breedte: 290, Materiaal: Meranti, Toepassing: Vier zijden geschaafd Meranti hout is binnen toepasbaar voor het afdekken van openingen, voor het maken van meubels of voor constructiewerk\nPrice: EUR 228.57"
  },
  {
    "id": "1c8231d7da78",
    "source_url": "https://www.houthandelonline.nl/meranti-28x190-geschaafd",
    "name": "Timmerhout Meranti 28x190mm geschaafd",
    "description": "Vierzijdig geschaafd Meranti aftimmerhout is onbehandeld. Timmerhout van hardhoutsoort Meranti is geschikt voor het maken van meubels, geschikt als afwerkprofiel of voor constructiewerk.",
    "brand": "HouthandelOnline",
    "category": "Douglas hout > Toon alles in Douglas hout > Douglas hout palen > Douglas hout balken > Douglas hout latten en regels",
    "price": 122.28,
    "currency": "EUR",
    "price_raw": "€44,47/m1",
    "specs": {
      "raw": {
        "Levertijd": "2-7 werkdagen",
        "Kopmaat": "28x190 mm",
        "Dikte": "28 mm",
        "Breedte": "190",
        "Materiaal": "Meranti",
        "Toepassing": "Vier zijden geschaafd Meranti hout is binnen toepasbaar voor het afdekken van openingen, voor het maken van meubels of voor constructiewerk"
      }
    },
    "images": [
      "https://www.houthandelonline.nl/cdn/resize-extended/el:true/rs:fill/w:1500/h:1068/extend:true/background:255:255:255/path/media/catalog/product/m/e/meranti-28x190-geschaafd-v_01_main.jpg"
    ],
    "rating": null,
    "review_count": null,
    "reviews_summary": null,
    "scraped_at": "2026-02-05T16:54:37.863448Z",
    "scrape_success": true,
    "scrape_errors": [],
    "embedding_text": "Product: Timmerhout Meranti 28x190mm geschaafd\nBrand: HouthandelOnline\nCategory: Douglas hout > Toon alles in Douglas hout > Douglas hout palen > Douglas hout balken > Douglas hout latten en regels\nDescription: Vierzijdig geschaafd Meranti aftimmerhout is onbehandeld. Timmerhout van hardhoutsoort Meranti is geschikt voor het maken van meubels, geschikt als afwerkprofiel of voor constructiewerk.\nSpecifications: Levertijd: 2-7 werkdagen, Kopmaat: 28x190 mm, Dikte: 28 mm, Breedte: 190, Materiaal: Meranti, Toepassing: Vier zijden geschaafd Meranti hout is binnen toepasbaar voor het afdekken van openingen, voor het maken van meubels of voor constructiewerk\nPrice: EUR 122.28"
  },
  {
    "id": "c6c644dd2078",
    "source_url": "https://www.houthandelonline.nl/meranti-9x28-geschaafd-6st",
    "name": "Timmerhout Meranti 9x28mm geschaafd per 6 stuks",
    "description": "Vierzijdig geschaafd Meranti aftimmerhout is onbehandeld. Deze schaaflat van hardhoutsoort Meranti is geschikt voor het maken van meubels, een afwerkprofiel voor het wegwerken van kieren of voor constructiewerk. Verpakt per 6 stuks.",
    "brand": "HouthandelOnline",
    "category": "Douglas hout > Toon alles in Douglas hout > Douglas hout palen > Douglas hout balken > Douglas hout latten en regels",
    "price": 39.85,
    "currency": "EUR",
    "price_raw": "€2,71/m1",
    "specs": {
      "raw": {
        "Levertijd": "2-7 werkdagen",
        "Kopmaat": "9x28 mm",
        "Dikte": "9 mm",
        "Breedte": "28",
        "Materiaal": "Meranti",
        "Toepassing": "Deze 4-zijden geschaafde Meranti lat is binnen toepasbaar als aftimmerlat of constructielat. Deze schaaflat kan toegepast worden om openingen af te dekken, voor het maken van meubels of als (achter)constructie of rasterwerk voor wanden, plafonds en ander constructiewerk. Bij een juiste"
      }
    },
    "images": [
      "https://www.houthandelonline.nl/cdn/resize-extended/el:true/rs:fill/w:1500/h:1068/extend:true/background:255:255:255/path/media/catalog/product/m/e/meranti-9x28-geschaafd-6st-v_01_main.jpg"
    ],
    "rating": null,
    "review_count": null,
    "reviews_summary": null,
    "scraped_at": "2026-02-05T16:54:37.863742Z",
    "scrape_success": true,
    "scrape_errors": [],
    "embedding_text": "Product: Timmerhout Meranti 9x28mm geschaafd per 6 stuks\nBrand: HouthandelOnline\nCategory: Douglas hout > Toon alles in Douglas hout > Douglas hout palen > Douglas hout balken > Douglas hout latten en regels\nDescription: Vierzijdig geschaafd Meranti aftimmerhout is onbehandeld. Deze schaaflat van hardhoutsoort Meranti is geschikt voor het maken van meubels, een afwerkprofiel voor het wegwerken van kieren of voor constructiewerk. Verpakt per 6 stuks.\nSpecifications: Levertijd: 2-7 werkdagen, Kopmaat: 9x28 mm, Dikte: 9 mm, Breedte: 28, Materiaal: Meranti, Toepassing: Deze 4-zijden geschaafde Meranti lat is binnen toepasbaar als aftimmerlat of constructielat. Deze schaaflat kan toegepast worden om openingen af te dekken, voor het maken van meubels of als (achter)constructie of rasterwerk voor wanden, plafonds en ander constructiewerk. Bij een juiste\nPrice: EUR 39.85"
  },
  {
    "id": "d808aca28142",
    "source_url": "https://www.houthandelonline.nl/meranti-40x240-geschaafd",
    "name": "Timmerhout Meranti 40x240mm geschaafd",
    "description": "Dit vierzijdig geschaafde Meranti aftimmerhout is onbehandeld. Timmerhout van hardhoutsoort Meranti is geschikt voor het maken van meubels, geschikt als afwerkprofiel of voor constructiewerk.",
    "brand": "HouthandelOnline",
    "category": "Douglas hout > Toon alles in Douglas hout > Douglas hout palen > Douglas hout balken > Douglas hout latten en regels",
    "price": 199.42,
    "currency": "EUR",
    "price_raw": "€72,52/m1",
    "specs": {
      "raw": {
        "Levertijd": "2-7 werkdagen",
        "Kopmaat": "40x240 mm",
        "Dikte": "40 mm",
        "Breedte": "240",
        "Materiaal": "Meranti",
        "Toepassing": "Vier zijden geschaafd Meranti hout is binnen toepasbaar voor het afdekken van openingen, voor het maken van meubels of voor constructiewerk"
      }
    },
    "images": [
      "https://www.houthandelonline.nl/cdn/resize-extended/el:true/rs:fill/w:1500/h:1068/extend:true/background:255:255:255/path/media/catalog/product/m/e/meranti-40x240-geschaafd-v_01_main.jpg"
    ],
    "rating": null,
    "review_count": null,
    "reviews_summary": null,
    "scraped_at": "2026-02-05T16:54:37.863755Z",
    "scrape_success": true,
    "scrape_errors": [],
    "embedding_text": "Product: Timmerhout Meranti 40x240mm geschaafd\nBrand: HouthandelOnline\nCategory: Douglas hout > Toon alles in Douglas hout > Douglas hout palen > Douglas hout balken > Douglas hout latten en regels\nDescription: Dit vierzijdig geschaafde Meranti aftimmerhout is onbehandeld. Timmerhout van hardhoutsoort Meranti is geschikt voor het maken van meubels, geschikt als afwerkprofiel of voor constructiewerk.\nSpecifications: Levertijd: 2-7 werkdagen, Kopmaat: 40x240 mm, Dikte: 40 mm, Breedte: 240, Materiaal: Meranti, Toepassing: Vier zijden geschaafd Meranti hout is binnen toepasbaar voor het afdekken van openingen, voor het maken van meubels of voor constructiewerk\nPrice: EUR 199.42"
  },
  {
    "id": "90d9ce26cadb",
    "source_url": "https://www.houthandelonline.nl/meranti-28x240-geschaafd",
    "name": "Timmerhout Meranti 28x240mm geschaafd",
    "description": "Dit vierzijdig geschaafde Meranti aftimmerhout is onbehandeld. Timmerhout van hardhoutsoort Meranti is geschikt voor het maken van meubels, geschikt als afwerkprofiel of voor constructiewerk.",
    "brand": "HouthandelOnline",
    "category": "Douglas hout > Toon alles in Douglas hout > Douglas hout palen > Douglas hout balken > Douglas hout latten en regels",
    "price": 150.94,
    "currency": "EUR",
    "price_raw": "€54,89/m1",
    "specs": {
      "raw": {
        "Levertijd": "2-7 werkdagen",
        "Kopmaat": "28x140 mm",
        "Dikte": "28 mm",
        "Breedte": "240",
        "Materiaal": "Meranti",
        "Toepassing": "Vier zijden geschaafd Meranti hout is binnen toepasbaar voor het afdekken van openingen, voor het maken van meubels of voor constructiewerk"
      }
    },
    "images": [
      "https://www.houthandelonline.nl/cdn/resize-extended/el:true/rs:fill/w:1500/h:1068/extend:true/background:255:255:255/path/media/catalog/product/m/e/meranti-28x240-geschaafd-v_01_main.jpg"
    ],
    "rating": null,
    "review_count": null,
    "reviews_summary": null,
    "scraped_at": "2026-02-05T16:54:37.863762Z",
    "scrape_success": true,
    "scrape_errors": [],
    "embedding_text": "Product: Timmerhout Meranti 28x240mm geschaafd\nBrand: HouthandelOnline\nCategory: Douglas hout > Toon alles in Douglas hout > Douglas hout palen > Douglas hout balken > Douglas hout latten en regels\nDescription: Dit vierzijdig geschaafde Meranti aftimmerhout is onbehandeld. Timmerhout van hardhoutsoort Meranti is geschikt voor het maken van meubels, geschikt als afwerkprofiel of voor constructiewerk.\nSpecifications: Levertijd: 2-7 werkdagen, Kopmaat: 28x140 mm, Dikte: 28 mm, Breedte: 240, Materiaal: Meranti, Toepassing: Vier zijden geschaafd Meranti hout is binnen toepasbaar voor het afdekken van openingen, voor het maken van meubels of voor constructiewerk\nPrice: EUR 150.94"
  },
  {
    "id": "e8cd614b649a",
    "source_url": "https://www.houthandelonline.nl/meranti-19x240-geschaafd",
    "name": "Timmerhout Meranti 19x240mm geschaafd",
    "description": "Dit vierzijdig geschaafde Meranti aftimmerhout is onbehandeld. Timmerhout van hardhoutsoort Meranti is geschikt voor het maken van meubels, geschikt als afwerkprofiel of voor constructiewerk.",
    "brand": "HouthandelOnline",
    "category": "Douglas hout > Toon alles in Douglas hout > Douglas hout palen > Douglas hout balken > Douglas hout latten en regels",
    "price": 138.42,
    "currency": "EUR",
    "price_raw": "€50,34/m1",
    "specs": {
      "raw": {
        "Levertijd": "2-7 werkdagen",
        "Kopmaat": "19x240 mm",
        "Dikte": "19 mm",
        "Breedte": "240",
        "Materiaal": "Meranti",
        "Toepassing": "Vier zijden geschaafd Meranti hout is binnen toepasbaar voor het afdekken van openingen, voor het maken van meubels of voor constructiewerk"
      }
    },
    "images": [
      "https://www.houthandelonline.nl/cdn/resize-extended/el:true/rs:fill/w:1500/h:1068/extend:true/background:255:255:255/path/media/catalog/product/m/e/meranti-19x240-geschaafd-v_01_main.jpg"
    ],
    "rating": null,
    "review_count": null,
    "reviews_summary": null,
    "scraped_at": "2026-02-05T16:54:37.863767Z",
    "scrape_success": true,
    "scrape_errors": [],
    "embedding_text": "Product: Timmerhout Meranti 19x240mm geschaafd\nBrand: HouthandelOnline\nCategory: Douglas hout > Toon alles in Douglas hout > Douglas hout palen > Douglas hout balken > Douglas hout latten en regels\nDescription: Dit vierzijdig geschaafde Meranti aftimmerhout is onbehandeld. Timmerhout van hardhoutsoort Meranti is geschikt voor het maken van meubels, geschikt als afwerkprofiel of voor constructiewerk.\nSpecifications: Levertijd: 2-7 werkdagen, Kopmaat: 19x240 mm, Dikte: 19 mm, Breedte: 240, Materiaal: Meranti, Toepassing: Vier zijden geschaafd Meranti hout is binnen toepasbaar voor het afdekken van openingen, voor het maken van meubels of voor constructiewerk\nPrice: EUR 138.42"
  },
  {
    "id": "d6869684e07c",
    "source_url": "https://www.houthandelonline.nl/meranti-12x90-geschaafd-6st",
    "name": "Timmerhout Meranti 12x90mm geschaafd per 6 stuks",
    "description": "Vierzijdig geschaafd Meranti aftimmerhout is onbehandeld. Deze schaaflat van hardhoutsoort Meranti is geschikt voor het maken van meubels, een afwerkprofiel voor het wegwerken van kieren of voor constructiewerk. Verpakt per 6 stuks.",
    "brand": "HouthandelOnline",
    "category": "Douglas hout > Toon alles in Douglas hout > Douglas hout palen > Douglas hout balken > Douglas hout latten en regels",
    "price": 144.15,
    "currency": "EUR",
    "price_raw": "€8,74/m1",
    "specs": {
      "raw": {
        "Levertijd": "2-7 werkdagen",
        "Kopmaat": "12x90 mm",
        "Dikte": "12 mm",
        "Breedte": "90",
        "Materiaal": "Meranti",
        "Toepassing": "Deze 4-zijden geschaafde Meranti lat is binnen toepasbaar als aftimmerlat of constructielat. Deze schaaflat kan toegepast worden om openingen af te dekken, voor het maken van meubels of als (achter)constructie of rasterwerk voor wanden, plafonds en ander constructiewerk"
      }
    },
    "images": [
      "https://www.houthandelonline.nl/cdn/resize-extended/el:true/rs:fill/w:1500/h:1068/extend:true/background:255:255:255/path/media/catalog/product/m/e/meranti-12x90-geschaafd-6st-v_01_main.jpg"
    ],
    "rating": null,
    "review_count": null,
    "reviews_summary": null,
    "scraped_at": "2026-02-05T16:54:37.863777Z",
    "scrape_success": true,
    "scrape_errors": [],
    "embedding_text": "Product: Timmerhout Meranti 12x90mm geschaafd per 6 stuks\nBrand: HouthandelOnline\nCategory: Douglas hout > Toon alles in Douglas hout > Douglas hout palen > Douglas hout balken > Douglas hout latten en regels\nDescription: Vierzijdig geschaafd Meranti aftimmerhout is onbehandeld. Deze schaaflat van hardhoutsoort Meranti is geschikt voor het maken van meubels, een afwerkprofiel voor het wegwerken van kieren of voor constructiewerk. Verpakt per 6 stuks.\nSpecifications: Levertijd: 2-7 werkdagen, Kopmaat: 12x90 mm, Dikte: 12 mm, Breedte: 90, Materiaal: Meranti, Toepassing: Deze 4-zijden geschaafde Meranti lat is binnen toepasbaar als aftimmerlat of constructielat. Deze schaaflat kan toegepast worden om openingen af te dekken, voor het maken van meubels of als (achter)constructie of rasterwerk voor wanden, plafonds en ander constructiewerk\nPrice: EUR 144.15"
  },
  {
    "id": "508c01216776",
    "source_url": "https://www.houthandelonline.nl/meranti-12x68-geschaafd-6st",
    "name": "Timmerhout Meranti 12x68mm geschaafd per 6 stuks",
    "description": "Vierzijdig geschaafd Meranti aftimmerhout is onbehandeld. Deze schaaflat van hardhoutsoort Meranti is geschikt voor het maken van meubels, een afwerkprofiel voor het wegwerken van kieren of voor constructiewerk. Verpakt per 6 stuks.",
    "brand": "HouthandelOnline",
    "category": "Douglas hout > Toon alles in Douglas hout > Douglas hout palen > Douglas hout balken > Douglas hout latten en regels",
    "price": 115.4,
    "currency": "EUR",
    "price_raw": "€6,99/m1",
    "specs": {
      "raw": {
        "Levertijd": "2-7 werkdagen",
        "Kopmaat": "12x68 mm",
        "Dikte": "12 mm",
        "Breedte": "68",
        "Materiaal": "Meranti",
        "Toepassing": "Deze 4-zijden geschaafde Meranti lat is binnen toepasbaar als aftimmerlat of constructielat. Deze schaaflat kan toegepast worden om openingen af te dekken, voor het maken van meubels of als (achter)constructie of rasterwerk voor wanden, plafonds en ander constructiewerk"
      }
    },
    "images": [
      "https://www.houthandelonline.nl/cdn/resize-extended/el:true/rs:fill/w:1500/h:1068/extend:true/background:255:255:255/path/media/catalog/product/m/e/meranti-12x68-geschaafd-6st-v_01_main.jpg"
    ],
    "rating": null,
    "review_count": null,
    "reviews_summary": null,
    "scraped_at": "2026-02-05T16:54:37.863783Z",
    "scrape_success": true,
    "scrape_errors": [],
    "embedding_text": "Product: Timmerhout Meranti 12x68mm geschaafd per 6 stuks\nBrand: HouthandelOnline\nCategory: Douglas hout > Toon alles in Douglas hout > Douglas hout palen > Douglas hout balken > Douglas hout latten en regels\nDescription: Vierzijdig geschaafd Meranti aftimmerhout is onbehandeld. Deze schaaflat van hardhoutsoort Meranti is geschikt voor het maken van meubels, een afwerkprofiel voor het wegwerken van kieren of voor constructiewerk. Verpakt per 6 stuks.\nSpecifications: Levertijd: 2-7 werkdagen, Kopmaat: 12x68 mm, Dikte: 12 mm, Breedte: 68, Materiaal: Meranti, Toepassing: Deze 4-zijden geschaafde Meranti lat is binnen toepasbaar als aftimmerlat of constructielat. Deze schaaflat kan toegepast worden om openingen af te dekken, voor het maken van meubels of als (achter)constructie of rasterwerk voor wanden, plafonds en ander constructiewerk\nPrice: EUR 115.4"
  },
  {
    "id": "d3c60e417bcd",
    "source_url": "https://www.houthandelonline.nl/meranti-12x45-geschaafd-6st",
    "name": "Timmerhout Meranti 12x45mm geschaafd per 6 stuks",
    "description": "Vierzijdig geschaafd Meranti aftimmerhout is onbehandeld. Deze schaaflat van hardhoutsoort Meranti is geschikt voor het maken van meubels, een afwerkprofiel voor het wegwerken van kieren of voor constructiewerk. Verpakt per 6 stuks.",
    "brand": "HouthandelOnline",
    "category": "Douglas hout > Toon alles in Douglas hout > Douglas hout palen > Douglas hout balken > Douglas hout latten en regels",
    "price": 74.08,
    "currency": "EUR",
    "price_raw": "€4,49/m1",
    "specs": {
      "raw": {
        "Levertijd": "2-7 werkdagen",
        "Kopmaat": "12x45 mm",
        "Dikte": "12 mm",
        "Breedte": "45",
        "Materiaal": "Meranti",
        "Toepassing": "Deze 4-zijden geschaafde Meranti lat is binnen toepasbaar als aftimmerlat of constructielat. Deze schaaflat kan toegepast worden om openingen af te dekken, voor het maken van meubels of als (achter)constructie of rasterwerk voor wanden, plafonds en ander constructiewerk"
      }
    },
    "images": [
      "https://www.houthandelonline.nl/cdn/resize-extended/el:true/rs:fill/w:1500/h:1068/extend:true/background:255:255:255/path/media/catalog/product/m/e/meranti-12x45-geschaafd-6st-v_01_main.jpg"
    ],
    "rating": null,
    "review_count": null,
    "reviews_summary": null,
    "scraped_at": "2026-02-05T16:54:37.863789Z",
    "scrape_success": true,
    "scrape_errors": [],
    "embedding_text": "Product: Timmerhout Meranti 12x45mm geschaafd per 6 stuks\nBrand: HouthandelOnline\nCategory: Douglas hout > Toon alles in Douglas hout > Douglas hout palen > Douglas hout balken > Douglas hout latten en regels\nDescription: Vierzijdig geschaafd Meranti aftimmerhout is onbehandeld. Deze schaaflat van hardhoutsoort Meranti is geschikt voor het maken van meubels, een afwerkprofiel voor het wegwerken van kieren of voor constructiewerk. Verpakt per 6 stuks.\nSpecifications: Levertijd: 2-7 werkdagen, Kopmaat: 12x45 mm, Dikte: 12 mm, Breedte: 45, Materiaal: Meranti, Toepassing: Deze 4-zijden geschaafde Meranti lat is binnen toepasbaar als aftimmerlat of constructielat. Deze schaaflat kan toegepast worden om openingen af te dekken, voor het maken van meubels of als (achter)constructie of rasterwerk voor wanden, plafonds en ander constructiewerk\nPrice: EUR 74.08"
  },
  {
    "id": "d9a9c09d18a6",
    "source_url": "https://www.houthandelonline.nl/meranti-12x140-geschaafd-6st",
    "name": "Timmerhout Meranti 12x140mm geschaafd per 6 stuks",
    "description": "Vierzijdig geschaafd Meranti aftimmerhout is onbehandeld. Deze schaaflat van hardhoutsoort Meranti is geschikt voor het maken van meubels, een afwerkprofiel voor het wegwerken van kieren of voor constructiewerk. Verpakt per 6 stuks.",
    "brand": "HouthandelOnline",
    "category": "Douglas hout > Toon alles in Douglas hout > Douglas hout palen > Douglas hout balken > Douglas hout latten en regels",
    "price": 228.0,
    "currency": "EUR",
    "price_raw": "€13,82/m1",
    "specs": {
      "raw": {
        "Levertijd": "2-7 werkdagen",
        "Kopmaat": "12x14 mm",
        "Dikte": "12 mm",
        "Breedte": "140",
        "Materiaal": "Meranti",
        "Toepassing": "Deze vier zijden geschaafde Meranti lat is binnen toepasbaar als aftimmerlat of constructielat. Deze schaaflat kan toegepast worden om openingen af te dekken, voor het maken van meubels of als (achter)constructie of rasterwerk voor wanden, plafonds en ander constructiewerk"
      }
    },
    "images": [
      "https://www.houthandelonline.nl/cdn/resize-extended/el:true/rs:fill/w:1500/h:1068/extend:true/background:255:255:255/path/media/catalog/product/m/e/meranti-12x140-geschaafd-6st-v_01_main.jpg"
    ],
    "rating": null,
    "review_count": null,
    "reviews_summary": null,
    "scraped_at": "2026-02-05T16:54:37.863801Z",
    "scrape_success": true,
    "scrape_errors": [],
    "embedding_text": "Product: Timmerhout Meranti 12x140mm geschaafd per 6 stuks\nBrand: HouthandelOnline\nCategory: Douglas hout > Toon alles in Douglas hout > Douglas hout palen > Douglas hout balken > Douglas hout latten en regels\nDescription: Vierzijdig geschaafd Meranti aftimmerhout is onbehandeld. Deze schaaflat van hardhoutsoort Meranti is geschikt voor het maken van meubels, een afwerkprofiel voor het wegwerken van kieren of voor constructiewerk. Verpakt per 6 stuks.\nSpecifications: Levertijd: 2-7 werkdagen, Kopmaat: 12x14 mm, Dikte: 12 mm, Breedte: 140, Materiaal: Meranti, Toepassing: Deze vier zijden geschaafde Meranti lat is binnen toepasbaar als aftimmerlat of constructielat. Deze schaaflat kan toegepast worden om openingen af te dekken, voor het maken van meubels of als (achter)constructie of rasterwerk voor wanden, plafonds en ander constructiewerk\nPrice: EUR 228.0"
  },
  {
    "id": "83925028e054",
    "source_url": "https://www.houthandelonline.nl/mdf-overzetplint-vochtw-18x120-4st",
    "name": "Overzetplint MDF 18x120mm (12x60mm uitsparing) geschaafd vochtwerend wit voorgelakt per 4 stuks",
    "description": "Deze holle MDF V313 overzetplinten zijn wit voorgelakt, hebben een afgeronde hoek en zijn vochtwerend. Deze rechte opzetplint kan eenvoudig over een bestaande plint heen geplaatst worden of biedt een grote uitsparing voor het wegwerken van veel kabels. Afmetingen uitsparing: 12x60mm. Verpakt per 4 stuks.",
    "brand": "HouthandelOnline",
    "category": "Douglas hout > Toon alles in Douglas hout > Douglas hout palen > Douglas hout balken > Douglas hout latten en regels",
    "price": 71.8,
    "currency": "EUR",
    "price_raw": "€7,36/m1",
    "specs": {
      "raw": {
        "Levertijd": "2-7 werkdagen",
        "Kopmaat": "18x120 mm",
        "Dikte": "18 mm",
        "Breedte": "120",
        "Materiaal": "MDF"
      }
    },
    "images": [
      "https://www.houthandelonline.nl/cdn/resize-extended/el:true/rs:fill/w:1500/h:1068/extend:true/background:255:255:255/path/media/catalog/product/m/d/mdf-overzetplint-vochtw-18x120-4st-v_01_main.jpg",
      "https://www.houthandelonline.nl/cdn/resize-extended/el:true/rs:fill/w:1500/h:1068/extend:true/background:255:255:255/path/media/catalog/product/m/d/mdf-overzetplint-vochtw-18x120-4st-v_02_view.jpg"
    ],
    "rating": null,
    "review_count": null,
    "reviews_summary": null,
    "scraped_at": "2026-02-05T16:54:37.863811Z",
    "scrape_success": true,
    "scrape_errors": [],
    "embedding_text": "Product: Overzetplint MDF 18x120mm (12x60mm uitsparing) geschaafd vochtwerend wit voorgelakt per 4 stuks\nBrand: HouthandelOnline\nCategory: Douglas hout > Toon alles in Douglas hout > Douglas hout palen > Douglas hout balken > Douglas hout latten en regels\nDescription: Deze holle MDF V313 overzetplinten zijn wit voorgelakt, hebben een afgeronde hoek en zijn vochtwerend. Deze rechte opzetplint kan eenvoudig over een bestaande plint heen geplaatst worden of biedt een grote uitsparing voor het wegwerken van veel kabels. Afmetingen uitsparing: 12x60mm. Verpakt per 4 stuks.\nSpecifications: Levertijd: 2-7 werkdagen, Kopmaat: 18x120 mm, Dikte: 18 mm, Breedte: 120, Materiaal: MDF\nPrice: EUR 71.8"
  },
  {
    "id": "d59af1e74aa6",
    "source_url": "https://www.houthandelonline.nl/meranti-28x68-geschaafd-6st",
    "name": "Timmerhout Meranti 28x68mm geschaafd per 6 stuks",
    "description": "Vierzijdig geschaafd Meranti aftimmerhout is onbehandeld. Deze schaaflat van hardhoutsoort Meranti is geschikt voor het maken van meubels, een afwerkprofiel voor het wegwerken van kieren of voor constructiewerk. Verpakt per 6 stuks.",
    "brand": "HouthandelOnline",
    "category": "Douglas hout > Toon alles in Douglas hout > Douglas hout palen > Douglas hout balken > Douglas hout latten en regels",
    "price": 204.65,
    "currency": "EUR",
    "price_raw": "€12,40/m1",
    "specs": {
      "raw": {
        "Levertijd": "2-7 werkdagen",
        "Kopmaat": "28x68 mm",
        "Dikte": "28 mm",
        "Breedte": "68",
        "Materiaal": "Meranti",
        "Toepassing": "Deze 4-zijden geschaafde Meranti lat is binnen toepasbaar als aftimmerlat of constructielat. Deze schaaflat kan toegepast worden om openingen af te dekken, voor het maken van meubels of als (achter)constructie of rasterwerk voor wanden, plafonds en ander constructiewerk"
      }
    },
    "images": [
      "https://www.houthandelonline.nl/cdn/resize-extended/el:true/rs:fill/w:1500/h:1068/extend:true/background:255:255:255/path/media/catalog/product/m/e/meranti-28x68-geschaafd-6st-v_01_main.jpg"
    ],
    "rating": null,
    "review_count": null,
    "reviews_summary": null,
    "scraped_at": "2026-02-05T16:54:37.863816Z",
    "scrape_success": true,
    "scrape_errors": [],
    "embedding_text": "Product: Timmerhout Meranti 28x68mm geschaafd per 6 stuks\nBrand: HouthandelOnline\nCategory: Douglas hout > Toon alles in Douglas hout > Douglas hout palen > Douglas hout balken > Douglas hout latten en regels\nDescription: Vierzijdig geschaafd Meranti aftimmerhout is onbehandeld. Deze schaaflat van hardhoutsoort Meranti is geschikt voor het maken van meubels, een afwerkprofiel voor het wegwerken van kieren of voor constructiewerk. Verpakt per 6 stuks.\nSpecifications: Levertijd: 2-7 werkdagen, Kopmaat: 28x68 mm, Dikte: 28 mm, Breedte: 68, Materiaal: Meranti, Toepassing: Deze 4-zijden geschaafde Meranti lat is binnen toepasbaar als aftimmerlat of constructielat. Deze schaaflat kan toegepast worden om openingen af te dekken, voor het maken van meubels of als (achter)constructie of rasterwerk voor wanden, plafonds en ander constructiewerk\nPrice: EUR 204.65"
  },
  {
    "id": "3e619b1e8878",
    "source_url": "https://www.houthandelonline.nl/meranti-19x90-geschaafd-6st",
    "name": "Timmerhout Meranti 19x90mm geschaafd per 6 stuks",
    "description": "Vierzijdig geschaafd Meranti aftimmerhout is onbehandeld. Deze schaaflat van hardhoutsoort Meranti is geschikt voor het maken van meubels, een afwerkprofiel voor het wegwerken van kieren of voor constructiewerk. Verpakt per 6 stuks.",
    "brand": "HouthandelOnline",
    "category": "Douglas hout > Toon alles in Douglas hout > Douglas hout palen > Douglas hout balken > Douglas hout latten en regels",
    "price": 215.22,
    "currency": "EUR",
    "price_raw": "€13,04/m1",
    "specs": {
      "raw": {
        "Levertijd": "2-7 werkdagen",
        "Kopmaat": "19x90 mm",
        "Dikte": "19 mm",
        "Breedte": "90",
        "Materiaal": "Meranti",
        "Toepassing": "Deze 4-zijden geschaafde Meranti lat is binnen toepasbaar als aftimmerlat of constructielat. Deze schaaflat kan toegepast worden om openingen af te dekken, voor het maken van meubels of als (achter)constructie of rasterwerk voor wanden, plafonds en ander constructiewerk"
      }
    },
    "images": [
      "https://www.houthandelonline.nl/cdn/resize-extended/el:true/rs:fill/w:1500/h:1068/extend:true/background:255:255:255/path/media/catalog/product/m/e/meranti-19x90-geschaafd-6st-v_01_main.jpg"
    ],
    "rating": null,
    "review_count": null,
    "reviews_summary": null,
    "scraped_at": "2026-02-05T16:54:37.863824Z",
    "scrape_success": true,
    "scrape_errors": [],
    "embedding_text": "Product: Timmerhout Meranti 19x90mm geschaafd per 6 stuks\nBrand: HouthandelOnline\nCategory: Douglas hout > Toon alles in Douglas hout > Douglas hout palen > Douglas hout balken > Douglas hout latten en regels\nDescription: Vierzijdig geschaafd Meranti aftimmerhout is onbehandeld. Deze schaaflat van hardhoutsoort Meranti is geschikt voor het maken van meubels, een afwerkprofiel voor het wegwerken van kieren of voor constructiewerk. Verpakt per 6 stuks.\nSpecifications: Levertijd: 2-7 werkdagen, Kopmaat: 19x90 mm, Dikte: 19 mm, Breedte: 90, Materiaal: Meranti, Toepassing: Deze 4-zijden geschaafde Meranti lat is binnen toepasbaar als aftimmerlat of constructielat. Deze schaaflat kan toegepast worden om openingen af te dekken, voor het maken van meubels of als (achter)constructie of rasterwerk voor wanden, plafonds en ander constructiewerk\nPrice: EUR 215.22"
  },
  {
    "id": "6c04b5b754f3",
    "source_url": "https://www.houthandelonline.nl/meranti-19x45-geschaafd-6st",
    "name": "Timmerhout Meranti 19x45mm geschaafd per 6 stuks",
    "description": "Vierzijdig geschaafd Meranti aftimmerhout is onbehandeld. Deze schaaflat van hardhoutsoort Meranti is geschikt voor het maken van meubels, een afwerkprofiel voor het wegwerken van kieren of voor constructiewerk. Verpakt per 6 stuks.",
    "brand": "HouthandelOnline",
    "category": "Douglas hout > Toon alles in Douglas hout > Douglas hout palen > Douglas hout balken > Douglas hout latten en regels",
    "price": 102.83,
    "currency": "EUR",
    "price_raw": "€6,23/m1",
    "specs": {
      "raw": {
        "Levertijd": "2-7 werkdagen",
        "Kopmaat": "19x45 mm",
        "Dikte": "19 mm",
        "Breedte": "45",
        "Materiaal": "Meranti",
        "Toepassing": "Deze 4-zijden geschaafde Meranti lat is binnen toepasbaar als aftimmerlat of constructielat. Deze schaaflat kan toegepast worden om openingen af te dekken, voor het maken van meubels of als (achter)constructie of rasterwerk voor wanden, plafonds en ander constructiewerk"
      }
    },
    "images": [
      "https://www.houthandelonline.nl/cdn/resize-extended/el:true/rs:fill/w:1500/h:1068/extend:true/background:255:255:255/path/media/catalog/product/m/e/meranti-19x45-geschaafd-6st-v_01_main.jpg"
    ],
    "rating": null,
    "review_count": null,
    "reviews_summary": null,
    "scraped_at": "2026-02-05T16:54:37.863830Z",
    "scrape_success": true,
    "scrape_errors": [],
    "embedding_text": "Product: Timmerhout Meranti 19x45mm geschaafd per 6 stuks\nBrand: HouthandelOnline\nCategory: Douglas hout > Toon alles in Douglas hout > Douglas hout palen > Douglas hout balken > Douglas hout latten en regels\nDescription: Vierzijdig geschaafd Meranti aftimmerhout is onbehandeld. Deze schaaflat van hardhoutsoort Meranti is geschikt voor het maken van meubels, een afwerkprofiel voor het wegwerken van kieren of voor constructiewerk. Verpakt per 6 stuks.\nSpecifications: Levertijd: 2-7 werkdagen, Kopmaat: 19x45 mm, Dikte: 19 mm, Breedte: 45, Materiaal: Meranti, Toepassing: Deze 4-zijden geschaafde Meranti lat is binnen toepasbaar als aftimmerlat of constructielat. Deze schaaflat kan toegepast worden om openingen af te dekken, voor het maken van meubels of als (achter)constructie of rasterwerk voor wanden, plafonds en ander constructiewerk\nPrice: EUR 102.83"
  },
  {
    "id": "b49b8e643ac8",
    "source_url": "https://www.houthandelonline.nl/glaslat-d2-meranti",
    "name": "Glaslat D2 Meranti 17x18mm (bovenzijde afgeschuind) 80mu wit gegrond per 10 stuks",
    "description": "Hardhouten glaslat met een afgeschuinde bovenzijde. De glaslat is wit gegrond en heeft een afmeting van 17x18mm. De glaslatten zijn verpakt per 10 stuks.",
    "brand": "HouthandelOnline",
    "category": "Douglas hout > Toon alles in Douglas hout > Douglas hout palen > Douglas hout balken > Douglas hout latten en regels",
    "price": 190.91,
    "currency": "EUR",
    "price_raw": "€3,90/m1",
    "specs": {
      "raw": {
        "Levertijd": "2-7 werkdagen",
        "Kopmaat": "17x18 mm",
        "Dikte": "17 mm",
        "Breedte": "18",
        "Materiaal": "Meranti",
        "Toepassing": "Glaslatten voor het opsluiten van glas in een kozijn, raam of deur"
      }
    },
    "images": [
      "https://www.houthandelonline.nl/cdn/resize-extended/el:true/rs:fill/w:1500/h:1068/extend:true/background:255:255:255/path/media/catalog/product/g/l/glaslat-d2-meranti-v_01_main.jpg"
    ],
    "rating": null,
    "review_count": null,
    "reviews_summary": null,
    "scraped_at": "2026-02-05T16:54:37.863836Z",
    "scrape_success": true,
    "scrape_errors": [],
    "embedding_text": "Product: Glaslat D2 Meranti 17x18mm (bovenzijde afgeschuind) 80mu wit gegrond per 10 stuks\nBrand: HouthandelOnline\nCategory: Douglas hout > Toon alles in Douglas hout > Douglas hout palen > Douglas hout balken > Douglas hout latten en regels\nDescription: Hardhouten glaslat met een afgeschuinde bovenzijde. De glaslat is wit gegrond en heeft een afmeting van 17x18mm. De glaslatten zijn verpakt per 10 stuks.\nSpecifications: Levertijd: 2-7 werkdagen, Kopmaat: 17x18 mm, Dikte: 17 mm, Breedte: 18, Materiaal: Meranti, Toepassing: Glaslatten voor het opsluiten van glas in een kozijn, raam of deur\nPrice: EUR 190.91"
  },
  {
    "id": "2a8797366fd8",
    "source_url": "https://www.houthandelonline.nl/glaslat-a1-meranti",
    "name": "Glaslat A1 Meranti 15x28mm (bovenzijde afgeschuind) Komo 80mu wit gegrond per 10 stuks",
    "description": "Meranti glaslat met een afgeschuinde bovenzijde. 2x gegrond in RAL1013. KOMO SKH",
    "brand": "HouthandelOnline",
    "category": "Douglas hout > Toon alles in Douglas hout > Douglas hout palen > Douglas hout balken > Douglas hout latten en regels",
    "price": 244.87,
    "currency": "EUR",
    "price_raw": null,
    "specs": {
      "raw": {
        "Levertijd": "2-7 werkdagen",
        "Kopmaat": "15x28 mm",
        "Dikte": "15 mm",
        "Breedte": "28",
        "Materiaal": "Meranti",
        "Toepassing": "Glaslatten voor het opsluiten van glas in een kozijn, raam of deur"
      }
    },
    "images": [
      "https://www.houthandelonline.nl/cdn/resize-extended/el:true/rs:fill/w:1500/h:1068/extend:true/background:255:255:255/path/media/catalog/product/g/l/glaslat-a1-meranti-v_01_main.jpg"
    ],
    "rating": null,
    "review_count": null,
    "reviews_summary": null,
    "scraped_at": "2026-02-05T16:54:37.863842Z",
    "scrape_success": true,
    "scrape_errors": [],
    "embedding_text": "Product: Glaslat A1 Meranti 15x28mm (bovenzijde afgeschuind) Komo 80mu wit gegrond per 10 stuks\nBrand: HouthandelOnline\nCategory: Douglas hout > Toon alles in Douglas hout > Douglas hout palen > Douglas hout balken > Douglas hout latten en regels\nDescription: Meranti glaslat met een afgeschuinde bovenzijde. 2x gegrond in RAL1013. KOMO SKH\nSpecifications: Levertijd: 2-7 werkdagen, Kopmaat: 15x28 mm, Dikte: 15 mm, Breedte: 28, Materiaal: Meranti, Toepassing: Glaslatten voor het opsluiten van glas in een kozijn, raam of deur\nPrice: EUR 244.87"
  },
  {
    "id": "b95a3ac24a48",
    "source_url": "https://www.houthandelonline.nl/glaslat-f5-meranti",
    "name": "Glaslat F5 Meranti 25x25mm (rechthoekig met 1 afgeronde hoek) Komo 80mu wit gegrond per 10 stuks",
    "description": "Meranti glaslat, 4-zijden geschaafd met 1 afgeronde hoek. 2x Gegrond in RAL1013. KOMO SKH",
    "brand": "HouthandelOnline",
    "category": "Douglas hout > Toon alles in Douglas hout > Douglas hout palen > Douglas hout balken > Douglas hout latten en regels",
    "price": 361.08,
    "currency": "EUR",
    "price_raw": "€7,37/m1",
    "specs": {
      "raw": {
        "Levertijd": "2-7 werkdagen",
        "Kopmaat": "25x25 mm",
        "Dikte": "25 mm",
        "Breedte": "25",
        "Materiaal": "Meranti",
        "Toepassing": "Glaslatten voor het opsluiten van glas in een kozijn, raam of deur"
      }
    },
    "images": [
      "https://www.houthandelonline.nl/cdn/resize-extended/el:true/rs:fill/w:1500/h:1068/extend:true/background:255:255:255/path/media/catalog/product/g/l/glaslat-f5-meranti-v_01_main.jpg",
      "https://www.houthandelonline.nl/cdn/resize-extended/el:true/rs:fill/w:1500/h:1068/extend:true/background:255:255:255/path/media/catalog/product/g/l/glaslat-f5-meranti-v_02_view.jpg"
    ],
    "rating": null,
    "review_count": null,
    "reviews_summary": null,
    "scraped_at": "2026-02-05T16:54:37.863847Z",
    "scrape_success": true,
    "scrape_errors": [],
    "embedding_text": "Product: Glaslat F5 Meranti 25x25mm (rechthoekig met 1 afgeronde hoek) Komo 80mu wit gegrond per 10 stuks\nBrand: HouthandelOnline\nCategory: Douglas hout > Toon alles in Douglas hout > Douglas hout palen > Douglas hout balken > Douglas hout latten en regels\nDescription: Meranti glaslat, 4-zijden geschaafd met 1 afgeronde hoek. 2x Gegrond in RAL1013. KOMO SKH\nSpecifications: Levertijd: 2-7 werkdagen, Kopmaat: 25x25 mm, Dikte: 25 mm, Breedte: 25, Materiaal: Meranti, Toepassing: Glaslatten voor het opsluiten van glas in een kozijn, raam of deur\nPrice: EUR 361.08"
  },
  {
    "id": "052b71ebe405",
    "source_url": "https://www.houthandelonline.nl/glaslat-f3-meranti",
    "name": "Glaslat F3 Meranti 17x28mm (rechthoekig met 1 afgeronde hoek) Komo 80mu wit gegrond per 10 stuks",
    "description": "Meranti glaslat, 4-zijden geschaafd met 1 afgeronde hoek. 2x Gegrond in RAL1013. KOMO SKH",
    "brand": "HouthandelOnline",
    "category": "Douglas hout > Toon alles in Douglas hout > Douglas hout palen > Douglas hout balken > Douglas hout latten en regels",
    "price": 244.87,
    "currency": "EUR",
    "price_raw": null,
    "specs": {
      "raw": {
        "Levertijd": "2-7 werkdagen",
        "Kopmaat": "17x28 mm",
        "Dikte": "17 mm",
        "Breedte": "28",
        "Materiaal": "Meranti",
        "Toepassing": "Glaslatten voor het opsluiten van glas in een kozijn, raam of deur"
      }
    },
    "images": [
      "https://www.houthandelonline.nl/cdn/resize-extended/el:true/rs:fill/w:1500/h:1068/extend:true/background:255:255:255/path/media/catalog/product/g/l/glaslat-f3-meranti-v_01_main.jpg",
      "https://www.houthandelonline.nl/cdn/resize-extended/el:true/rs:fill/w:1500/h:1068/extend:true/background:255:255:255/path/media/catalog/product/g/l/glaslat-f3-meranti-v_02_view.jpg"
    ],
    "rating": null,
    "review_count": null,
    "reviews_summary": null,
    "scraped_at": "2026-02-05T16:54:37.863854Z",
    "scrape_success": true,
    "scrape_errors": [],
    "embedding_text": "Product: Glaslat F3 Meranti 17x28mm (rechthoekig met 1 afgeronde hoek) Komo 80mu wit gegrond per 10 stuks\nBrand: HouthandelOnline\nCategory: Douglas hout > Toon alles in Douglas hout > Douglas hout palen > Douglas hout balken > Douglas hout latten en regels\nDescription: Meranti glaslat, 4-zijden geschaafd met 1 afgeronde hoek. 2x Gegrond in RAL1013. KOMO SKH\nSpecifications: Levertijd: 2-7 werkdagen, Kopmaat: 17x28 mm, Dikte: 17 mm, Breedte: 28, Materiaal: Meranti, Toepassing: Glaslatten voor het opsluiten van glas in een kozijn, raam of deur\nPrice: EUR 244.87"
  },
  {
    "id": "47d4d8d8c3d2",
    "source_url": "https://www.houthandelonline.nl/ventilatieglaslat-l3-10st",
    "name": "Ventilatieglaslat L3 Meranti 21x30mm (bovenzijde afgeschuind) Komo, 80 mu gegrond per 10 stuks",
    "description": "Meranti ventilatieglaslat met een afgeschuinde bovenzijde en ventilatie holletjes aan de onderzijde",
    "brand": "HouthandelOnline",
    "category": "Douglas hout > Toon alles in Douglas hout > Douglas hout palen > Douglas hout balken > Douglas hout latten en regels",
    "price": 327.87,
    "currency": "EUR",
    "price_raw": "€6,69/m1",
    "specs": {
      "raw": {
        "Levertijd": "2-7 werkdagen",
        "Kopmaat": "21x30 mm",
        "Dikte": "21 mm",
        "Breedte": "30",
        "Materiaal": "Meranti",
        "Toepassing": "Glaslatten voor het opsluiten van glas in een kozijn, raam of deur"
      }
    },
    "images": [
      "https://www.houthandelonline.nl/cdn/resize-extended/el:true/rs:fill/w:1500/h:1068/extend:true/background:255:255:255/path/media/catalog/product/v/e/ventilatieglaslat-l3-10st-v_01_main_1.jpg",
      "https://www.houthandelonline.nl/cdn/resize-extended/el:true/rs:fill/w:1500/h:1068/extend:true/background:255:255:255/path/media/catalog/product/v/e/ventilatieglaslat-l3-10st-v_02_view_1.jpg"
    ],
    "rating": null,
    "review_count": null,
    "reviews_summary": null,
    "scraped_at": "2026-02-05T16:54:37.863860Z",
    "scrape_success": true,
    "scrape_errors": [],
    "embedding_text": "Product: Ventilatieglaslat L3 Meranti 21x30mm (bovenzijde afgeschuind) Komo, 80 mu gegrond per 10 stuks\nBrand: HouthandelOnline\nCategory: Douglas hout > Toon alles in Douglas hout > Douglas hout palen > Douglas hout balken > Douglas hout latten en regels\nDescription: Meranti ventilatieglaslat met een afgeschuinde bovenzijde en ventilatie holletjes aan de onderzijde\nSpecifications: Levertijd: 2-7 werkdagen, Kopmaat: 21x30 mm, Dikte: 21 mm, Breedte: 30, Materiaal: Meranti, Toepassing: Glaslatten voor het opsluiten van glas in een kozijn, raam of deur\nPrice: EUR 327.87"
  },
  {
    "id": "c8035cede288",
    "source_url": "https://www.houthandelonline.nl/opdekglaslat-zs12-10st",
    "name": "Opdekglaslat ZS12 Meranti 12x32mm 2 afgeschuinde kanten met sponning Komo 80mu wit gegrond per 10 stuks",
    "description": "Meranti opdekglaslat met 2 afgeschuinde kanten en voorzien van sponning. 2x Gegrond in RAL1013. KOMO SKH",
    "brand": "HouthandelOnline",
    "category": "Douglas hout > Toon alles in Douglas hout > Douglas hout palen > Douglas hout balken > Douglas hout latten en regels",
    "price": 187.36,
    "currency": "EUR",
    "price_raw": "€3,82/m1",
    "specs": {
      "raw": {
        "Levertijd": "2-7 werkdagen",
        "Kopmaat": "12x32 mm",
        "Dikte": "12 mm",
        "Breedte": "32",
        "Materiaal": "Meranti",
        "Toepassing": "Glaslatten voor het opsluiten van glas in een kozijn, raam of deur"
      }
    },
    "images": [
      "https://www.houthandelonline.nl/cdn/resize-extended/el:true/rs:fill/w:1500/h:1068/extend:true/background:255:255:255/path/media/catalog/product/o/p/opdekglaslat-zs12-10st-v_01_main_1.jpg",
      "https://www.houthandelonline.nl/cdn/resize-extended/el:true/rs:fill/w:1500/h:1068/extend:true/background:255:255:255/path/media/catalog/product/o/p/opdekglaslat-zs12-10st-v_02_view_1.jpg"
    ],
    "rating": null,
    "review_count": null,
    "reviews_summary": null,
    "scraped_at": "2026-02-05T16:54:37.863866Z",
    "scrape_success": true,
    "scrape_errors": [],
    "embedding_text": "Product: Opdekglaslat ZS12 Meranti 12x32mm 2 afgeschuinde kanten met sponning Komo 80mu wit gegrond per 10 stuks\nBrand: HouthandelOnline\nCategory: Douglas hout > Toon alles in Douglas hout > Douglas hout palen > Douglas hout balken > Douglas hout latten en regels\nDescription: Meranti opdekglaslat met 2 afgeschuinde kanten en voorzien van sponning. 2x Gegrond in RAL1013. KOMO SKH\nSpecifications: Levertijd: 2-7 werkdagen, Kopmaat: 12x32 mm, Dikte: 12 mm, Breedte: 32, Materiaal: Meranti, Toepassing: Glaslatten voor het opsluiten van glas in een kozijn, raam of deur\nPrice: EUR 187.36"
  },
  {
    "id": "22b26c49df38",
    "source_url": "https://www.houthandelonline.nl/glaslat-f2-meranti",
    "name": "Glaslat F2 Meranti 17x20mm (rechthoekig met 1 afgeronde hoek) Komo 80mu wit gegrond per 10 stuks",
    "description": "Meranti glaslat, 4-zijden geschaafd met 1 afgeronde hoek. 2x Gegrond in RAL1013. KOMO SKH",
    "brand": "HouthandelOnline",
    "category": "Douglas hout > Toon alles in Douglas hout > Douglas hout palen > Douglas hout balken > Douglas hout latten en regels",
    "price": 192.69,
    "currency": "EUR",
    "price_raw": "€3,93/m1",
    "specs": {
      "raw": {
        "Levertijd": "2-7 werkdagen",
        "Kopmaat": "17x20 mm",
        "Dikte": "17 mm",
        "Breedte": "20",
        "Materiaal": "Meranti",
        "Toepassing": "Glaslatten voor het opsluiten van glas in een kozijn, raam of deur"
      }
    },
    "images": [
      "https://www.houthandelonline.nl/cdn/resize-extended/el:true/rs:fill/w:1500/h:1068/extend:true/background:255:255:255/path/media/catalog/product/g/l/glaslat-f2-meranti-v_01_main.jpg",
      "https://www.houthandelonline.nl/cdn/resize-extended/el:true/rs:fill/w:1500/h:1068/extend:true/background:255:255:255/path/media/catalog/product/g/l/glaslat-f2-meranti-v_02_view.jpg"
    ],
    "rating": null,
    "review_count": null,
    "reviews_summary": null,
    "scraped_at": "2026-02-05T16:54:37.863874Z",
    "scrape_success": true,
    "scrape_errors": [],
    "embedding_text": "Product: Glaslat F2 Meranti 17x20mm (rechthoekig met 1 afgeronde hoek) Komo 80mu wit gegrond per 10 stuks\nBrand: HouthandelOnline\nCategory: Douglas hout > Toon alles in Douglas hout > Douglas hout palen > Douglas hout balken > Douglas hout latten en regels\nDescription: Meranti glaslat, 4-zijden geschaafd met 1 afgeronde hoek. 2x Gegrond in RAL1013. KOMO SKH\nSpecifications: Levertijd: 2-7 werkdagen, Kopmaat: 17x20 mm, Dikte: 17 mm, Breedte: 20, Materiaal: Meranti, Toepassing: Glaslatten voor het opsluiten van glas in een kozijn, raam of deur\nPrice: EUR 192.69"
  },
  {
    "id": "17a47e5e1e7c",
    "source_url": "https://www.houthandelonline.nl/glaslat-f1-meranti",
    "name": "Glaslat F1 Meranti 17x17mm (rechthoekig met 1 afgeronde hoek) 80mu wit gegrond per 10 stuks",
    "description": "Meranti glaslat, 4-zijden geschaafd met 1 afgeronde hoek. 2x Gegrond in RAL1013. KOMO SKH",
    "brand": "HouthandelOnline",
    "category": "Douglas hout > Toon alles in Douglas hout > Douglas hout palen > Douglas hout balken > Douglas hout latten en regels",
    "price": 146.45,
    "currency": "EUR",
    "price_raw": "€2,99/m1",
    "specs": {
      "raw": {
        "Levertijd": "2-7 werkdagen",
        "Kopmaat": "17x17 mm",
        "Dikte": "17 mm",
        "Breedte": "17",
        "Materiaal": "Meranti",
        "Toepassing": "Glaslatten voor het opsluiten van glas in een kozijn, raam of deur"
      }
    },
    "images": [
      "https://www.houthandelonline.nl/cdn/resize-extended/el:true/rs:fill/w:1500/h:1068/extend:true/background:255:255:255/path/media/catalog/product/g/l/glaslat-f1-meranti-v_01_main_1.jpeg",
      "https://www.houthandelonline.nl/cdn/resize-extended/el:true/rs:fill/w:1500/h:1068/extend:true/background:255:255:255/path/media/catalog/product/g/l/glaslat-f1-meranti-v_02_view_1.jpg"
    ],
    "rating": null,
    "review_count": null,
    "reviews_summary": null,
    "scraped_at": "2026-02-05T16:54:37.863882Z",
    "scrape_success": true,
    "scrape_errors": [],
    "embedding_text": "Product: Glaslat F1 Meranti 17x17mm (rechthoekig met 1 afgeronde hoek) 80mu wit gegrond per 10 stuks\nBrand: HouthandelOnline\nCategory: Douglas hout > Toon alles in Douglas hout > Douglas hout palen > Douglas hout balken > Douglas hout latten en regels\nDescription: Meranti glaslat, 4-zijden geschaafd met 1 afgeronde hoek. 2x Gegrond in RAL1013. KOMO SKH\nSpecifications: Levertijd: 2-7 werkdagen, Kopmaat: 17x17 mm, Dikte: 17 mm, Breedte: 17, Materiaal: Meranti, Toepassing: Glaslatten voor het opsluiten van glas in een kozijn, raam of deur\nPrice: EUR 146.45"
  },
  {
    "id": "dc06e95ba7b2",
    "source_url": "https://www.houthandelonline.nl/glaslat-a3-meranti",
    "name": "Glaslat A3 Meranti 15x33mm (bovenzijde afgeschuind) 80mu wit gegrond per 10 stuks",
    "description": "Meranti glaslat met een afgeschuinde bovenzijde. 1x wit gegrond",
    "brand": "HouthandelOnline",
    "category": "Douglas hout > Toon alles in Douglas hout > Douglas hout palen > Douglas hout balken > Douglas hout latten en regels",
    "price": 265.03,
    "currency": "EUR",
    "price_raw": "€5,41/m1",
    "specs": {
      "raw": {
        "Levertijd": "2-7 werkdagen",
        "Kopmaat": "15x33 mm",
        "Dikte": "15 mm",
        "Breedte": "33",
        "Materiaal": "Meranti",
        "Toepassing": "Glaslatten voor het opsluiten van glas in een kozijn, raam of deur"
      }
    },
    "images": [
      "https://www.houthandelonline.nl/cdn/resize-extended/el:true/rs:fill/w:1500/h:1068/extend:true/background:255:255:255/path/media/catalog/product/g/l/glaslat-a3-meranti-v_01_main.jpg",
      "https://www.houthandelonline.nl/cdn/resize-extended/el:true/rs:fill/w:1500/h:1068/extend:true/background:255:255:255/path/media/catalog/product/g/l/glaslat-a3-meranti-v_02_view.jpg"
    ],
    "rating": null,
    "review_count": null,
    "reviews_summary": null,
    "scraped_at": "2026-02-05T16:54:37.863888Z",
    "scrape_success": true,
    "scrape_errors": [],
    "embedding_text": "Product: Glaslat A3 Meranti 15x33mm (bovenzijde afgeschuind) 80mu wit gegrond per 10 stuks\nBrand: HouthandelOnline\nCategory: Douglas hout > Toon alles in Douglas hout > Douglas hout palen > Douglas hout balken > Douglas hout latten en regels\nDescription: Meranti glaslat met een afgeschuinde bovenzijde. 1x wit gegrond\nSpecifications: Levertijd: 2-7 werkdagen, Kopmaat: 15x33 mm, Dikte: 15 mm, Breedte: 33, Materiaal: Meranti, Toepassing: Glaslatten voor het opsluiten van glas in een kozijn, raam of deur\nPrice: EUR 265.03"
  },
  {
    "id": "f7f1d739180f",
    "source_url": "https://www.houthandelonline.nl/ventilatieglaslat-l1-10st",
    "name": "Ventilatieglaslat L1 Meranti 17x25mm (bovenzijde afgeschuind) Komo, 80 mu gegrond per 10 stuks",
    "description": "Meranti ventilatieglaslat met een afgeschuinde bovenzijde en ventilatie holletjes aan de onderzijde",
    "brand": "HouthandelOnline",
    "category": "Douglas hout > Toon alles in Douglas hout > Douglas hout palen > Douglas hout balken > Douglas hout latten en regels",
    "price": 275.11,
    "currency": "EUR",
    "price_raw": "€5,61/m1",
    "specs": {
      "raw": {
        "Levertijd": "2-7 werkdagen",
        "Kopmaat": "17x25 mm",
        "Dikte": "17 mm",
        "Breedte": "25",
        "Materiaal": "Meranti",
        "Toepassing": "Glaslatten voor het opsluiten van glas in een kozijn, raam of deur"
      }
    },
    "images": [
      "https://www.houthandelonline.nl/cdn/resize-extended/el:true/rs:fill/w:1500/h:1068/extend:true/background:255:255:255/path/media/catalog/product/v/e/ventilatieglaslat-l1-10st-v_01_main.jpg",
      "https://www.houthandelonline.nl/cdn/resize-extended/el:true/rs:fill/w:1500/h:1068/extend:true/background:255:255:255/path/media/catalog/product/v/e/ventilatieglaslat-l1-10st-v_02_view.jpg"
    ],
    "rating": null,
    "review_count": null,
    "reviews_summary": null,
    "scraped_at": "2026-02-05T16:54:37.863894Z",
    "scrape_success": true,
    "scrape_errors": [],
    "embedding_text": "Product: Ventilatieglaslat L1 Meranti 17x25mm (bovenzijde afgeschuind) Komo, 80 mu gegrond per 10 stuks\nBrand: HouthandelOnline\nCategory: Douglas hout > Toon alles in Douglas hout > Douglas hout palen > Douglas hout balken > Douglas hout latten en regels\nDescription: Meranti ventilatieglaslat met een afgeschuinde bovenzijde en ventilatie holletjes aan de onderzijde\nSpecifications: Levertijd: 2-7 werkdagen, Kopmaat: 17x25 mm, Dikte: 17 mm, Breedte: 25, Materiaal: Meranti, Toepassing: Glaslatten voor het opsluiten van glas in een kozijn, raam of deur\nPrice: EUR 275.11"
  },
  {
    "id": "9f6808fda010",
    "source_url": "https://www.houthandelonline.nl/glaslat-f4-meranti",
    "name": "Glaslat F4 Meranti 17x33mm (bovenzijde afgeschuind) 80mu wit gegrond per 10 stuks",
    "description": "Hardhouten glaslat met een afgeschuinde bovenzijde. De glaslat is wit gegrond en heeft een afmeting van 17x33mm. De glaslatten zijn verpakt per 10 stuks.",
    "brand": "HouthandelOnline",
    "category": "Douglas hout > Toon alles in Douglas hout > Douglas hout palen > Douglas hout balken > Douglas hout latten en regels",
    "price": 286.96,
    "currency": "EUR",
    "price_raw": "€5,86/m1",
    "specs": {
      "raw": {
        "Levertijd": "2-7 werkdagen",
        "Kopmaat": "17x33 mm",
        "Dikte": "17 mm",
        "Breedte": "33",
        "Materiaal": "Meranti",
        "Toepassing": "Glaslatten voor het opsluiten van glas in een kozijn, raam of deur"
      }
    },
    "images": [
      "https://www.houthandelonline.nl/cdn/resize-extended/el:true/rs:fill/w:1500/h:1068/extend:true/background:255:255:255/path/media/catalog/product/g/l/glaslat-f4-meranti-v_01_main.jpg"
    ],
    "rating": null,
    "review_count": null,
    "reviews_summary": null,
    "scraped_at": "2026-02-05T16:54:37.863900Z",
    "scrape_success": true,
    "scrape_errors": [],
    "embedding_text": "Product: Glaslat F4 Meranti 17x33mm (bovenzijde afgeschuind) 80mu wit gegrond per 10 stuks\nBrand: HouthandelOnline\nCategory: Douglas hout > Toon alles in Douglas hout > Douglas hout palen > Douglas hout balken > Douglas hout latten en regels\nDescription: Hardhouten glaslat met een afgeschuinde bovenzijde. De glaslat is wit gegrond en heeft een afmeting van 17x33mm. De glaslatten zijn verpakt per 10 stuks.\nSpecifications: Levertijd: 2-7 werkdagen, Kopmaat: 17x33 mm, Dikte: 17 mm, Breedte: 33, Materiaal: Meranti, Toepassing: Glaslatten voor het opsluiten van glas in een kozijn, raam of deur\nPrice: EUR 286.96"
  },
  {
    "id": "a28eac27e064",
    "source_url": "https://www.houthandelonline.nl/opdekglaslat-z9-10st",
    "name": "Opdekglaslat Z9 Meranti 9x32mm 2 afgeschuinde kanten Komo 80mu wit gegrond per 10 stuks",
    "description": "Meranti opdekglaslat met 2 afgeschuinde kanten. 2x Gegrond in RAL1013. KOMO SKH",
    "brand": "HouthandelOnline",
    "category": "Douglas hout > Toon alles in Douglas hout > Douglas hout palen > Douglas hout balken > Douglas hout latten en regels",
    "price": 180.24,
    "currency": "EUR",
    "price_raw": "€3,68/m1",
    "specs": {
      "raw": {
        "Levertijd": "2-7 werkdagen",
        "Kopmaat": "9x32 mm",
        "Dikte": "9 mm",
        "Breedte": "32",
        "Materiaal": "Meranti",
        "Toepassing": "Glaslatten voor het opsluiten van glas in een kozijn, raam of deur"
      }
    },
    "images": [
      "https://www.houthandelonline.nl/cdn/resize-extended/el:true/rs:fill/w:1500/h:1068/extend:true/background:255:255:255/path/media/catalog/product/o/p/opdekglaslat-z9-10st-v_01_main.jpg",
      "https://www.houthandelonline.nl/cdn/resize-extended/el:true/rs:fill/w:1500/h:1068/extend:true/background:255:255:255/path/media/catalog/product/o/p/opdekglaslat-z9-10st-v_02_view.jpg"
    ],
    "rating": null,
    "review_count": null,
    "reviews_summary": null,
    "scraped_at": "2026-02-05T16:54:37.863905Z",
    "scrape_success": true,
    "scrape_errors": [],
    "embedding_text": "Product: Opdekglaslat Z9 Meranti 9x32mm 2 afgeschuinde kanten Komo 80mu wit gegrond per 10 stuks\nBrand: HouthandelOnline\nCategory: Douglas hout > Toon alles in Douglas hout > Douglas hout palen > Douglas hout balken > Douglas hout latten en regels\nDescription: Meranti opdekglaslat met 2 afgeschuinde kanten. 2x Gegrond in RAL1013. KOMO SKH\nSpecifications: Levertijd: 2-7 werkdagen, Kopmaat: 9x32 mm, Dikte: 9 mm, Breedte: 32, Materiaal: Meranti, Toepassing: Glaslatten voor het opsluiten van glas in een kozijn, raam of deur\nPrice: EUR 180.24"
  },
  {
    "id": "d79c06a694ab",
    "source_url": "https://www.houthandelonline.nl/opdekglaslat-z12-10st",
    "name": "Opdekglaslat Z12 Meranti 12x32mm 2 afgeschuinde kanten Komo 80mu wit gegrond per 10 stuks",
    "description": "Meranti opdekglaslat met 2 afgeschuinde kanten. 2x Gegrond in RAL1013. KOMO SKH",
    "brand": "HouthandelOnline",
    "category": "Douglas hout > Toon alles in Douglas hout > Douglas hout palen > Douglas hout balken > Douglas hout latten en regels",
    "price": 187.36,
    "currency": "EUR",
    "price_raw": "€3,82/m1",
    "specs": {
      "raw": {
        "Levertijd": "2-7 werkdagen",
        "Kopmaat": "12x32 mm",
        "Dikte": "12 mm",
        "Breedte": "32",
        "Materiaal": "Meranti",
        "Toepassing": "Glaslatten voor het opsluiten van glas in een kozijn, raam of deur"
      }
    },
    "images": [
      "https://www.houthandelonline.nl/cdn/resize-extended/el:true/rs:fill/w:1500/h:1068/extend:true/background:255:255:255/path/media/catalog/product/o/p/opdekglaslat-z12-10st-v_01_main.jpg",
      "https://www.houthandelonline.nl/cdn/resize-extended/el:true/rs:fill/w:1500/h:1068/extend:true/background:255:255:255/path/media/catalog/product/o/p/opdekglaslat-z12-10st-v_02_view.jpg"
    ],
    "rating": null,
    "review_count": null,
    "reviews_summary": null,
    "scraped_at": "2026-02-05T16:54:37.863912Z",
    "scrape_success": true,
    "scrape_errors": [],
    "embedding_text": "Product: Opdekglaslat Z12 Meranti 12x32mm 2 afgeschuinde kanten Komo 80mu wit gegrond per 10 stuks\nBrand: HouthandelOnline\nCategory: Douglas hout > Toon alles in Douglas hout > Douglas hout palen > Douglas hout balken > Douglas hout latten en regels\nDescription: Meranti opdekglaslat met 2 afgeschuinde kanten. 2x Gegrond in RAL1013. KOMO SKH\nSpecifications: Levertijd: 2-7 werkdagen, Kopmaat: 12x32 mm, Dikte: 12 mm, Breedte: 32, Materiaal: Meranti, Toepassing: Glaslatten voor het opsluiten van glas in een kozijn, raam of deur\nPrice: EUR 187.36"
  },
  {
    "id": "7136f2cc075f",
    "source_url": "https://www.houthandelonline.nl/opdekglaslat-zs9-10st",
    "name": "Opdekglaslat ZS9 Meranti 9x32mm 2 afgeschuinde kanten met sponning Komo 80mu wit gegrond per 10 stuks",
    "description": "Meranti opdekglaslat met 2 afgeschuinde kanten en voorzien van sponning. 2x Gegrond in RAL1013. KOMO SKH",
    "brand": "HouthandelOnline",
    "category": "Douglas hout > Toon alles in Douglas hout > Douglas hout palen > Douglas hout balken > Douglas hout latten en regels",
    "price": 224.12,
    "currency": "EUR",
    "price_raw": "€4,57/m1",
    "specs": {
      "raw": {
        "Levertijd": "2-7 werkdagen",
        "Kopmaat": "9x32 mm",
        "Dikte": "9 mm",
        "Breedte": "32",
        "Materiaal": "Meranti",
        "Toepassing": "Glaslatten voor het opsluiten van glas in een kozijn, raam of deur"
      }
    },
    "images": [
      "https://www.houthandelonline.nl/cdn/resize-extended/el:true/rs:fill/w:1500/h:1068/extend:true/background:255:255:255/path/media/catalog/product/o/p/opdekglaslat-zs9-10st-v_01_main.jpg",
      "https://www.houthandelonline.nl/cdn/resize-extended/el:true/rs:fill/w:1500/h:1068/extend:true/background:255:255:255/path/media/catalog/product/o/p/opdekglaslat-zs9-10st-v_02_view.jpg"
    ],
    "rating": null,
    "review_count": null,
    "reviews_summary": null,
    "scraped_at": "2026-02-05T16:54:37.863943Z",
    "scrape_success": true,
    "scrape_errors": [],
    "embedding_text": "Product: Opdekglaslat ZS9 Meranti 9x32mm 2 afgeschuinde kanten met sponning Komo 80mu wit gegrond per 10 stuks\nBrand: HouthandelOnline\nCategory: Douglas hout > Toon alles in Douglas hout > Douglas hout palen > Douglas hout balken > Douglas hout latten en regels\nDescription: Meranti opdekglaslat met 2 afgeschuinde kanten en voorzien van sponning. 2x Gegrond in RAL1013. KOMO SKH\nSpecifications: Levertijd: 2-7 werkdagen, Kopmaat: 9x32 mm, Dikte: 9 mm, Breedte: 32, Materiaal: Meranti, Toepassing: Glaslatten voor het opsluiten van glas in een kozijn, raam of deur\nPrice: EUR 224.12"
  },
  {
    "id": "5e682ca17f71",
    "source_url": "https://www.houthandelonline.nl/glaslat-e1-meranti",
    "name": "Glaslat E1 Meranti 17x15mm (bovenzijde afgeschuind en ondersponning) Komo 80mu wit gegrond per 10 stuks",
    "description": "Meranti glaslat met een afgeschuinde bovenzijde en voorzien van extra sponning. 2x Gegrond in RAL1013. KOMO SKH",
    "brand": "HouthandelOnline",
    "category": "Douglas hout > Toon alles in Douglas hout > Douglas hout palen > Douglas hout balken > Douglas hout latten en regels",
    "price": 184.39,
    "currency": "EUR",
    "price_raw": "€3,76/m1",
    "specs": {
      "raw": {
        "Levertijd": "2-7 werkdagen",
        "Kopmaat": "17x15 mm",
        "Dikte": "17 mm",
        "Breedte": "15",
        "Materiaal": "Meranti",
        "Toepassing": "Glaslatten voor het opsluiten van glas in een kozijn, raam of deur"
      }
    },
    "images": [
      "https://www.houthandelonline.nl/cdn/resize-extended/el:true/rs:fill/w:1500/h:1068/extend:true/background:255:255:255/path/media/catalog/product/g/l/glaslat-e1-meranti-v_01_main.jpg",
      "https://www.houthandelonline.nl/cdn/resize-extended/el:true/rs:fill/w:1500/h:1068/extend:true/background:255:255:255/path/media/catalog/product/g/l/glaslat-e1-meranti-v_02_view.jpg"
    ],
    "rating": null,
    "review_count": null,
    "reviews_summary": null,
    "scraped_at": "2026-02-05T16:54:37.863966Z",
    "scrape_success": true,
    "scrape_errors": [],
    "embedding_text": "Product: Glaslat E1 Meranti 17x15mm (bovenzijde afgeschuind en ondersponning) Komo 80mu wit gegrond per 10 stuks\nBrand: HouthandelOnline\nCategory: Douglas hout > Toon alles in Douglas hout > Douglas hout palen > Douglas hout balken > Douglas hout latten en regels\nDescription: Meranti glaslat met een afgeschuinde bovenzijde en voorzien van extra sponning. 2x Gegrond in RAL1013. KOMO SKH\nSpecifications: Levertijd: 2-7 werkdagen, Kopmaat: 17x15 mm, Dikte: 17 mm, Breedte: 15, Materiaal: Meranti, Toepassing: Glaslatten voor het opsluiten van glas in een kozijn, raam of deur\nPrice: EUR 184.39"
  },
  {
    "id": "264826e0d33c",
    "source_url": "https://www.houthandelonline.nl/glaslat-d1-meranti",
    "name": "Glaslat D1 Meranti 17x15mm (bovenzijde afgeschuind) 80mu wit gegrond per 10 stuks",
    "description": "Hardhouten glaslat met een afgeschuinde bovenzijde. De glaslat is wit gegrond en heeft een afmeting van 17x15mm. De glaslatten zijn verpakt per 10 stuks.",
    "brand": "HouthandelOnline",
    "category": "Douglas hout > Toon alles in Douglas hout > Douglas hout palen > Douglas hout balken > Douglas hout latten en regels",
    "price": 133.4,
    "currency": "EUR",
    "price_raw": "€2,72/m1",
    "specs": {
      "raw": {
        "Levertijd": "2-7 werkdagen",
        "Kopmaat": "17x15 mm",
        "Dikte": "17 mm",
        "Breedte": "15",
        "Materiaal": "Meranti",
        "Toepassing": "Glaslatten voor het opsluiten van glas in een kozijn, raam of deur"
      }
    },
    "images": [
      "https://www.houthandelonline.nl/cdn/resize-extended/el:true/rs:fill/w:1500/h:1068/extend:true/background:255:255:255/path/media/catalog/product/g/l/glaslat-d1-meranti-v_01_main.jpg"
    ],
    "rating": null,
    "review_count": null,
    "reviews_summary": null,
    "scraped_at": "2026-02-05T16:54:37.863974Z",
    "scrape_success": true,
    "scrape_errors": [],
    "embedding_text": "Product: Glaslat D1 Meranti 17x15mm (bovenzijde afgeschuind) 80mu wit gegrond per 10 stuks\nBrand: HouthandelOnline\nCategory: Douglas hout > Toon alles in Douglas hout > Douglas hout palen > Douglas hout balken > Douglas hout latten en regels\nDescription: Hardhouten glaslat met een afgeschuinde bovenzijde. De glaslat is wit gegrond en heeft een afmeting van 17x15mm. De glaslatten zijn verpakt per 10 stuks.\nSpecifications: Levertijd: 2-7 werkdagen, Kopmaat: 17x15 mm, Dikte: 17 mm, Breedte: 15, Materiaal: Meranti, Toepassing: Glaslatten voor het opsluiten van glas in een kozijn, raam of deur\nPrice: EUR 133.4"
  },
  {
    "id": "d31151ef57cd",
    "source_url": "https://www.houthandelonline.nl/glaslat-a4-meranti",
    "name": "Glaslat A4 Meranti 17x28mm (bovenzijde afgeschuind) Komo 80mu wit gegrond per 10 stuks",
    "description": "Meranti glaslat met een afgeschuinde bovenzijde. 2x Gegrond in RAL1013. KOMO SKH",
    "brand": "HouthandelOnline",
    "category": "Douglas hout > Toon alles in Douglas hout > Douglas hout palen > Douglas hout balken > Douglas hout latten en regels",
    "price": 251.98,
    "currency": "EUR",
    "price_raw": "€5,14/m1",
    "specs": {
      "raw": {
        "Levertijd": "2-7 werkdagen",
        "Kopmaat": "17x28 mm",
        "Dikte": "17 mm",
        "Breedte": "28",
        "Materiaal": "Meranti",
        "Toepassing": "Glaslatten voor het opsluiten van glas in een kozijn, raam of deur"
      }
    },
    "images": [
      "https://www.houthandelonline.nl/cdn/resize-extended/el:true/rs:fill/w:1500/h:1068/extend:true/background:255:255:255/path/media/catalog/product/g/l/glaslat-a4-meranti-v_01_main.jpg",
      "https://www.houthandelonline.nl/cdn/resize-extended/el:true/rs:fill/w:1500/h:1068/extend:true/background:255:255:255/path/media/catalog/product/g/l/glaslat-a4-meranti-v_02_view.jpg"
    ],
    "rating": null,
    "review_count": null,
    "reviews_summary": null,
    "scraped_at": "2026-02-05T16:54:37.863980Z",
    "scrape_success": true,
    "scrape_errors": [],
    "embedding_text": "Product: Glaslat A4 Meranti 17x28mm (bovenzijde afgeschuind) Komo 80mu wit gegrond per 10 stuks\nBrand: HouthandelOnline\nCategory: Douglas hout > Toon alles in Douglas hout > Douglas hout palen > Douglas hout balken > Douglas hout latten en regels\nDescription: Meranti glaslat met een afgeschuinde bovenzijde. 2x Gegrond in RAL1013. KOMO SKH\nSpecifications: Levertijd: 2-7 werkdagen, Kopmaat: 17x28 mm, Dikte: 17 mm, Breedte: 28, Materiaal: Meranti, Toepassing: Glaslatten voor het opsluiten van glas in een kozijn, raam of deur\nPrice: EUR 251.98"
  },
  {
    "id": "03fbe767e12d",
    "source_url": "https://www.houthandelonline.nl/glaslat-e2-meranti",
    "name": "Glaslat E2 Meranti 17x19mm (bovenzijde afgeschuind en ondersponning) Komo 80mu wit gegrond per 10 stuks",
    "description": "Meranti glaslat met een afgeschuinde bovenzijde en voorzien van extra sponning. 2x Gegrond in RAL1013. KOMO SKH",
    "brand": "HouthandelOnline",
    "category": "Douglas hout > Toon alles in Douglas hout > Douglas hout palen > Douglas hout balken > Douglas hout latten en regels",
    "price": 228.27,
    "currency": "EUR",
    "price_raw": "€4,66/m1",
    "specs": {
      "raw": {
        "Levertijd": "2-7 werkdagen",
        "Kopmaat": "17x19 mm",
        "Dikte": "17 mm",
        "Breedte": "19",
        "Materiaal": "Meranti",
        "Toepassing": "Glaslatten voor het opsluiten van glas in een kozijn, raam of deur"
      }
    },
    "images": [
      "https://www.houthandelonline.nl/cdn/resize-extended/el:true/rs:fill/w:1500/h:1068/extend:true/background:255:255:255/path/media/catalog/product/g/l/glaslat-e2-meranti-v_01_main.jpg",
      "https://www.houthandelonline.nl/cdn/resize-extended/el:true/rs:fill/w:1500/h:1068/extend:true/background:255:255:255/path/media/catalog/product/g/l/glaslat-e2-meranti-v_02_view.jpg"
    ],
    "rating": null,
    "review_count": null,
    "reviews_summary": null,
    "scraped_at": "2026-02-05T16:54:37.863986Z",
    "scrape_success": true,
    "scrape_errors": [],
    "embedding_text": "Product: Glaslat E2 Meranti 17x19mm (bovenzijde afgeschuind en ondersponning) Komo 80mu wit gegrond per 10 stuks\nBrand: HouthandelOnline\nCategory: Douglas hout > Toon alles in Douglas hout > Douglas hout palen > Douglas hout balken > Douglas hout latten en regels\nDescription: Meranti glaslat met een afgeschuinde bovenzijde en voorzien van extra sponning. 2x Gegrond in RAL1013. KOMO SKH\nSpecifications: Levertijd: 2-7 werkdagen, Kopmaat: 17x19 mm, Dikte: 17 mm, Breedte: 19, Materiaal: Meranti, Toepassing: Glaslatten voor het opsluiten van glas in een kozijn, raam of deur\nPrice: EUR 228.27"
  },
  {
    "id": "2a9af13def8c",
    "source_url": "https://www.houthandelonline.nl/glaslat-d1-meranti-komo",
    "name": "Glaslat D1 Meranti 17x15mm (bovenzijde afgeschuind) Komo 80mu wit gegrond per 10 stuks",
    "description": "Meranti glaslat met een afgeschuinde bovenzijde. 2x Gegrond in RAL1013. KOMO SKH",
    "brand": "HouthandelOnline",
    "category": "Douglas hout > Toon alles in Douglas hout > Douglas hout palen > Douglas hout balken > Douglas hout latten en regels",
    "price": 144.07,
    "currency": "EUR",
    "price_raw": "€2,94/m1",
    "specs": {
      "raw": {
        "Levertijd": "2-7 werkdagen",
        "Kopmaat": "17x15 mm",
        "Dikte": "17 mm",
        "Breedte": "15",
        "Materiaal": "Meranti",
        "Toepassing": "Glaslatten voor het opsluiten van glas in een kozijn, raam of deur"
      }
    },
    "images": [
      "https://www.houthandelonline.nl/cdn/resize-extended/el:true/rs:fill/w:1500/h:1068/extend:true/background:255:255:255/path/media/catalog/product/g/l/glaslat-d1-meranti-komo-v_01_main_1.jpg",
      "https://www.houthandelonline.nl/cdn/resize-extended/el:true/rs:fill/w:1500/h:1068/extend:true/background:255:255:255/path/media/catalog/product/g/l/glaslat-d1-meranti-komo-v_02_view_1.jpg"
    ],
    "rating": null,
    "review_count": null,
    "reviews_summary": null,
    "scraped_at": "2026-02-05T16:54:37.863993Z",
    "scrape_success": true,
    "scrape_errors": [],
    "embedding_text": "Product: Glaslat D1 Meranti 17x15mm (bovenzijde afgeschuind) Komo 80mu wit gegrond per 10 stuks\nBrand: HouthandelOnline\nCategory: Douglas hout > Toon alles in Douglas hout > Douglas hout palen > Douglas hout balken > Douglas hout latten en regels\nDescription: Meranti glaslat met een afgeschuinde bovenzijde. 2x Gegrond in RAL1013. KOMO SKH\nSpecifications: Levertijd: 2-7 werkdagen, Kopmaat: 17x15 mm, Dikte: 17 mm, Breedte: 15, Materiaal: Meranti, Toepassing: Glaslatten voor het opsluiten van glas in een kozijn, raam of deur\nPrice: EUR 144.07"
  },
  {
    "id": "506650504f45",
    "source_url": "https://www.houthandelonline.nl/glaslat-c2-meranti",
    "name": "Glaslat C2 Meranti 19x21mm (bovenzijde afgeschuind) Komo 80mu wit gegrond per 10 stuks",
    "description": "Meranti Glaslat met een afgeschuinde bovenzijde. 2x gegrond in RAL1013. KOMO SKH",
    "brand": "HouthandelOnline",
    "category": "Douglas hout > Toon alles in Douglas hout > Douglas hout palen > Douglas hout balken > Douglas hout latten en regels",
    "price": 282.22,
    "currency": "EUR",
    "price_raw": "€5,76/m1",
    "specs": {
      "raw": {
        "Levertijd": "2-7 werkdagen",
        "Kopmaat": "19x21 mm",
        "Dikte": "19 mm",
        "Breedte": "21",
        "Materiaal": "Meranti",
        "Toepassing": "Glaslatten voor het opsluiten van glas in een kozijn, raam of deur"
      }
    },
    "images": [
      "https://www.houthandelonline.nl/cdn/resize-extended/el:true/rs:fill/w:1500/h:1068/extend:true/background:255:255:255/path/media/catalog/product/g/l/glaslat-c2-meranti-v_01_main_1.jpg"
    ],
    "rating": null,
    "review_count": null,
    "reviews_summary": null,
    "scraped_at": "2026-02-05T16:54:37.863998Z",
    "scrape_success": true,
    "scrape_errors": [],
    "embedding_text": "Product: Glaslat C2 Meranti 19x21mm (bovenzijde afgeschuind) Komo 80mu wit gegrond per 10 stuks\nBrand: HouthandelOnline\nCategory: Douglas hout > Toon alles in Douglas hout > Douglas hout palen > Douglas hout balken > Douglas hout latten en regels\nDescription: Meranti Glaslat met een afgeschuinde bovenzijde. 2x gegrond in RAL1013. KOMO SKH\nSpecifications: Levertijd: 2-7 werkdagen, Kopmaat: 19x21 mm, Dikte: 19 mm, Breedte: 21, Materiaal: Meranti, Toepassing: Glaslatten voor het opsluiten van glas in een kozijn, raam of deur\nPrice: EUR 282.22"
  },
  {
    "id": "254c0f1ed779",
    "source_url": "https://www.houthandelonline.nl/glaslat-b2-meranti",
    "name": "Glaslat B2 Meranti 12x20mm (bovenzijde afgeschuind) 80mu wit gegrond per 10 stuks",
    "description": "Hardhouten glaslat met een afgeschuinde bovenzijde. De glaslat is wit gegrond en heeft een afmeting van 12x20mm. De glaslatten zijn verpakt per 10 stuks.",
    "brand": "HouthandelOnline",
    "category": "Douglas hout > Toon alles in Douglas hout > Douglas hout palen > Douglas hout balken > Douglas hout latten en regels",
    "price": 213.44,
    "currency": "EUR",
    "price_raw": "€4,36/m1",
    "specs": {
      "raw": {
        "Levertijd": "2-7 werkdagen",
        "Kopmaat": "12x20 mm",
        "Dikte": "12 mm",
        "Breedte": "20",
        "Materiaal": "Meranti",
        "Toepassing": "Glaslatten voor het opsluiten van glas in een kozijn, raam of deur"
      }
    },
    "images": [
      "https://www.houthandelonline.nl/cdn/resize-extended/el:true/rs:fill/w:1500/h:1068/extend:true/background:255:255:255/path/media/catalog/product/g/l/glaslat-b2-meranti-v_01_main.jpg"
    ],
    "rating": null,
    "review_count": null,
    "reviews_summary": null,
    "scraped_at": "2026-02-05T16:54:37.864004Z",
    "scrape_success": true,
    "scrape_errors": [],
    "embedding_text": "Product: Glaslat B2 Meranti 12x20mm (bovenzijde afgeschuind) 80mu wit gegrond per 10 stuks\nBrand: HouthandelOnline\nCategory: Douglas hout > Toon alles in Douglas hout > Douglas hout palen > Douglas hout balken > Douglas hout latten en regels\nDescription: Hardhouten glaslat met een afgeschuinde bovenzijde. De glaslat is wit gegrond en heeft een afmeting van 12x20mm. De glaslatten zijn verpakt per 10 stuks.\nSpecifications: Levertijd: 2-7 werkdagen, Kopmaat: 12x20 mm, Dikte: 12 mm, Breedte: 20, Materiaal: Meranti, Toepassing: Glaslatten voor het opsluiten van glas in een kozijn, raam of deur\nPrice: EUR 213.44"
  },
  {
    "id": "e34089fcdf95",
    "source_url": "https://www.houthandelonline.nl/glaslat-b1-meranti",
    "name": "Glaslat B1 Meranti 12x14mm (bovenzijde afgeschuind) 80mu wit gegrond per 10 stuks",
    "description": "Hardhouten glaslat met een afgeschuinde bovenzijde. De glaslat is wit gegrond en heeft een afmeting van 12x14mm. De glaslatten zijn verpakt per 10 stuks en hebben een lengte van 490cm.",
    "brand": "HouthandelOnline",
    "category": "Douglas hout > Toon alles in Douglas hout > Douglas hout palen > Douglas hout balken > Douglas hout latten en regels",
    "price": 172.53,
    "currency": "EUR",
    "price_raw": "€3,52/m1",
    "specs": {
      "raw": {
        "Levertijd": "2-7 werkdagen",
        "Kopmaat": "12x14 mm",
        "Dikte": "12 mm",
        "Breedte": "14",
        "Materiaal": "Meranti",
        "Toepassing": "Glaslatten voor het opsluiten van glas in een kozijn, raam of deur"
      }
    },
    "images": [
      "https://www.houthandelonline.nl/cdn/resize-extended/el:true/rs:fill/w:1500/h:1068/extend:true/background:255:255:255/path/media/catalog/product/g/l/glaslat-b1-meranti-v_01_main.jpg"
    ],
    "rating": null,
    "review_count": null,
    "reviews_summary": null,
    "scraped_at": "2026-02-05T16:54:37.864011Z",
    "scrape_success": true,
    "scrape_errors": [],
    "embedding_text": "Product: Glaslat B1 Meranti 12x14mm (bovenzijde afgeschuind) 80mu wit gegrond per 10 stuks\nBrand: HouthandelOnline\nCategory: Douglas hout > Toon alles in Douglas hout > Douglas hout palen > Douglas hout balken > Douglas hout latten en regels\nDescription: Hardhouten glaslat met een afgeschuinde bovenzijde. De glaslat is wit gegrond en heeft een afmeting van 12x14mm. De glaslatten zijn verpakt per 10 stuks en hebben een lengte van 490cm.\nSpecifications: Levertijd: 2-7 werkdagen, Kopmaat: 12x14 mm, Dikte: 12 mm, Breedte: 14, Materiaal: Meranti, Toepassing: Glaslatten voor het opsluiten van glas in een kozijn, raam of deur\nPrice: EUR 172.53"
  },
  {
    "id": "b8446c0ff263",
    "source_url": "https://www.houthandelonline.nl/glaslat-c1-meranti",
    "name": "Glaslat C1 Meranti 17x19mm (bovenzijde afgeschuind) Komo 80mu wit gegrond per 10 stuks",
    "description": "Meranti glaslat met een afgeschuinde bovenzijde. 2x Gegrond in RAL1013. KOMO SKH",
    "brand": "HouthandelOnline",
    "category": "Douglas hout > Toon alles in Douglas hout > Douglas hout palen > Douglas hout balken > Douglas hout latten en regels",
    "price": 142.3,
    "currency": "EUR",
    "price_raw": "€2,90/m1",
    "specs": {
      "raw": {
        "Levertijd": "2-7 werkdagen",
        "Kopmaat": "17x19 mm",
        "Dikte": "17 mm",
        "Breedte": "19",
        "Materiaal": "Meranti",
        "Toepassing": "Glaslatten voor het opsluiten van glas in een kozijn, raam of deur"
      }
    },
    "images": [
      "https://www.houthandelonline.nl/cdn/resize-extended/el:true/rs:fill/w:1500/h:1068/extend:true/background:255:255:255/path/media/catalog/product/g/l/glaslat-c1-meranti-v_01_main.jpg",
      "https://www.houthandelonline.nl/cdn/resize-extended/el:true/rs:fill/w:1500/h:1068/extend:true/background:255:255:255/path/media/catalog/product/g/l/glaslat-c1-meranti-v_02_view.jpg"
    ],
    "rating": null,
    "review_count": null,
    "reviews_summary": null,
    "scraped_at": "2026-02-05T16:54:37.864017Z",
    "scrape_success": true,
    "scrape_errors": [],
    "embedding_text": "Product: Glaslat C1 Meranti 17x19mm (bovenzijde afgeschuind) Komo 80mu wit gegrond per 10 stuks\nBrand: HouthandelOnline\nCategory: Douglas hout > Toon alles in Douglas hout > Douglas hout palen > Douglas hout balken > Douglas hout latten en regels\nDescription: Meranti glaslat met een afgeschuinde bovenzijde. 2x Gegrond in RAL1013. KOMO SKH\nSpecifications: Levertijd: 2-7 werkdagen, Kopmaat: 17x19 mm, Dikte: 17 mm, Breedte: 19, Materiaal: Meranti, Toepassing: Glaslatten voor het opsluiten van glas in een kozijn, raam of deur\nPrice: EUR 142.3"
  },
  {
    "id": "92bdd915a399",
    "source_url": "https://www.houthandelonline.nl/neuslat-tricoya-mdf-k25-5st",
    "name": "Neuslat Tricoya MDF K25 18x39mm (sponning 25mm) geschaafd wit gegrond per 5 stuks",
    "description": "Tricoya MDF neuslat, een glaslat met 25mm sponning, is geschaafd en rondom 60mu gegrond. Deze raamafwerklijst is binnen en buiten toepasbaar als geventileerde neuslat voor het afvoeren van vuil en vocht en het beschermen van het kozijnhout. De neuslat is 18x39mm. Verpakt per 5 stuks.",
    "brand": "HouthandelOnline",
    "category": "Douglas hout > Toon alles in Douglas hout > Douglas hout palen > Douglas hout balken > Douglas hout latten en regels",
    "price": 311.77,
    "currency": "EUR",
    "price_raw": "€12,78/m1",
    "specs": {
      "raw": {
        "Levertijd": "2-7 werkdagen",
        "Kopmaat": "18x39 mm",
        "Dikte": "18 mm",
        "Breedte": "39",
        "Materiaal": "MDF Tricoya"
      }
    },
    "images": [
      "https://www.houthandelonline.nl/cdn/resize-extended/el:true/rs:fill/w:1500/h:1068/extend:true/background:255:255:255/path/media/catalog/product/n/e/neuslat-tricoya-mdf-k25-5st-v_01_main.jpg",
      "https://www.houthandelonline.nl/cdn/resize-extended/el:true/rs:fill/w:1500/h:1068/extend:true/background:255:255:255/path/media/catalog/product/n/e/neuslat-tricoya-mdf-k25-5st-v_02_view.jpg"
    ],
    "rating": null,
    "review_count": null,
    "reviews_summary": null,
    "scraped_at": "2026-02-05T16:54:37.864023Z",
    "scrape_success": true,
    "scrape_errors": [],
    "embedding_text": "Product: Neuslat Tricoya MDF K25 18x39mm (sponning 25mm) geschaafd wit gegrond per 5 stuks\nBrand: HouthandelOnline\nCategory: Douglas hout > Toon alles in Douglas hout > Douglas hout palen > Douglas hout balken > Douglas hout latten en regels\nDescription: Tricoya MDF neuslat, een glaslat met 25mm sponning, is geschaafd en rondom 60mu gegrond. Deze raamafwerklijst is binnen en buiten toepasbaar als geventileerde neuslat voor het afvoeren van vuil en vocht en het beschermen van het kozijnhout. De neuslat is 18x39mm. Verpakt per 5 stuks.\nSpecifications: Levertijd: 2-7 werkdagen, Kopmaat: 18x39 mm, Dikte: 18 mm, Breedte: 39, Materiaal: MDF Tricoya\nPrice: EUR 311.77"
  },
  {
    "id": "2bffa22b9315",
    "source_url": "https://www.houthandelonline.nl/neuslat-meranti-mdf-k55-5st",
    "name": "Neuslat Meranti K55 18x70mm (sponning 55mm) geschaafd wit gegrond per 5 stuks",
    "description": "Meranti houten neuslat, een glaslat met 55mm sponning, is geschaafd en rondom 80mu gegrond. Deze raamafwerklijst is buiten toepasbaar als geventileerde neuslat voor het afvoeren van vocht en het beschermen van het kozijnhout. Verpakt per 5 stuks.",
    "brand": "HouthandelOnline",
    "category": "Douglas hout > Toon alles in Douglas hout > Douglas hout palen > Douglas hout balken > Douglas hout latten en regels",
    "price": 321.35,
    "currency": "EUR",
    "price_raw": "€13,12/m1",
    "specs": {
      "raw": {
        "Levertijd": "2-7 werkdagen",
        "Kopmaat": "18x70 mm",
        "Dikte": "18 mm",
        "Breedte": "70",
        "Materiaal": "Meranti"
      }
    },
    "images": [
      "https://www.houthandelonline.nl/cdn/resize-extended/el:true/rs:fill/w:1500/h:1068/extend:true/background:255:255:255/path/media/catalog/product/n/e/neuslat-meranti-mdf-k55-5st-v_01_main.jpg",
      "https://www.houthandelonline.nl/cdn/resize-extended/el:true/rs:fill/w:1500/h:1068/extend:true/background:255:255:255/path/media/catalog/product/n/e/neuslat-meranti-mdf-k55-5st-v_02_view.jpg"
    ],
    "rating": null,
    "review_count": null,
    "reviews_summary": null,
    "scraped_at": "2026-02-05T16:54:37.864029Z",
    "scrape_success": true,
    "scrape_errors": [],
    "embedding_text": "Product: Neuslat Meranti K55 18x70mm (sponning 55mm) geschaafd wit gegrond per 5 stuks\nBrand: HouthandelOnline\nCategory: Douglas hout > Toon alles in Douglas hout > Douglas hout palen > Douglas hout balken > Douglas hout latten en regels\nDescription: Meranti houten neuslat, een glaslat met 55mm sponning, is geschaafd en rondom 80mu gegrond. Deze raamafwerklijst is buiten toepasbaar als geventileerde neuslat voor het afvoeren van vocht en het beschermen van het kozijnhout. Verpakt per 5 stuks.\nSpecifications: Levertijd: 2-7 werkdagen, Kopmaat: 18x70 mm, Dikte: 18 mm, Breedte: 70, Materiaal: Meranti\nPrice: EUR 321.35"
  },
  {
    "id": "419a94b3c920",
    "source_url": "https://www.houthandelonline.nl/kraalplint-mdf-vochtw-18x195-3st",
    "name": "Kraalplint MDF 18x195mm vochtwerend wit voorgelakt bos a 3 stuks",
    "description": "Deze vochtwerende V313 vloerplint met een kraalmodel aan de bovenzijde ter afwerking van de aansluiting van de vloer en wand. Deze kraalplint heeft een afmeting van 18x195mm en is wit voorgelakt. De plinten zijn verpakt per 3 stuks.",
    "brand": "HouthandelOnline",
    "category": "Douglas hout > Toon alles in Douglas hout > Douglas hout palen > Douglas hout balken > Douglas hout latten en regels",
    "price": 157.13,
    "currency": "EUR",
    "price_raw": "€10,73/m1",
    "specs": {
      "raw": {
        "Levertijd": "2-7 werkdagen",
        "Kopmaat": "18x195 mm",
        "Dikte": "18 mm",
        "Breedte": "195",
        "Materiaal": "MDF",
        "Toepassing": "Kraalplinten voor het afwerken van de aansluiting tussen vloer en wand"
      }
    },
    "images": [
      "https://www.houthandelonline.nl/cdn/resize-extended/el:true/rs:fill/w:1500/h:1068/extend:true/background:255:255:255/path/media/catalog/product/k/r/kraalplint-mdf-vochtw-18x195-3st-v_01_main.jpg",
      "https://www.houthandelonline.nl/cdn/resize-extended/el:true/rs:fill/w:1500/h:1068/extend:true/background:255:255:255/path/media/catalog/product/k/r/kraalplint-mdf-vochtw-18x195-3st-v_02_view.jpg"
    ],
    "rating": null,
    "review_count": null,
    "reviews_summary": null,
    "scraped_at": "2026-02-05T16:54:37.864035Z",
    "scrape_success": true,
    "scrape_errors": [],
    "embedding_text": "Product: Kraalplint MDF 18x195mm vochtwerend wit voorgelakt bos a 3 stuks\nBrand: HouthandelOnline\nCategory: Douglas hout > Toon alles in Douglas hout > Douglas hout palen > Douglas hout balken > Douglas hout latten en regels\nDescription: Deze vochtwerende V313 vloerplint met een kraalmodel aan de bovenzijde ter afwerking van de aansluiting van de vloer en wand. Deze kraalplint heeft een afmeting van 18x195mm en is wit voorgelakt. De plinten zijn verpakt per 3 stuks.\nSpecifications: Levertijd: 2-7 werkdagen, Kopmaat: 18x195 mm, Dikte: 18 mm, Breedte: 195, Materiaal: MDF, Toepassing: Kraalplinten voor het afwerken van de aansluiting tussen vloer en wand\nPrice: EUR 157.13"
  },
  {
    "id": "42958a912c77",
    "source_url": "https://www.houthandelonline.nl/hoeklat-meranti-18x18-10st",
    "name": "Hoeklat Meranti 18x18mm geschaafd per 10 stuks",
    "description": "Hardhouten hoeklatten zijn geschaafd en onbehandeld. Houten hoekprofielen zorgen voor een nette hoekafwerking binnenshuis. Deze hoekprofielen zijn geschikt voor het afwerken van hoeken van wanden, meubels of voor een decoratieve overgang van de ene naar de andere wand. Deze Hardhouten afwerklijst is zeer sterk en gaat lang mee. Verpakt per 10 stuks.",
    "brand": "HouthandelOnline",
    "category": "Douglas hout > Toon alles in Douglas hout > Douglas hout palen > Douglas hout balken > Douglas hout latten en regels",
    "price": 99.16,
    "currency": "EUR",
    "price_raw": "€3,61/m1",
    "specs": {
      "raw": {
        "Levertijd": "2-7 werkdagen",
        "Kopmaat": "18x18 mm",
        "Dikte": "18 mm",
        "Breedte": "18",
        "Materiaal": "Meranti",
        "Toepassing": "Deze Hardhouten buitenhoeklat is binnen toepasbaar voor het afwerken van verschillende hoeken van bijvoorbeeld wanden, meubels, vloeren of andere klussen. Ook voorzien hoekprofielen in het maken van een decoratieve overgang van wanden. Let op: niet buiten toepasbaar"
      }
    },
    "images": [
      "https://www.houthandelonline.nl/cdn/resize-extended/el:true/rs:fill/w:1500/h:1068/extend:true/background:255:255:255/path/media/catalog/product/h/o/hoeklat-meranti-18x18-10st-v_01_main.jpg"
    ],
    "rating": null,
    "review_count": null,
    "reviews_summary": null,
    "scraped_at": "2026-02-05T16:54:37.864041Z",
    "scrape_success": true,
    "scrape_errors": [],
    "embedding_text": "Product: Hoeklat Meranti 18x18mm geschaafd per 10 stuks\nBrand: HouthandelOnline\nCategory: Douglas hout > Toon alles in Douglas hout > Douglas hout palen > Douglas hout balken > Douglas hout latten en regels\nDescription: Hardhouten hoeklatten zijn geschaafd en onbehandeld. Houten hoekprofielen zorgen voor een nette hoekafwerking binnenshuis. Deze hoekprofielen zijn geschikt voor het afwerken van hoeken van wanden, meubels of voor een decoratieve overgang van de ene naar de andere wand. Deze Hardhouten afwerklijst is zeer sterk en gaat lang mee. Verpakt per 10 stuks.\nSpecifications: Levertijd: 2-7 werkdagen, Kopmaat: 18x18 mm, Dikte: 18 mm, Breedte: 18, Materiaal: Meranti, Toepassing: Deze Hardhouten buitenhoeklat is binnen toepasbaar voor het afwerken van verschillende hoeken van bijvoorbeeld wanden, meubels, vloeren of andere klussen. Ook voorzien hoekprofielen in het maken van een decoratieve overgang van wanden. Let op: niet buiten toepasbaar\nPrice: EUR 99.16"
  },
  {
    "id": "74cf6beb46e2",
    "source_url": "https://www.houthandelonline.nl/halfronde-lat-vuren-17x35-10st",
    "name": "Lat halfrond Vuren 17x35mm geschaafd per 10 stuks",
    "description": "Deze Vuren halfronde lijsten zijn geschaafd en onbehandeld. Houten afwerklijsten zorgen voor een nette afwerking binnenshuis. Deze halfronde lijsten zijn geschikt voor het afwerken van tafelranden, meubels of voor een decoratieve wand- of plafondlijst. Deze Vuren houten afwerklijst is licht van gewicht en kan makkelijk bewerkt worden. Verpakt per 10 stuks.",
    "brand": "HouthandelOnline",
    "category": "Douglas hout > Toon alles in Douglas hout > Douglas hout palen > Douglas hout balken > Douglas hout latten en regels",
    "price": 62.4,
    "currency": "EUR",
    "price_raw": "€2,31/m1",
    "specs": {
      "raw": {
        "Levertijd": "2-7 werkdagen",
        "Kopmaat": "17x35 mm",
        "Dikte": "17 mm",
        "Breedte": "35",
        "Materiaal": "Vuren",
        "Toepassing": "Deze Vuren houten halfronde sierlijst is binnen toepasbaar voor het afwerken van verschillende meubelstukken, tafelranden of als wandstijl. Let op: niet buiten toepasbaar"
      }
    },
    "images": [
      "https://www.houthandelonline.nl/cdn/resize-extended/el:true/rs:fill/w:1500/h:1068/extend:true/background:255:255:255/path/media/catalog/product/h/a/halfronde-lat-vuren-17x35-10st-v_01_main.jpg"
    ],
    "rating": null,
    "review_count": null,
    "reviews_summary": null,
    "scraped_at": "2026-02-05T16:54:37.864046Z",
    "scrape_success": true,
    "scrape_errors": [],
    "embedding_text": "Product: Lat halfrond Vuren 17x35mm geschaafd per 10 stuks\nBrand: HouthandelOnline\nCategory: Douglas hout > Toon alles in Douglas hout > Douglas hout palen > Douglas hout balken > Douglas hout latten en regels\nDescription: Deze Vuren halfronde lijsten zijn geschaafd en onbehandeld. Houten afwerklijsten zorgen voor een nette afwerking binnenshuis. Deze halfronde lijsten zijn geschikt voor het afwerken van tafelranden, meubels of voor een decoratieve wand- of plafondlijst. Deze Vuren houten afwerklijst is licht van gewicht en kan makkelijk bewerkt worden. Verpakt per 10 stuks.\nSpecifications: Levertijd: 2-7 werkdagen, Kopmaat: 17x35 mm, Dikte: 17 mm, Breedte: 35, Materiaal: Vuren, Toepassing: Deze Vuren houten halfronde sierlijst is binnen toepasbaar voor het afwerken van verschillende meubelstukken, tafelranden of als wandstijl. Let op: niet buiten toepasbaar\nPrice: EUR 62.4"
  },
  {
    "id": "972c44a550c4",
    "source_url": "https://www.houthandelonline.nl/plint-mdf-18x90-4st",
    "name": "Plint MDF 18x90mm vochtwerend wit voorgelakt per 4 stuks",
    "description": "Deze vochtwerende V313 plint is geschikt voor de afwerking van een vloer of wand. De plint is wit voorgelakt en heeft een afmeting van 18x90mm. De plinten zijn verpakt per 4 stuks.",
    "brand": "HouthandelOnline",
    "category": "Douglas hout > Toon alles in Douglas hout > Douglas hout palen > Douglas hout balken > Douglas hout latten en regels",
    "price": 90.7,
    "currency": "EUR",
    "price_raw": "€4,65/m1",
    "specs": {
      "raw": {
        "Levertijd": "2-7 werkdagen",
        "Kopmaat": "18x90 mm",
        "Dikte": "18 mm",
        "Breedte": "90",
        "Materiaal": "MDF",
        "Toepassing": "Lijstwerk voor het afwerken van de aansluiting tussen vloer en wand"
      }
    },
    "images": [
      "https://www.houthandelonline.nl/cdn/resize-extended/el:true/rs:fill/w:1500/h:1068/extend:true/background:255:255:255/path/media/catalog/product/p/l/plint-mdf-18x90-4st-v_01_main.jpg"
    ],
    "rating": null,
    "review_count": null,
    "reviews_summary": null,
    "scraped_at": "2026-02-05T16:54:37.864052Z",
    "scrape_success": true,
    "scrape_errors": [],
    "embedding_text": "Product: Plint MDF 18x90mm vochtwerend wit voorgelakt per 4 stuks\nBrand: HouthandelOnline\nCategory: Douglas hout > Toon alles in Douglas hout > Douglas hout palen > Douglas hout balken > Douglas hout latten en regels\nDescription: Deze vochtwerende V313 plint is geschikt voor de afwerking van een vloer of wand. De plint is wit voorgelakt en heeft een afmeting van 18x90mm. De plinten zijn verpakt per 4 stuks.\nSpecifications: Levertijd: 2-7 werkdagen, Kopmaat: 18x90 mm, Dikte: 18 mm, Breedte: 90, Materiaal: MDF, Toepassing: Lijstwerk voor het afwerken van de aansluiting tussen vloer en wand\nPrice: EUR 90.7"
  },
  {
    "id": "afc45bd8f40f",
    "source_url": "https://www.houthandelonline.nl/neuslat-meranti-mdf-k60-5st",
    "name": "Neuslat Meranti K60 18x74mm (sponning 60mm) geschaafd wit gegrond per 5 stuks",
    "description": "Meranti houten neuslat, een glaslat met 60mm sponning, is geschaafd en rondom 80mu gegrond. Deze raamafwerklijst is buiten toepasbaar als geventileerde neuslat voor het afvoeren van vocht en het beschermen van het kozijnhout. Verpakt per 5 stuks.",
    "brand": "HouthandelOnline",
    "category": "Douglas hout > Toon alles in Douglas hout > Douglas hout palen > Douglas hout balken > Douglas hout latten en regels",
    "price": 370.27,
    "currency": "EUR",
    "price_raw": "€15,11/m1",
    "specs": {
      "raw": {
        "Levertijd": "2-7 werkdagen",
        "Kopmaat": "18x74 mm",
        "Dikte": "18 mm",
        "Breedte": "74",
        "Materiaal": "Meranti"
      }
    },
    "images": [
      "https://www.houthandelonline.nl/cdn/resize-extended/el:true/rs:fill/w:1500/h:1068/extend:true/background:255:255:255/path/media/catalog/product/n/e/neuslat-meranti-mdf-k60-5st-v_01_main_1.jpg",
      "https://www.houthandelonline.nl/cdn/resize-extended/el:true/rs:fill/w:1500/h:1068/extend:true/background:255:255:255/path/media/catalog/product/n/e/neuslat-meranti-mdf-k60-5st-v_02_view_1.jpg"
    ],
    "rating": null,
    "review_count": null,
    "reviews_summary": null,
    "scraped_at": "2026-02-05T16:54:37.864058Z",
    "scrape_success": true,
    "scrape_errors": [],
    "embedding_text": "Product: Neuslat Meranti K60 18x74mm (sponning 60mm) geschaafd wit gegrond per 5 stuks\nBrand: HouthandelOnline\nCategory: Douglas hout > Toon alles in Douglas hout > Douglas hout palen > Douglas hout balken > Douglas hout latten en regels\nDescription: Meranti houten neuslat, een glaslat met 60mm sponning, is geschaafd en rondom 80mu gegrond. Deze raamafwerklijst is buiten toepasbaar als geventileerde neuslat voor het afvoeren van vocht en het beschermen van het kozijnhout. Verpakt per 5 stuks.\nSpecifications: Levertijd: 2-7 werkdagen, Kopmaat: 18x74 mm, Dikte: 18 mm, Breedte: 74, Materiaal: Meranti\nPrice: EUR 370.27"
  },
  {
    "id": "15995b517c5f",
    "source_url": "https://www.houthandelonline.nl/koplat-mdf-model-e-12x45-10st",
    "name": "Koplat MDF Vochtwerend (model E) 12x45mm met rechte kanten wit voorgelakt per 10 stuks",
    "description": "Deze vochtwerende V313 koplat (model E) met rechte kanten is geschikt voor de afwerking van een vloer of wand van de aansluiting van kozijnstijl en afgewerkte wand. De koplatten zijn wit voorgelakt en zijn voor de sierlijke afwerking rond deuren of ramen. \n\n Deze koplat heeft een afmeting van 12x45mm en is wit voorgelakt. De koplatten zijn verpakt per 10 stuks.",
    "brand": "HouthandelOnline",
    "category": "Douglas hout > Toon alles in Douglas hout > Douglas hout palen > Douglas hout balken > Douglas hout latten en regels",
    "price": 77.36,
    "currency": "EUR",
    "price_raw": "€1,59/m1",
    "specs": {
      "raw": {
        "Levertijd": "2-7 werkdagen",
        "Kopmaat": "12x45 mm",
        "Dikte": "12 mm",
        "Breedte": "45",
        "Materiaal": "MDF",
        "Toepassing": "Lijstwerk voor het afwerken van de aansluiting tussen wand en kozijn"
      }
    },
    "images": [
      "https://www.houthandelonline.nl/cdn/resize-extended/el:true/rs:fill/w:1500/h:1068/extend:true/background:255:255:255/path/media/catalog/product/k/o/koplat-mdf-model-e-12x45-10st-v_01_main.jpg"
    ],
    "rating": null,
    "review_count": null,
    "reviews_summary": null,
    "scraped_at": "2026-02-05T16:54:37.864069Z",
    "scrape_success": true,
    "scrape_errors": [],
    "embedding_text": "Product: Koplat MDF Vochtwerend (model E) 12x45mm met rechte kanten wit voorgelakt per 10 stuks\nBrand: HouthandelOnline\nCategory: Douglas hout > Toon alles in Douglas hout > Douglas hout palen > Douglas hout balken > Douglas hout latten en regels\nDescription: Deze vochtwerende V313 koplat (model E) met rechte kanten is geschikt voor de afwerking van een vloer of wand van de aansluiting van kozijnstijl en afgewerkte wand. De koplatten zijn wit voorgelakt en zijn voor de sierlijke afwerking rond deuren of ramen. \n\n Deze koplat heeft een afmeting van 12x45mm en is wit voorgelakt. De koplatten zijn verpakt per 10 stuks.\nSpecifications: Levertijd: 2-7 werkdagen, Kopmaat: 12x45 mm, Dikte: 12 mm, Breedte: 45, Materiaal: MDF, Toepassing: Lijstwerk voor het afwerken van de aansluiting tussen wand en kozijn\nPrice: EUR 77.36"
  },
  {
    "id": "aa453ee996b8",
    "source_url": "https://www.houthandelonline.nl/koplat-mdf-halve-e-recht-10st",
    "name": "Koplat MDF Vochtwerend recht (model halve E) 12x20mm wit voorgelakt per 10 stuks",
    "description": "Deze vochtwerende V313 koplat (model halve E) is geschikt voor de afwerking van een vloer of wand van de aansluiting van kozijnstijl en afgewerkte wand. De koplatten zijn wit voorgelakt en zijn voor de sierlijke afwerking rond deuren of ramen. Deze koplat heeft een afmeting van 12x20mm en is wit voorgelakt. De koplatten zijn verpakt per 10 stuks.",
    "brand": "HouthandelOnline",
    "category": "Douglas hout > Toon alles in Douglas hout > Douglas hout palen > Douglas hout balken > Douglas hout latten en regels",
    "price": 62.0,
    "currency": "EUR",
    "price_raw": "€1,27/m1",
    "specs": {
      "raw": {
        "Levertijd": "2-7 werkdagen",
        "Kopmaat": "12x20 mm",
        "Dikte": "12 mm",
        "Breedte": "20",
        "Materiaal": "MDF",
        "Toepassing": "Lijstwerk voor het afwerken van de aansluiting tussen wand en kozijn"
      }
    },
    "images": [
      "https://www.houthandelonline.nl/cdn/resize-extended/el:true/rs:fill/w:1500/h:1068/extend:true/background:255:255:255/path/media/catalog/product/k/o/koplat-mdf-halve-e-recht-10st-v_01_main.jpg"
    ],
    "rating": null,
    "review_count": null,
    "reviews_summary": null,
    "scraped_at": "2026-02-05T16:54:37.864077Z",
    "scrape_success": true,
    "scrape_errors": [],
    "embedding_text": "Product: Koplat MDF Vochtwerend recht (model halve E) 12x20mm wit voorgelakt per 10 stuks\nBrand: HouthandelOnline\nCategory: Douglas hout > Toon alles in Douglas hout > Douglas hout palen > Douglas hout balken > Douglas hout latten en regels\nDescription: Deze vochtwerende V313 koplat (model halve E) is geschikt voor de afwerking van een vloer of wand van de aansluiting van kozijnstijl en afgewerkte wand. De koplatten zijn wit voorgelakt en zijn voor de sierlijke afwerking rond deuren of ramen. Deze koplat heeft een afmeting van 12x20mm en is wit voorgelakt. De koplatten zijn verpakt per 10 stuks.\nSpecifications: Levertijd: 2-7 werkdagen, Kopmaat: 12x20 mm, Dikte: 12 mm, Breedte: 20, Materiaal: MDF, Toepassing: Lijstwerk voor het afwerken van de aansluiting tussen wand en kozijn\nPrice: EUR 62.0"
  },
  {
    "id": "8073a8a6ff9c",
    "source_url": "https://www.houthandelonline.nl/hollat-grenen-14x14-10st",
    "name": "Hollat Grenen 14x14mm geschaafd per 10 stuks",
    "description": "Grenen hollatten zijn geschaafd en onbehandeld. Houten afwerklijsten zorgen voor een nette hoekafwerking binnenshuis. Deze hollatten zijn geschikt voor het afwerken van binnenhoeken van wanden, meubels of voor een decoratieve overgang van de muur naar het plafond of kozijn. Deze Grenen houten afwerklijst is licht van gewicht en kan makkelijk bewerkt worden. Verpakt per 10 stuks.",
    "brand": "HouthandelOnline",
    "category": "Douglas hout > Toon alles in Douglas hout > Douglas hout palen > Douglas hout balken > Douglas hout latten en regels",
    "price": 37.9,
    "currency": "EUR",
    "price_raw": "€1,40/m1",
    "specs": {
      "raw": {
        "Levertijd": "2-7 werkdagen",
        "Kopmaat": "14x14 mm",
        "Dikte": "14 mm",
        "Breedte": "14",
        "Materiaal": "Grenen"
      }
    },
    "images": [
      "https://www.houthandelonline.nl/cdn/resize-extended/el:true/rs:fill/w:1500/h:1068/extend:true/background:255:255:255/path/media/catalog/product/h/o/hollat-grenen-14x14-10st-v_01_main.jpg"
    ],
    "rating": null,
    "review_count": null,
    "reviews_summary": null,
    "scraped_at": "2026-02-05T16:54:37.864083Z",
    "scrape_success": true,
    "scrape_errors": [],
    "embedding_text": "Product: Hollat Grenen 14x14mm geschaafd per 10 stuks\nBrand: HouthandelOnline\nCategory: Douglas hout > Toon alles in Douglas hout > Douglas hout palen > Douglas hout balken > Douglas hout latten en regels\nDescription: Grenen hollatten zijn geschaafd en onbehandeld. Houten afwerklijsten zorgen voor een nette hoekafwerking binnenshuis. Deze hollatten zijn geschikt voor het afwerken van binnenhoeken van wanden, meubels of voor een decoratieve overgang van de muur naar het plafond of kozijn. Deze Grenen houten afwerklijst is licht van gewicht en kan makkelijk bewerkt worden. Verpakt per 10 stuks.\nSpecifications: Levertijd: 2-7 werkdagen, Kopmaat: 14x14 mm, Dikte: 14 mm, Breedte: 14, Materiaal: Grenen\nPrice: EUR 37.9"
  },
  {
    "id": "352c61bb49b9",
    "source_url": "https://www.houthandelonline.nl/plint-grenen-12x120-10st",
    "name": "Plint Grenen 12x120mm wit gegrond per 10 stuks",
    "description": "Vloerplint ter afwerking van de aansluiting van de vloer en wand",
    "brand": "HouthandelOnline",
    "category": "Douglas hout > Toon alles in Douglas hout > Douglas hout palen > Douglas hout balken > Douglas hout latten en regels",
    "price": 318.98,
    "currency": "EUR",
    "price_raw": "€6,51/m1",
    "specs": {
      "raw": {
        "Levertijd": "2-7 werkdagen",
        "Kopmaat": "12x120 mm",
        "Dikte": "12 mm",
        "Breedte": "120",
        "Materiaal": "Grenen",
        "Toepassing": "Lijstwerk voor het afwerken van de aansluiting tussen vloer en wand"
      }
    },
    "images": [
      "https://www.houthandelonline.nl/cdn/resize-extended/el:true/rs:fill/w:1500/h:1068/extend:true/background:255:255:255/path/media/catalog/product/p/l/plint-grenen-12x120-10st-v_01_main.jpg",
      "https://www.houthandelonline.nl/cdn/resize-extended/el:true/rs:fill/w:1500/h:1068/extend:true/background:255:255:255/path/media/catalog/product/p/l/plint-grenen-12x120-10st-v_02_view.jpg",
      "https://www.houthandelonline.nl/cdn/resize-extended/el:true/rs:fill/w:1500/h:1068/extend:true/background:255:255:255/path/media/catalog/product/p/l/plint-grenen-12x120-10st-v_03_view.jpg",
      "https://www.houthandelonline.nl/cdn/resize-extended/el:true/rs:fill/w:1500/h:1068/extend:true/background:255:255:255/path/media/catalog/product/p/l/plint-grenen-12x120-10st-v_04_view.jpg"
    ],
    "rating": null,
    "review_count": null,
    "reviews_summary": null,
    "scraped_at": "2026-02-05T16:55:41.416188Z",
    "scrape_success": true,
    "scrape_errors": [],
    "embedding_text": "Product: Plint Grenen 12x120mm wit gegrond per 10 stuks\nBrand: HouthandelOnline\nCategory: Douglas hout > Toon alles in Douglas hout > Douglas hout palen > Douglas hout balken > Douglas hout latten en regels\nDescription: Vloerplint ter afwerking van de aansluiting van de vloer en wand\nSpecifications: Levertijd: 2-7 werkdagen, Kopmaat: 12x120 mm, Dikte: 12 mm, Breedte: 120, Materiaal: Grenen, Toepassing: Lijstwerk voor het afwerken van de aansluiting tussen vloer en wand\nPrice: EUR 318.98"
  },
  {
    "id": "5e47956da7e9",
    "source_url": "https://www.houthandelonline.nl/plint-grenen-12x45-10st",
    "name": "",
    "description": "",
    "brand": null,
    "category": null,
    "price": null,
    "currency": null,
    "price_raw": null,
    "specs": {
      "raw": {}
    },
    "images": [],
    "rating": null,
    "review_count": null,
    "reviews_summary": null,
    "scraped_at": "2026-02-05T16:55:41.416266Z",
    "scrape_success": false,
    "scrape_errors": [
      "Page.goto: Timeout 20000ms exceeded.\nCall log:\n  - navigating to \"https://www.houthandelonline.nl/plint-grenen-12x45-10st\", waiting until \"networkidle\"\n"
    ],
    "embedding_text": ""
  },
  {
    "id": "fa1b406a454f",
    "source_url": "https://www.houthandelonline.nl/koplat-grenen-model-e-12x45-10",
    "name": "Koplat Grenen (Model E) 12x45mm met rechte kanten wit gegrond per 10 stuks",
    "description": "Koplat ter afwerking van de aansluiting van kozijnstijl en afgewerkte wand",
    "brand": "HouthandelOnline",
    "category": "Douglas hout > Toon alles in Douglas hout > Douglas hout palen > Douglas hout balken > Douglas hout latten en regels",
    "price": 117.39,
    "currency": "EUR",
    "price_raw": "€2,40/m1",
    "specs": {
      "raw": {
        "Levertijd": "2-7 werkdagen",
        "Kopmaat": "12x45 mm",
        "Dikte": "12 mm",
        "Breedte": "45",
        "Materiaal": "Grenen",
        "Toepassing": "Lijstwerk voor het afwerken van de aansluiting tussen wand en kozijn"
      }
    },
    "images": [
      "https://www.houthandelonline.nl/cdn/resize-extended/el:true/rs:fill/w:1500/h:1068/extend:true/background:255:255:255/path/media/catalog/product/k/o/koplat-grenen-model-e-12x45-10-v_01_main.jpg",
      "https://www.houthandelonline.nl/cdn/resize-extended/el:true/rs:fill/w:1500/h:1068/extend:true/background:255:255:255/path/media/catalog/product/k/o/koplat-grenen-model-e-12x45-10-v_02_view.jpg",
      "https://www.houthandelonline.nl/cdn/resize-extended/el:true/rs:fill/w:1500/h:1068/extend:true/background:255:255:255/path/media/catalog/product/k/o/koplat-grenen-model-e-12x45-10-v_03_view.jpg"
    ],
    "rating": null,
    "review_count": null,
    "reviews_summary": null,
    "scraped_at": "2026-02-05T16:55:41.416283Z",
    "scrape_success": true,
    "scrape_errors": [],
    "embedding_text": "Product: Koplat Grenen (Model E) 12x45mm met rechte kanten wit gegrond per 10 stuks\nBrand: HouthandelOnline\nCategory: Douglas hout > Toon alles in Douglas hout > Douglas hout palen > Douglas hout balken > Douglas hout latten en regels\nDescription: Koplat ter afwerking van de aansluiting van kozijnstijl en afgewerkte wand\nSpecifications: Levertijd: 2-7 werkdagen, Kopmaat: 12x45 mm, Dikte: 12 mm, Breedte: 45, Materiaal: Grenen, Toepassing: Lijstwerk voor het afwerken van de aansluiting tussen wand en kozijn\nPrice: EUR 117.39"
  },
  {
    "id": "b08cc0aa9f96",
    "source_url": "https://www.houthandelonline.nl/koplat-grenen-model-b-12x45",
    "name": "Koplat Grenen (Model B) 12x45mm met schuine kanten wit gegrond per 10 stuks",
    "description": "Koplat ter afwerking van de aansluiting van kozijnstijl en afgewerkte wand",
    "brand": "HouthandelOnline",
    "category": "Douglas hout > Toon alles in Douglas hout > Douglas hout palen > Douglas hout balken > Douglas hout latten en regels",
    "price": 117.39,
    "currency": "EUR",
    "price_raw": "€2,40/m1",
    "specs": {
      "raw": {
        "Levertijd": "2-7 werkdagen",
        "Kopmaat": "12x45 mm",
        "Dikte": "12 mm",
        "Breedte": "45",
        "Materiaal": "Grenen",
        "Toepassing": "Lijstwerk voor het afwerken van de aansluiting tussen wand en kozijn"
      }
    },
    "images": [
      "https://www.houthandelonline.nl/cdn/resize-extended/el:true/rs:fill/w:1500/h:1068/extend:true/background:255:255:255/path/media/catalog/product/k/o/koplat-grenen-model-b-12x45-v_01_main.jpg",
      "https://www.houthandelonline.nl/cdn/resize-extended/el:true/rs:fill/w:1500/h:1068/extend:true/background:255:255:255/path/media/catalog/product/k/o/koplat-grenen-model-b-12x45-v_02_view.jpg",
      "https://www.houthandelonline.nl/cdn/resize-extended/el:true/rs:fill/w:1500/h:1068/extend:true/background:255:255:255/path/media/catalog/product/k/o/koplat-grenen-model-b-12x45-v_03_view.jpg"
    ],
    "rating": null,
    "review_count": null,
    "reviews_summary": null,
    "scraped_at": "2026-02-05T16:55:41.416294Z",
    "scrape_success": true,
    "scrape_errors": [],
    "embedding_text": "Product: Koplat Grenen (Model B) 12x45mm met schuine kanten wit gegrond per 10 stuks\nBrand: HouthandelOnline\nCategory: Douglas hout > Toon alles in Douglas hout > Douglas hout palen > Douglas hout balken > Douglas hout latten en regels\nDescription: Koplat ter afwerking van de aansluiting van kozijnstijl en afgewerkte wand\nSpecifications: Levertijd: 2-7 werkdagen, Kopmaat: 12x45 mm, Dikte: 12 mm, Breedte: 45, Materiaal: Grenen, Toepassing: Lijstwerk voor het afwerken van de aansluiting tussen wand en kozijn\nPrice: EUR 117.39"
  },
  {
    "id": "336d0227b8bb",
    "source_url": "https://www.houthandelonline.nl/koplat-mdf-model-b-12x32-10st",
    "name": "Koplat MDF Vochtwerend (model B) 12x32mm met schuine kanten wit voorgelakt per 10 stuks",
    "description": "Deze vochtwerende V313 koplat (model B) met schuine kanten is geschikt voor de afwerking van een vloer of wand van de aansluiting van kozijnstijl en afgewerkte wand. De koplatten zijn wit voorgelakt en zijn voor de sierlijke afwerking rond deuren of ramen. Deze koplat heeft een afmeting van 12x32mm en is wit voorgelakt. De koplatten zijn verpakt per 10 stuks en hebben een lengte van 488cm.",
    "brand": "HouthandelOnline",
    "category": "Douglas hout > Toon alles in Douglas hout > Douglas hout palen > Douglas hout balken > Douglas hout latten en regels",
    "price": 66.72,
    "currency": "EUR",
    "price_raw": "€1,37/m1",
    "specs": {
      "raw": {
        "Levertijd": "2-7 werkdagen",
        "Kopmaat": "12x32 mm",
        "Dikte": "12 mm",
        "Breedte": "32",
        "Materiaal": "MDF",
        "Toepassing": "Lijstwerk voor het afwerken van de aansluiting tussen wand en kozijn"
      }
    },
    "images": [
      "https://www.houthandelonline.nl/cdn/resize-extended/el:true/rs:fill/w:1500/h:1068/extend:true/background:255:255:255/path/media/catalog/product/k/o/koplat-mdf-model-b-12x32-10st-v_01_main.jpg"
    ],
    "rating": null,
    "review_count": null,
    "reviews_summary": null,
    "scraped_at": "2026-02-05T16:55:41.416306Z",
    "scrape_success": true,
    "scrape_errors": [],
    "embedding_text": "Product: Koplat MDF Vochtwerend (model B) 12x32mm met schuine kanten wit voorgelakt per 10 stuks\nBrand: HouthandelOnline\nCategory: Douglas hout > Toon alles in Douglas hout > Douglas hout palen > Douglas hout balken > Douglas hout latten en regels\nDescription: Deze vochtwerende V313 koplat (model B) met schuine kanten is geschikt voor de afwerking van een vloer of wand van de aansluiting van kozijnstijl en afgewerkte wand. De koplatten zijn wit voorgelakt en zijn voor de sierlijke afwerking rond deuren of ramen. Deze koplat heeft een afmeting van 12x32mm en is wit voorgelakt. De koplatten zijn verpakt per 10 stuks en hebben een lengte van 488cm.\nSpecifications: Levertijd: 2-7 werkdagen, Kopmaat: 12x32 mm, Dikte: 12 mm, Breedte: 32, Materiaal: MDF, Toepassing: Lijstwerk voor het afwerken van de aansluiting tussen wand en kozijn\nPrice: EUR 66.72"
  },
  {
    "id": "f48a7f0e85dd",
    "source_url": "https://www.houthandelonline.nl/bollat-meranti-18x18",
    "name": "Bollat Meranti 18x18mm geschaafd per 10 stuks",
    "description": "Hardhouten bollijsten zijn geschaafd en onbehandeld. Houten afwerklijsten zorgen voor een nette hoekafwerking binnenshuis. Deze bollijsten zijn geschikt voor het afwerken van binnenhoeken van wanden, meubels of voor een decoratieve overgang van de muur naar het plafond of kozijn. Deze Meranti houten afwerklijst is licht van gewicht en kan makkelijk bewerkt worden. Verpakt per 10 stuks.",
    "brand": "HouthandelOnline",
    "category": "Douglas hout > Toon alles in Douglas hout > Douglas hout palen > Douglas hout balken > Douglas hout latten en regels",
    "price": 98.17,
    "currency": "EUR",
    "price_raw": "€3,57/m1",
    "specs": {
      "raw": {
        "Levertijd": "2-7 werkdagen",
        "Kopmaat": "18x18 mm",
        "Dikte": "18 mm",
        "Breedte": "18",
        "Materiaal": "Meranti"
      }
    },
    "images": [
      "https://www.houthandelonline.nl/cdn/resize-extended/el:true/rs:fill/w:1500/h:1068/extend:true/background:255:255:255/path/media/catalog/product/b/o/bollat-meranti-18x18-v_01_main.jpg"
    ],
    "rating": null,
    "review_count": null,
    "reviews_summary": null,
    "scraped_at": "2026-02-05T16:55:41.416318Z",
    "scrape_success": true,
    "scrape_errors": [],
    "embedding_text": "Product: Bollat Meranti 18x18mm geschaafd per 10 stuks\nBrand: HouthandelOnline\nCategory: Douglas hout > Toon alles in Douglas hout > Douglas hout palen > Douglas hout balken > Douglas hout latten en regels\nDescription: Hardhouten bollijsten zijn geschaafd en onbehandeld. Houten afwerklijsten zorgen voor een nette hoekafwerking binnenshuis. Deze bollijsten zijn geschikt voor het afwerken van binnenhoeken van wanden, meubels of voor een decoratieve overgang van de muur naar het plafond of kozijn. Deze Meranti houten afwerklijst is licht van gewicht en kan makkelijk bewerkt worden. Verpakt per 10 stuks.\nSpecifications: Levertijd: 2-7 werkdagen, Kopmaat: 18x18 mm, Dikte: 18 mm, Breedte: 18, Materiaal: Meranti\nPrice: EUR 98.17"
  },
  {
    "id": "3b70a8c17259",
    "source_url": "https://www.houthandelonline.nl/ronde-stok-grenen-45-5st",
    "name": "Stok Grenen 45mm geschaafd per 5 stuks",
    "description": "Grenen ronde stokken zijn geschaafd en onbehandeld waardoor rondhout vele toepassingen binnenshuis kent. De stok wordt veel toegepast als trapleuning of voor het opvullen van ronde gaten. Deze Grenen trapleuning is licht van gewicht en kan makkelijk bewerkt worden. Verpakt per 5 stuks.",
    "brand": "HouthandelOnline",
    "category": "Douglas hout > Toon alles in Douglas hout > Douglas hout palen > Douglas hout balken > Douglas hout latten en regels",
    "price": 165.81,
    "currency": "EUR",
    "price_raw": "€12,28/m1",
    "specs": {
      "raw": {
        "Levertijd": "2-7 werkdagen",
        "Dikte": "45 mm",
        "Breedte": "45",
        "Materiaal": "Grenen",
        "Toepassing": "Rond houten stokken worden veel toegepast als trapleuning, worden gebruikt in de interieurbouw of zijn geschikt voor het opvullen van ronde gaten. Let op: niet buiten toepasbaar"
      }
    },
    "images": [
      "https://www.houthandelonline.nl/cdn/resize-extended/el:true/rs:fill/w:1500/h:1068/extend:true/background:255:255:255/path/media/catalog/product/r/o/ronde-stok-grenen-45-5st-v_01_main.jpg"
    ],
    "rating": null,
    "review_count": null,
    "reviews_summary": null,
    "scraped_at": "2026-02-05T16:55:41.416329Z",
    "scrape_success": true,
    "scrape_errors": [],
    "embedding_text": "Product: Stok Grenen 45mm geschaafd per 5 stuks\nBrand: HouthandelOnline\nCategory: Douglas hout > Toon alles in Douglas hout > Douglas hout palen > Douglas hout balken > Douglas hout latten en regels\nDescription: Grenen ronde stokken zijn geschaafd en onbehandeld waardoor rondhout vele toepassingen binnenshuis kent. De stok wordt veel toegepast als trapleuning of voor het opvullen van ronde gaten. Deze Grenen trapleuning is licht van gewicht en kan makkelijk bewerkt worden. Verpakt per 5 stuks.\nSpecifications: Levertijd: 2-7 werkdagen, Dikte: 45 mm, Breedte: 45, Materiaal: Grenen, Toepassing: Rond houten stokken worden veel toegepast als trapleuning, worden gebruikt in de interieurbouw of zijn geschikt voor het opvullen van ronde gaten. Let op: niet buiten toepasbaar\nPrice: EUR 165.81"
  },
  {
    "id": "43af488c2b44",
    "source_url": "https://www.houthandelonline.nl/plint-mdf-9x45-10st",
    "name": "Plint MDF 9x45mm vochtwerend wit voorgelakt per 10 stuks",
    "description": "Deze vochtwerende V313 plint is geschikt voor de afwerking van een vloer of wand. De plint is wit voorgelakt en heeft een afmeting van 9x45mm. De plinten zijn verpakt per 10 stuks.",
    "brand": "HouthandelOnline",
    "category": "Douglas hout > Toon alles in Douglas hout > Douglas hout palen > Douglas hout balken > Douglas hout latten en regels",
    "price": 60.23,
    "currency": "EUR",
    "price_raw": "€1,23/m1",
    "specs": {
      "raw": {
        "Levertijd": "2-7 werkdagen",
        "Kopmaat": "9x45 mm",
        "Dikte": "9 mm",
        "Breedte": "45",
        "Materiaal": "MDF",
        "Toepassing": "Lijstwerk voor het afwerken van de aansluiting tussen vloer en wand of de aansluiting van wand en plafond"
      }
    },
    "images": [
      "https://www.houthandelonline.nl/cdn/resize-extended/el:true/rs:fill/w:1500/h:1068/extend:true/background:255:255:255/path/media/catalog/product/p/l/plint-mdf-9x45-10st-v_01_main.jpg",
      "https://www.houthandelonline.nl/cdn/resize-extended/el:true/rs:fill/w:1500/h:1068/extend:true/background:255:255:255/path/media/catalog/product/p/l/plint-mdf-9x45-10st-v_02_view.jpg",
      "https://www.houthandelonline.nl/cdn/resize-extended/el:true/rs:fill/w:1500/h:1068/extend:true/background:255:255:255/path/media/catalog/product/p/l/plint-mdf-9x45-10st-v_03_view.jpg",
      "https://www.houthandelonline.nl/cdn/resize-extended/el:true/rs:fill/w:1500/h:1068/extend:true/background:255:255:255/path/media/catalog/product/p/l/plint-mdf-9x45-10st-v_04_view.jpg"
    ],
    "rating": null,
    "review_count": null,
    "reviews_summary": null,
    "scraped_at": "2026-02-05T16:55:41.416341Z",
    "scrape_success": true,
    "scrape_errors": [],
    "embedding_text": "Product: Plint MDF 9x45mm vochtwerend wit voorgelakt per 10 stuks\nBrand: HouthandelOnline\nCategory: Douglas hout > Toon alles in Douglas hout > Douglas hout palen > Douglas hout balken > Douglas hout latten en regels\nDescription: Deze vochtwerende V313 plint is geschikt voor de afwerking van een vloer of wand. De plint is wit voorgelakt en heeft een afmeting van 9x45mm. De plinten zijn verpakt per 10 stuks.\nSpecifications: Levertijd: 2-7 werkdagen, Kopmaat: 9x45 mm, Dikte: 9 mm, Breedte: 45, Materiaal: MDF, Toepassing: Lijstwerk voor het afwerken van de aansluiting tussen vloer en wand of de aansluiting van wand en plafond\nPrice: EUR 60.23"
  },
  {
    "id": "cf17d8b4626c",
    "source_url": "https://www.houthandelonline.nl/koplat-grenen-model-e-12x45-lak-5st",
    "name": "Koplat Grenen (Model E) 12x45mm met rechte kanten zichtzijde wit afgelakt per 6 stuks",
    "description": "Koplat ter afwerking van de aansluiting van kozijnstijl en afgewerkte wand",
    "brand": "HouthandelOnline",
    "category": "Douglas hout > Toon alles in Douglas hout > Douglas hout palen > Douglas hout balken > Douglas hout latten en regels",
    "price": 124.16,
    "currency": "EUR",
    "price_raw": "€5,07/m1",
    "specs": {
      "raw": {
        "Levertijd": "2-7 werkdagen",
        "Kopmaat": "12x45 mm",
        "Dikte": "12 mm",
        "Breedte": "45",
        "Materiaal": "Grenen",
        "Toepassing": "Lijstwerk voor het afwerken van de aansluiting tussen wand en kozijn"
      }
    },
    "images": [
      "https://www.houthandelonline.nl/cdn/resize-extended/el:true/rs:fill/w:1500/h:1068/extend:true/background:255:255:255/path/media/catalog/product/k/o/koplat-grenen-model-e-12x45-lak-5st-v_01_main_1.jpg",
      "https://www.houthandelonline.nl/cdn/resize-extended/el:true/rs:fill/w:1500/h:1068/extend:true/background:255:255:255/path/media/catalog/product/k/o/koplat-grenen-model-e-12x45-lak-5st-v_02_view_1.jpg",
      "https://www.houthandelonline.nl/cdn/resize-extended/el:true/rs:fill/w:1500/h:1068/extend:true/background:255:255:255/path/media/catalog/product/k/o/koplat-grenen-model-e-12x45-lak-5st-v_03_view_1.jpg"
    ],
    "rating": null,
    "review_count": null,
    "reviews_summary": null,
    "scraped_at": "2026-02-05T16:55:41.416352Z",
    "scrape_success": true,
    "scrape_errors": [],
    "embedding_text": "Product: Koplat Grenen (Model E) 12x45mm met rechte kanten zichtzijde wit afgelakt per 6 stuks\nBrand: HouthandelOnline\nCategory: Douglas hout > Toon alles in Douglas hout > Douglas hout palen > Douglas hout balken > Douglas hout latten en regels\nDescription: Koplat ter afwerking van de aansluiting van kozijnstijl en afgewerkte wand\nSpecifications: Levertijd: 2-7 werkdagen, Kopmaat: 12x45 mm, Dikte: 12 mm, Breedte: 45, Materiaal: Grenen, Toepassing: Lijstwerk voor het afwerken van de aansluiting tussen wand en kozijn\nPrice: EUR 124.16"
  },
  {
    "id": "66fd81f7f0f4",
    "source_url": "https://www.houthandelonline.nl/hoeklat-grenen-35x35-10st",
    "name": "Hoeklat Grenen 35x35mm geschaafd per 10 stuks",
    "description": "Grenen hoeklatten zijn geschaafd en onbehandeld. Houten hoekprofielen zorgen voor een nette hoekafwerking binnenshuis. Deze hoeklatten zijn geschikt voor het afwerken van hoeken van wanden, meubels of voor een decoratieve overgang van de ene naar de andere wand. Deze Grenen houten afwerklijst is licht van gewicht en kan makkelijk bewerkt worden. Verpakt per 10 stuks.",
    "brand": "HouthandelOnline",
    "category": "Douglas hout > Toon alles in Douglas hout > Douglas hout palen > Douglas hout balken > Douglas hout latten en regels",
    "price": 210.39,
    "currency": "EUR",
    "price_raw": "€7,79/m1",
    "specs": {
      "raw": {
        "Levertijd": "2-7 werkdagen",
        "Kopmaat": "35x35 mm",
        "Dikte": "35 mm",
        "Breedte": "35",
        "Materiaal": "Grenen",
        "Toepassing": "Deze Grenen houten hoeklat is binnen toepasbaar voor het afwerken van verschillende binnen- en buitenhoeken van bijvoorbeeld wanden, meubels, vloeren of andere klussen. Ook voorzien hoekprofielen in het maken van een decoratieve overgang van wanden. Let op: niet buiten toepasbaar"
      }
    },
    "images": [
      "https://www.houthandelonline.nl/cdn/resize-extended/el:true/rs:fill/w:1500/h:1068/extend:true/background:255:255:255/path/media/catalog/product/h/o/hoeklat-grenen-35x35-10st-v_01_main_2.jpg"
    ],
    "rating": null,
    "review_count": null,
    "reviews_summary": null,
    "scraped_at": "2026-02-05T16:55:41.416365Z",
    "scrape_success": true,
    "scrape_errors": [],
    "embedding_text": "Product: Hoeklat Grenen 35x35mm geschaafd per 10 stuks\nBrand: HouthandelOnline\nCategory: Douglas hout > Toon alles in Douglas hout > Douglas hout palen > Douglas hout balken > Douglas hout latten en regels\nDescription: Grenen hoeklatten zijn geschaafd en onbehandeld. Houten hoekprofielen zorgen voor een nette hoekafwerking binnenshuis. Deze hoeklatten zijn geschikt voor het afwerken van hoeken van wanden, meubels of voor een decoratieve overgang van de ene naar de andere wand. Deze Grenen houten afwerklijst is licht van gewicht en kan makkelijk bewerkt worden. Verpakt per 10 stuks.\nSpecifications: Levertijd: 2-7 werkdagen, Kopmaat: 35x35 mm, Dikte: 35 mm, Breedte: 35, Materiaal: Grenen, Toepassing: Deze Grenen houten hoeklat is binnen toepasbaar voor het afwerken van verschillende binnen- en buitenhoeken van bijvoorbeeld wanden, meubels, vloeren of andere klussen. Ook voorzien hoekprofielen in het maken van een decoratieve overgang van wanden. Let op: niet buiten toepasbaar\nPrice: EUR 210.39"
  },
  {
    "id": "15d8d67cebad",
    "source_url": "https://www.houthandelonline.nl/traditionele-neut-mdf",
    "name": "Traditionele neut MDF 28x105mm vochtwerend wit gegrond",
    "description": "Deze MDF V313 klassieke plintneuten wit gegrond zijn aan de kopse kanten dubbelzijdig afgerond en vochtwerend. Door middel van een houten neut kan er een stijlvolle overgang gecreëerd worden tussen een plint en de deurlijst. Aangeraden wordt de neut altijd hoger en dikker dan de plint, en breder en dikker dan de architraaf of deurlijst te nemen. De neut kan zelf naar wens ingekort worden. Per stuk verpakt",
    "brand": "HouthandelOnline",
    "category": "Douglas hout > Toon alles in Douglas hout > Douglas hout palen > Douglas hout balken > Douglas hout latten en regels",
    "price": 20.23,
    "currency": "EUR",
    "price_raw": null,
    "specs": {
      "raw": {
        "Levertijd": "2-7 werkdagen",
        "Kopmaat": "28x105 mm",
        "Dikte": "28 mm",
        "Breedte": "105",
        "Materiaal": "MDF"
      }
    },
    "images": [
      "https://www.houthandelonline.nl/cdn/resize-extended/el:true/rs:fill/w:1500/h:1068/extend:true/background:255:255:255/path/media/catalog/product/t/r/traditionele-neut-mdf-v_01_main.jpg"
    ],
    "rating": null,
    "review_count": null,
    "reviews_summary": null,
    "scraped_at": "2026-02-05T16:55:41.416375Z",
    "scrape_success": true,
    "scrape_errors": [],
    "embedding_text": "Product: Traditionele neut MDF 28x105mm vochtwerend wit gegrond\nBrand: HouthandelOnline\nCategory: Douglas hout > Toon alles in Douglas hout > Douglas hout palen > Douglas hout balken > Douglas hout latten en regels\nDescription: Deze MDF V313 klassieke plintneuten wit gegrond zijn aan de kopse kanten dubbelzijdig afgerond en vochtwerend. Door middel van een houten neut kan er een stijlvolle overgang gecreëerd worden tussen een plint en de deurlijst. Aangeraden wordt de neut altijd hoger en dikker dan de plint, en breder en dikker dan de architraaf of deurlijst te nemen. De neut kan zelf naar wens ingekort worden. Per stuk verpakt\nSpecifications: Levertijd: 2-7 werkdagen, Kopmaat: 28x105 mm, Dikte: 28 mm, Breedte: 105, Materiaal: MDF\nPrice: EUR 20.23"
  },
  {
    "id": "014258506f50",
    "source_url": "https://www.houthandelonline.nl/ronde-stok-grenen-23-10st",
    "name": "Stok Grenen 23mm geschaafd per 10 stuks",
    "description": "Grenen ronde stokken zijn geschaafd en onbehandeld waardoor rondhout vele toepassingen binnenshuis kent. De stok wordt veel toegepast als gordijnroede in kleine kozijnen, in de interieurbouw of voor het opvullen van ronde gaten. Deze Grenen interieurlijst rond is licht van gewicht en kan makkelijk bewerkt worden. Verpakt per 10 stuks.",
    "brand": "HouthandelOnline",
    "category": "Douglas hout > Toon alles in Douglas hout > Douglas hout palen > Douglas hout balken > Douglas hout latten en regels",
    "price": 96.38,
    "currency": "EUR",
    "price_raw": "€3,57/m1",
    "specs": {
      "raw": {
        "Levertijd": "2-7 werkdagen",
        "Dikte": "23 mm",
        "Breedte": "23",
        "Materiaal": "Grenen",
        "Toepassing": "Rond houten stokken zijn binnen toepasbaar als gordijnroedes voor kleine kozijnen, knutselwerk, interieurbouw en voor het opvullen van ronde gaten. Let op: niet buiten toepasbaar"
      }
    },
    "images": [
      "https://www.houthandelonline.nl/cdn/resize-extended/el:true/rs:fill/w:1500/h:1068/extend:true/background:255:255:255/path/media/catalog/product/r/o/ronde-stok-grenen-23-10st-v_01_main.jpg"
    ],
    "rating": null,
    "review_count": null,
    "reviews_summary": null,
    "scraped_at": "2026-02-05T16:55:41.416388Z",
    "scrape_success": true,
    "scrape_errors": [],
    "embedding_text": "Product: Stok Grenen 23mm geschaafd per 10 stuks\nBrand: HouthandelOnline\nCategory: Douglas hout > Toon alles in Douglas hout > Douglas hout palen > Douglas hout balken > Douglas hout latten en regels\nDescription: Grenen ronde stokken zijn geschaafd en onbehandeld waardoor rondhout vele toepassingen binnenshuis kent. De stok wordt veel toegepast als gordijnroede in kleine kozijnen, in de interieurbouw of voor het opvullen van ronde gaten. Deze Grenen interieurlijst rond is licht van gewicht en kan makkelijk bewerkt worden. Verpakt per 10 stuks.\nSpecifications: Levertijd: 2-7 werkdagen, Dikte: 23 mm, Breedte: 23, Materiaal: Grenen, Toepassing: Rond houten stokken zijn binnen toepasbaar als gordijnroedes voor kleine kozijnen, knutselwerk, interieurbouw en voor het opvullen van ronde gaten. Let op: niet buiten toepasbaar\nPrice: EUR 96.38"
  },
  {
    "id": "025851b64e08",
    "source_url": "https://www.houthandelonline.nl/plint-mdf-12x120-4st",
    "name": "Plint MDF 12x120mm vochtwerend wit voorgelakt per 4 stuks",
    "description": "Deze vochtwerende V313 plint is geschikt voor de afwerking van een vloer of wand. De plint is wit voorgelakt en heeft een afmeting van 12x120mm. De plinten zijn verpakt per 4 stuks.",
    "brand": "HouthandelOnline",
    "category": "Douglas hout > Toon alles in Douglas hout > Douglas hout palen > Douglas hout balken > Douglas hout latten en regels",
    "price": 69.2,
    "currency": "EUR",
    "price_raw": "€3,55/m1",
    "specs": {
      "raw": {
        "Levertijd": "2-7 werkdagen",
        "Kopmaat": "12x120 mm",
        "Dikte": "12 mm",
        "Breedte": "120",
        "Materiaal": "MDF",
        "Toepassing": "Lijstwerk voor het afwerken van de aansluiting tussen vloer en wand"
      }
    },
    "images": [
      "https://www.houthandelonline.nl/cdn/resize-extended/el:true/rs:fill/w:1500/h:1068/extend:true/background:255:255:255/path/media/catalog/product/p/l/plint-mdf-12x120-4st-v_01_main.jpg",
      "https://www.houthandelonline.nl/cdn/resize-extended/el:true/rs:fill/w:1500/h:1068/extend:true/background:255:255:255/path/media/catalog/product/p/l/plint-mdf-12x120-4st-v_02_view.jpg",
      "https://www.houthandelonline.nl/cdn/resize-extended/el:true/rs:fill/w:1500/h:1068/extend:true/background:255:255:255/path/media/catalog/product/p/l/plint-mdf-12x120-4st-v_03_view.jpg",
      "https://www.houthandelonline.nl/cdn/resize-extended/el:true/rs:fill/w:1500/h:1068/extend:true/background:255:255:255/path/media/catalog/product/p/l/plint-mdf-12x120-4st-v_04_view.jpg"
    ],
    "rating": null,
    "review_count": null,
    "reviews_summary": null,
    "scraped_at": "2026-02-05T16:55:41.416399Z",
    "scrape_success": true,
    "scrape_errors": [],
    "embedding_text": "Product: Plint MDF 12x120mm vochtwerend wit voorgelakt per 4 stuks\nBrand: HouthandelOnline\nCategory: Douglas hout > Toon alles in Douglas hout > Douglas hout palen > Douglas hout balken > Douglas hout latten en regels\nDescription: Deze vochtwerende V313 plint is geschikt voor de afwerking van een vloer of wand. De plint is wit voorgelakt en heeft een afmeting van 12x120mm. De plinten zijn verpakt per 4 stuks.\nSpecifications: Levertijd: 2-7 werkdagen, Kopmaat: 12x120 mm, Dikte: 12 mm, Breedte: 120, Materiaal: MDF, Toepassing: Lijstwerk voor het afwerken van de aansluiting tussen vloer en wand\nPrice: EUR 69.2"
  },
  {
    "id": "a6476504935d",
    "source_url": "https://www.houthandelonline.nl/neuslat-meranti-mdf-k30-5st",
    "name": "Neuslat Meranti K30 18x45mm (sponning 30mm) geschaafd wit gegrond per 5 stuks",
    "description": "Meranti houten neuslat, een glaslat met 30mm sponning, is geschaafd en rondom 80mu gegrond. Deze raamafwerklijst is buiten toepasbaar als geventileerde neuslat voor het afvoeren van vocht en het beschermen van het kozijnhout. Verpakt per 5 stuks.",
    "brand": "HouthandelOnline",
    "category": "Douglas hout > Toon alles in Douglas hout > Douglas hout palen > Douglas hout balken > Douglas hout latten en regels",
    "price": 244.58,
    "currency": "EUR",
    "price_raw": "€9,98/m1",
    "specs": {
      "raw": {
        "Levertijd": "2-7 werkdagen",
        "Kopmaat": "18x45 mm",
        "Dikte": "18 mm",
        "Breedte": "45",
        "Materiaal": "Meranti"
      }
    },
    "images": [
      "https://www.houthandelonline.nl/cdn/resize-extended/el:true/rs:fill/w:1500/h:1068/extend:true/background:255:255:255/path/media/catalog/product/n/e/neuslat-meranti-mdf-k30-5st-v_01_main.jpg",
      "https://www.houthandelonline.nl/cdn/resize-extended/el:true/rs:fill/w:1500/h:1068/extend:true/background:255:255:255/path/media/catalog/product/n/e/neuslat-meranti-mdf-k30-5st-v_02_view.jpg"
    ],
    "rating": null,
    "review_count": null,
    "reviews_summary": null,
    "scraped_at": "2026-02-05T16:55:41.416412Z",
    "scrape_success": true,
    "scrape_errors": [],
    "embedding_text": "Product: Neuslat Meranti K30 18x45mm (sponning 30mm) geschaafd wit gegrond per 5 stuks\nBrand: HouthandelOnline\nCategory: Douglas hout > Toon alles in Douglas hout > Douglas hout palen > Douglas hout balken > Douglas hout latten en regels\nDescription: Meranti houten neuslat, een glaslat met 30mm sponning, is geschaafd en rondom 80mu gegrond. Deze raamafwerklijst is buiten toepasbaar als geventileerde neuslat voor het afvoeren van vocht en het beschermen van het kozijnhout. Verpakt per 5 stuks.\nSpecifications: Levertijd: 2-7 werkdagen, Kopmaat: 18x45 mm, Dikte: 18 mm, Breedte: 45, Materiaal: Meranti\nPrice: EUR 244.58"
  },
  {
    "id": "2a9e7187073d",
    "source_url": "https://www.houthandelonline.nl/ronde-stok-grenen-35-5st",
    "name": "Stok Grenen 35mm geschaafd per 5 stuks",
    "description": "Grenen ronde stokken zijn geschaafd en onbehandeld waardoor rondhout vele toepassingen binnenshuis kent. De stok wordt veel toegepast als trapleuning of voor het opvullen van ronde gaten. Deze Grenen trapleuning is licht van gewicht en kan makkelijk bewerkt worden. Verpakt per 5 stuks.",
    "brand": "HouthandelOnline",
    "category": "Douglas hout > Toon alles in Douglas hout > Douglas hout palen > Douglas hout balken > Douglas hout latten en regels",
    "price": 144.4,
    "currency": "EUR",
    "price_raw": "€10,70/m1",
    "specs": {
      "raw": {
        "Levertijd": "2-7 werkdagen",
        "Dikte": "35 mm",
        "Breedte": "35",
        "Materiaal": "Grenen",
        "Toepassing": "Rond houten stokken worden veel toegepast als trapleuning, worden gebruikt in de interieurbouw of zijn geschikt voor het opvullen van ronde gaten. Let op: niet buiten toepasbaar"
      }
    },
    "images": [
      "https://www.houthandelonline.nl/cdn/resize-extended/el:true/rs:fill/w:1500/h:1068/extend:true/background:255:255:255/path/media/catalog/product/r/o/ronde-stok-grenen-35-5st-v_01_main.jpg"
    ],
    "rating": null,
    "review_count": null,
    "reviews_summary": null,
    "scraped_at": "2026-02-05T16:55:41.416423Z",
    "scrape_success": true,
    "scrape_errors": [],
    "embedding_text": "Product: Stok Grenen 35mm geschaafd per 5 stuks\nBrand: HouthandelOnline\nCategory: Douglas hout > Toon alles in Douglas hout > Douglas hout palen > Douglas hout balken > Douglas hout latten en regels\nDescription: Grenen ronde stokken zijn geschaafd en onbehandeld waardoor rondhout vele toepassingen binnenshuis kent. De stok wordt veel toegepast als trapleuning of voor het opvullen van ronde gaten. Deze Grenen trapleuning is licht van gewicht en kan makkelijk bewerkt worden. Verpakt per 5 stuks.\nSpecifications: Levertijd: 2-7 werkdagen, Dikte: 35 mm, Breedte: 35, Materiaal: Grenen, Toepassing: Rond houten stokken worden veel toegepast als trapleuning, worden gebruikt in de interieurbouw of zijn geschikt voor het opvullen van ronde gaten. Let op: niet buiten toepasbaar\nPrice: EUR 144.4"
  },
  {
    "id": "c48a9ed3797a",
    "source_url": "https://www.houthandelonline.nl/kraalplint-mdf-vochtw-18x167-3st",
    "name": "Kraalplint MDF 18x167mm vochtwerend wit voorgelakt bos a 3 stuks",
    "description": "Deze vochtwerende V313 vloerplint met een kraalmodel aan de bovenzijde ter afwerking van de aansluiting van de vloer en wand. Deze kraalplint heeft een afmeting van 18x167mm en is wit voorgelakt. De plinten zijn verpakt per 3 stuks.",
    "brand": "HouthandelOnline",
    "category": "Douglas hout > Toon alles in Douglas hout > Douglas hout palen > Douglas hout balken > Douglas hout latten en regels",
    "price": 136.94,
    "currency": "EUR",
    "price_raw": "€9,35/m1",
    "specs": {
      "raw": {
        "Levertijd": "2-7 werkdagen",
        "Kopmaat": "18x167 mm",
        "Dikte": "18 mm",
        "Breedte": "167",
        "Materiaal": "MDF",
        "Toepassing": "Kraalplinten voor het afwerken van de aansluiting tussen vloer en wand"
      }
    },
    "images": [
      "https://www.houthandelonline.nl/cdn/resize-extended/el:true/rs:fill/w:1500/h:1068/extend:true/background:255:255:255/path/media/catalog/product/k/r/kraalplint-mdf-vochtw-18x167-3st-v_01_main.jpg",
      "https://www.houthandelonline.nl/cdn/resize-extended/el:true/rs:fill/w:1500/h:1068/extend:true/background:255:255:255/path/media/catalog/product/k/r/kraalplint-mdf-vochtw-18x167-3st-v_02_view.jpg"
    ],
    "rating": null,
    "review_count": null,
    "reviews_summary": null,
    "scraped_at": "2026-02-05T16:55:41.416433Z",
    "scrape_success": true,
    "scrape_errors": [],
    "embedding_text": "Product: Kraalplint MDF 18x167mm vochtwerend wit voorgelakt bos a 3 stuks\nBrand: HouthandelOnline\nCategory: Douglas hout > Toon alles in Douglas hout > Douglas hout palen > Douglas hout balken > Douglas hout latten en regels\nDescription: Deze vochtwerende V313 vloerplint met een kraalmodel aan de bovenzijde ter afwerking van de aansluiting van de vloer en wand. Deze kraalplint heeft een afmeting van 18x167mm en is wit voorgelakt. De plinten zijn verpakt per 3 stuks.\nSpecifications: Levertijd: 2-7 werkdagen, Kopmaat: 18x167 mm, Dikte: 18 mm, Breedte: 167, Materiaal: MDF, Toepassing: Kraalplinten voor het afwerken van de aansluiting tussen vloer en wand\nPrice: EUR 136.94"
  },
  {
    "id": "22fb484e6ce3",
    "source_url": "https://www.houthandelonline.nl/neuslat-meranti-mdf-k65-5st",
    "name": "Neuslat Meranti K65 18x79mm (sponning 65mm) geschaafd wit gegrond per 5 stuks",
    "description": "Meranti houten neuslat, een glaslat met 65mm sponning, is geschaafd en rondom 80mu gegrond. Deze raamafwerklijst is buiten toepasbaar als geventileerde neuslat voor het afvoeren van vocht en het beschermen van het kozijnhout. Verpakt per 5 stuks.",
    "brand": "HouthandelOnline",
    "category": "Douglas hout > Toon alles in Douglas hout > Douglas hout palen > Douglas hout balken > Douglas hout latten en regels",
    "price": 404.66,
    "currency": "EUR",
    "price_raw": "€16,52/m1",
    "specs": {
      "raw": {
        "Levertijd": "2-7 werkdagen",
        "Kopmaat": "18x79 mm",
        "Dikte": "18 mm",
        "Breedte": "79",
        "Materiaal": "Meranti"
      }
    },
    "images": [
      "https://www.houthandelonline.nl/cdn/resize-extended/el:true/rs:fill/w:1500/h:1068/extend:true/background:255:255:255/path/media/catalog/product/n/e/neuslat-meranti-mdf-k65-5st-v_01_main.jpg",
      "https://www.houthandelonline.nl/cdn/resize-extended/el:true/rs:fill/w:1500/h:1068/extend:true/background:255:255:255/path/media/catalog/product/n/e/neuslat-meranti-mdf-k65-5st-v_02_view.jpg"
    ],
    "rating": null,
    "review_count": null,
    "reviews_summary": null,
    "scraped_at": "2026-02-05T16:55:41.416443Z",
    "scrape_success": true,
    "scrape_errors": [],
    "embedding_text": "Product: Neuslat Meranti K65 18x79mm (sponning 65mm) geschaafd wit gegrond per 5 stuks\nBrand: HouthandelOnline\nCategory: Douglas hout > Toon alles in Douglas hout > Douglas hout palen > Douglas hout balken > Douglas hout latten en regels\nDescription: Meranti houten neuslat, een glaslat met 65mm sponning, is geschaafd en rondom 80mu gegrond. Deze raamafwerklijst is buiten toepasbaar als geventileerde neuslat voor het afvoeren van vocht en het beschermen van het kozijnhout. Verpakt per 5 stuks.\nSpecifications: Levertijd: 2-7 werkdagen, Kopmaat: 18x79 mm, Dikte: 18 mm, Breedte: 79, Materiaal: Meranti\nPrice: EUR 404.66"
  },
  {
    "id": "19a253419a38",
    "source_url": "https://www.houthandelonline.nl/ronde-stok-grenen-28-10st",
    "name": "Stok Grenen 28mm geschaafd per 10 stuks",
    "description": "Grenen ronde stokken zijn geschaafd en onbehandeld waardoor rondhout vele toepassingen binnenshuis kent. De stok wordt veel toegepast als gordijnroede in kleine kozijnen, in de interieurbouw of voor het opvullen van ronde gaten. Deze Grenen interieurlijst rond is licht van gewicht en kan makkelijk bewerkt worden. Verpakt per 10 stuks.",
    "brand": "HouthandelOnline",
    "category": "Douglas hout > Toon alles in Douglas hout > Douglas hout palen > Douglas hout balken > Douglas hout latten en regels",
    "price": 146.03,
    "currency": "EUR",
    "price_raw": "€5,41/m1",
    "specs": {
      "raw": {
        "Levertijd": "2-7 werkdagen",
        "Dikte": "28 mm",
        "Breedte": "28",
        "Materiaal": "Grenen",
        "Toepassing": "Rond houten stokken zijn binnen toepasbaar als gordijnroedes voor kleine kozijnen, knutselwerk, interieurbouw en voor het opvullen van ronde gaten. Let op: niet buiten toepasbaar"
      }
    },
    "images": [
      "https://www.houthandelonline.nl/cdn/resize-extended/el:true/rs:fill/w:1500/h:1068/extend:true/background:255:255:255/path/media/catalog/product/r/o/ronde-stok-grenen-28-10st-v_01_main.jpg"
    ],
    "rating": null,
    "review_count": null,
    "reviews_summary": null,
    "scraped_at": "2026-02-05T16:55:41.416451Z",
    "scrape_success": true,
    "scrape_errors": [],
    "embedding_text": "Product: Stok Grenen 28mm geschaafd per 10 stuks\nBrand: HouthandelOnline\nCategory: Douglas hout > Toon alles in Douglas hout > Douglas hout palen > Douglas hout balken > Douglas hout latten en regels\nDescription: Grenen ronde stokken zijn geschaafd en onbehandeld waardoor rondhout vele toepassingen binnenshuis kent. De stok wordt veel toegepast als gordijnroede in kleine kozijnen, in de interieurbouw of voor het opvullen van ronde gaten. Deze Grenen interieurlijst rond is licht van gewicht en kan makkelijk bewerkt worden. Verpakt per 10 stuks.\nSpecifications: Levertijd: 2-7 werkdagen, Dikte: 28 mm, Breedte: 28, Materiaal: Grenen, Toepassing: Rond houten stokken zijn binnen toepasbaar als gordijnroedes voor kleine kozijnen, knutselwerk, interieurbouw en voor het opvullen van ronde gaten. Let op: niet buiten toepasbaar\nPrice: EUR 146.03"
  },
  {
    "id": "debad04768ce",
    "source_url": "https://www.houthandelonline.nl/neuslat-meranti-mdf-k75-5st",
    "name": "Neuslat Meranti K75 18x89mm (sponning 75mm) geschaafd wit gegrond per 5 stuks",
    "description": "Meranti houten neuslat, een glaslat met 75mm sponning, is geschaafd en rondom 80mu gegrond. Deze raamafwerklijst is buiten toepasbaar als geventileerde neuslat voor het afvoeren van vocht en het beschermen van het kozijnhout. Verpakt per 5 stuks.",
    "brand": "HouthandelOnline",
    "category": "Douglas hout > Toon alles in Douglas hout > Douglas hout palen > Douglas hout balken > Douglas hout latten en regels",
    "price": 444.68,
    "currency": "EUR",
    "price_raw": "€18,15/m1",
    "specs": {
      "raw": {
        "Levertijd": "2-7 werkdagen",
        "Kopmaat": "18x89 mm",
        "Dikte": "18 mm",
        "Breedte": "89",
        "Materiaal": "Meranti"
      }
    },
    "images": [
      "https://www.houthandelonline.nl/cdn/resize-extended/el:true/rs:fill/w:1500/h:1068/extend:true/background:255:255:255/path/media/catalog/product/n/e/neuslat-meranti-mdf-k75-5st-v_01_main.jpg",
      "https://www.houthandelonline.nl/cdn/resize-extended/el:true/rs:fill/w:1500/h:1068/extend:true/background:255:255:255/path/media/catalog/product/n/e/neuslat-meranti-mdf-k75-5st-v_02_view.jpg"
    ],
    "rating": null,
    "review_count": null,
    "reviews_summary": null,
    "scraped_at": "2026-02-05T16:55:41.416459Z",
    "scrape_success": true,
    "scrape_errors": [],
    "embedding_text": "Product: Neuslat Meranti K75 18x89mm (sponning 75mm) geschaafd wit gegrond per 5 stuks\nBrand: HouthandelOnline\nCategory: Douglas hout > Toon alles in Douglas hout > Douglas hout palen > Douglas hout balken > Douglas hout latten en regels\nDescription: Meranti houten neuslat, een glaslat met 75mm sponning, is geschaafd en rondom 80mu gegrond. Deze raamafwerklijst is buiten toepasbaar als geventileerde neuslat voor het afvoeren van vocht en het beschermen van het kozijnhout. Verpakt per 5 stuks.\nSpecifications: Levertijd: 2-7 werkdagen, Kopmaat: 18x89 mm, Dikte: 18 mm, Breedte: 89, Materiaal: Meranti\nPrice: EUR 444.68"
  },
  {
    "id": "56b56d4ab498",
    "source_url": "https://www.houthandelonline.nl/neuslat-meranti-mdf-k25-5st",
    "name": "Neuslat Meranti K25 18x39mm (sponning 25mm) geschaafd wit gegrond per 5 stuks",
    "description": "Meranti houten neuslat, een glaslat met 25mm sponning, is geschaafd en rondom 80mu gegrond. Deze raamafwerklijst is buiten toepasbaar als geventileerde neuslat voor het afvoeren van vocht en het beschermen",
    "brand": "HouthandelOnline",
    "category": "Douglas hout > Toon alles in Douglas hout > Douglas hout palen > Douglas hout balken > Douglas hout latten en regels",
    "price": 237.16,
    "currency": "EUR",
    "price_raw": "€9,68/m1",
    "specs": {
      "raw": {
        "Levertijd": "2-7 werkdagen",
        "Kopmaat": "18x39 mm",
        "Dikte": "18 mm",
        "Breedte": "39",
        "Materiaal": "Meranti"
      }
    },
    "images": [
      "https://www.houthandelonline.nl/cdn/resize-extended/el:true/rs:fill/w:1500/h:1068/extend:true/background:255:255:255/path/media/catalog/product/n/e/neuslat-meranti-mdf-k25-5st-v_01_main.jpg",
      "https://www.houthandelonline.nl/cdn/resize-extended/el:true/rs:fill/w:1500/h:1068/extend:true/background:255:255:255/path/media/catalog/product/n/e/neuslat-meranti-mdf-k25-5st-v_02_view.jpg"
    ],
    "rating": null,
    "review_count": null,
    "reviews_summary": null,
    "scraped_at": "2026-02-05T16:55:41.416467Z",
    "scrape_success": true,
    "scrape_errors": [],
    "embedding_text": "Product: Neuslat Meranti K25 18x39mm (sponning 25mm) geschaafd wit gegrond per 5 stuks\nBrand: HouthandelOnline\nCategory: Douglas hout > Toon alles in Douglas hout > Douglas hout palen > Douglas hout balken > Douglas hout latten en regels\nDescription: Meranti houten neuslat, een glaslat met 25mm sponning, is geschaafd en rondom 80mu gegrond. Deze raamafwerklijst is buiten toepasbaar als geventileerde neuslat voor het afvoeren van vocht en het beschermen\nSpecifications: Levertijd: 2-7 werkdagen, Kopmaat: 18x39 mm, Dikte: 18 mm, Breedte: 39, Materiaal: Meranti\nPrice: EUR 237.16"
  },
  {
    "id": "f7f4f216b9ee",
    "source_url": "https://www.houthandelonline.nl/koplat-mdf-model-e-12x32-10st",
    "name": "Koplat MDF Vochtwerend (model E) 12x32mm met rechte kanten wit voorgelakt per 10 stuks",
    "description": "Deze vochtwerende V313 koplat (model E) met rechte kanten is geschikt voor de afwerking van een vloer of wand van de aansluiting van kozijnstijl en afgewerkte wand. De koplatten zijn wit voorgelakt en zijn voor de sierlijke afwerking rond deuren of ramen. \n\n Deze koplat heeft een afmeting van 12x32mm en is wit voorgelakt. De koplatten zijn verpakt per 10 stuks.",
    "brand": "HouthandelOnline",
    "category": "Douglas hout > Toon alles in Douglas hout > Douglas hout palen > Douglas hout balken > Douglas hout latten en regels",
    "price": 66.72,
    "currency": "EUR",
    "price_raw": "€1,37/m1",
    "specs": {
      "raw": {
        "Levertijd": "2-7 werkdagen",
        "Kopmaat": "12x32 mm",
        "Dikte": "12 mm",
        "Breedte": "32",
        "Materiaal": "MDF",
        "Toepassing": "Lijstwerk voor het afwerken van de aansluiting tussen wand en kozijn"
      }
    },
    "images": [
      "https://www.houthandelonline.nl/cdn/resize-extended/el:true/rs:fill/w:1500/h:1068/extend:true/background:255:255:255/path/media/catalog/product/k/o/koplat-mdf-model-e-12x32-10st-v_01_main.jpg"
    ],
    "rating": null,
    "review_count": null,
    "reviews_summary": null,
    "scraped_at": "2026-02-05T16:55:41.416476Z",
    "scrape_success": true,
    "scrape_errors": [],
    "embedding_text": "Product: Koplat MDF Vochtwerend (model E) 12x32mm met rechte kanten wit voorgelakt per 10 stuks\nBrand: HouthandelOnline\nCategory: Douglas hout > Toon alles in Douglas hout > Douglas hout palen > Douglas hout balken > Douglas hout latten en regels\nDescription: Deze vochtwerende V313 koplat (model E) met rechte kanten is geschikt voor de afwerking van een vloer of wand van de aansluiting van kozijnstijl en afgewerkte wand. De koplatten zijn wit voorgelakt en zijn voor de sierlijke afwerking rond deuren of ramen. \n\n Deze koplat heeft een afmeting van 12x32mm en is wit voorgelakt. De koplatten zijn verpakt per 10 stuks.\nSpecifications: Levertijd: 2-7 werkdagen, Kopmaat: 12x32 mm, Dikte: 12 mm, Breedte: 32, Materiaal: MDF, Toepassing: Lijstwerk voor het afwerken van de aansluiting tussen wand en kozijn\nPrice: EUR 66.72"
  },
  {
    "id": "1d8f95e4803d",
    "source_url": "https://www.houthandelonline.nl/hoeklat-grenen-14x14-10st",
    "name": "Hoeklat Grenen 14x14mm geschaafd per 10 stuks",
    "description": "Grenen hoeklatten zijn geschaafd en onbehandeld. Houten hoekprofielen zorgen voor een nette hoekafwerking binnenshuis. Deze hoeklatten zijn geschikt voor het afwerken van hoeken van wanden, meubels of voor een decoratieve overgang van de ene naar de andere wand. Deze Grenen houten afwerklijst is licht van gewicht en kan makkelijk bewerkt worden. Verpakt per 10 stuks.",
    "brand": "HouthandelOnline",
    "category": "Douglas hout > Toon alles in Douglas hout > Douglas hout palen > Douglas hout balken > Douglas hout latten en regels",
    "price": 55.87,
    "currency": "EUR",
    "price_raw": "€2,07/m1",
    "specs": {
      "raw": {
        "Levertijd": "2-7 werkdagen",
        "Kopmaat": "14x14 mm",
        "Dikte": "14 mm",
        "Breedte": "14",
        "Materiaal": "Grenen",
        "Toepassing": "Deze Grenen houten hoeklat is binnen toepasbaar voor het afwerken van verschillende binnen- en buitenhoeken van bijvoorbeeld wanden, meubels, vloeren of andere klussen. Ook voorzien hoekprofielen in het maken van een decoratieve overgang van wanden. Let op: niet buiten toepasbaar"
      }
    },
    "images": [
      "https://www.houthandelonline.nl/cdn/resize-extended/el:true/rs:fill/w:1500/h:1068/extend:true/background:255:255:255/path/media/catalog/product/h/o/hoeklat-grenen-14x14-10st-v_01_main.jpg"
    ],
    "rating": null,
    "review_count": null,
    "reviews_summary": null,
    "scraped_at": "2026-02-05T16:55:41.416483Z",
    "scrape_success": true,
    "scrape_errors": [],
    "embedding_text": "Product: Hoeklat Grenen 14x14mm geschaafd per 10 stuks\nBrand: HouthandelOnline\nCategory: Douglas hout > Toon alles in Douglas hout > Douglas hout palen > Douglas hout balken > Douglas hout latten en regels\nDescription: Grenen hoeklatten zijn geschaafd en onbehandeld. Houten hoekprofielen zorgen voor een nette hoekafwerking binnenshuis. Deze hoeklatten zijn geschikt voor het afwerken van hoeken van wanden, meubels of voor een decoratieve overgang van de ene naar de andere wand. Deze Grenen houten afwerklijst is licht van gewicht en kan makkelijk bewerkt worden. Verpakt per 10 stuks.\nSpecifications: Levertijd: 2-7 werkdagen, Kopmaat: 14x14 mm, Dikte: 14 mm, Breedte: 14, Materiaal: Grenen, Toepassing: Deze Grenen houten hoeklat is binnen toepasbaar voor het afwerken van verschillende binnen- en buitenhoeken van bijvoorbeeld wanden, meubels, vloeren of andere klussen. Ook voorzien hoekprofielen in het maken van een decoratieve overgang van wanden. Let op: niet buiten toepasbaar\nPrice: EUR 55.87"
  },
  {
    "id": "a42cfc22057f",
    "source_url": "https://www.houthandelonline.nl/halfronde-lat-grenen-12x30-10st",
    "name": "Lat halfrond Grenen 12x30mm geschaafd per 10 stuks",
    "description": "Deze Grenen halfronde lijsten zijn geschaafd en onbehandeld. Houten afwerklijsten zorgen voor een nette afwerking binnenshuis. Deze halfronde lijsten zijn geschikt voor het afwerken van tafelranden, meubels of voor een decoratieve wandlijst of plafondlijst. Deze Grenen houten afwerklijst is licht van gewicht en kan makkelijk bewerkt worden. Verpakt per 10 stuks.",
    "brand": "HouthandelOnline",
    "category": "Douglas hout > Toon alles in Douglas hout > Douglas hout palen > Douglas hout balken > Douglas hout latten en regels",
    "price": 83.64,
    "currency": "EUR",
    "price_raw": "€3,10/m1",
    "specs": {
      "raw": {
        "Levertijd": "2-7 werkdagen",
        "Kopmaat": "12x30 mm",
        "Dikte": "12 mm",
        "Breedte": "30",
        "Materiaal": "Grenen",
        "Toepassing": "Deze Grenen houten halfronde sierlijst is binnen toepasbaar voor het afwerken van verschillende meubelstukken, tafelranden of als decoratieve wandlijst of plafondlijst. Let op: niet buiten toepasbaar"
      }
    },
    "images": [
      "https://www.houthandelonline.nl/cdn/resize-extended/el:true/rs:fill/w:1500/h:1068/extend:true/background:255:255:255/path/media/catalog/product/h/a/halfronde-lat-grenen-12x30-10st-v_01_main.jpg"
    ],
    "rating": null,
    "review_count": null,
    "reviews_summary": null,
    "scraped_at": "2026-02-05T16:55:41.416491Z",
    "scrape_success": true,
    "scrape_errors": [],
    "embedding_text": "Product: Lat halfrond Grenen 12x30mm geschaafd per 10 stuks\nBrand: HouthandelOnline\nCategory: Douglas hout > Toon alles in Douglas hout > Douglas hout palen > Douglas hout balken > Douglas hout latten en regels\nDescription: Deze Grenen halfronde lijsten zijn geschaafd en onbehandeld. Houten afwerklijsten zorgen voor een nette afwerking binnenshuis. Deze halfronde lijsten zijn geschikt voor het afwerken van tafelranden, meubels of voor een decoratieve wandlijst of plafondlijst. Deze Grenen houten afwerklijst is licht van gewicht en kan makkelijk bewerkt worden. Verpakt per 10 stuks.\nSpecifications: Levertijd: 2-7 werkdagen, Kopmaat: 12x30 mm, Dikte: 12 mm, Breedte: 30, Materiaal: Grenen, Toepassing: Deze Grenen houten halfronde sierlijst is binnen toepasbaar voor het afwerken van verschillende meubelstukken, tafelranden of als decoratieve wandlijst of plafondlijst. Let op: niet buiten toepasbaar\nPrice: EUR 83.64"
  },
  {
    "id": "233a01c629d5",
    "source_url": "https://www.houthandelonline.nl/ronde-stok-meranti-35-275cm-5st",
    "name": "Ronde stok Meranti 35mm geschaafd per 5 stuks",
    "description": "De Hardhouten ronde stokken zijn geschaafd en onbehandeld waardoor rondhout vele toepassingen binnenshuis kent. De stok wordt veel toegepast als trapleuning of voor het opvullen van ronde gaten. Deze Hardhouten trapleuning is licht van gewicht en kan makkelijk bewerkt worden. Verpakt per 5 stuks.",
    "brand": "HouthandelOnline",
    "category": "Douglas hout > Toon alles in Douglas hout > Douglas hout palen > Douglas hout balken > Douglas hout latten en regels",
    "price": 219.62,
    "currency": "EUR",
    "price_raw": "€15,97/m1",
    "specs": {
      "raw": {
        "Levertijd": "2-7 werkdagen",
        "Dikte": "35 mm",
        "Materiaal": "Meranti",
        "Toepassing": "Rond houten stokken worden veel toegepast als trapleuning, worden gebruikt in de interieurbouw of zijn geschikt voor het opvullen van ronde gaten. Let op: niet buiten toepasbaar"
      }
    },
    "images": [
      "https://www.houthandelonline.nl/cdn/resize-extended/el:true/rs:fill/w:1500/h:1068/extend:true/background:255:255:255/path/media/catalog/product/r/o/ronde-stok-meranti-35-275cm-5st-v_01_main.jpg"
    ],
    "rating": null,
    "review_count": null,
    "reviews_summary": null,
    "scraped_at": "2026-02-05T16:55:41.416499Z",
    "scrape_success": true,
    "scrape_errors": [],
    "embedding_text": "Product: Ronde stok Meranti 35mm geschaafd per 5 stuks\nBrand: HouthandelOnline\nCategory: Douglas hout > Toon alles in Douglas hout > Douglas hout palen > Douglas hout balken > Douglas hout latten en regels\nDescription: De Hardhouten ronde stokken zijn geschaafd en onbehandeld waardoor rondhout vele toepassingen binnenshuis kent. De stok wordt veel toegepast als trapleuning of voor het opvullen van ronde gaten. Deze Hardhouten trapleuning is licht van gewicht en kan makkelijk bewerkt worden. Verpakt per 5 stuks.\nSpecifications: Levertijd: 2-7 werkdagen, Dikte: 35 mm, Materiaal: Meranti, Toepassing: Rond houten stokken worden veel toegepast als trapleuning, worden gebruikt in de interieurbouw of zijn geschikt voor het opvullen van ronde gaten. Let op: niet buiten toepasbaar\nPrice: EUR 219.62"
  },
  {
    "id": "dfa3a3c024b8",
    "source_url": "https://www.houthandelonline.nl/plint-mdf-12x90-4st",
    "name": "Plint MDF 12x90mm vochtwerend wit voorgelakt per 4 stuks",
    "description": "Deze vochtwerende V313 plint is geschikt voor de afwerking van een vloer of wand. De plint is wit voorgelakt en heeft een afmeting van 12x90mm. De plinten zijn verpakt per 4 stuks.",
    "brand": "HouthandelOnline",
    "category": "Douglas hout > Toon alles in Douglas hout > Douglas hout palen > Douglas hout balken > Douglas hout latten en regels",
    "price": 58.33,
    "currency": "EUR",
    "price_raw": "€2,99/m1",
    "specs": {
      "raw": {
        "Levertijd": "2-7 werkdagen",
        "Kopmaat": "12x90 mm",
        "Dikte": "12 mm",
        "Breedte": "90",
        "Materiaal": "MDF",
        "Toepassing": "Lijstwerk voor het afwerken van de aansluiting tussen vloer en wand"
      }
    },
    "images": [
      "https://www.houthandelonline.nl/cdn/resize-extended/el:true/rs:fill/w:1500/h:1068/extend:true/background:255:255:255/path/media/catalog/product/p/l/plint-mdf-12x90-4st-v_01_main.jpg",
      "https://www.houthandelonline.nl/cdn/resize-extended/el:true/rs:fill/w:1500/h:1068/extend:true/background:255:255:255/path/media/catalog/product/p/l/plint-mdf-12x90-4st-v_02_view.jpg",
      "https://www.houthandelonline.nl/cdn/resize-extended/el:true/rs:fill/w:1500/h:1068/extend:true/background:255:255:255/path/media/catalog/product/p/l/plint-mdf-12x90-4st-v_03_view.jpg"
    ],
    "rating": null,
    "review_count": null,
    "reviews_summary": null,
    "scraped_at": "2026-02-05T16:55:41.416508Z",
    "scrape_success": true,
    "scrape_errors": [],
    "embedding_text": "Product: Plint MDF 12x90mm vochtwerend wit voorgelakt per 4 stuks\nBrand: HouthandelOnline\nCategory: Douglas hout > Toon alles in Douglas hout > Douglas hout palen > Douglas hout balken > Douglas hout latten en regels\nDescription: Deze vochtwerende V313 plint is geschikt voor de afwerking van een vloer of wand. De plint is wit voorgelakt en heeft een afmeting van 12x90mm. De plinten zijn verpakt per 4 stuks.\nSpecifications: Levertijd: 2-7 werkdagen, Kopmaat: 12x90 mm, Dikte: 12 mm, Breedte: 90, Materiaal: MDF, Toepassing: Lijstwerk voor het afwerken van de aansluiting tussen vloer en wand\nPrice: EUR 58.33"
  },
  {
    "id": "77b7b66b56c7",
    "source_url": "https://www.houthandelonline.nl/plint-mdf-12x55-10st",
    "name": "Plint MDF 12x55mm vochtwerend wit voorgelakt per 10 stuks",
    "description": "Deze vochtwerende V313 plint is geschikt voor de afwerking van een vloer of wand. De plint is wit voorgelakt en heeft een afmeting van 12x55mm. De plinten zijn verpakt per 10 stuks.",
    "brand": "HouthandelOnline",
    "category": "Douglas hout > Toon alles in Douglas hout > Douglas hout palen > Douglas hout balken > Douglas hout latten en regels",
    "price": 85.62,
    "currency": "EUR",
    "price_raw": "€1,75/m1",
    "specs": {
      "raw": {
        "Levertijd": "2-7 werkdagen",
        "Kopmaat": "12x55 mm",
        "Dikte": "12 mm",
        "Breedte": "55",
        "Materiaal": "MDF",
        "Toepassing": "Lijstwerk voor het afwerken van de aansluiting tussen vloer en wand"
      }
    },
    "images": [
      "https://www.houthandelonline.nl/cdn/resize-extended/el:true/rs:fill/w:1500/h:1068/extend:true/background:255:255:255/path/media/catalog/product/p/l/plint-mdf-12x55-10st-v_01_main.jpg",
      "https://www.houthandelonline.nl/cdn/resize-extended/el:true/rs:fill/w:1500/h:1068/extend:true/background:255:255:255/path/media/catalog/product/p/l/plint-mdf-12x55-10st-v_02_view.jpg",
      "https://www.houthandelonline.nl/cdn/resize-extended/el:true/rs:fill/w:1500/h:1068/extend:true/background:255:255:255/path/media/catalog/product/p/l/plint-mdf-12x55-10st-v_03_view.jpg",
      "https://www.houthandelonline.nl/cdn/resize-extended/el:true/rs:fill/w:1500/h:1068/extend:true/background:255:255:255/path/media/catalog/product/p/l/plint-mdf-12x55-10st-v_04_view.jpg"
    ],
    "rating": null,
    "review_count": null,
    "reviews_summary": null,
    "scraped_at": "2026-02-05T16:55:41.416516Z",
    "scrape_success": true,
    "scrape_errors": [],
    "embedding_text": "Product: Plint MDF 12x55mm vochtwerend wit voorgelakt per 10 stuks\nBrand: HouthandelOnline\nCategory: Douglas hout > Toon alles in Douglas hout > Douglas hout palen > Douglas hout balken > Douglas hout latten en regels\nDescription: Deze vochtwerende V313 plint is geschikt voor de afwerking van een vloer of wand. De plint is wit voorgelakt en heeft een afmeting van 12x55mm. De plinten zijn verpakt per 10 stuks.\nSpecifications: Levertijd: 2-7 werkdagen, Kopmaat: 12x55 mm, Dikte: 12 mm, Breedte: 55, Materiaal: MDF, Toepassing: Lijstwerk voor het afwerken van de aansluiting tussen vloer en wand\nPrice: EUR 85.62"
  },
  {
    "id": "65e7d709207b",
    "source_url": "https://www.houthandelonline.nl/plint-grenen-12x90-5st",
    "name": "Plint Grenen 12x90mm zichtzijde wit afgelakt per 5 stuks",
    "description": "Vloerplint ter afwerking van de aansluiting van de vloer en wand",
    "brand": "HouthandelOnline",
    "category": "Douglas hout > Toon alles in Douglas hout > Douglas hout palen > Douglas hout balken > Douglas hout latten en regels",
    "price": 206.92,
    "currency": "EUR",
    "price_raw": "€8,45/m1",
    "specs": {
      "raw": {
        "Levertijd": "2-7 werkdagen",
        "Kopmaat": "12x90 mm",
        "Dikte": "12 mm",
        "Breedte": "90",
        "Materiaal": "Grenen",
        "Toepassing": "Lijstwerk voor het afwerken van de aansluiting tussen vloer en wand"
      }
    },
    "images": [
      "https://www.houthandelonline.nl/cdn/resize-extended/el:true/rs:fill/w:1500/h:1068/extend:true/background:255:255:255/path/media/catalog/product/p/l/plint-grenen-12x90-5st-v_01_main.jpg",
      "https://www.houthandelonline.nl/cdn/resize-extended/el:true/rs:fill/w:1500/h:1068/extend:true/background:255:255:255/path/media/catalog/product/p/l/plint-grenen-12x90-5st-v_02_view.jpg",
      "https://www.houthandelonline.nl/cdn/resize-extended/el:true/rs:fill/w:1500/h:1068/extend:true/background:255:255:255/path/media/catalog/product/p/l/plint-grenen-12x90-5st-v_03_view.jpg",
      "https://www.houthandelonline.nl/cdn/resize-extended/el:true/rs:fill/w:1500/h:1068/extend:true/background:255:255:255/path/media/catalog/product/p/l/plint-grenen-12x90-5st-v_04_view.jpg"
    ],
    "rating": null,
    "review_count": null,
    "reviews_summary": null,
    "scraped_at": "2026-02-05T16:55:41.416526Z",
    "scrape_success": true,
    "scrape_errors": [],
    "embedding_text": "Product: Plint Grenen 12x90mm zichtzijde wit afgelakt per 5 stuks\nBrand: HouthandelOnline\nCategory: Douglas hout > Toon alles in Douglas hout > Douglas hout palen > Douglas hout balken > Douglas hout latten en regels\nDescription: Vloerplint ter afwerking van de aansluiting van de vloer en wand\nSpecifications: Levertijd: 2-7 werkdagen, Kopmaat: 12x90 mm, Dikte: 12 mm, Breedte: 90, Materiaal: Grenen, Toepassing: Lijstwerk voor het afwerken van de aansluiting tussen vloer en wand\nPrice: EUR 206.92"
  },
  {
    "id": "339fd82fca60",
    "source_url": "https://www.houthandelonline.nl/neuslat-tricoya-mdf-k65-5st",
    "name": "Neuslat Tricoya MDF K65 18x79mm (sponning 65mm) geschaafd wit gegrond per 5 stuks",
    "description": "Tricoya MDF neuslat, een glaslat met 65mm sponning, is geschaafd en rondom 60mu gegrond. Deze raamafwerklijst is binnen en buiten toepasbaar als geventileerde neuslat voor het afvoeren van vuil en vocht en het beschermen van het kozijnhout. De neuslat is 18x79mm. Verpakt per 5 stuks.",
    "brand": "HouthandelOnline",
    "category": "Douglas hout > Toon alles in Douglas hout > Douglas hout palen > Douglas hout balken > Douglas hout latten en regels",
    "price": 543.83,
    "currency": "EUR",
    "price_raw": "€22,29/m1",
    "specs": {
      "raw": {
        "Levertijd": "2-7 werkdagen",
        "Kopmaat": "18x79 mm",
        "Dikte": "18 mm",
        "Breedte": "79",
        "Materiaal": "MDF Tricoya"
      }
    },
    "images": [
      "https://www.houthandelonline.nl/cdn/resize-extended/el:true/rs:fill/w:1500/h:1068/extend:true/background:255:255:255/path/media/catalog/product/n/e/neuslat-tricoya-mdf-k65-5st-v_01_main.jpg",
      "https://www.houthandelonline.nl/cdn/resize-extended/el:true/rs:fill/w:1500/h:1068/extend:true/background:255:255:255/path/media/catalog/product/n/e/neuslat-tricoya-mdf-k65-5st-v_02_view.jpg"
    ],
    "rating": null,
    "review_count": null,
    "reviews_summary": null,
    "scraped_at": "2026-02-05T16:55:41.416534Z",
    "scrape_success": true,
    "scrape_errors": [],
    "embedding_text": "Product: Neuslat Tricoya MDF K65 18x79mm (sponning 65mm) geschaafd wit gegrond per 5 stuks\nBrand: HouthandelOnline\nCategory: Douglas hout > Toon alles in Douglas hout > Douglas hout palen > Douglas hout balken > Douglas hout latten en regels\nDescription: Tricoya MDF neuslat, een glaslat met 65mm sponning, is geschaafd en rondom 60mu gegrond. Deze raamafwerklijst is binnen en buiten toepasbaar als geventileerde neuslat voor het afvoeren van vuil en vocht en het beschermen van het kozijnhout. De neuslat is 18x79mm. Verpakt per 5 stuks.\nSpecifications: Levertijd: 2-7 werkdagen, Kopmaat: 18x79 mm, Dikte: 18 mm, Breedte: 79, Materiaal: MDF Tricoya\nPrice: EUR 543.83"
  },
  {
    "id": "9071bd1f256b",
    "source_url": "https://www.houthandelonline.nl/neuslat-tricoya-mdf-k30-5st",
    "name": "Neuslat Tricoya MDF K30 18x45mm (sponning 30mm) geschaafd wit gegrond per 5 stuks",
    "description": "Tricoya MDF neuslat, een glaslat met 30mm sponning, is geschaafd en rondom 60mu gegrond. Deze raamafwerklijst is binnen en buiten toepasbaar als geventileerde neuslat voor het afvoeren van vuil en vocht en het beschermen van het kozijnhout. De neuslat is 18x45mm. Verpakt per 5 stuks.",
    "brand": "HouthandelOnline",
    "category": "Douglas hout > Toon alles in Douglas hout > Douglas hout palen > Douglas hout balken > Douglas hout latten en regels",
    "price": 353.1,
    "currency": "EUR",
    "price_raw": "€14,47/m1",
    "specs": {
      "raw": {
        "Levertijd": "2-7 werkdagen",
        "Kopmaat": "18x45 mm",
        "Dikte": "18 mm",
        "Breedte": "45",
        "Materiaal": "MDF Tricoya"
      }
    },
    "images": [
      "https://www.houthandelonline.nl/cdn/resize-extended/el:true/rs:fill/w:1500/h:1068/extend:true/background:255:255:255/path/media/catalog/product/n/e/neuslat-tricoya-mdf-k30-5st-v_01_main.jpg",
      "https://www.houthandelonline.nl/cdn/resize-extended/el:true/rs:fill/w:1500/h:1068/extend:true/background:255:255:255/path/media/catalog/product/n/e/neuslat-tricoya-mdf-k30-5st-v_02_view.jpg"
    ],
    "rating": null,
    "review_count": null,
    "reviews_summary": null,
    "scraped_at": "2026-02-05T16:55:41.416543Z",
    "scrape_success": true,
    "scrape_errors": [],
    "embedding_text": "Product: Neuslat Tricoya MDF K30 18x45mm (sponning 30mm) geschaafd wit gegrond per 5 stuks\nBrand: HouthandelOnline\nCategory: Douglas hout > Toon alles in Douglas hout > Douglas hout palen > Douglas hout balken > Douglas hout latten en regels\nDescription: Tricoya MDF neuslat, een glaslat met 30mm sponning, is geschaafd en rondom 60mu gegrond. Deze raamafwerklijst is binnen en buiten toepasbaar als geventileerde neuslat voor het afvoeren van vuil en vocht en het beschermen van het kozijnhout. De neuslat is 18x45mm. Verpakt per 5 stuks.\nSpecifications: Levertijd: 2-7 werkdagen, Kopmaat: 18x45 mm, Dikte: 18 mm, Breedte: 45, Materiaal: MDF Tricoya\nPrice: EUR 353.1"
  },
  {
    "id": "2d5ce384bdc1",
    "source_url": "https://www.houthandelonline.nl/neuslat-meranti-mdf-k50-5st",
    "name": "Neuslat Meranti K50 18x64mm (sponning 50mm) geschaafd wit gegrond per 5 stuks",
    "description": "Meranti houten neuslat, een glaslat met 50mm sponning, is geschaafd en rondom 80mu gegrond. Deze raamafwerklijst is buiten toepasbaar als geventileerde neuslat voor het afvoeren van vocht en het beschermen van het kozijnhout. Verpakt per 5 stuks.",
    "brand": "HouthandelOnline",
    "category": "Douglas hout > Toon alles in Douglas hout > Douglas hout palen > Douglas hout balken > Douglas hout latten en regels",
    "price": 307.72,
    "currency": "EUR",
    "price_raw": "€12,56/m1",
    "specs": {
      "raw": {
        "Levertijd": "2-7 werkdagen",
        "Kopmaat": "18x64 mm",
        "Dikte": "18 mm",
        "Breedte": "64",
        "Materiaal": "Meranti"
      }
    },
    "images": [
      "https://www.houthandelonline.nl/cdn/resize-extended/el:true/rs:fill/w:1500/h:1068/extend:true/background:255:255:255/path/media/catalog/product/n/e/neuslat-meranti-mdf-k50-5st-v_01_main.jpg",
      "https://www.houthandelonline.nl/cdn/resize-extended/el:true/rs:fill/w:1500/h:1068/extend:true/background:255:255:255/path/media/catalog/product/n/e/neuslat-meranti-mdf-k50-5st-v_02_view.jpg"
    ],
    "rating": null,
    "review_count": null,
    "reviews_summary": null,
    "scraped_at": "2026-02-05T16:55:41.416552Z",
    "scrape_success": true,
    "scrape_errors": [],
    "embedding_text": "Product: Neuslat Meranti K50 18x64mm (sponning 50mm) geschaafd wit gegrond per 5 stuks\nBrand: HouthandelOnline\nCategory: Douglas hout > Toon alles in Douglas hout > Douglas hout palen > Douglas hout balken > Douglas hout latten en regels\nDescription: Meranti houten neuslat, een glaslat met 50mm sponning, is geschaafd en rondom 80mu gegrond. Deze raamafwerklijst is buiten toepasbaar als geventileerde neuslat voor het afvoeren van vocht en het beschermen van het kozijnhout. Verpakt per 5 stuks.\nSpecifications: Levertijd: 2-7 werkdagen, Kopmaat: 18x64 mm, Dikte: 18 mm, Breedte: 64, Materiaal: Meranti\nPrice: EUR 307.72"
  },
  {
    "id": "45a392c7b1d0",
    "source_url": "https://www.houthandelonline.nl/neuslat-meranti-mdf-k20-5st",
    "name": "Neuslat Meranti K20 18x34mm (sponning 20mm) geschaafd wit gegrond per 5 stuks",
    "description": "Meranti houten neuslat, een glaslat met 20mm sponning, is geschaafd en rondom 80mu gegrond. Deze raamafwerklijst is buiten toepasbaar als geventileerde neuslat voor het afvoeren van vocht en het beschermen van het kozijnhout. Verpakt per 5 stuks.",
    "brand": "HouthandelOnline",
    "category": "Douglas hout > Toon alles in Douglas hout > Douglas hout palen > Douglas hout balken > Douglas hout latten en regels",
    "price": 169.87,
    "currency": "EUR",
    "price_raw": "€6,93/m1",
    "specs": {
      "raw": {
        "Levertijd": "2-7 werkdagen",
        "Kopmaat": "18x34 mm",
        "Dikte": "18 mm",
        "Breedte": "34",
        "Materiaal": "Meranti"
      }
    },
    "images": [
      "https://www.houthandelonline.nl/cdn/resize-extended/el:true/rs:fill/w:1500/h:1068/extend:true/background:255:255:255/path/media/catalog/product/n/e/neuslat-meranti-mdf-k20-5st-v_01_main.jpg",
      "https://www.houthandelonline.nl/cdn/resize-extended/el:true/rs:fill/w:1500/h:1068/extend:true/background:255:255:255/path/media/catalog/product/n/e/neuslat-meranti-mdf-k20-5st-v_02_view.jpg"
    ],
    "rating": null,
    "review_count": null,
    "reviews_summary": null,
    "scraped_at": "2026-02-05T16:55:41.416561Z",
    "scrape_success": true,
    "scrape_errors": [],
    "embedding_text": "Product: Neuslat Meranti K20 18x34mm (sponning 20mm) geschaafd wit gegrond per 5 stuks\nBrand: HouthandelOnline\nCategory: Douglas hout > Toon alles in Douglas hout > Douglas hout palen > Douglas hout balken > Douglas hout latten en regels\nDescription: Meranti houten neuslat, een glaslat met 20mm sponning, is geschaafd en rondom 80mu gegrond. Deze raamafwerklijst is buiten toepasbaar als geventileerde neuslat voor het afvoeren van vocht en het beschermen van het kozijnhout. Verpakt per 5 stuks.\nSpecifications: Levertijd: 2-7 werkdagen, Kopmaat: 18x34 mm, Dikte: 18 mm, Breedte: 34, Materiaal: Meranti\nPrice: EUR 169.87"
  },
  {
    "id": "7628100518f0",
    "source_url": "https://www.houthandelonline.nl/kwartrond-latgrenen14x14mm10st",
    "name": "Lat kwartrond Grenen 14x14mm geschaafd per 10 stuks",
    "description": "Grenen kwartronde latten zijn geschaafd en onbehandeld. Houten afwerklijsten zorgen voor een nette hoekafwerking binnenshuis. Deze kwartronde latten zijn geschikt voor het afwerken van binnenhoeken van wanden, meubels of voor een decoratieve overgang van de muur naar het plafond of kozijn. Deze Grenen houten afwerklijst is licht van gewicht en kan makkelijk bewerkt worden. Verpakt per 10 stuks.",
    "brand": "HouthandelOnline",
    "category": "Douglas hout > Toon alles in Douglas hout > Douglas hout palen > Douglas hout balken > Douglas hout latten en regels",
    "price": 37.9,
    "currency": "EUR",
    "price_raw": "€1,40/m1",
    "specs": {
      "raw": {
        "Levertijd": "2-7 werkdagen",
        "Kopmaat": "14x14 mm",
        "Dikte": "14 mm",
        "Breedte": "14",
        "Materiaal": "Grenen"
      }
    },
    "images": [
      "https://www.houthandelonline.nl/cdn/resize-extended/el:true/rs:fill/w:1500/h:1068/extend:true/background:255:255:255/path/media/catalog/product/k/w/kwartrond-latgrenen14x14mm10st-v_01_main.jpg"
    ],
    "rating": null,
    "review_count": null,
    "reviews_summary": null,
    "scraped_at": "2026-02-05T16:55:41.416569Z",
    "scrape_success": true,
    "scrape_errors": [],
    "embedding_text": "Product: Lat kwartrond Grenen 14x14mm geschaafd per 10 stuks\nBrand: HouthandelOnline\nCategory: Douglas hout > Toon alles in Douglas hout > Douglas hout palen > Douglas hout balken > Douglas hout latten en regels\nDescription: Grenen kwartronde latten zijn geschaafd en onbehandeld. Houten afwerklijsten zorgen voor een nette hoekafwerking binnenshuis. Deze kwartronde latten zijn geschikt voor het afwerken van binnenhoeken van wanden, meubels of voor een decoratieve overgang van de muur naar het plafond of kozijn. Deze Grenen houten afwerklijst is licht van gewicht en kan makkelijk bewerkt worden. Verpakt per 10 stuks.\nSpecifications: Levertijd: 2-7 werkdagen, Kopmaat: 14x14 mm, Dikte: 14 mm, Breedte: 14, Materiaal: Grenen\nPrice: EUR 37.9"
  },
  {
    "id": "f8b1171c62e5",
    "source_url": "https://www.houthandelonline.nl/koplat-mdf-model-b-16x45-10st",
    "name": "Koplat MDF Vochtwerend (model B) 16x45mm met schuine kanten wit voorgelakt per 10 stuks",
    "description": "Deze vochtwerende V313 koplat (model B) met schuine kanten is geschikt voor de afwerking van een vloer of wand van de aansluiting van kozijnstijl en afgewerkte wand. De koplatten zijn wit voorgelakt en zijn voor de sierlijke afwerking rond deuren of ramen. Deze koplat heeft een afmeting van 16x45mm en is wit voorgelakt. De koplatten zijn verpakt per 10 stuks.",
    "brand": "HouthandelOnline",
    "category": "Douglas hout > Toon alles in Douglas hout > Douglas hout palen > Douglas hout balken > Douglas hout latten en regels",
    "price": 108.65,
    "currency": "EUR",
    "price_raw": "€2,23/m1",
    "specs": {
      "raw": {
        "Levertijd": "2-7 werkdagen",
        "Kopmaat": "16x45 mm",
        "Dikte": "16 mm",
        "Breedte": "45",
        "Materiaal": "MDF",
        "Toepassing": "Lijstwerk voor het afwerken van de aansluiting tussen wand en kozijn"
      }
    },
    "images": [
      "https://www.houthandelonline.nl/cdn/resize-extended/el:true/rs:fill/w:1500/h:1068/extend:true/background:255:255:255/path/media/catalog/product/k/o/koplat-mdf-model-b-16x45-10st-v_01_main.jpg"
    ],
    "rating": null,
    "review_count": null,
    "reviews_summary": null,
    "scraped_at": "2026-02-05T16:55:41.416576Z",
    "scrape_success": true,
    "scrape_errors": [],
    "embedding_text": "Product: Koplat MDF Vochtwerend (model B) 16x45mm met schuine kanten wit voorgelakt per 10 stuks\nBrand: HouthandelOnline\nCategory: Douglas hout > Toon alles in Douglas hout > Douglas hout palen > Douglas hout balken > Douglas hout latten en regels\nDescription: Deze vochtwerende V313 koplat (model B) met schuine kanten is geschikt voor de afwerking van een vloer of wand van de aansluiting van kozijnstijl en afgewerkte wand. De koplatten zijn wit voorgelakt en zijn voor de sierlijke afwerking rond deuren of ramen. Deze koplat heeft een afmeting van 16x45mm en is wit voorgelakt. De koplatten zijn verpakt per 10 stuks.\nSpecifications: Levertijd: 2-7 werkdagen, Kopmaat: 16x45 mm, Dikte: 16 mm, Breedte: 45, Materiaal: MDF, Toepassing: Lijstwerk voor het afwerken van de aansluiting tussen wand en kozijn\nPrice: EUR 108.65"
  },
  {
    "id": "7303a448f537",
    "source_url": "https://www.houthandelonline.nl/klassieke-neut-mdf-vochtw",
    "name": "Klassieke neut MDF 30x100mm vochtwerend wit gegrond",
    "description": "Deze MDF V313 klassieke plintneuten wit gegrond zijn aan de kopse kanten dubbelzijdig afgerond en vochtwerend. Door middel van een houten neut kan er een stijlvolle overgang gecreëerd worden tussen een plint en de deurlijst. Aangeraden wordt de neut altijd hoger en dikker dan de plint, en breder en dikker dan de architraaf of deurlijst te nemen. De neut kan zelf naar wens ingekort worden. Per stuk verpakt",
    "brand": "HouthandelOnline",
    "category": "Douglas hout > Toon alles in Douglas hout > Douglas hout palen > Douglas hout balken > Douglas hout latten en regels",
    "price": 17.16,
    "currency": "EUR",
    "price_raw": null,
    "specs": {
      "raw": {
        "Levertijd": "2-7 werkdagen",
        "Kopmaat": "30x100 mm",
        "Dikte": "30 mm",
        "Breedte": "100",
        "Materiaal": "MDF"
      }
    },
    "images": [
      "https://www.houthandelonline.nl/cdn/resize-extended/el:true/rs:fill/w:1500/h:1068/extend:true/background:255:255:255/path/media/catalog/product/k/l/klassieke-neut-mdf-vochtw-v_01_main.jpg"
    ],
    "rating": null,
    "review_count": null,
    "reviews_summary": null,
    "scraped_at": "2026-02-05T16:55:41.416585Z",
    "scrape_success": true,
    "scrape_errors": [],
    "embedding_text": "Product: Klassieke neut MDF 30x100mm vochtwerend wit gegrond\nBrand: HouthandelOnline\nCategory: Douglas hout > Toon alles in Douglas hout > Douglas hout palen > Douglas hout balken > Douglas hout latten en regels\nDescription: Deze MDF V313 klassieke plintneuten wit gegrond zijn aan de kopse kanten dubbelzijdig afgerond en vochtwerend. Door middel van een houten neut kan er een stijlvolle overgang gecreëerd worden tussen een plint en de deurlijst. Aangeraden wordt de neut altijd hoger en dikker dan de plint, en breder en dikker dan de architraaf of deurlijst te nemen. De neut kan zelf naar wens ingekort worden. Per stuk verpakt\nSpecifications: Levertijd: 2-7 werkdagen, Kopmaat: 30x100 mm, Dikte: 30 mm, Breedte: 100, Materiaal: MDF\nPrice: EUR 17.16"
  },
  {
    "id": "e06bb128e39a",
    "source_url": "https://www.houthandelonline.nl/hollat-meranti-14x14-10st",
    "name": "Hollat Meranti 14x14mm geschaafd per 10 stuks",
    "description": "Hardhouten hollatten zijn geschaafd en onbehandeld. Houten afwerklijsten zorgen voor een nette hoekafwerking binnenshuis. Deze hollatten zijn geschikt voor het afwerken van binnenhoeken van wanden, meubels of voor een decoratieve overgang van de muur naar het plafond of kozijn. Deze Hardhouten afwerklijst is zeer sterk en gaat lang mee. Verpakt per 10 stuks.",
    "brand": "HouthandelOnline",
    "category": "Douglas hout > Toon alles in Douglas hout > Douglas hout palen > Douglas hout balken > Douglas hout latten en regels",
    "price": 51.58,
    "currency": "EUR",
    "price_raw": "€1,88/m1",
    "specs": {
      "raw": {
        "Levertijd": "2-7 werkdagen",
        "Kopmaat": "14x14 mm",
        "Dikte": "14 mm",
        "Breedte": "14",
        "Materiaal": "Meranti"
      }
    },
    "images": [
      "https://www.houthandelonline.nl/cdn/resize-extended/el:true/rs:fill/w:1500/h:1068/extend:true/background:255:255:255/path/media/catalog/product/h/o/hollat-meranti-14x14-10st-v_01_main.jpg"
    ],
    "rating": null,
    "review_count": null,
    "reviews_summary": null,
    "scraped_at": "2026-02-05T16:55:41.416594Z",
    "scrape_success": true,
    "scrape_errors": [],
    "embedding_text": "Product: Hollat Meranti 14x14mm geschaafd per 10 stuks\nBrand: HouthandelOnline\nCategory: Douglas hout > Toon alles in Douglas hout > Douglas hout palen > Douglas hout balken > Douglas hout latten en regels\nDescription: Hardhouten hollatten zijn geschaafd en onbehandeld. Houten afwerklijsten zorgen voor een nette hoekafwerking binnenshuis. Deze hollatten zijn geschikt voor het afwerken van binnenhoeken van wanden, meubels of voor een decoratieve overgang van de muur naar het plafond of kozijn. Deze Hardhouten afwerklijst is zeer sterk en gaat lang mee. Verpakt per 10 stuks.\nSpecifications: Levertijd: 2-7 werkdagen, Kopmaat: 14x14 mm, Dikte: 14 mm, Breedte: 14, Materiaal: Meranti\nPrice: EUR 51.58"
  },
  {
    "id": "b7a6303c54e4",
    "source_url": "https://www.houthandelonline.nl/hoeklat-meranti-14x14-10st",
    "name": "Hoeklat Meranti 14x14mm geschaafd per 10 stuks",
    "description": "Hardhouten hoeklatten zijn geschaafd en onbehandeld. Houten hoekprofielen zorgen voor een nette hoekafwerking binnenshuis. Deze hoekprofielen zijn geschikt voor het afwerken van hoeken van wanden, meubels of voor een decoratieve overgang van de ene naar de andere wand. Deze Hardhouten afwerklijst is zeer sterk en gaat lang mee. Verpakt per 10 stuks.",
    "brand": "HouthandelOnline",
    "category": "Douglas hout > Toon alles in Douglas hout > Douglas hout palen > Douglas hout balken > Douglas hout latten en regels",
    "price": 89.52,
    "currency": "EUR",
    "price_raw": "€3,26/m1",
    "specs": {
      "raw": {
        "Levertijd": "2-7 werkdagen",
        "Kopmaat": "14x14 mm",
        "Dikte": "14 mm",
        "Breedte": "14",
        "Materiaal": "Meranti",
        "Toepassing": "Deze Hardhouten buitenhoeklat is binnen toepasbaar voor het afwerken van verschillende hoeken van bijvoorbeeld wanden, meubels, vloeren of andere klussen. Ook voorzien hoekprofielen in het maken van een decoratieve overgang van wanden. Let op: niet buiten toepasbaar"
      }
    },
    "images": [
      "https://www.houthandelonline.nl/cdn/resize-extended/el:true/rs:fill/w:1500/h:1068/extend:true/background:255:255:255/path/media/catalog/product/h/o/hoeklat-meranti-14x14-10st-v_01_main.jpg"
    ],
    "rating": null,
    "review_count": null,
    "reviews_summary": null,
    "scraped_at": "2026-02-05T16:55:41.416603Z",
    "scrape_success": true,
    "scrape_errors": [],
    "embedding_text": "Product: Hoeklat Meranti 14x14mm geschaafd per 10 stuks\nBrand: HouthandelOnline\nCategory: Douglas hout > Toon alles in Douglas hout > Douglas hout palen > Douglas hout balken > Douglas hout latten en regels\nDescription: Hardhouten hoeklatten zijn geschaafd en onbehandeld. Houten hoekprofielen zorgen voor een nette hoekafwerking binnenshuis. Deze hoekprofielen zijn geschikt voor het afwerken van hoeken van wanden, meubels of voor een decoratieve overgang van de ene naar de andere wand. Deze Hardhouten afwerklijst is zeer sterk en gaat lang mee. Verpakt per 10 stuks.\nSpecifications: Levertijd: 2-7 werkdagen, Kopmaat: 14x14 mm, Dikte: 14 mm, Breedte: 14, Materiaal: Meranti, Toepassing: Deze Hardhouten buitenhoeklat is binnen toepasbaar voor het afwerken van verschillende hoeken van bijvoorbeeld wanden, meubels, vloeren of andere klussen. Ook voorzien hoekprofielen in het maken van een decoratieve overgang van wanden. Let op: niet buiten toepasbaar\nPrice: EUR 89.52"
  },
  {
    "id": "6cd7343b26fe",
    "source_url": "https://www.houthandelonline.nl/halfronde-lat-grenen-6x12-10st",
    "name": "Lat halfrond Grenen 6x12mm geschaafd per 10 stuks",
    "description": "Deze Grenen halfronde lijsten zijn geschaafd en onbehandeld. Houten afwerklijsten zorgen voor een nette afwerking binnenshuis. Deze halfronde lijsten zijn geschikt voor het afwerken van tafelranden, meubels of voor een decoratieve wandlijst of plafondlijst. Deze Grenen houten afwerklijst is licht van gewicht en kan makkelijk bewerkt worden. Verpakt per 10 stuks.",
    "brand": "HouthandelOnline",
    "category": "Douglas hout > Toon alles in Douglas hout > Douglas hout palen > Douglas hout balken > Douglas hout latten en regels",
    "price": 36.92,
    "currency": "EUR",
    "price_raw": "€1,37/m1",
    "specs": {
      "raw": {
        "Levertijd": "2-7 werkdagen",
        "Kopmaat": "6x12 mm",
        "Dikte": "6 mm",
        "Breedte": "12",
        "Materiaal": "Grenen",
        "Toepassing": "Deze Grenen houten halfronde sierlijst is binnen toepasbaar voor het afwerken van verschillende meubelstukken, tafelranden of als decoratieve wandlijst of plafondlijst. Let op: niet buiten toepasbaar"
      }
    },
    "images": [
      "https://www.houthandelonline.nl/cdn/resize-extended/el:true/rs:fill/w:1500/h:1068/extend:true/background:255:255:255/path/media/catalog/product/h/a/halfronde-lat-grenen-6x12-10st-v_01_main.jpg"
    ],
    "rating": null,
    "review_count": null,
    "reviews_summary": null,
    "scraped_at": "2026-02-05T16:55:41.416609Z",
    "scrape_success": true,
    "scrape_errors": [],
    "embedding_text": "Product: Lat halfrond Grenen 6x12mm geschaafd per 10 stuks\nBrand: HouthandelOnline\nCategory: Douglas hout > Toon alles in Douglas hout > Douglas hout palen > Douglas hout balken > Douglas hout latten en regels\nDescription: Deze Grenen halfronde lijsten zijn geschaafd en onbehandeld. Houten afwerklijsten zorgen voor een nette afwerking binnenshuis. Deze halfronde lijsten zijn geschikt voor het afwerken van tafelranden, meubels of voor een decoratieve wandlijst of plafondlijst. Deze Grenen houten afwerklijst is licht van gewicht en kan makkelijk bewerkt worden. Verpakt per 10 stuks.\nSpecifications: Levertijd: 2-7 werkdagen, Kopmaat: 6x12 mm, Dikte: 6 mm, Breedte: 12, Materiaal: Grenen, Toepassing: Deze Grenen houten halfronde sierlijst is binnen toepasbaar voor het afwerken van verschillende meubelstukken, tafelranden of als decoratieve wandlijst of plafondlijst. Let op: niet buiten toepasbaar\nPrice: EUR 36.92"
  },
  {
    "id": "268fe4521ca4",
    "source_url": "https://www.houthandelonline.nl/halfronde-lat-grenen-12x24-10st",
    "name": "Lat halfrond Grenen 12x24mm geschaafd per 10 stuks",
    "description": "Deze Grenen halfronde lijsten zijn geschaafd en onbehandeld. Houten afwerklijsten zorgen voor een nette afwerking binnenshuis. Deze halfronde lijsten zijn geschikt voor het afwerken van tafelranden, meubels of voor een decoratieve wandlijst of plafondlijst. Deze Grenen houten afwerklijst is licht van gewicht en kan makkelijk bewerkt worden. Verpakt per 10 stuks.",
    "brand": "HouthandelOnline",
    "category": "Douglas hout > Toon alles in Douglas hout > Douglas hout palen > Douglas hout balken > Douglas hout latten en regels",
    "price": 78.41,
    "currency": "EUR",
    "price_raw": "€2,90/m1",
    "specs": {
      "raw": {
        "Levertijd": "2-7 werkdagen",
        "Kopmaat": "12x24 mm",
        "Dikte": "12 mm",
        "Breedte": "24",
        "Materiaal": "Grenen",
        "Toepassing": "Deze Grenen houten halfronde sierlijst is binnen toepasbaar voor het afwerken van verschillende meubelstukken, tafelranden of als decoratieve wandlijst of plafondlijst. Let op: niet buiten toepasbaar"
      }
    },
    "images": [
      "https://www.houthandelonline.nl/cdn/resize-extended/el:true/rs:fill/w:1500/h:1068/extend:true/background:255:255:255/path/media/catalog/product/h/a/halfronde-lat-grenen-12x24-10st-v_01_main.jpg"
    ],
    "rating": null,
    "review_count": null,
    "reviews_summary": null,
    "scraped_at": "2026-02-05T16:55:41.416617Z",
    "scrape_success": true,
    "scrape_errors": [],
    "embedding_text": "Product: Lat halfrond Grenen 12x24mm geschaafd per 10 stuks\nBrand: HouthandelOnline\nCategory: Douglas hout > Toon alles in Douglas hout > Douglas hout palen > Douglas hout balken > Douglas hout latten en regels\nDescription: Deze Grenen halfronde lijsten zijn geschaafd en onbehandeld. Houten afwerklijsten zorgen voor een nette afwerking binnenshuis. Deze halfronde lijsten zijn geschikt voor het afwerken van tafelranden, meubels of voor een decoratieve wandlijst of plafondlijst. Deze Grenen houten afwerklijst is licht van gewicht en kan makkelijk bewerkt worden. Verpakt per 10 stuks.\nSpecifications: Levertijd: 2-7 werkdagen, Kopmaat: 12x24 mm, Dikte: 12 mm, Breedte: 24, Materiaal: Grenen, Toepassing: Deze Grenen houten halfronde sierlijst is binnen toepasbaar voor het afwerken van verschillende meubelstukken, tafelranden of als decoratieve wandlijst of plafondlijst. Let op: niet buiten toepasbaar\nPrice: EUR 78.41"
  },
  {
    "id": "aebb033a31d2",
    "source_url": "https://www.houthandelonline.nl/neuslat-tricoya-mdf-k70-5st",
    "name": "Neuslat Tricoya MDF K70 18x84mm (sponning 70mm) geschaafd wit gegrond per 5 stuks",
    "description": "Tricoya MDF neuslat, een glaslat met 70mm sponning, is geschaafd en rondom 60mu gegrond. Deze raamafwerklijst is binnen en buiten toepasbaar als geventileerde neuslat voor het afvoeren van vuil en vocht en het beschermen van het kozijnhout. De neuslat is 18x84mm. Verpakt per 5 stuks.",
    "brand": "HouthandelOnline",
    "category": "Douglas hout > Toon alles in Douglas hout > Douglas hout palen > Douglas hout balken > Douglas hout latten en regels",
    "price": 582.51,
    "currency": "EUR",
    "price_raw": "€23,87/m1",
    "specs": {
      "raw": {
        "Levertijd": "2-7 werkdagen",
        "Kopmaat": "18x84 mm",
        "Dikte": "18 mm",
        "Breedte": "84",
        "Materiaal": "MDF Tricoya"
      }
    },
    "images": [
      "https://www.houthandelonline.nl/cdn/resize-extended/el:true/rs:fill/w:1500/h:1068/extend:true/background:255:255:255/path/media/catalog/product/n/e/neuslat-tricoya-mdf-k70-5st-v_01_main.jpg",
      "https://www.houthandelonline.nl/cdn/resize-extended/el:true/rs:fill/w:1500/h:1068/extend:true/background:255:255:255/path/media/catalog/product/n/e/neuslat-tricoya-mdf-k70-5st-v_02_view.jpg"
    ],
    "rating": null,
    "review_count": null,
    "reviews_summary": null,
    "scraped_at": "2026-02-05T16:55:41.416625Z",
    "scrape_success": true,
    "scrape_errors": [],
    "embedding_text": "Product: Neuslat Tricoya MDF K70 18x84mm (sponning 70mm) geschaafd wit gegrond per 5 stuks\nBrand: HouthandelOnline\nCategory: Douglas hout > Toon alles in Douglas hout > Douglas hout palen > Douglas hout balken > Douglas hout latten en regels\nDescription: Tricoya MDF neuslat, een glaslat met 70mm sponning, is geschaafd en rondom 60mu gegrond. Deze raamafwerklijst is binnen en buiten toepasbaar als geventileerde neuslat voor het afvoeren van vuil en vocht en het beschermen van het kozijnhout. De neuslat is 18x84mm. Verpakt per 5 stuks.\nSpecifications: Levertijd: 2-7 werkdagen, Kopmaat: 18x84 mm, Dikte: 18 mm, Breedte: 84, Materiaal: MDF Tricoya\nPrice: EUR 582.51"
  },
  {
    "id": "051e3660dc5f",
    "source_url": "https://www.houthandelonline.nl/neuslat-tricoya-mdf-k45-5st",
    "name": "Neuslat Tricoya MDF K45 18x59mm (sponning 45mm) geschaafd wit gegrond per 5 stuks",
    "description": "Tricoya MDF neuslat, een glaslat met 45mm sponning, is geschaafd en rondom 60mu gegrond. Deze raamafwerklijst is binnen en buiten toepasbaar als geventileerde neuslat voor het afvoeren van vuil en vocht en het beschermen van het kozijnhout. De neuslat is 18x59mm. Verpakt per 5 stuks.",
    "brand": "HouthandelOnline",
    "category": "Douglas hout > Toon alles in Douglas hout > Douglas hout palen > Douglas hout balken > Douglas hout latten en regels",
    "price": 435.77,
    "currency": "EUR",
    "price_raw": "€17,86/m1",
    "specs": {
      "raw": {
        "Levertijd": "2-7 werkdagen",
        "Kopmaat": "18x59 mm",
        "Dikte": "18 mm",
        "Breedte": "59",
        "Materiaal": "MDF Tricoya"
      }
    },
    "images": [
      "https://www.houthandelonline.nl/cdn/resize-extended/el:true/rs:fill/w:1500/h:1068/extend:true/background:255:255:255/path/media/catalog/product/n/e/neuslat-tricoya-mdf-k45-5st-v_01_main.jpg",
      "https://www.houthandelonline.nl/cdn/resize-extended/el:true/rs:fill/w:1500/h:1068/extend:true/background:255:255:255/path/media/catalog/product/n/e/neuslat-tricoya-mdf-k45-5st-v_02_view.jpg"
    ],
    "rating": null,
    "review_count": null,
    "reviews_summary": null,
    "scraped_at": "2026-02-05T16:55:41.416632Z",
    "scrape_success": true,
    "scrape_errors": [],
    "embedding_text": "Product: Neuslat Tricoya MDF K45 18x59mm (sponning 45mm) geschaafd wit gegrond per 5 stuks\nBrand: HouthandelOnline\nCategory: Douglas hout > Toon alles in Douglas hout > Douglas hout palen > Douglas hout balken > Douglas hout latten en regels\nDescription: Tricoya MDF neuslat, een glaslat met 45mm sponning, is geschaafd en rondom 60mu gegrond. Deze raamafwerklijst is binnen en buiten toepasbaar als geventileerde neuslat voor het afvoeren van vuil en vocht en het beschermen van het kozijnhout. De neuslat is 18x59mm. Verpakt per 5 stuks.\nSpecifications: Levertijd: 2-7 werkdagen, Kopmaat: 18x59 mm, Dikte: 18 mm, Breedte: 59, Materiaal: MDF Tricoya\nPrice: EUR 435.77"
  },
  {
    "id": "39a7330b5bda",
    "source_url": "https://www.houthandelonline.nl/neuslat-meranti-mdf-k45-5st",
    "name": "Neuslat Meranti K45 18x59mm (sponning 45mm) geschaafd wit gegrond per 5 stuks",
    "description": "Meranti houten neuslat, een glaslat met 45mm sponning, is geschaafd en rondom 80mu gegrond. Deze raamafwerklijst is buiten toepasbaar als geventileerde neuslat voor het afvoeren van vocht en het beschermen van het kozijnhout. Verpakt per 5 stuks.",
    "brand": "HouthandelOnline",
    "category": "Douglas hout > Toon alles in Douglas hout > Douglas hout palen > Douglas hout balken > Douglas hout latten en regels",
    "price": 264.74,
    "currency": "EUR",
    "price_raw": "€10,81/m1",
    "specs": {
      "raw": {
        "Levertijd": "2-7 werkdagen",
        "Kopmaat": "18x59 mm",
        "Dikte": "18 mm",
        "Breedte": "59",
        "Materiaal": "Meranti"
      }
    },
    "images": [
      "https://www.houthandelonline.nl/cdn/resize-extended/el:true/rs:fill/w:1500/h:1068/extend:true/background:255:255:255/path/media/catalog/product/n/e/neuslat-meranti-mdf-k45-5st-v_01_main.jpg",
      "https://www.houthandelonline.nl/cdn/resize-extended/el:true/rs:fill/w:1500/h:1068/extend:true/background:255:255:255/path/media/catalog/product/n/e/neuslat-meranti-mdf-k45-5st-v_02_view.jpg"
    ],
    "rating": null,
    "review_count": null,
    "reviews_summary": null,
    "scraped_at": "2026-02-05T16:55:41.416641Z",
    "scrape_success": true,
    "scrape_errors": [],
    "embedding_text": "Product: Neuslat Meranti K45 18x59mm (sponning 45mm) geschaafd wit gegrond per 5 stuks\nBrand: HouthandelOnline\nCategory: Douglas hout > Toon alles in Douglas hout > Douglas hout palen > Douglas hout balken > Douglas hout latten en regels\nDescription: Meranti houten neuslat, een glaslat met 45mm sponning, is geschaafd en rondom 80mu gegrond. Deze raamafwerklijst is buiten toepasbaar als geventileerde neuslat voor het afvoeren van vocht en het beschermen van het kozijnhout. Verpakt per 5 stuks.\nSpecifications: Levertijd: 2-7 werkdagen, Kopmaat: 18x59 mm, Dikte: 18 mm, Breedte: 59, Materiaal: Meranti\nPrice: EUR 264.74"
  },
  {
    "id": "b04e4dc80621",
    "source_url": "https://www.houthandelonline.nl/moderne-neut-mdf-vochtw-18x75-gegr-50cm",
    "name": "Moderne neut MDF 18x75mm vochtwerend wit gegrond",
    "description": "Deze MDF V313 klassieke plintneuten wit gegrond zijn aan de kopse kanten dubbelzijdig afgerond en vochtwerend. Door middel van een houten neut kan er een stijlvolle overgang gecreëerd worden tussen een plint en de deurlijst. Aangeraden wordt de neut altijd hoger en dikker dan de plint, en breder en dikker dan de architraaf of deurlijst te nemen. De neut kan zelf naar wens ingekort worden. Per stuk verpakt",
    "brand": "HouthandelOnline",
    "category": "Douglas hout > Toon alles in Douglas hout > Douglas hout palen > Douglas hout balken > Douglas hout latten en regels",
    "price": 16.37,
    "currency": "EUR",
    "price_raw": null,
    "specs": {
      "raw": {
        "Levertijd": "2-7 werkdagen",
        "Kopmaat": "18x75 mm",
        "Dikte": "18 mm",
        "Breedte": "75",
        "Materiaal": "MDF"
      }
    },
    "images": [
      "https://www.houthandelonline.nl/cdn/resize-extended/el:true/rs:fill/w:1500/h:1068/extend:true/background:255:255:255/path/media/catalog/product/m/o/moderne-neut-mdf-vochtw-18x75-gegr-50cm-v_01_main.jpg"
    ],
    "rating": null,
    "review_count": null,
    "reviews_summary": null,
    "scraped_at": "2026-02-05T16:55:41.416650Z",
    "scrape_success": true,
    "scrape_errors": [],
    "embedding_text": "Product: Moderne neut MDF 18x75mm vochtwerend wit gegrond\nBrand: HouthandelOnline\nCategory: Douglas hout > Toon alles in Douglas hout > Douglas hout palen > Douglas hout balken > Douglas hout latten en regels\nDescription: Deze MDF V313 klassieke plintneuten wit gegrond zijn aan de kopse kanten dubbelzijdig afgerond en vochtwerend. Door middel van een houten neut kan er een stijlvolle overgang gecreëerd worden tussen een plint en de deurlijst. Aangeraden wordt de neut altijd hoger en dikker dan de plint, en breder en dikker dan de architraaf of deurlijst te nemen. De neut kan zelf naar wens ingekort worden. Per stuk verpakt\nSpecifications: Levertijd: 2-7 werkdagen, Kopmaat: 18x75 mm, Dikte: 18 mm, Breedte: 75, Materiaal: MDF\nPrice: EUR 16.37"
  },
  {
    "id": "545b773db23d",
    "source_url": "https://www.houthandelonline.nl/kwartrond-latgrenen18x18mm10st",
    "name": "Lat kwartrond Grenen 18x18mm geschaafd per 10 stuks",
    "description": "Grenen kwartronde latten zijn geschaafd en onbehandeld. Houten afwerklijsten zorgen voor een nette hoekafwerking binnenshuis. Deze kwartronde latten zijn geschikt voor het afwerken van binnenhoeken van wanden, meubels of voor een decoratieve overgang van de muur naar het plafond of kozijn. Deze Grenen houten afwerklijst is licht van gewicht en kan makkelijk bewerkt worden. Verpakt per 10 stuks.",
    "brand": "HouthandelOnline",
    "category": "Douglas hout > Toon alles in Douglas hout > Douglas hout palen > Douglas hout balken > Douglas hout latten en regels",
    "price": 40.84,
    "currency": "EUR",
    "price_raw": "€1,51/m1",
    "specs": {
      "raw": {
        "Levertijd": "2-7 werkdagen",
        "Kopmaat": "18x18 mm",
        "Dikte": "18 mm",
        "Breedte": "18",
        "Materiaal": "Grenen"
      }
    },
    "images": [
      "https://www.houthandelonline.nl/cdn/resize-extended/el:true/rs:fill/w:1500/h:1068/extend:true/background:255:255:255/path/media/catalog/product/k/w/kwartrond-latgrenen18x18mm10st-v_01_main.jpg"
    ],
    "rating": null,
    "review_count": null,
    "reviews_summary": null,
    "scraped_at": "2026-02-05T16:55:41.416659Z",
    "scrape_success": true,
    "scrape_errors": [],
    "embedding_text": "Product: Lat kwartrond Grenen 18x18mm geschaafd per 10 stuks\nBrand: HouthandelOnline\nCategory: Douglas hout > Toon alles in Douglas hout > Douglas hout palen > Douglas hout balken > Douglas hout latten en regels\nDescription: Grenen kwartronde latten zijn geschaafd en onbehandeld. Houten afwerklijsten zorgen voor een nette hoekafwerking binnenshuis. Deze kwartronde latten zijn geschikt voor het afwerken van binnenhoeken van wanden, meubels of voor een decoratieve overgang van de muur naar het plafond of kozijn. Deze Grenen houten afwerklijst is licht van gewicht en kan makkelijk bewerkt worden. Verpakt per 10 stuks.\nSpecifications: Levertijd: 2-7 werkdagen, Kopmaat: 18x18 mm, Dikte: 18 mm, Breedte: 18, Materiaal: Grenen\nPrice: EUR 40.84"
  },
  {
    "id": "4fab4d06aa22",
    "source_url": "https://www.houthandelonline.nl/hollat-mdf-18x18-gegr-10st",
    "name": "Hollat MDF 18x18mm geschaafd per 10 stuks",
    "description": "MDF hollatten zijn geschaafd en wit voorgelakt. Houten afwerklijsten zorgen voor een nette hoekafwerking binnenshuis. Voor het afwerken van binnenhoeken van wanden, meubels of voor een decoratieve overgang van de muur naar het plafond of kozijn. Verpakt per 10 stuks.",
    "brand": "HouthandelOnline",
    "category": "Douglas hout > Toon alles in Douglas hout > Douglas hout palen > Douglas hout balken > Douglas hout latten en regels",
    "price": 83.85,
    "currency": "EUR",
    "price_raw": "€1,72/m1",
    "specs": {
      "raw": {
        "Levertijd": "2-7 werkdagen",
        "Kopmaat": "18x18 mm",
        "Dikte": "18 mm",
        "Breedte": "18",
        "Materiaal": "MDF"
      }
    },
    "images": [
      "https://www.houthandelonline.nl/cdn/resize-extended/el:true/rs:fill/w:1500/h:1068/extend:true/background:255:255:255/path/media/catalog/product/h/o/hollat-mdf-18x18-gegr-10st-v_01_main.jpg",
      "https://www.houthandelonline.nl/cdn/resize-extended/el:true/rs:fill/w:1500/h:1068/extend:true/background:255:255:255/path/media/catalog/product/h/o/hollat-mdf-18x18-gegr-10st-v_02_view.jpg"
    ],
    "rating": null,
    "review_count": null,
    "reviews_summary": null,
    "scraped_at": "2026-02-05T16:55:41.416668Z",
    "scrape_success": true,
    "scrape_errors": [],
    "embedding_text": "Product: Hollat MDF 18x18mm geschaafd per 10 stuks\nBrand: HouthandelOnline\nCategory: Douglas hout > Toon alles in Douglas hout > Douglas hout palen > Douglas hout balken > Douglas hout latten en regels\nDescription: MDF hollatten zijn geschaafd en wit voorgelakt. Houten afwerklijsten zorgen voor een nette hoekafwerking binnenshuis. Voor het afwerken van binnenhoeken van wanden, meubels of voor een decoratieve overgang van de muur naar het plafond of kozijn. Verpakt per 10 stuks.\nSpecifications: Levertijd: 2-7 werkdagen, Kopmaat: 18x18 mm, Dikte: 18 mm, Breedte: 18, Materiaal: MDF\nPrice: EUR 83.85"
  },
  {
    "id": "d0d0d53da4c0",
    "source_url": "https://www.houthandelonline.nl/neuslijst-meranti-28x120-gegr",
    "name": "Neuslijst Meranti 28x120mm geschaafd wit gegrond",
    "description": "Deze Meranti houten neuslijst is rondom 80mu wit gegrond en heeft afgeronde geschaafde hoeken. Een neuslijst dient ter afwerking en verfraaiing van goten, gevels of schouwen. Verpakt per stuk.",
    "brand": "HouthandelOnline",
    "category": "Douglas hout > Toon alles in Douglas hout > Douglas hout palen > Douglas hout balken > Douglas hout latten en regels",
    "price": 136.49,
    "currency": "EUR",
    "price_raw": "€27,85/m1",
    "specs": {
      "raw": {
        "Kopmaat": "28x120 mm",
        "Dikte": "28 mm",
        "Breedte": "120",
        "Materiaal": "Meranti",
        "Toepassing": "Deze witte neuslijst is geschaafd en rondom 80mu wit gegrond. Deze neuslijst zorgt voor een mooie klassieke uitstraling van de buitengevel als goot"
      }
    },
    "images": [
      "https://www.houthandelonline.nl/cdn/resize-extended/el:true/rs:fill/w:1500/h:1068/extend:true/background:255:255:255/path/media/catalog/product/n/e/neuslijst-meranti-28x120-gegr-v_01_main.jpg"
    ],
    "rating": null,
    "review_count": null,
    "reviews_summary": null,
    "scraped_at": "2026-02-05T16:55:41.416676Z",
    "scrape_success": true,
    "scrape_errors": [],
    "embedding_text": "Product: Neuslijst Meranti 28x120mm geschaafd wit gegrond\nBrand: HouthandelOnline\nCategory: Douglas hout > Toon alles in Douglas hout > Douglas hout palen > Douglas hout balken > Douglas hout latten en regels\nDescription: Deze Meranti houten neuslijst is rondom 80mu wit gegrond en heeft afgeronde geschaafde hoeken. Een neuslijst dient ter afwerking en verfraaiing van goten, gevels of schouwen. Verpakt per stuk.\nSpecifications: Kopmaat: 28x120 mm, Dikte: 28 mm, Breedte: 120, Materiaal: Meranti, Toepassing: Deze witte neuslijst is geschaafd en rondom 80mu wit gegrond. Deze neuslijst zorgt voor een mooie klassieke uitstraling van de buitengevel als goot\nPrice: EUR 136.49"
  },
  {
    "id": "789849fc4a57",
    "source_url": "https://www.houthandelonline.nl/bollat-grenen-18x18",
    "name": "Bollat Grenen 18x18mm geschaafd per 10 stuks",
    "description": "Hardhouten bollijsten zijn geschaafd en onbehandeld. Houten afwerklijsten zorgen voor een nette hoekafwerking binnenshuis. Deze bollijsten zijn geschikt voor het afwerken van binnenhoeken van wanden, meubels of voor een decoratieve overgang van de muur naar het plafond of kozijn. Deze Meranti houten afwerklijst is licht van gewicht en kan makkelijk bewerkt worden. Verpakt per 10 stuks.",
    "brand": "HouthandelOnline",
    "category": "Douglas hout > Toon alles in Douglas hout > Douglas hout palen > Douglas hout balken > Douglas hout latten en regels",
    "price": 42.8,
    "currency": "EUR",
    "price_raw": "€1,59/m1",
    "specs": {
      "raw": {
        "Levertijd": "2-7 werkdagen",
        "Kopmaat": "18x18 mm",
        "Dikte": "18 mm",
        "Breedte": "18",
        "Materiaal": "Grenen"
      }
    },
    "images": [
      "https://www.houthandelonline.nl/cdn/resize-extended/el:true/rs:fill/w:1500/h:1068/extend:true/background:255:255:255/path/media/catalog/product/b/o/bollat-grenen-18x18-v_01_main.jpg"
    ],
    "rating": null,
    "review_count": null,
    "reviews_summary": null,
    "scraped_at": "2026-02-05T16:55:41.416685Z",
    "scrape_success": true,
    "scrape_errors": [],
    "embedding_text": "Product: Bollat Grenen 18x18mm geschaafd per 10 stuks\nBrand: HouthandelOnline\nCategory: Douglas hout > Toon alles in Douglas hout > Douglas hout palen > Douglas hout balken > Douglas hout latten en regels\nDescription: Hardhouten bollijsten zijn geschaafd en onbehandeld. Houten afwerklijsten zorgen voor een nette hoekafwerking binnenshuis. Deze bollijsten zijn geschikt voor het afwerken van binnenhoeken van wanden, meubels of voor een decoratieve overgang van de muur naar het plafond of kozijn. Deze Meranti houten afwerklijst is licht van gewicht en kan makkelijk bewerkt worden. Verpakt per 10 stuks.\nSpecifications: Levertijd: 2-7 werkdagen, Kopmaat: 18x18 mm, Dikte: 18 mm, Breedte: 18, Materiaal: Grenen\nPrice: EUR 42.8"
  },
  {
    "id": "72631ecab2c1",
    "source_url": "https://www.houthandelonline.nl/plint-grenen-9x45-10st",
    "name": "Plint Grenen 9x45mm wit gegrond per 10 stuks",
    "description": "Vloer-plafondplint ter afwerking van de aansluiting van de vloer en wand of plafond en wand",
    "brand": "HouthandelOnline",
    "category": "Douglas hout > Toon alles in Douglas hout > Douglas hout palen > Douglas hout balken > Douglas hout latten en regels",
    "price": 87.16,
    "currency": "EUR",
    "price_raw": "€1,78/m1",
    "specs": {
      "raw": {
        "Levertijd": "2-7 werkdagen",
        "Kopmaat": "9x45 mm",
        "Dikte": "9 mm",
        "Breedte": "45",
        "Materiaal": "Grenen",
        "Toepassing": "Lijstwerk voor het afwerken van de aansluiting tussen vloer en wand of de aansluiting van wand en plafond"
      }
    },
    "images": [
      "https://www.houthandelonline.nl/cdn/resize-extended/el:true/rs:fill/w:1500/h:1068/extend:true/background:255:255:255/path/media/catalog/product/p/l/plint-grenen-9x45-10st-v_01_main.jpg",
      "https://www.houthandelonline.nl/cdn/resize-extended/el:true/rs:fill/w:1500/h:1068/extend:true/background:255:255:255/path/media/catalog/product/p/l/plint-grenen-9x45-10st-v_02_view.jpg",
      "https://www.houthandelonline.nl/cdn/resize-extended/el:true/rs:fill/w:1500/h:1068/extend:true/background:255:255:255/path/media/catalog/product/p/l/plint-grenen-9x45-10st-v_03_view.jpg",
      "https://www.houthandelonline.nl/cdn/resize-extended/el:true/rs:fill/w:1500/h:1068/extend:true/background:255:255:255/path/media/catalog/product/p/l/plint-grenen-9x45-10st-v_04_view.jpg"
    ],
    "rating": null,
    "review_count": null,
    "reviews_summary": null,
    "scraped_at": "2026-02-05T16:55:41.416694Z",
    "scrape_success": true,
    "scrape_errors": [],
    "embedding_text": "Product: Plint Grenen 9x45mm wit gegrond per 10 stuks\nBrand: HouthandelOnline\nCategory: Douglas hout > Toon alles in Douglas hout > Douglas hout palen > Douglas hout balken > Douglas hout latten en regels\nDescription: Vloer-plafondplint ter afwerking van de aansluiting van de vloer en wand of plafond en wand\nSpecifications: Levertijd: 2-7 werkdagen, Kopmaat: 9x45 mm, Dikte: 9 mm, Breedte: 45, Materiaal: Grenen, Toepassing: Lijstwerk voor het afwerken van de aansluiting tussen vloer en wand of de aansluiting van wand en plafond\nPrice: EUR 87.16"
  },
  {
    "id": "62cd2ffd80ad",
    "source_url": "https://www.houthandelonline.nl/plint-grenen-12x55-10st",
    "name": "Plint Grenen 12x55mm wit gegrond per 10 stuks",
    "description": "Vloer-plafondplint ter afwerking van de aansluiting van de vloer en wand of plafond en wand",
    "brand": "HouthandelOnline",
    "category": "Douglas hout > Toon alles in Douglas hout > Douglas hout palen > Douglas hout balken > Douglas hout latten en regels",
    "price": 146.45,
    "currency": "EUR",
    "price_raw": "€2,99/m1",
    "specs": {
      "raw": {
        "Levertijd": "2-7 werkdagen",
        "Kopmaat": "12x55 mm",
        "Dikte": "12 mm",
        "Breedte": "55",
        "Materiaal": "Grenen",
        "Toepassing": "Lijstwerk voor het afwerken van de aansluiting tussen vloer en wand"
      }
    },
    "images": [
      "https://www.houthandelonline.nl/cdn/resize-extended/el:true/rs:fill/w:1500/h:1068/extend:true/background:255:255:255/path/media/catalog/product/p/l/plint-grenen-12x55-10st-v_01_main.jpg",
      "https://www.houthandelonline.nl/cdn/resize-extended/el:true/rs:fill/w:1500/h:1068/extend:true/background:255:255:255/path/media/catalog/product/p/l/plint-grenen-12x55-10st-v_02_view.jpg",
      "https://www.houthandelonline.nl/cdn/resize-extended/el:true/rs:fill/w:1500/h:1068/extend:true/background:255:255:255/path/media/catalog/product/p/l/plint-grenen-12x55-10st-v_03_view.jpg",
      "https://www.houthandelonline.nl/cdn/resize-extended/el:true/rs:fill/w:1500/h:1068/extend:true/background:255:255:255/path/media/catalog/product/p/l/plint-grenen-12x55-10st-v_04_view.jpg"
    ],
    "rating": null,
    "review_count": null,
    "reviews_summary": null,
    "scraped_at": "2026-02-05T16:55:41.416703Z",
    "scrape_success": true,
    "scrape_errors": [],
    "embedding_text": "Product: Plint Grenen 12x55mm wit gegrond per 10 stuks\nBrand: HouthandelOnline\nCategory: Douglas hout > Toon alles in Douglas hout > Douglas hout palen > Douglas hout balken > Douglas hout latten en regels\nDescription: Vloer-plafondplint ter afwerking van de aansluiting van de vloer en wand of plafond en wand\nSpecifications: Levertijd: 2-7 werkdagen, Kopmaat: 12x55 mm, Dikte: 12 mm, Breedte: 55, Materiaal: Grenen, Toepassing: Lijstwerk voor het afwerken van de aansluiting tussen vloer en wand\nPrice: EUR 146.45"
  },
  {
    "id": "1568dfac2cc5",
    "source_url": "https://www.houthandelonline.nl/hollat-meranti-28x28-10st",
    "name": "Hollat Meranti 28x28mm geschaafd per 10 stuks",
    "description": "Hardhouten hollatten zijn geschaafd en onbehandeld. Houten afwerklijsten zorgen voor een nette hoekafwerking binnenshuis. Deze hollatten zijn geschikt voor het afwerken van binnenhoeken van wanden, meubels of voor een decoratieve overgang van de muur naar het plafond of kozijn. Deze Hardhouten afwerklijst is zeer sterk en gaat lang mee. Verpakt per 10 stuks.",
    "brand": "HouthandelOnline",
    "category": "Douglas hout > Toon alles in Douglas hout > Douglas hout palen > Douglas hout balken > Douglas hout latten en regels",
    "price": 150.74,
    "currency": "EUR",
    "price_raw": "€5,48/m1",
    "specs": {
      "raw": {
        "Levertijd": "2-7 werkdagen",
        "Kopmaat": "28x28 mm",
        "Dikte": "28 mm",
        "Breedte": "28",
        "Materiaal": "Meranti"
      }
    },
    "images": [
      "https://www.houthandelonline.nl/cdn/resize-extended/el:true/rs:fill/w:1500/h:1068/extend:true/background:255:255:255/path/media/catalog/product/h/o/hollat-meranti-28x28-10st-v_01_main.jpg"
    ],
    "rating": null,
    "review_count": null,
    "reviews_summary": null,
    "scraped_at": "2026-02-05T16:55:41.416732Z",
    "scrape_success": true,
    "scrape_errors": [],
    "embedding_text": "Product: Hollat Meranti 28x28mm geschaafd per 10 stuks\nBrand: HouthandelOnline\nCategory: Douglas hout > Toon alles in Douglas hout > Douglas hout palen > Douglas hout balken > Douglas hout latten en regels\nDescription: Hardhouten hollatten zijn geschaafd en onbehandeld. Houten afwerklijsten zorgen voor een nette hoekafwerking binnenshuis. Deze hollatten zijn geschikt voor het afwerken van binnenhoeken van wanden, meubels of voor een decoratieve overgang van de muur naar het plafond of kozijn. Deze Hardhouten afwerklijst is zeer sterk en gaat lang mee. Verpakt per 10 stuks.\nSpecifications: Levertijd: 2-7 werkdagen, Kopmaat: 28x28 mm, Dikte: 28 mm, Breedte: 28, Materiaal: Meranti\nPrice: EUR 150.74"
  },
  {
    "id": "bb577e2d8450",
    "source_url": "https://www.houthandelonline.nl/hollat-meranti-18x28-10st",
    "name": "Hollat Meranti 18x28mm geschaafd per 10 stuks",
    "description": "Hardhouten hollatten zijn geschaafd en onbehandeld. Houten afwerklijsten zorgen voor een nette hoekafwerking binnenshuis. Deze hollatten zijn geschikt voor het afwerken van binnenhoeken van wanden, meubels of voor een decoratieve overgang van de muur naar het plafond of kozijn. Deze Hardhouten afwerklijst is zeer sterk en gaat lang mee. Verpakt per 10 stuks.",
    "brand": "HouthandelOnline",
    "category": "Douglas hout > Toon alles in Douglas hout > Douglas hout palen > Douglas hout balken > Douglas hout latten en regels",
    "price": 136.77,
    "currency": "EUR",
    "price_raw": "€4,97/m1",
    "specs": {
      "raw": {
        "Levertijd": "2-7 werkdagen",
        "Kopmaat": "18x28 mm",
        "Dikte": "18 mm",
        "Breedte": "18",
        "Materiaal": "Meranti"
      }
    },
    "images": [
      "https://www.houthandelonline.nl/cdn/resize-extended/el:true/rs:fill/w:1500/h:1068/extend:true/background:255:255:255/path/media/catalog/product/h/o/hollat-meranti-18x28-10st-v_01_main.jpg"
    ],
    "rating": null,
    "review_count": null,
    "reviews_summary": null,
    "scraped_at": "2026-02-05T16:55:41.416743Z",
    "scrape_success": true,
    "scrape_errors": [],
    "embedding_text": "Product: Hollat Meranti 18x28mm geschaafd per 10 stuks\nBrand: HouthandelOnline\nCategory: Douglas hout > Toon alles in Douglas hout > Douglas hout palen > Douglas hout balken > Douglas hout latten en regels\nDescription: Hardhouten hollatten zijn geschaafd en onbehandeld. Houten afwerklijsten zorgen voor een nette hoekafwerking binnenshuis. Deze hollatten zijn geschikt voor het afwerken van binnenhoeken van wanden, meubels of voor een decoratieve overgang van de muur naar het plafond of kozijn. Deze Hardhouten afwerklijst is zeer sterk en gaat lang mee. Verpakt per 10 stuks.\nSpecifications: Levertijd: 2-7 werkdagen, Kopmaat: 18x28 mm, Dikte: 18 mm, Breedte: 18, Materiaal: Meranti\nPrice: EUR 136.77"
  },
  {
    "id": "8239f1f37438",
    "source_url": "https://www.houthandelonline.nl/hoeklat-grenen-40x40-10st",
    "name": "Hoeklat Grenen 40x40mm geschaafd per 10 stuks",
    "description": "Grenen hoeklatten zijn geschaafd en onbehandeld. Houten hoekprofielen zorgen voor een nette hoekafwerking binnenshuis. Deze hoeklatten zijn geschikt voor het afwerken van hoeken van wanden, meubels of voor een decoratieve overgang van de ene naar de andere wand. Deze Grenen houten afwerklijst is licht van gewicht en kan makkelijk bewerkt worden. Verpakt per 10 stuks.",
    "brand": "HouthandelOnline",
    "category": "Douglas hout > Toon alles in Douglas hout > Douglas hout palen > Douglas hout balken > Douglas hout latten en regels",
    "price": 210.39,
    "currency": "EUR",
    "price_raw": "€7,79/m1",
    "specs": {
      "raw": {
        "Levertijd": "2-7 werkdagen",
        "Kopmaat": "40x40 mm",
        "Dikte": "40 mm",
        "Breedte": "40",
        "Materiaal": "Grenen",
        "Toepassing": "Deze Grenen houten hoeklat is binnen toepasbaar voor het afwerken van verschillende binnen- en buitenhoeken van bijvoorbeeld wanden, meubels, vloeren of andere klussen. Ook voorzien hoekprofielen in het maken van een decoratieve overgang van wanden. Let op: niet buiten toepasbaar"
      }
    },
    "images": [
      "https://www.houthandelonline.nl/cdn/resize-extended/el:true/rs:fill/w:1500/h:1068/extend:true/background:255:255:255/path/media/catalog/product/h/o/hoeklat-grenen-40x40-10st-v_01_main.jpg"
    ],
    "rating": null,
    "review_count": null,
    "reviews_summary": null,
    "scraped_at": "2026-02-05T16:55:41.416756Z",
    "scrape_success": true,
    "scrape_errors": [],
    "embedding_text": "Product: Hoeklat Grenen 40x40mm geschaafd per 10 stuks\nBrand: HouthandelOnline\nCategory: Douglas hout > Toon alles in Douglas hout > Douglas hout palen > Douglas hout balken > Douglas hout latten en regels\nDescription: Grenen hoeklatten zijn geschaafd en onbehandeld. Houten hoekprofielen zorgen voor een nette hoekafwerking binnenshuis. Deze hoeklatten zijn geschikt voor het afwerken van hoeken van wanden, meubels of voor een decoratieve overgang van de ene naar de andere wand. Deze Grenen houten afwerklijst is licht van gewicht en kan makkelijk bewerkt worden. Verpakt per 10 stuks.\nSpecifications: Levertijd: 2-7 werkdagen, Kopmaat: 40x40 mm, Dikte: 40 mm, Breedte: 40, Materiaal: Grenen, Toepassing: Deze Grenen houten hoeklat is binnen toepasbaar voor het afwerken van verschillende binnen- en buitenhoeken van bijvoorbeeld wanden, meubels, vloeren of andere klussen. Ook voorzien hoekprofielen in het maken van een decoratieve overgang van wanden. Let op: niet buiten toepasbaar\nPrice: EUR 210.39"
  },
  {
    "id": "e6432f314bf4",
    "source_url": "https://www.houthandelonline.nl/hoeklat-grenen-18x18-10st",
    "name": "Hoeklat Grenen 18x18mm geschaafd per 10 stuks",
    "description": "Grenen hoeklatten zijn geschaafd en onbehandeld. Houten hoekprofielen zorgen voor een nette hoekafwerking binnenshuis. Deze hoeklatten zijn geschikt voor het afwerken van hoeken van wanden, meubels of voor een decoratieve overgang van de ene naar de andere wand. Deze Grenen houten afwerklijst is licht van gewicht en kan makkelijk bewerkt worden. Verpakt per 10 stuks.",
    "brand": "HouthandelOnline",
    "category": "Douglas hout > Toon alles in Douglas hout > Douglas hout palen > Douglas hout balken > Douglas hout latten en regels",
    "price": 62.4,
    "currency": "EUR",
    "price_raw": "€2,31/m1",
    "specs": {
      "raw": {
        "Levertijd": "2-7 werkdagen",
        "Kopmaat": "18x18 mm",
        "Dikte": "18 mm",
        "Breedte": "18",
        "Materiaal": "Grenen",
        "Toepassing": "Deze Grenen houten hoeklat is binnen toepasbaar voor het afwerken van verschillende binnen- en buitenhoeken van bijvoorbeeld wanden, meubels, vloeren of andere klussen. Ook voorzien hoekprofielen in het maken van een decoratieve overgang van wanden. Let op: niet buiten toepasbaar"
      }
    },
    "images": [
      "https://www.houthandelonline.nl/cdn/resize-extended/el:true/rs:fill/w:1500/h:1068/extend:true/background:255:255:255/path/media/catalog/product/h/o/hoeklat-grenen-18x18-10st-v_01_main.jpg"
    ],
    "rating": null,
    "review_count": null,
    "reviews_summary": null,
    "scraped_at": "2026-02-05T16:55:41.416768Z",
    "scrape_success": true,
    "scrape_errors": [],
    "embedding_text": "Product: Hoeklat Grenen 18x18mm geschaafd per 10 stuks\nBrand: HouthandelOnline\nCategory: Douglas hout > Toon alles in Douglas hout > Douglas hout palen > Douglas hout balken > Douglas hout latten en regels\nDescription: Grenen hoeklatten zijn geschaafd en onbehandeld. Houten hoekprofielen zorgen voor een nette hoekafwerking binnenshuis. Deze hoeklatten zijn geschikt voor het afwerken van hoeken van wanden, meubels of voor een decoratieve overgang van de ene naar de andere wand. Deze Grenen houten afwerklijst is licht van gewicht en kan makkelijk bewerkt worden. Verpakt per 10 stuks.\nSpecifications: Levertijd: 2-7 werkdagen, Kopmaat: 18x18 mm, Dikte: 18 mm, Breedte: 18, Materiaal: Grenen, Toepassing: Deze Grenen houten hoeklat is binnen toepasbaar voor het afwerken van verschillende binnen- en buitenhoeken van bijvoorbeeld wanden, meubels, vloeren of andere klussen. Ook voorzien hoekprofielen in het maken van een decoratieve overgang van wanden. Let op: niet buiten toepasbaar\nPrice: EUR 62.4"
  },
  {
    "id": "e896fc59fc49",
    "source_url": "https://www.houthandelonline.nl/halfronde-lat-vuren-15x30-10st",
    "name": "Lat halfrond Vuren 15x30mm geschaafd per 10 stuks",
    "description": "Deze Vuren halfronde lijsten zijn geschaafd en onbehandeld. Houten afwerklijsten zorgen voor een nette afwerking binnenshuis. Deze halfronde lijsten zijn geschikt voor het afwerken van tafelranden, meubels of voor een decoratieve wand- of plafondlijst. Deze Vuren houten afwerklijst is licht van gewicht en kan makkelijk bewerkt worden. Verpakt per 10 stuks.",
    "brand": "HouthandelOnline",
    "category": "Douglas hout > Toon alles in Douglas hout > Douglas hout palen > Douglas hout balken > Douglas hout latten en regels",
    "price": 41.49,
    "currency": "EUR",
    "price_raw": "€1,54/m1",
    "specs": {
      "raw": {
        "Levertijd": "2-7 werkdagen",
        "Kopmaat": "15x30 mm",
        "Dikte": "15 mm",
        "Breedte": "30",
        "Materiaal": "Vuren",
        "Toepassing": "Deze Vuren houten halfronde sierlijst is binnen toepasbaar voor het afwerken van verschillende meubelstukken, tafelranden of als wandstijl. Let op: niet buiten toepasbaar"
      }
    },
    "images": [
      "https://www.houthandelonline.nl/cdn/resize-extended/el:true/rs:fill/w:1500/h:1068/extend:true/background:255:255:255/path/media/catalog/product/h/a/halfronde-lat-vuren-15x30-10st-v_01_main.jpg"
    ],
    "rating": null,
    "review_count": null,
    "reviews_summary": null,
    "scraped_at": "2026-02-05T16:55:41.416784Z",
    "scrape_success": true,
    "scrape_errors": [],
    "embedding_text": "Product: Lat halfrond Vuren 15x30mm geschaafd per 10 stuks\nBrand: HouthandelOnline\nCategory: Douglas hout > Toon alles in Douglas hout > Douglas hout palen > Douglas hout balken > Douglas hout latten en regels\nDescription: Deze Vuren halfronde lijsten zijn geschaafd en onbehandeld. Houten afwerklijsten zorgen voor een nette afwerking binnenshuis. Deze halfronde lijsten zijn geschikt voor het afwerken van tafelranden, meubels of voor een decoratieve wand- of plafondlijst. Deze Vuren houten afwerklijst is licht van gewicht en kan makkelijk bewerkt worden. Verpakt per 10 stuks.\nSpecifications: Levertijd: 2-7 werkdagen, Kopmaat: 15x30 mm, Dikte: 15 mm, Breedte: 30, Materiaal: Vuren, Toepassing: Deze Vuren houten halfronde sierlijst is binnen toepasbaar voor het afwerken van verschillende meubelstukken, tafelranden of als wandstijl. Let op: niet buiten toepasbaar\nPrice: EUR 41.49"
  },
  {
    "id": "9845a7ca307e",
    "source_url": "https://www.houthandelonline.nl/halfronde-lat-grenen-9x18-10st",
    "name": "Lat halfrond Grenen 9x18mm geschaafd per 10 stuks",
    "description": "Deze Grenen halfronde lijsten zijn geschaafd en onbehandeld. Houten afwerklijsten zorgen voor een nette afwerking binnenshuis. Deze halfronde lijsten zijn geschikt voor het afwerken van tafelranden, meubels of voor een decoratieve wandlijst of plafondlijst. Deze Grenen houten afwerklijst is licht van gewicht en kan makkelijk bewerkt worden. Verpakt per 10 stuks.",
    "brand": "HouthandelOnline",
    "category": "Douglas hout > Toon alles in Douglas hout > Douglas hout palen > Douglas hout balken > Douglas hout latten en regels",
    "price": 55.21,
    "currency": "EUR",
    "price_raw": "€2,04/m1",
    "specs": {
      "raw": {
        "Levertijd": "2-7 werkdagen",
        "Kopmaat": "9x18 mm",
        "Dikte": "9 mm",
        "Breedte": "18",
        "Materiaal": "Grenen",
        "Toepassing": "Deze Grenen houten halfronde sierlijst is binnen toepasbaar voor het afwerken van verschillende meubelstukken, tafelranden of als decoratieve wandlijst of plafondlijst. Let op: niet buiten toepasbaar"
      }
    },
    "images": [
      "https://www.houthandelonline.nl/cdn/resize-extended/el:true/rs:fill/w:1500/h:1068/extend:true/background:255:255:255/path/media/catalog/product/h/a/halfronde-lat-grenen-9x18-10st-v_01_main.jpg"
    ],
    "rating": null,
    "review_count": null,
    "reviews_summary": null,
    "scraped_at": "2026-02-05T16:55:41.416797Z",
    "scrape_success": true,
    "scrape_errors": [],
    "embedding_text": "Product: Lat halfrond Grenen 9x18mm geschaafd per 10 stuks\nBrand: HouthandelOnline\nCategory: Douglas hout > Toon alles in Douglas hout > Douglas hout palen > Douglas hout balken > Douglas hout latten en regels\nDescription: Deze Grenen halfronde lijsten zijn geschaafd en onbehandeld. Houten afwerklijsten zorgen voor een nette afwerking binnenshuis. Deze halfronde lijsten zijn geschikt voor het afwerken van tafelranden, meubels of voor een decoratieve wandlijst of plafondlijst. Deze Grenen houten afwerklijst is licht van gewicht en kan makkelijk bewerkt worden. Verpakt per 10 stuks.\nSpecifications: Levertijd: 2-7 werkdagen, Kopmaat: 9x18 mm, Dikte: 9 mm, Breedte: 18, Materiaal: Grenen, Toepassing: Deze Grenen houten halfronde sierlijst is binnen toepasbaar voor het afwerken van verschillende meubelstukken, tafelranden of als decoratieve wandlijst of plafondlijst. Let op: niet buiten toepasbaar\nPrice: EUR 55.21"
  },
  {
    "id": "3b2bdb72d389",
    "source_url": "https://www.houthandelonline.nl/ronde-stok-grenen-14-10st",
    "name": "Stok Grenen 14mm geschaafd per 10 stuks",
    "description": "Grenen ronde stokken zijn geschaafd en onbehandeld waardoor rondhout vele toepassingen binnenshuis kent. De stok wordt veel toegepast als gordijnroede in kleine kozijnen, in de interieurbouw of voor het opvullen van ronde gaten. Deze Grenen interieurlijst rond is licht van gewicht en kan makkelijk bewerkt worden. Verpakt per 10 stuks.",
    "brand": "HouthandelOnline",
    "category": "Douglas hout > Toon alles in Douglas hout > Douglas hout palen > Douglas hout balken > Douglas hout latten en regels",
    "price": 57.5,
    "currency": "EUR",
    "price_raw": "€2,13/m1",
    "specs": {
      "raw": {
        "Levertijd": "2-7 werkdagen",
        "Dikte": "14 mm",
        "Breedte": "14",
        "Materiaal": "Grenen",
        "Toepassing": "Rond houten stokken zijn binnen toepasbaar als gordijnroedes voor kleine kozijnen, knutselwerk, interieurbouw en voor het opvullen van ronde gaten. Let op: niet buiten toepasbaar"
      }
    },
    "images": [
      "https://www.houthandelonline.nl/cdn/resize-extended/el:true/rs:fill/w:1500/h:1068/extend:true/background:255:255:255/path/media/catalog/product/r/o/ronde-stok-grenen-14-10st-v_01_main.jpg"
    ],
    "rating": null,
    "review_count": null,
    "reviews_summary": null,
    "scraped_at": "2026-02-05T16:55:41.416809Z",
    "scrape_success": true,
    "scrape_errors": [],
    "embedding_text": "Product: Stok Grenen 14mm geschaafd per 10 stuks\nBrand: HouthandelOnline\nCategory: Douglas hout > Toon alles in Douglas hout > Douglas hout palen > Douglas hout balken > Douglas hout latten en regels\nDescription: Grenen ronde stokken zijn geschaafd en onbehandeld waardoor rondhout vele toepassingen binnenshuis kent. De stok wordt veel toegepast als gordijnroede in kleine kozijnen, in de interieurbouw of voor het opvullen van ronde gaten. Deze Grenen interieurlijst rond is licht van gewicht en kan makkelijk bewerkt worden. Verpakt per 10 stuks.\nSpecifications: Levertijd: 2-7 werkdagen, Dikte: 14 mm, Breedte: 14, Materiaal: Grenen, Toepassing: Rond houten stokken zijn binnen toepasbaar als gordijnroedes voor kleine kozijnen, knutselwerk, interieurbouw en voor het opvullen van ronde gaten. Let op: niet buiten toepasbaar\nPrice: EUR 57.5"
  },
  {
    "id": "1d7f255991df",
    "source_url": "https://www.houthandelonline.nl/plint-grenen-16x140-5st",
    "name": "Plint Grenen 16x140mm zichtzijde wit afgelakt per 5 stuks",
    "description": "Vloerplint ter afwerking van de aansluiting van de vloer en wand",
    "brand": "HouthandelOnline",
    "category": "Douglas hout > Toon alles in Douglas hout > Douglas hout palen > Douglas hout balken > Douglas hout latten en regels",
    "price": 339.44,
    "currency": "EUR",
    "price_raw": "€13,85/m1",
    "specs": {
      "raw": {
        "Levertijd": "2-7 werkdagen",
        "Kopmaat": "16x140 mm",
        "Dikte": "16 mm",
        "Breedte": "140",
        "Materiaal": "Grenen",
        "Toepassing": "Lijstwerk voor het afwerken van de aansluiting tussen vloer en wand"
      }
    },
    "images": [
      "https://www.houthandelonline.nl/cdn/resize-extended/el:true/rs:fill/w:1500/h:1068/extend:true/background:255:255:255/path/media/catalog/product/p/l/plint-grenen-16x140-5st-v_01_main.jpg",
      "https://www.houthandelonline.nl/cdn/resize-extended/el:true/rs:fill/w:1500/h:1068/extend:true/background:255:255:255/path/media/catalog/product/p/l/plint-grenen-16x140-5st-v_02_view.jpg",
      "https://www.houthandelonline.nl/cdn/resize-extended/el:true/rs:fill/w:1500/h:1068/extend:true/background:255:255:255/path/media/catalog/product/p/l/plint-grenen-16x140-5st-v_03_view.jpg"
    ],
    "rating": null,
    "review_count": null,
    "reviews_summary": null,
    "scraped_at": "2026-02-05T16:55:41.416822Z",
    "scrape_success": true,
    "scrape_errors": [],
    "embedding_text": "Product: Plint Grenen 16x140mm zichtzijde wit afgelakt per 5 stuks\nBrand: HouthandelOnline\nCategory: Douglas hout > Toon alles in Douglas hout > Douglas hout palen > Douglas hout balken > Douglas hout latten en regels\nDescription: Vloerplint ter afwerking van de aansluiting van de vloer en wand\nSpecifications: Levertijd: 2-7 werkdagen, Kopmaat: 16x140 mm, Dikte: 16 mm, Breedte: 140, Materiaal: Grenen, Toepassing: Lijstwerk voor het afwerken van de aansluiting tussen vloer en wand\nPrice: EUR 339.44"
  },
  {
    "id": "e1f8c2abc71a",
    "source_url": "https://www.houthandelonline.nl/hoeklat-meranti-35x35-10st",
    "name": "Hoeklat Meranti 35x35mm geschaafd per 10 stuks",
    "description": "Hardhouten hoeklatten zijn geschaafd en onbehandeld. Houten hoekprofielen zorgen voor een nette hoekafwerking binnenshuis. Deze hoekprofielen zijn geschikt voor het afwerken van hoeken van wanden, meubels of voor een decoratieve overgang van de ene naar de andere wand. Deze Hardhouten afwerklijst is zeer sterk en gaat lang mee. Verpakt per 10 stuks.",
    "brand": "HouthandelOnline",
    "category": "Douglas hout > Toon alles in Douglas hout > Douglas hout palen > Douglas hout balken > Douglas hout latten en regels",
    "price": 232.93,
    "currency": "EUR",
    "price_raw": "€8,47/m1",
    "specs": {
      "raw": {
        "Levertijd": "2-7 werkdagen",
        "Kopmaat": "35x35 mm",
        "Dikte": "35 mm",
        "Breedte": "35",
        "Materiaal": "Meranti",
        "Toepassing": "Deze Hardhouten buitenhoeklat is binnen toepasbaar voor het afwerken van verschillende hoeken van bijvoorbeeld wanden, meubels, vloeren of andere klussen. Ook voorzien hoekprofielen in het maken van een decoratieve overgang van wanden. Let op: niet buiten toepasbaar"
      }
    },
    "images": [
      "https://www.houthandelonline.nl/cdn/resize-extended/el:true/rs:fill/w:1500/h:1068/extend:true/background:255:255:255/path/media/catalog/product/h/o/hoeklat-meranti-35x35-10st-v_01_main.jpg"
    ],
    "rating": null,
    "review_count": null,
    "reviews_summary": null,
    "scraped_at": "2026-02-05T16:55:41.416833Z",
    "scrape_success": true,
    "scrape_errors": [],
    "embedding_text": "Product: Hoeklat Meranti 35x35mm geschaafd per 10 stuks\nBrand: HouthandelOnline\nCategory: Douglas hout > Toon alles in Douglas hout > Douglas hout palen > Douglas hout balken > Douglas hout latten en regels\nDescription: Hardhouten hoeklatten zijn geschaafd en onbehandeld. Houten hoekprofielen zorgen voor een nette hoekafwerking binnenshuis. Deze hoekprofielen zijn geschikt voor het afwerken van hoeken van wanden, meubels of voor een decoratieve overgang van de ene naar de andere wand. Deze Hardhouten afwerklijst is zeer sterk en gaat lang mee. Verpakt per 10 stuks.\nSpecifications: Levertijd: 2-7 werkdagen, Kopmaat: 35x35 mm, Dikte: 35 mm, Breedte: 35, Materiaal: Meranti, Toepassing: Deze Hardhouten buitenhoeklat is binnen toepasbaar voor het afwerken van verschillende hoeken van bijvoorbeeld wanden, meubels, vloeren of andere klussen. Ook voorzien hoekprofielen in het maken van een decoratieve overgang van wanden. Let op: niet buiten toepasbaar\nPrice: EUR 232.93"
  },
  {
    "id": "026fd17f2410",
    "source_url": "https://www.houthandelonline.nl/sierlijst-mdf-vochtw-4st",
    "name": "Sierlijst MDF Vochtwerend 16x45mm wit voorgelakt per 4 stuks",
    "description": "MDF V313 vochtwerende decorlijsten zijn wit voorgelakt en vochtwerend. Houten bekledingslijsten zorgen voor een fraaie afwerking van deuren, wanden en plafonds binnenshuis. Verpakt per 4 stuks.",
    "brand": "HouthandelOnline",
    "category": "Douglas hout > Toon alles in Douglas hout > Douglas hout palen > Douglas hout balken > Douglas hout latten en regels",
    "price": 67.78,
    "currency": "EUR",
    "price_raw": "€3,47/m1",
    "specs": {
      "raw": {
        "Levertijd": "2-7 werkdagen",
        "Kopmaat": "16x45 mm",
        "Dikte": "16 mm",
        "Breedte": "45",
        "Materiaal": "MDF"
      }
    },
    "images": [
      "https://www.houthandelonline.nl/cdn/resize-extended/el:true/rs:fill/w:1500/h:1068/extend:true/background:255:255:255/path/media/catalog/product/s/i/sierlijst-mdf-vochtw-4st-v_01_main.jpg",
      "https://www.houthandelonline.nl/cdn/resize-extended/el:true/rs:fill/w:1500/h:1068/extend:true/background:255:255:255/path/media/catalog/product/s/i/sierlijst-mdf-vochtw-4st-v_02_view.jpg"
    ],
    "rating": null,
    "review_count": null,
    "reviews_summary": null,
    "scraped_at": "2026-02-05T16:55:41.416843Z",
    "scrape_success": true,
    "scrape_errors": [],
    "embedding_text": "Product: Sierlijst MDF Vochtwerend 16x45mm wit voorgelakt per 4 stuks\nBrand: HouthandelOnline\nCategory: Douglas hout > Toon alles in Douglas hout > Douglas hout palen > Douglas hout balken > Douglas hout latten en regels\nDescription: MDF V313 vochtwerende decorlijsten zijn wit voorgelakt en vochtwerend. Houten bekledingslijsten zorgen voor een fraaie afwerking van deuren, wanden en plafonds binnenshuis. Verpakt per 4 stuks.\nSpecifications: Levertijd: 2-7 werkdagen, Kopmaat: 16x45 mm, Dikte: 16 mm, Breedte: 45, Materiaal: MDF\nPrice: EUR 67.78"
  },
  {
    "id": "4314ec49e54c",
    "source_url": "https://www.houthandelonline.nl/plint-mdf-18x120-4st",
    "name": "Plint MDF 18x120mm vochtwerend wit voorgelakt per 4 stuks",
    "description": "Deze vochtwerende V313 plint is geschikt voor de afwerking van een vloer of wand. De plint is wit voorgelakt en heeft een afmeting van 18x120mm. De plinten zijn verpakt per 4 stuks en hebben een lengte van 488cm.",
    "brand": "HouthandelOnline",
    "category": "Douglas hout > Toon alles in Douglas hout > Douglas hout palen > Douglas hout balken > Douglas hout latten en regels",
    "price": 110.78,
    "currency": "EUR",
    "price_raw": "€5,67/m1",
    "specs": {
      "raw": {
        "Levertijd": "2-7 werkdagen",
        "Kopmaat": "18x120 mm",
        "Dikte": "18 mm",
        "Breedte": "120",
        "Materiaal": "MDF",
        "Toepassing": "Lijstwerk voor het afwerken van de aansluiting tussen vloer en wand"
      }
    },
    "images": [
      "https://www.houthandelonline.nl/cdn/resize-extended/el:true/rs:fill/w:1500/h:1068/extend:true/background:255:255:255/path/media/catalog/product/p/l/plint-mdf-18x120-4st-v_01_main.jpg"
    ],
    "rating": null,
    "review_count": null,
    "reviews_summary": null,
    "scraped_at": "2026-02-05T16:55:41.416852Z",
    "scrape_success": true,
    "scrape_errors": [],
    "embedding_text": "Product: Plint MDF 18x120mm vochtwerend wit voorgelakt per 4 stuks\nBrand: HouthandelOnline\nCategory: Douglas hout > Toon alles in Douglas hout > Douglas hout palen > Douglas hout balken > Douglas hout latten en regels\nDescription: Deze vochtwerende V313 plint is geschikt voor de afwerking van een vloer of wand. De plint is wit voorgelakt en heeft een afmeting van 18x120mm. De plinten zijn verpakt per 4 stuks en hebben een lengte van 488cm.\nSpecifications: Levertijd: 2-7 werkdagen, Kopmaat: 18x120 mm, Dikte: 18 mm, Breedte: 120, Materiaal: MDF, Toepassing: Lijstwerk voor het afwerken van de aansluiting tussen vloer en wand\nPrice: EUR 110.78"
  },
  {
    "id": "c30a3964f677",
    "source_url": "https://www.houthandelonline.nl/plint-grenen-16x120-5st",
    "name": "Plint Grenen 16x120mm zichtzijde wit afgelakt per 5 stuks",
    "description": "Vloerplint ter afwerking van de aansluiting van de vloer en wand",
    "brand": "HouthandelOnline",
    "category": "Douglas hout > Toon alles in Douglas hout > Douglas hout palen > Douglas hout balken > Douglas hout latten en regels",
    "price": 278.07,
    "currency": "EUR",
    "price_raw": "€11,35/m1",
    "specs": {
      "raw": {
        "Levertijd": "2-7 werkdagen",
        "Kopmaat": "16x120 mm",
        "Dikte": "16 mm",
        "Breedte": "120",
        "Materiaal": "Grenen",
        "Toepassing": "Lijstwerk voor het afwerken van de aansluiting tussen vloer en wand"
      }
    },
    "images": [
      "https://www.houthandelonline.nl/cdn/resize-extended/el:true/rs:fill/w:1500/h:1068/extend:true/background:255:255:255/path/media/catalog/product/p/l/plint-grenen-16x120-5st-v_01_main.jpg",
      "https://www.houthandelonline.nl/cdn/resize-extended/el:true/rs:fill/w:1500/h:1068/extend:true/background:255:255:255/path/media/catalog/product/p/l/plint-grenen-16x120-5st-v_02_view.jpg",
      "https://www.houthandelonline.nl/cdn/resize-extended/el:true/rs:fill/w:1500/h:1068/extend:true/background:255:255:255/path/media/catalog/product/p/l/plint-grenen-16x120-5st-v_03_view.jpg"
    ],
    "rating": null,
    "review_count": null,
    "reviews_summary": null,
    "scraped_at": "2026-02-05T16:55:41.416862Z",
    "scrape_success": true,
    "scrape_errors": [],
    "embedding_text": "Product: Plint Grenen 16x120mm zichtzijde wit afgelakt per 5 stuks\nBrand: HouthandelOnline\nCategory: Douglas hout > Toon alles in Douglas hout > Douglas hout palen > Douglas hout balken > Douglas hout latten en regels\nDescription: Vloerplint ter afwerking van de aansluiting van de vloer en wand\nSpecifications: Levertijd: 2-7 werkdagen, Kopmaat: 16x120 mm, Dikte: 16 mm, Breedte: 120, Materiaal: Grenen, Toepassing: Lijstwerk voor het afwerken van de aansluiting tussen vloer en wand\nPrice: EUR 278.07"
  },
  {
    "id": "848c49ec3022",
    "source_url": "https://www.houthandelonline.nl/plint-grenen-12x55-5st",
    "name": "Plint Grenen 12x55mm zichtzijde wit afgelakt per 5 stuks",
    "description": "Vloer-plafondplint ter afwerking van de aansluiting van de vloer en wand of plafond en wand",
    "brand": "HouthandelOnline",
    "category": "Douglas hout > Toon alles in Douglas hout > Douglas hout palen > Douglas hout balken > Douglas hout latten en regels",
    "price": 135.77,
    "currency": "EUR",
    "price_raw": "€5,54/m1",
    "specs": {
      "raw": {
        "Levertijd": "2-7 werkdagen",
        "Kopmaat": "12x55 mm",
        "Dikte": "12 mm",
        "Breedte": "55",
        "Materiaal": "Grenen",
        "Toepassing": "Lijstwerk voor het afwerken van de aansluiting tussen vloer en wand"
      }
    },
    "images": [
      "https://www.houthandelonline.nl/cdn/resize-extended/el:true/rs:fill/w:1500/h:1068/extend:true/background:255:255:255/path/media/catalog/product/p/l/plint-grenen-12x55-5st-v_01_main.jpg",
      "https://www.houthandelonline.nl/cdn/resize-extended/el:true/rs:fill/w:1500/h:1068/extend:true/background:255:255:255/path/media/catalog/product/p/l/plint-grenen-12x55-5st-v_02_view.jpg",
      "https://www.houthandelonline.nl/cdn/resize-extended/el:true/rs:fill/w:1500/h:1068/extend:true/background:255:255:255/path/media/catalog/product/p/l/plint-grenen-12x55-5st-v_03_view.jpg",
      "https://www.houthandelonline.nl/cdn/resize-extended/el:true/rs:fill/w:1500/h:1068/extend:true/background:255:255:255/path/media/catalog/product/p/l/plint-grenen-12x55-5st-v_04_view.jpg"
    ],
    "rating": null,
    "review_count": null,
    "reviews_summary": null,
    "scraped_at": "2026-02-05T16:55:41.416870Z",
    "scrape_success": true,
    "scrape_errors": [],
    "embedding_text": "Product: Plint Grenen 12x55mm zichtzijde wit afgelakt per 5 stuks\nBrand: HouthandelOnline\nCategory: Douglas hout > Toon alles in Douglas hout > Douglas hout palen > Douglas hout balken > Douglas hout latten en regels\nDescription: Vloer-plafondplint ter afwerking van de aansluiting van de vloer en wand of plafond en wand\nSpecifications: Levertijd: 2-7 werkdagen, Kopmaat: 12x55 mm, Dikte: 12 mm, Breedte: 55, Materiaal: Grenen, Toepassing: Lijstwerk voor het afwerken van de aansluiting tussen vloer en wand\nPrice: EUR 135.77"
  },
  {
    "id": "1f0cd79a5bbb",
    "source_url": "https://www.houthandelonline.nl/neuslat-tricoya-mdf-k60-5st",
    "name": "Neuslat Tricoya MDF K60 18x74mm (sponning 60mm) geschaafd wit gegrond per 5 stuks",
    "description": "Tricoya MDF neuslat, een glaslat met 60mm sponning, is geschaafd en rondom 60mu gegrond. Deze raamafwerklijst is binnen en buiten toepasbaar als geventileerde neuslat voor het afvoeren van vuil en vocht en het beschermen van het kozijnhout. De neuslat is 18x74mm. Verpakt per 5 stuks.",
    "brand": "HouthandelOnline",
    "category": "Douglas hout > Toon alles in Douglas hout > Douglas hout palen > Douglas hout balken > Douglas hout latten en regels",
    "price": 513.12,
    "currency": "EUR",
    "price_raw": "€21,03/m1",
    "specs": {
      "raw": {
        "Levertijd": "2-7 werkdagen",
        "Kopmaat": "18x74 mm",
        "Dikte": "18 mm",
        "Breedte": "74",
        "Materiaal": "MDF Tricoya"
      }
    },
    "images": [
      "https://www.houthandelonline.nl/cdn/resize-extended/el:true/rs:fill/w:1500/h:1068/extend:true/background:255:255:255/path/media/catalog/product/n/e/neuslat-tricoya-mdf-k60-5st-v_01_main.jpg",
      "https://www.houthandelonline.nl/cdn/resize-extended/el:true/rs:fill/w:1500/h:1068/extend:true/background:255:255:255/path/media/catalog/product/n/e/neuslat-tricoya-mdf-k60-5st-v_02_view.jpg"
    ],
    "rating": null,
    "review_count": null,
    "reviews_summary": null,
    "scraped_at": "2026-02-05T16:55:41.416878Z",
    "scrape_success": true,
    "scrape_errors": [],
    "embedding_text": "Product: Neuslat Tricoya MDF K60 18x74mm (sponning 60mm) geschaafd wit gegrond per 5 stuks\nBrand: HouthandelOnline\nCategory: Douglas hout > Toon alles in Douglas hout > Douglas hout palen > Douglas hout balken > Douglas hout latten en regels\nDescription: Tricoya MDF neuslat, een glaslat met 60mm sponning, is geschaafd en rondom 60mu gegrond. Deze raamafwerklijst is binnen en buiten toepasbaar als geventileerde neuslat voor het afvoeren van vuil en vocht en het beschermen van het kozijnhout. De neuslat is 18x74mm. Verpakt per 5 stuks.\nSpecifications: Levertijd: 2-7 werkdagen, Kopmaat: 18x74 mm, Dikte: 18 mm, Breedte: 74, Materiaal: MDF Tricoya\nPrice: EUR 513.12"
  },
  {
    "id": "7306d2790567",
    "source_url": "https://www.houthandelonline.nl/neuslat-tricoya-mdf-k55-5st",
    "name": "Neuslat Tricoya MDF K55 18x70mm (sponning 55mm) geschaafd wit gegrond per 5 stuks",
    "description": "Tricoya MDF neuslat, een glaslat met 55mm sponning, is geschaafd en rondom 60mu gegrond. Deze raamafwerklijst is binnen en buiten toepasbaar als geventileerde neuslat voor het afvoeren van vuil en vocht en het beschermen van het kozijnhout. De neuslat is 18x70mm. Verpakt per 5 stuks.",
    "brand": "HouthandelOnline",
    "category": "Douglas hout > Toon alles in Douglas hout > Douglas hout palen > Douglas hout balken > Douglas hout latten en regels",
    "price": 485.67,
    "currency": "EUR",
    "price_raw": "€19,90/m1",
    "specs": {
      "raw": {
        "Levertijd": "2-7 werkdagen",
        "Kopmaat": "18x70 mm",
        "Dikte": "18 mm",
        "Breedte": "70",
        "Materiaal": "MDF Tricoya"
      }
    },
    "images": [
      "https://www.houthandelonline.nl/cdn/resize-extended/el:true/rs:fill/w:1500/h:1068/extend:true/background:255:255:255/path/media/catalog/product/n/e/neuslat-tricoya-mdf-k55-5st-v_01_main.jpg",
      "https://www.houthandelonline.nl/cdn/resize-extended/el:true/rs:fill/w:1500/h:1068/extend:true/background:255:255:255/path/media/catalog/product/n/e/neuslat-tricoya-mdf-k55-5st-v_02_view.jpg"
    ],
    "rating": null,
    "review_count": null,
    "reviews_summary": null,
    "scraped_at": "2026-02-05T16:55:41.416886Z",
    "scrape_success": true,
    "scrape_errors": [],
    "embedding_text": "Product: Neuslat Tricoya MDF K55 18x70mm (sponning 55mm) geschaafd wit gegrond per 5 stuks\nBrand: HouthandelOnline\nCategory: Douglas hout > Toon alles in Douglas hout > Douglas hout palen > Douglas hout balken > Douglas hout latten en regels\nDescription: Tricoya MDF neuslat, een glaslat met 55mm sponning, is geschaafd en rondom 60mu gegrond. Deze raamafwerklijst is binnen en buiten toepasbaar als geventileerde neuslat voor het afvoeren van vuil en vocht en het beschermen van het kozijnhout. De neuslat is 18x70mm. Verpakt per 5 stuks.\nSpecifications: Levertijd: 2-7 werkdagen, Kopmaat: 18x70 mm, Dikte: 18 mm, Breedte: 70, Materiaal: MDF Tricoya\nPrice: EUR 485.67"
  },
  {
    "id": "fe3563e9dbfd",
    "source_url": "https://www.houthandelonline.nl/neuslat-tricoya-mdf-k40-5st",
    "name": "Neuslat Tricoya MDF K40 18x54mm (sponning 40mm) geschaafd wit gegrond per 5 stuks",
    "description": "Tricoya MDF neuslat, een glaslat met 40mm sponning, is geschaafd en rondom 60mu gegrond. Deze raamafwerklijst is binnen en buiten toepasbaar als geventileerde neuslat voor het afvoeren van vuil en vocht en het beschermen van het kozijnhout. De neuslat is 18x54mm. Verpakt per 5 stuks.",
    "brand": "HouthandelOnline",
    "category": "Douglas hout > Toon alles in Douglas hout > Douglas hout palen > Douglas hout balken > Douglas hout latten en regels",
    "price": 400.93,
    "currency": "EUR",
    "price_raw": "€16,43/m1",
    "specs": {
      "raw": {
        "Levertijd": "2-7 werkdagen",
        "Kopmaat": "18x54 mm",
        "Dikte": "18 mm",
        "Breedte": "54",
        "Materiaal": "MDF Tricoya"
      }
    },
    "images": [
      "https://www.houthandelonline.nl/cdn/resize-extended/el:true/rs:fill/w:1500/h:1068/extend:true/background:255:255:255/path/media/catalog/product/n/e/neuslat-tricoya-mdf-k40-5st-v_01_main.jpg",
      "https://www.houthandelonline.nl/cdn/resize-extended/el:true/rs:fill/w:1500/h:1068/extend:true/background:255:255:255/path/media/catalog/product/n/e/neuslat-tricoya-mdf-k40-5st-v_02_view.jpg"
    ],
    "rating": null,
    "review_count": null,
    "reviews_summary": null,
    "scraped_at": "2026-02-05T16:55:41.416894Z",
    "scrape_success": true,
    "scrape_errors": [],
    "embedding_text": "Product: Neuslat Tricoya MDF K40 18x54mm (sponning 40mm) geschaafd wit gegrond per 5 stuks\nBrand: HouthandelOnline\nCategory: Douglas hout > Toon alles in Douglas hout > Douglas hout palen > Douglas hout balken > Douglas hout latten en regels\nDescription: Tricoya MDF neuslat, een glaslat met 40mm sponning, is geschaafd en rondom 60mu gegrond. Deze raamafwerklijst is binnen en buiten toepasbaar als geventileerde neuslat voor het afvoeren van vuil en vocht en het beschermen van het kozijnhout. De neuslat is 18x54mm. Verpakt per 5 stuks.\nSpecifications: Levertijd: 2-7 werkdagen, Kopmaat: 18x54 mm, Dikte: 18 mm, Breedte: 54, Materiaal: MDF Tricoya\nPrice: EUR 400.93"
  },
  {
    "id": "b7f50183f9e9",
    "source_url": "https://www.houthandelonline.nl/koplat-mdf-schuin-halve-b-10st",
    "name": "Koplat MDF Vochtwerend schuin (model halve B) 12x20mm wit voorgelakt per 10 stuks",
    "description": "Deze vochtwerende V313 koplat (model halve B) is geschikt voor de afwerking van een vloer of wand van de aansluiting van kozijnstijl en afgewerkte wand. De koplatten zijn wit voorgelakt en zijn voor de sierlijke afwerking rond deuren of ramen. Deze koplat heeft een afmeting van 12x20mm en is wit voorgelakt. De koplatten zijn verpakt per 10 stuks en hebben een lengte van 488cm.",
    "brand": "HouthandelOnline",
    "category": "Douglas hout > Toon alles in Douglas hout > Douglas hout palen > Douglas hout balken > Douglas hout latten en regels",
    "price": 62.0,
    "currency": "EUR",
    "price_raw": "€1,27/m1",
    "specs": {
      "raw": {
        "Levertijd": "2-7 werkdagen",
        "Kopmaat": "12x20 mm",
        "Dikte": "12 mm",
        "Breedte": "20",
        "Materiaal": "MDF",
        "Toepassing": "Lijstwerk voor het afwerken van de aansluiting tussen wand en kozijn"
      }
    },
    "images": [
      "https://www.houthandelonline.nl/cdn/resize-extended/el:true/rs:fill/w:1500/h:1068/extend:true/background:255:255:255/path/media/catalog/product/k/o/koplat-mdf-schuin-halve-b-10st-v_01_main.jpg"
    ],
    "rating": null,
    "review_count": null,
    "reviews_summary": null,
    "scraped_at": "2026-02-05T16:55:41.416903Z",
    "scrape_success": true,
    "scrape_errors": [],
    "embedding_text": "Product: Koplat MDF Vochtwerend schuin (model halve B) 12x20mm wit voorgelakt per 10 stuks\nBrand: HouthandelOnline\nCategory: Douglas hout > Toon alles in Douglas hout > Douglas hout palen > Douglas hout balken > Douglas hout latten en regels\nDescription: Deze vochtwerende V313 koplat (model halve B) is geschikt voor de afwerking van een vloer of wand van de aansluiting van kozijnstijl en afgewerkte wand. De koplatten zijn wit voorgelakt en zijn voor de sierlijke afwerking rond deuren of ramen. Deze koplat heeft een afmeting van 12x20mm en is wit voorgelakt. De koplatten zijn verpakt per 10 stuks en hebben een lengte van 488cm.\nSpecifications: Levertijd: 2-7 werkdagen, Kopmaat: 12x20 mm, Dikte: 12 mm, Breedte: 20, Materiaal: MDF, Toepassing: Lijstwerk voor het afwerken van de aansluiting tussen wand en kozijn\nPrice: EUR 62.0"
  },
  {
    "id": "b84ab4b556f5",
    "source_url": "https://www.houthandelonline.nl/koplat-mdf-model-e-12x37-10st",
    "name": "Koplat MDF Vochtwerend (model E) 12x37mm met rechte kanten wit voorgelakt per 10 stuks",
    "description": "Deze vochtwerende V313 koplat (model E) met rechte kanten is geschikt voor de afwerking van een vloer of wand van de aansluiting van kozijnstijl en afgewerkte wand. De koplatten zijn wit voorgelakt en zijn voor de sierlijke afwerking rond deuren of ramen. \n\n Deze koplat heeft een afmeting van 12x37mm en is wit voorgelakt. De koplatten zijn verpakt per 10 stuks en hebben een lengte van 488cm.",
    "brand": "HouthandelOnline",
    "category": "Douglas hout > Toon alles in Douglas hout > Douglas hout palen > Douglas hout balken > Douglas hout latten en regels",
    "price": 70.86,
    "currency": "EUR",
    "price_raw": "€1,45/m1",
    "specs": {
      "raw": {
        "Levertijd": "2-7 werkdagen",
        "Kopmaat": "12x37 mm",
        "Dikte": "12 mm",
        "Breedte": "37",
        "Materiaal": "MDF",
        "Toepassing": "Lijstwerk voor het afwerken van de aansluiting tussen wand en kozijn"
      }
    },
    "images": [
      "https://www.houthandelonline.nl/cdn/resize-extended/el:true/rs:fill/w:1500/h:1068/extend:true/background:255:255:255/path/media/catalog/product/k/o/koplat-mdf-model-e-12x37-10st-v_01_main.jpg"
    ],
    "rating": null,
    "review_count": null,
    "reviews_summary": null,
    "scraped_at": "2026-02-05T16:55:41.416914Z",
    "scrape_success": true,
    "scrape_errors": [],
    "embedding_text": "Product: Koplat MDF Vochtwerend (model E) 12x37mm met rechte kanten wit voorgelakt per 10 stuks\nBrand: HouthandelOnline\nCategory: Douglas hout > Toon alles in Douglas hout > Douglas hout palen > Douglas hout balken > Douglas hout latten en regels\nDescription: Deze vochtwerende V313 koplat (model E) met rechte kanten is geschikt voor de afwerking van een vloer of wand van de aansluiting van kozijnstijl en afgewerkte wand. De koplatten zijn wit voorgelakt en zijn voor de sierlijke afwerking rond deuren of ramen. \n\n Deze koplat heeft een afmeting van 12x37mm en is wit voorgelakt. De koplatten zijn verpakt per 10 stuks en hebben een lengte van 488cm.\nSpecifications: Levertijd: 2-7 werkdagen, Kopmaat: 12x37 mm, Dikte: 12 mm, Breedte: 37, Materiaal: MDF, Toepassing: Lijstwerk voor het afwerken van de aansluiting tussen wand en kozijn\nPrice: EUR 70.86"
  },
  {
    "id": "0712059526a7",
    "source_url": "https://www.houthandelonline.nl/koplat-mdf-model-b-12x45-10st",
    "name": "Koplat MDF Vochtwerend (model B) 12x45mm met schuine kanten wit voorgelakt per 10 stuks",
    "description": "Deze vochtwerende V313 koplat (model B) met schuine kanten is geschikt voor de afwerking van een vloer of wand van de aansluiting van kozijnstijl en afgewerkte wand. De koplatten zijn wit voorgelakt en zijn voor de sierlijke afwerking rond deuren of ramen. Deze koplat heeft een afmeting van 12x45mm en is wit voorgelakt. De koplatten zijn verpakt per 10 stuks en hebben een lengte van 488cm.",
    "brand": "HouthandelOnline",
    "category": "Douglas hout > Toon alles in Douglas hout > Douglas hout palen > Douglas hout balken > Douglas hout latten en regels",
    "price": 77.36,
    "currency": "EUR",
    "price_raw": "€1,59/m1",
    "specs": {
      "raw": {
        "Levertijd": "2-7 werkdagen",
        "Kopmaat": "12x45 mm",
        "Dikte": "12 mm",
        "Breedte": "45",
        "Materiaal": "MDF",
        "Toepassing": "Lijstwerk voor het afwerken van de aansluiting tussen wand en kozijn"
      }
    },
    "images": [
      "https://www.houthandelonline.nl/cdn/resize-extended/el:true/rs:fill/w:1500/h:1068/extend:true/background:255:255:255/path/media/catalog/product/k/o/koplat-mdf-model-b-12x45-10st-v_01_main.jpg"
    ],
    "rating": null,
    "review_count": null,
    "reviews_summary": null,
    "scraped_at": "2026-02-05T16:55:41.416922Z",
    "scrape_success": true,
    "scrape_errors": [],
    "embedding_text": "Product: Koplat MDF Vochtwerend (model B) 12x45mm met schuine kanten wit voorgelakt per 10 stuks\nBrand: HouthandelOnline\nCategory: Douglas hout > Toon alles in Douglas hout > Douglas hout palen > Douglas hout balken > Douglas hout latten en regels\nDescription: Deze vochtwerende V313 koplat (model B) met schuine kanten is geschikt voor de afwerking van een vloer of wand van de aansluiting van kozijnstijl en afgewerkte wand. De koplatten zijn wit voorgelakt en zijn voor de sierlijke afwerking rond deuren of ramen. Deze koplat heeft een afmeting van 12x45mm en is wit voorgelakt. De koplatten zijn verpakt per 10 stuks en hebben een lengte van 488cm.\nSpecifications: Levertijd: 2-7 werkdagen, Kopmaat: 12x45 mm, Dikte: 12 mm, Breedte: 45, Materiaal: MDF, Toepassing: Lijstwerk voor het afwerken van de aansluiting tussen wand en kozijn\nPrice: EUR 77.36"
  },
  {
    "id": "05b9b4f55575",
    "source_url": "https://www.houthandelonline.nl/koplat-grenen-model-e-16x70-lak-5st",
    "name": "Koplat Grenen (Model E) 16x70mm met rechte kanten zichtzijde wit afgelakt per 4 stuks",
    "description": "Koplat ter afwerking van de aansluiting van kozijnstijl en afgewerkte wand",
    "brand": "HouthandelOnline",
    "category": "Douglas hout > Toon alles in Douglas hout > Douglas hout palen > Douglas hout balken > Douglas hout latten en regels",
    "price": 143.48,
    "currency": "EUR",
    "price_raw": "€5,86/m1",
    "specs": {
      "raw": {
        "Levertijd": "2-7 werkdagen",
        "Kopmaat": "16x70 mm",
        "Dikte": "16 mm",
        "Breedte": "70",
        "Materiaal": "Grenen",
        "Toepassing": "Lijstwerk voor het afwerken van de aansluiting tussen wand en kozijn"
      }
    },
    "images": [
      "https://www.houthandelonline.nl/cdn/resize-extended/el:true/rs:fill/w:1500/h:1068/extend:true/background:255:255:255/path/media/catalog/product/k/o/koplat-grenen-model-e-16x70-lak-5st-v_01_main.jpg",
      "https://www.houthandelonline.nl/cdn/resize-extended/el:true/rs:fill/w:1500/h:1068/extend:true/background:255:255:255/path/media/catalog/product/k/o/koplat-grenen-model-e-16x70-lak-5st-v_02_view.jpg",
      "https://www.houthandelonline.nl/cdn/resize-extended/el:true/rs:fill/w:1500/h:1068/extend:true/background:255:255:255/path/media/catalog/product/k/o/koplat-grenen-model-e-16x70-lak-5st-v_03_view.jpg"
    ],
    "rating": null,
    "review_count": null,
    "reviews_summary": null,
    "scraped_at": "2026-02-05T16:55:41.416928Z",
    "scrape_success": true,
    "scrape_errors": [],
    "embedding_text": "Product: Koplat Grenen (Model E) 16x70mm met rechte kanten zichtzijde wit afgelakt per 4 stuks\nBrand: HouthandelOnline\nCategory: Douglas hout > Toon alles in Douglas hout > Douglas hout palen > Douglas hout balken > Douglas hout latten en regels\nDescription: Koplat ter afwerking van de aansluiting van kozijnstijl en afgewerkte wand\nSpecifications: Levertijd: 2-7 werkdagen, Kopmaat: 16x70 mm, Dikte: 16 mm, Breedte: 70, Materiaal: Grenen, Toepassing: Lijstwerk voor het afwerken van de aansluiting tussen wand en kozijn\nPrice: EUR 143.48"
  },
  {
    "id": "2757b849b017",
    "source_url": "https://www.houthandelonline.nl/hollat-grenen-18x18-10st",
    "name": "Hollat Grenen 18x18mm geschaafd per 10 stuks",
    "description": "Grenen hollatten zijn geschaafd en onbehandeld. Houten afwerklijsten zorgen voor een nette hoekafwerking binnenshuis. Deze hollatten zijn geschikt voor het afwerken van binnenhoeken van wanden, meubels of voor een decoratieve overgang van de muur naar het plafond of kozijn. Deze Grenen houten afwerklijst is licht van gewicht en kan makkelijk bewerkt worden. Verpakt per 10 stuks.",
    "brand": "HouthandelOnline",
    "category": "Douglas hout > Toon alles in Douglas hout > Douglas hout palen > Douglas hout balken > Douglas hout latten en regels",
    "price": 42.8,
    "currency": "EUR",
    "price_raw": "€1,59/m1",
    "specs": {
      "raw": {
        "Levertijd": "2-7 werkdagen",
        "Kopmaat": "18x18 mm",
        "Dikte": "18 mm",
        "Breedte": "18",
        "Materiaal": "Grenen"
      }
    },
    "images": [
      "https://www.houthandelonline.nl/cdn/resize-extended/el:true/rs:fill/w:1500/h:1068/extend:true/background:255:255:255/path/media/catalog/product/h/o/hollat-grenen-18x18-10st-v_01_main.jpg"
    ],
    "rating": null,
    "review_count": null,
    "reviews_summary": null,
    "scraped_at": "2026-02-05T16:55:41.416936Z",
    "scrape_success": true,
    "scrape_errors": [],
    "embedding_text": "Product: Hollat Grenen 18x18mm geschaafd per 10 stuks\nBrand: HouthandelOnline\nCategory: Douglas hout > Toon alles in Douglas hout > Douglas hout palen > Douglas hout balken > Douglas hout latten en regels\nDescription: Grenen hollatten zijn geschaafd en onbehandeld. Houten afwerklijsten zorgen voor een nette hoekafwerking binnenshuis. Deze hollatten zijn geschikt voor het afwerken van binnenhoeken van wanden, meubels of voor een decoratieve overgang van de muur naar het plafond of kozijn. Deze Grenen houten afwerklijst is licht van gewicht en kan makkelijk bewerkt worden. Verpakt per 10 stuks.\nSpecifications: Levertijd: 2-7 werkdagen, Kopmaat: 18x18 mm, Dikte: 18 mm, Breedte: 18, Materiaal: Grenen\nPrice: EUR 42.8"
  },
  {
    "id": "7cb52f742078",
    "source_url": "https://www.houthandelonline.nl/hoeklat-meranti-45x45-10st",
    "name": "Hoeklat Meranti 45x45mm geschaafd per 10 stuks",
    "description": "Hardhouten hoeklatten zijn geschaafd en onbehandeld. Houten hoekprofielen zorgen voor een nette hoekafwerking binnenshuis. Deze hoekprofielen zijn geschikt voor het afwerken van hoeken van wanden, meubels of voor een decoratieve overgang van de ene naar de andere wand. Deze Hardhouten afwerklijst is zeer sterk en gaat lang mee. Verpakt per 10 stuks.",
    "brand": "HouthandelOnline",
    "category": "Douglas hout > Toon alles in Douglas hout > Douglas hout palen > Douglas hout balken > Douglas hout latten en regels",
    "price": 442.9,
    "currency": "EUR",
    "price_raw": "€16,11/m1",
    "specs": {
      "raw": {
        "Levertijd": "2-7 werkdagen",
        "Kopmaat": "45x45 mm",
        "Dikte": "45 mm",
        "Breedte": "45",
        "Materiaal": "Meranti",
        "Toepassing": "Deze Hardhouten buitenhoeklat is binnen toepasbaar voor het afwerken van verschillende hoeken van bijvoorbeeld wanden, meubels, vloeren of andere klussen. Ook voorzien hoekprofielen in het maken van een decoratieve overgang van wanden. Let op: niet buiten toepasbaar"
      }
    },
    "images": [
      "https://www.houthandelonline.nl/cdn/resize-extended/el:true/rs:fill/w:1500/h:1068/extend:true/background:255:255:255/path/media/catalog/product/h/o/hoeklat-meranti-45x45-10st-v_01_main.jpg"
    ],
    "rating": null,
    "review_count": null,
    "reviews_summary": null,
    "scraped_at": "2026-02-05T16:55:41.416944Z",
    "scrape_success": true,
    "scrape_errors": [],
    "embedding_text": "Product: Hoeklat Meranti 45x45mm geschaafd per 10 stuks\nBrand: HouthandelOnline\nCategory: Douglas hout > Toon alles in Douglas hout > Douglas hout palen > Douglas hout balken > Douglas hout latten en regels\nDescription: Hardhouten hoeklatten zijn geschaafd en onbehandeld. Houten hoekprofielen zorgen voor een nette hoekafwerking binnenshuis. Deze hoekprofielen zijn geschikt voor het afwerken van hoeken van wanden, meubels of voor een decoratieve overgang van de ene naar de andere wand. Deze Hardhouten afwerklijst is zeer sterk en gaat lang mee. Verpakt per 10 stuks.\nSpecifications: Levertijd: 2-7 werkdagen, Kopmaat: 45x45 mm, Dikte: 45 mm, Breedte: 45, Materiaal: Meranti, Toepassing: Deze Hardhouten buitenhoeklat is binnen toepasbaar voor het afwerken van verschillende hoeken van bijvoorbeeld wanden, meubels, vloeren of andere klussen. Ook voorzien hoekprofielen in het maken van een decoratieve overgang van wanden. Let op: niet buiten toepasbaar\nPrice: EUR 442.9"
  },
  {
    "id": "4ce4b9dc8679",
    "source_url": "https://www.houthandelonline.nl/ronde-stok-grenen-9-10st",
    "name": "Stok Grenen 9mm geschaafd per 10 stuks",
    "description": "Grenen ronde stokken zijn geschaafd en onbehandeld waardoor rondhout vele toepassingen binnenshuis kent. De stok wordt veel toegepast als gordijnroede in kleine kozijnen, in de interieurbouw of voor het opvullen van ronde gaten. Deze Grenen interieurlijst rond is licht van gewicht en kan makkelijk bewerkt worden. Verpakt per 10 stuks.",
    "brand": "HouthandelOnline",
    "category": "Douglas hout > Toon alles in Douglas hout > Douglas hout palen > Douglas hout balken > Douglas hout latten en regels",
    "price": 32.67,
    "currency": "EUR",
    "price_raw": "€1,21/m1",
    "specs": {
      "raw": {
        "Levertijd": "2-7 werkdagen",
        "Dikte": "9 mm",
        "Breedte": "9",
        "Materiaal": "Grenen",
        "Toepassing": "Rond houten stokken zijn binnen toepasbaar als gordijnroedes voor kleine kozijnen, knutselwerk, interieurbouw en voor het opvullen van ronde gaten. Let op: niet buiten toepasbaar"
      }
    },
    "images": [
      "https://www.houthandelonline.nl/cdn/resize-extended/el:true/rs:fill/w:1500/h:1068/extend:true/background:255:255:255/path/media/catalog/product/r/o/ronde-stok-grenen-9-10st-v_01_main.jpg"
    ],
    "rating": null,
    "review_count": null,
    "reviews_summary": null,
    "scraped_at": "2026-02-05T16:55:41.416951Z",
    "scrape_success": true,
    "scrape_errors": [],
    "embedding_text": "Product: Stok Grenen 9mm geschaafd per 10 stuks\nBrand: HouthandelOnline\nCategory: Douglas hout > Toon alles in Douglas hout > Douglas hout palen > Douglas hout balken > Douglas hout latten en regels\nDescription: Grenen ronde stokken zijn geschaafd en onbehandeld waardoor rondhout vele toepassingen binnenshuis kent. De stok wordt veel toegepast als gordijnroede in kleine kozijnen, in de interieurbouw of voor het opvullen van ronde gaten. Deze Grenen interieurlijst rond is licht van gewicht en kan makkelijk bewerkt worden. Verpakt per 10 stuks.\nSpecifications: Levertijd: 2-7 werkdagen, Dikte: 9 mm, Breedte: 9, Materiaal: Grenen, Toepassing: Rond houten stokken zijn binnen toepasbaar als gordijnroedes voor kleine kozijnen, knutselwerk, interieurbouw en voor het opvullen van ronde gaten. Let op: niet buiten toepasbaar\nPrice: EUR 32.67"
  },
  {
    "id": "05dc43fdec64",
    "source_url": "https://www.houthandelonline.nl/plint-mdf-18x195-3st",
    "name": "Plint MDF 18x195mm vochtwerend wit voorgelakt per 3 stuks",
    "description": "Deze vochtwerende V313 plint is geschikt voor de afwerking van een vloer of wand. De plint is wit voorgelakt en heeft een afmeting van 18x195mm. De plinten zijn verpakt per 3 stuks en hebben een lengte van 488cm",
    "brand": "HouthandelOnline",
    "category": "Douglas hout > Toon alles in Douglas hout > Douglas hout palen > Douglas hout balken > Douglas hout latten en regels",
    "price": 157.13,
    "currency": "EUR",
    "price_raw": "€10,73/m1",
    "specs": {
      "raw": {
        "Levertijd": "2-7 werkdagen",
        "Kopmaat": "18x195 mm",
        "Dikte": "18 mm",
        "Breedte": "195",
        "Materiaal": "MDF",
        "Toepassing": "Lijstwerk voor het afwerken van de aansluiting tussen vloer en wand"
      }
    },
    "images": [
      "https://www.houthandelonline.nl/cdn/resize-extended/el:true/rs:fill/w:1500/h:1068/extend:true/background:255:255:255/path/media/catalog/product/p/l/plint-mdf-18x195-3st-v_01_main.jpg"
    ],
    "rating": null,
    "review_count": null,
    "reviews_summary": null,
    "scraped_at": "2026-02-05T16:55:41.416959Z",
    "scrape_success": true,
    "scrape_errors": [],
    "embedding_text": "Product: Plint MDF 18x195mm vochtwerend wit voorgelakt per 3 stuks\nBrand: HouthandelOnline\nCategory: Douglas hout > Toon alles in Douglas hout > Douglas hout palen > Douglas hout balken > Douglas hout latten en regels\nDescription: Deze vochtwerende V313 plint is geschikt voor de afwerking van een vloer of wand. De plint is wit voorgelakt en heeft een afmeting van 18x195mm. De plinten zijn verpakt per 3 stuks en hebben een lengte van 488cm\nSpecifications: Levertijd: 2-7 werkdagen, Kopmaat: 18x195 mm, Dikte: 18 mm, Breedte: 195, Materiaal: MDF, Toepassing: Lijstwerk voor het afwerken van de aansluiting tussen vloer en wand\nPrice: EUR 157.13"
  },
  {
    "id": "7fa06960f6bc",
    "source_url": "https://www.houthandelonline.nl/plint-mdf-18x167-3st",
    "name": "Plint MDF 18x167mm vochtwerend wit voorgelakt per 3 stuks",
    "description": "Deze vochtwerende V313 plint is geschikt voor de afwerking van een vloer of wand. De plint is wit voorgelakt en heeft een afmeting van 18x167mm. De plinten zijn verpakt per 3 stuks en hebben een lengte van 488cm.",
    "brand": "HouthandelOnline",
    "category": "Douglas hout > Toon alles in Douglas hout > Douglas hout palen > Douglas hout balken > Douglas hout latten en regels",
    "price": 136.94,
    "currency": "EUR",
    "price_raw": "€9,35/m1",
    "specs": {
      "raw": {
        "Levertijd": "2-7 werkdagen",
        "Kopmaat": "18x167 mm",
        "Dikte": "18 mm",
        "Breedte": "167",
        "Materiaal": "MDF",
        "Toepassing": "Lijstwerk voor het afwerken van de aansluiting tussen vloer en wand"
      }
    },
    "images": [
      "https://www.houthandelonline.nl/cdn/resize-extended/el:true/rs:fill/w:1500/h:1068/extend:true/background:255:255:255/path/media/catalog/product/p/l/plint-mdf-18x167-3st-v_01_main.jpg",
      "https://www.houthandelonline.nl/cdn/resize-extended/el:true/rs:fill/w:1500/h:1068/extend:true/background:255:255:255/path/media/catalog/product/p/l/plint-mdf-18x167-3st-v_02_view.jpg"
    ],
    "rating": null,
    "review_count": null,
    "reviews_summary": null,
    "scraped_at": "2026-02-05T16:56:47.781251Z",
    "scrape_success": true,
    "scrape_errors": [],
    "embedding_text": "Product: Plint MDF 18x167mm vochtwerend wit voorgelakt per 3 stuks\nBrand: HouthandelOnline\nCategory: Douglas hout > Toon alles in Douglas hout > Douglas hout palen > Douglas hout balken > Douglas hout latten en regels\nDescription: Deze vochtwerende V313 plint is geschikt voor de afwerking van een vloer of wand. De plint is wit voorgelakt en heeft een afmeting van 18x167mm. De plinten zijn verpakt per 3 stuks en hebben een lengte van 488cm.\nSpecifications: Levertijd: 2-7 werkdagen, Kopmaat: 18x167 mm, Dikte: 18 mm, Breedte: 167, Materiaal: MDF, Toepassing: Lijstwerk voor het afwerken van de aansluiting tussen vloer en wand\nPrice: EUR 136.94"
  },
  {
    "id": "cd46228db62d",
    "source_url": "https://www.houthandelonline.nl/plint-grenen-16x90-5st",
    "name": "Plint Grenen 16x90mm zichtzijde wit afgelakt per 5 stuks",
    "description": "Vloerplint ter afwerking van de aansluiting van de vloer en wand",
    "brand": "HouthandelOnline",
    "category": "Douglas hout > Toon alles in Douglas hout > Douglas hout palen > Douglas hout balken > Douglas hout latten en regels",
    "price": 226.49,
    "currency": "EUR",
    "price_raw": "€9,24/m1",
    "specs": {
      "raw": {
        "Levertijd": "2-7 werkdagen",
        "Kopmaat": "16x90 mm",
        "Dikte": "16 mm",
        "Breedte": "90",
        "Materiaal": "Grenen",
        "Toepassing": "Lijstwerk voor het afwerken van de aansluiting tussen vloer en wand"
      }
    },
    "images": [
      "https://www.houthandelonline.nl/cdn/resize-extended/el:true/rs:fill/w:1500/h:1068/extend:true/background:255:255:255/path/media/catalog/product/p/l/plint-grenen-16x90-5st-v_01_main.jpg",
      "https://www.houthandelonline.nl/cdn/resize-extended/el:true/rs:fill/w:1500/h:1068/extend:true/background:255:255:255/path/media/catalog/product/p/l/plint-grenen-16x90-5st-v_02_view.jpg",
      "https://www.houthandelonline.nl/cdn/resize-extended/el:true/rs:fill/w:1500/h:1068/extend:true/background:255:255:255/path/media/catalog/product/p/l/plint-grenen-16x90-5st-v_03_view.jpg"
    ],
    "rating": null,
    "review_count": null,
    "reviews_summary": null,
    "scraped_at": "2026-02-05T16:56:47.781332Z",
    "scrape_success": true,
    "scrape_errors": [],
    "embedding_text": "Product: Plint Grenen 16x90mm zichtzijde wit afgelakt per 5 stuks\nBrand: HouthandelOnline\nCategory: Douglas hout > Toon alles in Douglas hout > Douglas hout palen > Douglas hout balken > Douglas hout latten en regels\nDescription: Vloerplint ter afwerking van de aansluiting van de vloer en wand\nSpecifications: Levertijd: 2-7 werkdagen, Kopmaat: 16x90 mm, Dikte: 16 mm, Breedte: 90, Materiaal: Grenen, Toepassing: Lijstwerk voor het afwerken van de aansluiting tussen vloer en wand\nPrice: EUR 226.49"
  },
  {
    "id": "952f717eea2f",
    "source_url": "https://www.houthandelonline.nl/neuslijst-meranti-28x140-gegr",
    "name": "Neuslijst Meranti 28x140mm geschaafd wit gegrond",
    "description": "Deze Meranti houten neuslijst is rondom 80mu wit gegrond en heeft afgeronde geschaafde hoeken. Een neuslijst dient ter afwerking en verfraaiing van goten, gevels of schouwen. Verpakt per stuk.",
    "brand": "HouthandelOnline",
    "category": "Douglas hout > Toon alles in Douglas hout > Douglas hout palen > Douglas hout balken > Douglas hout latten en regels",
    "price": 160.74,
    "currency": "EUR",
    "price_raw": "€32,80/m1",
    "specs": {
      "raw": {
        "Kopmaat": "28x140 mm",
        "Dikte": "28 mm",
        "Breedte": "140",
        "Materiaal": "Meranti",
        "Toepassing": "Deze witte neuslijst is geschaafd en rondom 80mu wit gegrond. Deze neuslijst zorgt voor een mooie klassieke uitstraling van de buitengevel als goot"
      }
    },
    "images": [
      "https://www.houthandelonline.nl/cdn/resize-extended/el:true/rs:fill/w:1500/h:1068/extend:true/background:255:255:255/path/media/catalog/product/n/e/neuslijst-meranti-28x140-gegr-v_01_main.jpg"
    ],
    "rating": null,
    "review_count": null,
    "reviews_summary": null,
    "scraped_at": "2026-02-05T16:56:47.781354Z",
    "scrape_success": true,
    "scrape_errors": [],
    "embedding_text": "Product: Neuslijst Meranti 28x140mm geschaafd wit gegrond\nBrand: HouthandelOnline\nCategory: Douglas hout > Toon alles in Douglas hout > Douglas hout palen > Douglas hout balken > Douglas hout latten en regels\nDescription: Deze Meranti houten neuslijst is rondom 80mu wit gegrond en heeft afgeronde geschaafde hoeken. Een neuslijst dient ter afwerking en verfraaiing van goten, gevels of schouwen. Verpakt per stuk.\nSpecifications: Kopmaat: 28x140 mm, Dikte: 28 mm, Breedte: 140, Materiaal: Meranti, Toepassing: Deze witte neuslijst is geschaafd en rondom 80mu wit gegrond. Deze neuslijst zorgt voor een mooie klassieke uitstraling van de buitengevel als goot\nPrice: EUR 160.74"
  },
  {
    "id": "7439bf2e9eb2",
    "source_url": "https://www.houthandelonline.nl/neuslat-tricoya-mdf-k75-5st",
    "name": "Neuslat Tricoya MDF K75 18x89mm (sponning 75mm) geschaafd wit gegrond per 5 stuks",
    "description": "Tricoya MDF neuslat, een glaslat met 75mm sponning, is geschaafd en rondom 60mu gegrond. Deze raamafwerklijst is binnen en buiten toepasbaar als geventileerde neuslat voor het afvoeren van vuil en vocht en het beschermen van het kozijnhout. De neuslat is 18x89mm. Verpakt per 5 stuks.",
    "brand": "HouthandelOnline",
    "category": "Douglas hout > Toon alles in Douglas hout > Douglas hout palen > Douglas hout balken > Douglas hout latten en regels",
    "price": 622.67,
    "currency": "EUR",
    "price_raw": "€25,52/m1",
    "specs": {
      "raw": {
        "Levertijd": "2-7 werkdagen",
        "Kopmaat": "18x89 mm",
        "Dikte": "18 mm",
        "Breedte": "89",
        "Materiaal": "MDF Tricoya"
      }
    },
    "images": [
      "https://www.houthandelonline.nl/cdn/resize-extended/el:true/rs:fill/w:1500/h:1068/extend:true/background:255:255:255/path/media/catalog/product/n/e/neuslat-tricoya-mdf-k75-5st-v_01_main.jpg",
      "https://www.houthandelonline.nl/cdn/resize-extended/el:true/rs:fill/w:1500/h:1068/extend:true/background:255:255:255/path/media/catalog/product/n/e/neuslat-tricoya-mdf-k75-5st-v_02_view.jpg"
    ],
    "rating": null,
    "review_count": null,
    "reviews_summary": null,
    "scraped_at": "2026-02-05T16:56:47.781370Z",
    "scrape_success": true,
    "scrape_errors": [],
    "embedding_text": "Product: Neuslat Tricoya MDF K75 18x89mm (sponning 75mm) geschaafd wit gegrond per 5 stuks\nBrand: HouthandelOnline\nCategory: Douglas hout > Toon alles in Douglas hout > Douglas hout palen > Douglas hout balken > Douglas hout latten en regels\nDescription: Tricoya MDF neuslat, een glaslat met 75mm sponning, is geschaafd en rondom 60mu gegrond. Deze raamafwerklijst is binnen en buiten toepasbaar als geventileerde neuslat voor het afvoeren van vuil en vocht en het beschermen van het kozijnhout. De neuslat is 18x89mm. Verpakt per 5 stuks.\nSpecifications: Levertijd: 2-7 werkdagen, Kopmaat: 18x89 mm, Dikte: 18 mm, Breedte: 89, Materiaal: MDF Tricoya\nPrice: EUR 622.67"
  },
  {
    "id": "7556af4f2a96",
    "source_url": "https://www.houthandelonline.nl/neuslat-tricoya-mdf-k50-5st",
    "name": "Neuslat Tricoya MDF K50 18x64mm (sponning 50mm) geschaafd wit gegrond per 5 stuks",
    "description": "Tricoya MDF neuslat, een glaslat met 50mm sponning, is geschaafd en rondom 60mu gegrond. Deze raamafwerklijst is binnen en buiten toepasbaar als geventileerde neuslat voor het afvoeren van vuil en vocht en het beschermen van het kozijnhout. De neuslat is 18x64mm. Verpakt per 5 stuks.",
    "brand": "HouthandelOnline",
    "category": "Douglas hout > Toon alles in Douglas hout > Douglas hout palen > Douglas hout balken > Douglas hout latten en regels",
    "price": 460.57,
    "currency": "EUR",
    "price_raw": "€18,88/m1",
    "specs": {
      "raw": {
        "Levertijd": "2-7 werkdagen",
        "Kopmaat": "18x64 mm",
        "Dikte": "18 mm",
        "Breedte": "64",
        "Materiaal": "MDF Tricoya"
      }
    },
    "images": [
      "https://www.houthandelonline.nl/cdn/resize-extended/el:true/rs:fill/w:1500/h:1068/extend:true/background:255:255:255/path/media/catalog/product/n/e/neuslat-tricoya-mdf-k50-5st-v_01_main.jpg",
      "https://www.houthandelonline.nl/cdn/resize-extended/el:true/rs:fill/w:1500/h:1068/extend:true/background:255:255:255/path/media/catalog/product/n/e/neuslat-tricoya-mdf-k50-5st-v_02_view.jpg"
    ],
    "rating": null,
    "review_count": null,
    "reviews_summary": null,
    "scraped_at": "2026-02-05T16:56:47.781384Z",
    "scrape_success": true,
    "scrape_errors": [],
    "embedding_text": "Product: Neuslat Tricoya MDF K50 18x64mm (sponning 50mm) geschaafd wit gegrond per 5 stuks\nBrand: HouthandelOnline\nCategory: Douglas hout > Toon alles in Douglas hout > Douglas hout palen > Douglas hout balken > Douglas hout latten en regels\nDescription: Tricoya MDF neuslat, een glaslat met 50mm sponning, is geschaafd en rondom 60mu gegrond. Deze raamafwerklijst is binnen en buiten toepasbaar als geventileerde neuslat voor het afvoeren van vuil en vocht en het beschermen van het kozijnhout. De neuslat is 18x64mm. Verpakt per 5 stuks.\nSpecifications: Levertijd: 2-7 werkdagen, Kopmaat: 18x64 mm, Dikte: 18 mm, Breedte: 64, Materiaal: MDF Tricoya\nPrice: EUR 460.57"
  },
  {
    "id": "a4c53b98ada8",
    "source_url": "https://www.houthandelonline.nl/neuslat-tricoya-mdf-k35-5st",
    "name": "Neuslat Tricoya MDF K35 18x49mm (sponning 35mm) geschaafd wit gegrond per 5 stuks",
    "description": "Tricoya MDF neuslat, een glaslat met 35mm sponning, is geschaafd en rondom 60mu gegrond. Deze raamafwerklijst is binnen en buiten toepasbaar als geventileerde neuslat voor het afvoeren van vuil en vocht en het beschermen van het kozijnhout. De neuslat is 18x49mm. Verpakt per 5 stuks.",
    "brand": "HouthandelOnline",
    "category": "Douglas hout > Toon alles in Douglas hout > Douglas hout palen > Douglas hout balken > Douglas hout latten en regels",
    "price": 368.17,
    "currency": "EUR",
    "price_raw": "€15,09/m1",
    "specs": {
      "raw": {
        "Levertijd": "2-7 werkdagen",
        "Kopmaat": "18x49 mm",
        "Dikte": "18 mm",
        "Breedte": "49",
        "Materiaal": "MDF Tricoya"
      }
    },
    "images": [
      "https://www.houthandelonline.nl/cdn/resize-extended/el:true/rs:fill/w:1500/h:1068/extend:true/background:255:255:255/path/media/catalog/product/n/e/neuslat-tricoya-mdf-k35-5st-v_01_main.jpg",
      "https://www.houthandelonline.nl/cdn/resize-extended/el:true/rs:fill/w:1500/h:1068/extend:true/background:255:255:255/path/media/catalog/product/n/e/neuslat-tricoya-mdf-k35-5st-v_02_view.jpg"
    ],
    "rating": null,
    "review_count": null,
    "reviews_summary": null,
    "scraped_at": "2026-02-05T16:56:47.781398Z",
    "scrape_success": true,
    "scrape_errors": [],
    "embedding_text": "Product: Neuslat Tricoya MDF K35 18x49mm (sponning 35mm) geschaafd wit gegrond per 5 stuks\nBrand: HouthandelOnline\nCategory: Douglas hout > Toon alles in Douglas hout > Douglas hout palen > Douglas hout balken > Douglas hout latten en regels\nDescription: Tricoya MDF neuslat, een glaslat met 35mm sponning, is geschaafd en rondom 60mu gegrond. Deze raamafwerklijst is binnen en buiten toepasbaar als geventileerde neuslat voor het afvoeren van vuil en vocht en het beschermen van het kozijnhout. De neuslat is 18x49mm. Verpakt per 5 stuks.\nSpecifications: Levertijd: 2-7 werkdagen, Kopmaat: 18x49 mm, Dikte: 18 mm, Breedte: 49, Materiaal: MDF Tricoya\nPrice: EUR 368.17"
  },
  {
    "id": "6ab1210a928b",
    "source_url": "https://www.houthandelonline.nl/neuslat-tricoya-mdf-k20-5st",
    "name": "Neuslat Tricoya MDF K20 18x34mm (sponning 20mm) geschaafd wit gegrond per 5 stuks",
    "description": "Tricoya MDF neuslat, een glaslat met 20mm sponning, is geschaafd en rondom 60mu gegrond. Deze raamafwerklijst is binnen en buiten toepasbaar als geventileerde neuslat voor het afvoeren van vuil en vocht en het beschermen van het kozijnhout. De neuslat is 18x34mm. Verpakt per 5 stuks.",
    "brand": "HouthandelOnline",
    "category": "Douglas hout > Toon alles in Douglas hout > Douglas hout palen > Douglas hout balken > Douglas hout latten en regels",
    "price": 284.91,
    "currency": "EUR",
    "price_raw": "€11,68/m1",
    "specs": {
      "raw": {
        "Levertijd": "2-7 werkdagen",
        "Kopmaat": "18x34 mm",
        "Dikte": "18 mm",
        "Breedte": "34",
        "Materiaal": "MDF Tricoya"
      }
    },
    "images": [
      "https://www.houthandelonline.nl/cdn/resize-extended/el:true/rs:fill/w:1500/h:1068/extend:true/background:255:255:255/path/media/catalog/product/n/e/neuslat-tricoya-mdf-k20-5st-v_01_main.jpg",
      "https://www.houthandelonline.nl/cdn/resize-extended/el:true/rs:fill/w:1500/h:1068/extend:true/background:255:255:255/path/media/catalog/product/n/e/neuslat-tricoya-mdf-k20-5st-v_02_view.jpg"
    ],
    "rating": null,
    "review_count": null,
    "reviews_summary": null,
    "scraped_at": "2026-02-05T16:56:47.781413Z",
    "scrape_success": true,
    "scrape_errors": [],
    "embedding_text": "Product: Neuslat Tricoya MDF K20 18x34mm (sponning 20mm) geschaafd wit gegrond per 5 stuks\nBrand: HouthandelOnline\nCategory: Douglas hout > Toon alles in Douglas hout > Douglas hout palen > Douglas hout balken > Douglas hout latten en regels\nDescription: Tricoya MDF neuslat, een glaslat met 20mm sponning, is geschaafd en rondom 60mu gegrond. Deze raamafwerklijst is binnen en buiten toepasbaar als geventileerde neuslat voor het afvoeren van vuil en vocht en het beschermen van het kozijnhout. De neuslat is 18x34mm. Verpakt per 5 stuks.\nSpecifications: Levertijd: 2-7 werkdagen, Kopmaat: 18x34 mm, Dikte: 18 mm, Breedte: 34, Materiaal: MDF Tricoya\nPrice: EUR 284.91"
  },
  {
    "id": "0dba700e8c43",
    "source_url": "https://www.houthandelonline.nl/neuslat-meranti-mdf-k70-5st",
    "name": "Neuslat Meranti K70 18x84mm (sponning 70mm) geschaafd wit gegrond per 5 stuks",
    "description": "Meranti houten neuslat, een glaslat met 70mm sponning, is geschaafd en rondom 80mu gegrond. Deze raamafwerklijst is buiten toepasbaar als geventileerde neuslat voor het afvoeren van vocht en het beschermen van het kozijnhout. Verpakt per 5 stuks.",
    "brand": "HouthandelOnline",
    "category": "Douglas hout > Toon alles in Douglas hout > Douglas hout palen > Douglas hout balken > Douglas hout latten en regels",
    "price": 394.58,
    "currency": "EUR",
    "price_raw": "€16,11/m1",
    "specs": {
      "raw": {
        "Levertijd": "2-7 werkdagen",
        "Kopmaat": "18x84 mm",
        "Dikte": "18 mm",
        "Breedte": "84",
        "Materiaal": "Meranti"
      }
    },
    "images": [
      "https://www.houthandelonline.nl/cdn/resize-extended/el:true/rs:fill/w:1500/h:1068/extend:true/background:255:255:255/path/media/catalog/product/n/e/neuslat-meranti-mdf-k70-5st-v_01_main.jpg",
      "https://www.houthandelonline.nl/cdn/resize-extended/el:true/rs:fill/w:1500/h:1068/extend:true/background:255:255:255/path/media/catalog/product/n/e/neuslat-meranti-mdf-k70-5st-v_02_view.jpg"
    ],
    "rating": null,
    "review_count": null,
    "reviews_summary": null,
    "scraped_at": "2026-02-05T16:56:47.781428Z",
    "scrape_success": true,
    "scrape_errors": [],
    "embedding_text": "Product: Neuslat Meranti K70 18x84mm (sponning 70mm) geschaafd wit gegrond per 5 stuks\nBrand: HouthandelOnline\nCategory: Douglas hout > Toon alles in Douglas hout > Douglas hout palen > Douglas hout balken > Douglas hout latten en regels\nDescription: Meranti houten neuslat, een glaslat met 70mm sponning, is geschaafd en rondom 80mu gegrond. Deze raamafwerklijst is buiten toepasbaar als geventileerde neuslat voor het afvoeren van vocht en het beschermen van het kozijnhout. Verpakt per 5 stuks.\nSpecifications: Levertijd: 2-7 werkdagen, Kopmaat: 18x84 mm, Dikte: 18 mm, Breedte: 84, Materiaal: Meranti\nPrice: EUR 394.58"
  },
  {
    "id": "f96a9732b274",
    "source_url": "https://www.houthandelonline.nl/neuslat-meranti-mdf-k40-5st",
    "name": "Neuslat Meranti K40 18x54mm (sponning 40mm) geschaafd wit gegrond per 5 stuks",
    "description": "Meranti houten neuslat, een glaslat met 40mm sponning, is geschaafd en rondom 80mu gegrond. Deze raamafwerklijst is buiten toepasbaar als geventileerde neuslat voor het afvoeren van vocht en het beschermen van het kozijnhout. Verpakt per 5 stuks.",
    "brand": "HouthandelOnline",
    "category": "Douglas hout > Toon alles in Douglas hout > Douglas hout palen > Douglas hout balken > Douglas hout latten en regels",
    "price": 264.74,
    "currency": "EUR",
    "price_raw": "€10,81/m1",
    "specs": {
      "raw": {
        "Levertijd": "2-7 werkdagen",
        "Kopmaat": "18x54 mm",
        "Dikte": "18 mm",
        "Breedte": "54",
        "Materiaal": "Meranti"
      }
    },
    "images": [
      "https://www.houthandelonline.nl/cdn/resize-extended/el:true/rs:fill/w:1500/h:1068/extend:true/background:255:255:255/path/media/catalog/product/n/e/neuslat-meranti-mdf-k40-5st-v_01_main.jpg",
      "https://www.houthandelonline.nl/cdn/resize-extended/el:true/rs:fill/w:1500/h:1068/extend:true/background:255:255:255/path/media/catalog/product/n/e/neuslat-meranti-mdf-k40-5st-v_02_view.jpg"
    ],
    "rating": null,
    "review_count": null,
    "reviews_summary": null,
    "scraped_at": "2026-02-05T16:56:47.781442Z",
    "scrape_success": true,
    "scrape_errors": [],
    "embedding_text": "Product: Neuslat Meranti K40 18x54mm (sponning 40mm) geschaafd wit gegrond per 5 stuks\nBrand: HouthandelOnline\nCategory: Douglas hout > Toon alles in Douglas hout > Douglas hout palen > Douglas hout balken > Douglas hout latten en regels\nDescription: Meranti houten neuslat, een glaslat met 40mm sponning, is geschaafd en rondom 80mu gegrond. Deze raamafwerklijst is buiten toepasbaar als geventileerde neuslat voor het afvoeren van vocht en het beschermen van het kozijnhout. Verpakt per 5 stuks.\nSpecifications: Levertijd: 2-7 werkdagen, Kopmaat: 18x54 mm, Dikte: 18 mm, Breedte: 54, Materiaal: Meranti\nPrice: EUR 264.74"
  },
  {
    "id": "a0111867caf7",
    "source_url": "https://www.houthandelonline.nl/neuslat-meranti-mdf-k35-5st",
    "name": "Neuslat Meranti K35 18x49mm (sponning 35mm) geschaafd wit gegrond per 5 stuks",
    "description": "Meranti houten neuslat, een glaslat met 35mm sponning, is geschaafd en rondom 80mu gegrond. Deze raamafwerklijst is buiten toepasbaar als geventileerde neuslat voor het afvoeren van vocht en het beschermen van het kozijnhout. Verpakt per 5 stuks.",
    "brand": "HouthandelOnline",
    "category": "Douglas hout > Toon alles in Douglas hout > Douglas hout palen > Douglas hout balken > Douglas hout latten en regels",
    "price": 251.1,
    "currency": "EUR",
    "price_raw": "€10,25/m1",
    "specs": {
      "raw": {
        "Levertijd": "2-7 werkdagen",
        "Kopmaat": "18x49 mm",
        "Dikte": "18 mm",
        "Breedte": "49",
        "Materiaal": "Meranti"
      }
    },
    "images": [
      "https://www.houthandelonline.nl/cdn/resize-extended/el:true/rs:fill/w:1500/h:1068/extend:true/background:255:255:255/path/media/catalog/product/n/e/neuslat-meranti-mdf-k35-5st-v_01_main.jpg",
      "https://www.houthandelonline.nl/cdn/resize-extended/el:true/rs:fill/w:1500/h:1068/extend:true/background:255:255:255/path/media/catalog/product/n/e/neuslat-meranti-mdf-k35-5st-v_02_view.jpg"
    ],
    "rating": null,
    "review_count": null,
    "reviews_summary": null,
    "scraped_at": "2026-02-05T16:56:47.781455Z",
    "scrape_success": true,
    "scrape_errors": [],
    "embedding_text": "Product: Neuslat Meranti K35 18x49mm (sponning 35mm) geschaafd wit gegrond per 5 stuks\nBrand: HouthandelOnline\nCategory: Douglas hout > Toon alles in Douglas hout > Douglas hout palen > Douglas hout balken > Douglas hout latten en regels\nDescription: Meranti houten neuslat, een glaslat met 35mm sponning, is geschaafd en rondom 80mu gegrond. Deze raamafwerklijst is buiten toepasbaar als geventileerde neuslat voor het afvoeren van vocht en het beschermen van het kozijnhout. Verpakt per 5 stuks.\nSpecifications: Levertijd: 2-7 werkdagen, Kopmaat: 18x49 mm, Dikte: 18 mm, Breedte: 49, Materiaal: Meranti\nPrice: EUR 251.1"
  },
  {
    "id": "eb701c641524",
    "source_url": "https://www.houthandelonline.nl/lambrisering-toplijst-mdf-6st",
    "name": "Lambrisering toplijst MDF 30x45mm wit voorgelakt per 6 stuks",
    "description": "Deze MDF lambriseringslijst is wit voorgelakt. Deze afwerklijst wordt veelal toegepast als toplijst voor de bovenzijde van de lambrisering. Verpakt per 6 stuks.",
    "brand": "HouthandelOnline",
    "category": "Douglas hout > Toon alles in Douglas hout > Douglas hout palen > Douglas hout balken > Douglas hout latten en regels",
    "price": 182.81,
    "currency": "EUR",
    "price_raw": "€6,24/m1",
    "specs": {
      "raw": {
        "Levertijd": "2-7 werkdagen",
        "Kopmaat": "30x45 mm",
        "Dikte": "30 mm",
        "Breedte": "45",
        "Materiaal": "MDF",
        "Toepassing": "Met deze MDF houten toplijst kan de bovenzijde van de lambrisering netjes afgewerkt worden. Dit zorgt voor een sfeervolle overgang tussen de lambrisering en de afgewerkte wand. Daarnaast zorgt deze afwerklijst voor het creëren van een klassieke sfeer in de woonruimte of hal"
      }
    },
    "images": [
      "https://www.houthandelonline.nl/cdn/resize-extended/el:true/rs:fill/w:1500/h:1068/extend:true/background:255:255:255/path/media/catalog/product/l/a/lambrisering-toplijst-mdf-6st-v_01_main.jpg",
      "https://www.houthandelonline.nl/cdn/resize-extended/el:true/rs:fill/w:1500/h:1068/extend:true/background:255:255:255/path/media/catalog/product/l/a/lambrisering-toplijst-mdf-6st-v_02_view.jpg"
    ],
    "rating": null,
    "review_count": null,
    "reviews_summary": null,
    "scraped_at": "2026-02-05T16:56:47.781470Z",
    "scrape_success": true,
    "scrape_errors": [],
    "embedding_text": "Product: Lambrisering toplijst MDF 30x45mm wit voorgelakt per 6 stuks\nBrand: HouthandelOnline\nCategory: Douglas hout > Toon alles in Douglas hout > Douglas hout palen > Douglas hout balken > Douglas hout latten en regels\nDescription: Deze MDF lambriseringslijst is wit voorgelakt. Deze afwerklijst wordt veelal toegepast als toplijst voor de bovenzijde van de lambrisering. Verpakt per 6 stuks.\nSpecifications: Levertijd: 2-7 werkdagen, Kopmaat: 30x45 mm, Dikte: 30 mm, Breedte: 45, Materiaal: MDF, Toepassing: Met deze MDF houten toplijst kan de bovenzijde van de lambrisering netjes afgewerkt worden. Dit zorgt voor een sfeervolle overgang tussen de lambrisering en de afgewerkte wand. Daarnaast zorgt deze afwerklijst voor het creëren van een klassieke sfeer in de woonruimte of hal\nPrice: EUR 182.81"
  },
  {
    "id": "ef4eddd42dcd",
    "source_url": "https://www.houthandelonline.nl/kwartrond-latmeranti14x14mm10st",
    "name": "Lat kwartrond Meranti 14x14mm geschaafd per 10 stuks",
    "description": "Kwartronde latten zijn geschaafd en onbehandeld. Houten afwerklijsten zorgen voor een nette hoekafwerking binnenshuis. Deze kwartronde latten zijn geschikt voor het afwerken van binnenhoeken van wanden, meubels of voor een decoratieve overgang van de muur naar het plafond of kozijn. Verpakt per 10 stuks.",
    "brand": "HouthandelOnline",
    "category": "Douglas hout > Toon alles in Douglas hout > Douglas hout palen > Douglas hout balken > Douglas hout latten en regels",
    "price": 48.92,
    "currency": "EUR",
    "price_raw": "€1,78/m1",
    "specs": {
      "raw": {
        "Levertijd": "2-7 werkdagen",
        "Kopmaat": "14x14 mm",
        "Dikte": "14 mm",
        "Breedte": "14",
        "Materiaal": "Meranti"
      }
    },
    "images": [
      "https://www.houthandelonline.nl/cdn/resize-extended/el:true/rs:fill/w:1500/h:1068/extend:true/background:255:255:255/path/media/catalog/product/k/w/kwartrond-latmeranti14x14mm10st-v_01_main.jpg"
    ],
    "rating": null,
    "review_count": null,
    "reviews_summary": null,
    "scraped_at": "2026-02-05T16:56:47.781483Z",
    "scrape_success": true,
    "scrape_errors": [],
    "embedding_text": "Product: Lat kwartrond Meranti 14x14mm geschaafd per 10 stuks\nBrand: HouthandelOnline\nCategory: Douglas hout > Toon alles in Douglas hout > Douglas hout palen > Douglas hout balken > Douglas hout latten en regels\nDescription: Kwartronde latten zijn geschaafd en onbehandeld. Houten afwerklijsten zorgen voor een nette hoekafwerking binnenshuis. Deze kwartronde latten zijn geschikt voor het afwerken van binnenhoeken van wanden, meubels of voor een decoratieve overgang van de muur naar het plafond of kozijn. Verpakt per 10 stuks.\nSpecifications: Levertijd: 2-7 werkdagen, Kopmaat: 14x14 mm, Dikte: 14 mm, Breedte: 14, Materiaal: Meranti\nPrice: EUR 48.92"
  },
  {
    "id": "ea1c981466af",
    "source_url": "https://www.houthandelonline.nl/kraalplint-mdf-vochtw-18x90-4st",
    "name": "Kraalplint MDF 18x90mm vochtwerend wit voorgelakt bos a 4 stuks",
    "description": "Deze vochtwerende V313 vloerplint met een kraalmodel aan de bovenzijde ter afwerking van de aansluiting van de vloer en wand. Deze kraalplint heeft een afmeting van 18x90mm en is wit voorgelakt. De plinten zijn verpakt per 4 stuks en hebben een lengte van 488cm.",
    "brand": "HouthandelOnline",
    "category": "Douglas hout > Toon alles in Douglas hout > Douglas hout palen > Douglas hout balken > Douglas hout latten en regels",
    "price": 90.7,
    "currency": "EUR",
    "price_raw": "€4,65/m1",
    "specs": {
      "raw": {
        "Levertijd": "2-7 werkdagen",
        "Kopmaat": "18x90 mm",
        "Dikte": "18 mm",
        "Breedte": "90",
        "Materiaal": "MDF",
        "Toepassing": "Kraalplinten voor het afwerken van de aansluiting tussen vloer en wand"
      }
    },
    "images": [
      "https://www.houthandelonline.nl/cdn/resize-extended/el:true/rs:fill/w:1500/h:1068/extend:true/background:255:255:255/path/media/catalog/product/k/r/kraalplint-mdf-vochtw-18x90-4st-v_01_main.jpg",
      "https://www.houthandelonline.nl/cdn/resize-extended/el:true/rs:fill/w:1500/h:1068/extend:true/background:255:255:255/path/media/catalog/product/k/r/kraalplint-mdf-vochtw-18x90-4st-v_02_view.jpg"
    ],
    "rating": null,
    "review_count": null,
    "reviews_summary": null,
    "scraped_at": "2026-02-05T16:56:47.781497Z",
    "scrape_success": true,
    "scrape_errors": [],
    "embedding_text": "Product: Kraalplint MDF 18x90mm vochtwerend wit voorgelakt bos a 4 stuks\nBrand: HouthandelOnline\nCategory: Douglas hout > Toon alles in Douglas hout > Douglas hout palen > Douglas hout balken > Douglas hout latten en regels\nDescription: Deze vochtwerende V313 vloerplint met een kraalmodel aan de bovenzijde ter afwerking van de aansluiting van de vloer en wand. Deze kraalplint heeft een afmeting van 18x90mm en is wit voorgelakt. De plinten zijn verpakt per 4 stuks en hebben een lengte van 488cm.\nSpecifications: Levertijd: 2-7 werkdagen, Kopmaat: 18x90 mm, Dikte: 18 mm, Breedte: 90, Materiaal: MDF, Toepassing: Kraalplinten voor het afwerken van de aansluiting tussen vloer en wand\nPrice: EUR 90.7"
  },
  {
    "id": "0ac2e94c97d6",
    "source_url": "https://www.houthandelonline.nl/koplat-mdf-model-e-18x80-4st",
    "name": "Koplat MDF Vochtwerend (model E) 18x80mm met rechte kanten wit voorgelakt per 4 stuks",
    "description": "Deze vochtwerende V313 koplat (model E) met rechte kanten is geschikt voor de afwerking van een vloer of wand van de aansluiting van kozijnstijl en afgewerkte wand. De koplatten zijn wit voorgelakt en zijn voor de sierlijke afwerking rond deuren of ramen. \n\n Deze koplat heeft een afmeting van 18x80mm en is wit voorgelakt. De koplatten zijn verpakt per 4 stuks en hebben een lengte van 488cm.",
    "brand": "HouthandelOnline",
    "category": "Douglas hout > Toon alles in Douglas hout > Douglas hout palen > Douglas hout balken > Douglas hout latten en regels",
    "price": 110.78,
    "currency": "EUR",
    "price_raw": "€5,67/m1",
    "specs": {
      "raw": {
        "Levertijd": "2-7 werkdagen",
        "Kopmaat": "12x80 mm",
        "Dikte": "18 mm",
        "Breedte": "80",
        "Materiaal": "MDF",
        "Toepassing": "Lijstwerk voor het afwerken van de aansluiting tussen wand en kozijn"
      }
    },
    "images": [
      "https://www.houthandelonline.nl/cdn/resize-extended/el:true/rs:fill/w:1500/h:1068/extend:true/background:255:255:255/path/media/catalog/product/k/o/koplat-mdf-model-e-18x80-4st-v_01_main.jpg"
    ],
    "rating": null,
    "review_count": null,
    "reviews_summary": null,
    "scraped_at": "2026-02-05T16:56:47.781511Z",
    "scrape_success": true,
    "scrape_errors": [],
    "embedding_text": "Product: Koplat MDF Vochtwerend (model E) 18x80mm met rechte kanten wit voorgelakt per 4 stuks\nBrand: HouthandelOnline\nCategory: Douglas hout > Toon alles in Douglas hout > Douglas hout palen > Douglas hout balken > Douglas hout latten en regels\nDescription: Deze vochtwerende V313 koplat (model E) met rechte kanten is geschikt voor de afwerking van een vloer of wand van de aansluiting van kozijnstijl en afgewerkte wand. De koplatten zijn wit voorgelakt en zijn voor de sierlijke afwerking rond deuren of ramen. \n\n Deze koplat heeft een afmeting van 18x80mm en is wit voorgelakt. De koplatten zijn verpakt per 4 stuks en hebben een lengte van 488cm.\nSpecifications: Levertijd: 2-7 werkdagen, Kopmaat: 12x80 mm, Dikte: 18 mm, Breedte: 80, Materiaal: MDF, Toepassing: Lijstwerk voor het afwerken van de aansluiting tussen wand en kozijn\nPrice: EUR 110.78"
  },
  {
    "id": "39c1307215f5",
    "source_url": "https://www.houthandelonline.nl/koplat-mdf-model-e-12x70-4st",
    "name": "Koplat MDF Vochtwerend (model E) 12x70mm met rechte kanten wit voorgelakt per 4 stuks",
    "description": "Deze vochtwerende V313 koplat (model E) met rechte kanten is geschikt voor de afwerking van een vloer of wand van de aansluiting van kozijnstijl en afgewerkte wand. De koplatten zijn wit voorgelakt en zijn voor de sierlijke afwerking rond deuren of ramen. \n\n Deze koplat heeft een afmeting van 12x70mm en is wit voorgelakt. De koplatten zijn verpakt per 4 stuks en hebben een lengte van 488cm.",
    "brand": "HouthandelOnline",
    "category": "Douglas hout > Toon alles in Douglas hout > Douglas hout palen > Douglas hout balken > Douglas hout latten en regels",
    "price": 48.18,
    "currency": "EUR",
    "price_raw": "€2,47/m1",
    "specs": {
      "raw": {
        "Levertijd": "2-7 werkdagen",
        "Kopmaat": "12x70 mm",
        "Dikte": "12 mm",
        "Breedte": "70",
        "Materiaal": "MDF",
        "Toepassing": "Lijstwerk voor het afwerken van de aansluiting tussen wand en kozijn"
      }
    },
    "images": [
      "https://www.houthandelonline.nl/cdn/resize-extended/el:true/rs:fill/w:1500/h:1068/extend:true/background:255:255:255/path/media/catalog/product/k/o/koplat-mdf-model-e-12x70-4st-v_01_main.jpg"
    ],
    "rating": null,
    "review_count": null,
    "reviews_summary": null,
    "scraped_at": "2026-02-05T16:56:47.781524Z",
    "scrape_success": true,
    "scrape_errors": [],
    "embedding_text": "Product: Koplat MDF Vochtwerend (model E) 12x70mm met rechte kanten wit voorgelakt per 4 stuks\nBrand: HouthandelOnline\nCategory: Douglas hout > Toon alles in Douglas hout > Douglas hout palen > Douglas hout balken > Douglas hout latten en regels\nDescription: Deze vochtwerende V313 koplat (model E) met rechte kanten is geschikt voor de afwerking van een vloer of wand van de aansluiting van kozijnstijl en afgewerkte wand. De koplatten zijn wit voorgelakt en zijn voor de sierlijke afwerking rond deuren of ramen. \n\n Deze koplat heeft een afmeting van 12x70mm en is wit voorgelakt. De koplatten zijn verpakt per 4 stuks en hebben een lengte van 488cm.\nSpecifications: Levertijd: 2-7 werkdagen, Kopmaat: 12x70 mm, Dikte: 12 mm, Breedte: 70, Materiaal: MDF, Toepassing: Lijstwerk voor het afwerken van de aansluiting tussen wand en kozijn\nPrice: EUR 48.18"
  },
  {
    "id": "74f541bc872e",
    "source_url": "https://www.houthandelonline.nl/koplat-mdf-model-b-16x70-4st",
    "name": "Koplat MDF Vochtwerend (model B) 16x70mm met schuine kanten wit voorgelakt per 4 stuks",
    "description": "Deze vochtwerende V313 koplat (model B) met schuine kanten is geschikt voor de afwerking van een vloer of wand van de aansluiting van kozijnstijl en afgewerkte wand. De koplatten zijn wit voorgelakt en zijn voor de sierlijke afwerking rond deuren of ramen. Deze koplat heeft een afmeting van 16x70mm en is wit voorgelakt. De koplatten zijn verpakt per 4 stuks en hebben een lengte van 488cm.",
    "brand": "HouthandelOnline",
    "category": "Douglas hout > Toon alles in Douglas hout > Douglas hout palen > Douglas hout balken > Douglas hout latten en regels",
    "price": 69.2,
    "currency": "EUR",
    "price_raw": "€3,55/m1",
    "specs": {
      "raw": {
        "Levertijd": "2-7 werkdagen",
        "Kopmaat": "16x70 mm",
        "Dikte": "16 mm",
        "Breedte": "70",
        "Materiaal": "MDF",
        "Toepassing": "Lijstwerk voor het afwerken van de aansluiting tussen wand en kozijn"
      }
    },
    "images": [
      "https://www.houthandelonline.nl/cdn/resize-extended/el:true/rs:fill/w:1500/h:1068/extend:true/background:255:255:255/path/media/catalog/product/k/o/koplat-mdf-model-b-16x70-4st-v_01_main.jpg"
    ],
    "rating": null,
    "review_count": null,
    "reviews_summary": null,
    "scraped_at": "2026-02-05T16:56:47.781538Z",
    "scrape_success": true,
    "scrape_errors": [],
    "embedding_text": "Product: Koplat MDF Vochtwerend (model B) 16x70mm met schuine kanten wit voorgelakt per 4 stuks\nBrand: HouthandelOnline\nCategory: Douglas hout > Toon alles in Douglas hout > Douglas hout palen > Douglas hout balken > Douglas hout latten en regels\nDescription: Deze vochtwerende V313 koplat (model B) met schuine kanten is geschikt voor de afwerking van een vloer of wand van de aansluiting van kozijnstijl en afgewerkte wand. De koplatten zijn wit voorgelakt en zijn voor de sierlijke afwerking rond deuren of ramen. Deze koplat heeft een afmeting van 16x70mm en is wit voorgelakt. De koplatten zijn verpakt per 4 stuks en hebben een lengte van 488cm.\nSpecifications: Levertijd: 2-7 werkdagen, Kopmaat: 16x70 mm, Dikte: 16 mm, Breedte: 70, Materiaal: MDF, Toepassing: Lijstwerk voor het afwerken van de aansluiting tussen wand en kozijn\nPrice: EUR 69.2"
  },
  {
    "id": "9e9648a1ea73",
    "source_url": "https://www.houthandelonline.nl/koplat-mdf-model-b-12x70-4st",
    "name": "Koplat MDF Vochtwerend (model B) 12x70mm met schuine kanten wit voorgelakt per 4 stuks",
    "description": "Deze vochtwerende V313 koplat (model B) met schuine kanten is geschikt voor de afwerking van een vloer of wand van de aansluiting van kozijnstijl en afgewerkte wand. De koplatten zijn wit voorgelakt en zijn voor de sierlijke afwerking rond deuren of ramen. Deze koplat heeft een afmeting van 12x70mm en is wit voorgelakt. De koplatten zijn verpakt per 4 stuks en hebben een lengte van 488cm.",
    "brand": "HouthandelOnline",
    "category": "Douglas hout > Toon alles in Douglas hout > Douglas hout palen > Douglas hout balken > Douglas hout latten en regels",
    "price": 48.18,
    "currency": "EUR",
    "price_raw": "€2,47/m1",
    "specs": {
      "raw": {
        "Levertijd": "2-7 werkdagen",
        "Kopmaat": "12x70 mm",
        "Dikte": "12 mm",
        "Breedte": "70",
        "Materiaal": "MDF",
        "Toepassing": "Lijstwerk voor het afwerken van de aansluiting tussen wand en kozijn"
      }
    },
    "images": [
      "https://www.houthandelonline.nl/cdn/resize-extended/el:true/rs:fill/w:1500/h:1068/extend:true/background:255:255:255/path/media/catalog/product/k/o/koplat-mdf-model-b-12x70-4st-v_01_main.jpg"
    ],
    "rating": null,
    "review_count": null,
    "reviews_summary": null,
    "scraped_at": "2026-02-05T16:56:47.781549Z",
    "scrape_success": true,
    "scrape_errors": [],
    "embedding_text": "Product: Koplat MDF Vochtwerend (model B) 12x70mm met schuine kanten wit voorgelakt per 4 stuks\nBrand: HouthandelOnline\nCategory: Douglas hout > Toon alles in Douglas hout > Douglas hout palen > Douglas hout balken > Douglas hout latten en regels\nDescription: Deze vochtwerende V313 koplat (model B) met schuine kanten is geschikt voor de afwerking van een vloer of wand van de aansluiting van kozijnstijl en afgewerkte wand. De koplatten zijn wit voorgelakt en zijn voor de sierlijke afwerking rond deuren of ramen. Deze koplat heeft een afmeting van 12x70mm en is wit voorgelakt. De koplatten zijn verpakt per 4 stuks en hebben een lengte van 488cm.\nSpecifications: Levertijd: 2-7 werkdagen, Kopmaat: 12x70 mm, Dikte: 12 mm, Breedte: 70, Materiaal: MDF, Toepassing: Lijstwerk voor het afwerken van de aansluiting tussen wand en kozijn\nPrice: EUR 48.18"
  },
  {
    "id": "6605ace1385c",
    "source_url": "https://www.houthandelonline.nl/koplat-mdf-model-b-12x37-10st",
    "name": "Koplat MDF Vochtwerend (model B) 12x37mm met schuine kanten wit voorgelakt per 10 stuks",
    "description": "Deze vochtwerende V313 koplat (model B) met schuine kanten is geschikt voor de afwerking van een vloer of wand van de aansluiting van kozijnstijl en afgewerkte wand. De koplatten zijn wit voorgelakt en zijn voor de sierlijke afwerking rond deuren of ramen. Deze koplat heeft een afmeting van 12x37mm en is wit voorgelakt. De koplatten zijn verpakt per 10 stuks en hebben een lengte van 488cm.",
    "brand": "HouthandelOnline",
    "category": "Douglas hout > Toon alles in Douglas hout > Douglas hout palen > Douglas hout balken > Douglas hout latten en regels",
    "price": 70.86,
    "currency": "EUR",
    "price_raw": "€1,45/m1",
    "specs": {
      "raw": {
        "Levertijd": "2-7 werkdagen",
        "Kopmaat": "12x37 mm",
        "Dikte": "12 mm",
        "Breedte": "37",
        "Materiaal": "MDF",
        "Toepassing": "Lijstwerk voor het afwerken van de aansluiting tussen wand en kozijn"
      }
    },
    "images": [
      "https://www.houthandelonline.nl/cdn/resize-extended/el:true/rs:fill/w:1500/h:1068/extend:true/background:255:255:255/path/media/catalog/product/k/o/koplat-mdf-model-b-12x37-10st-v_01_main.jpg"
    ],
    "rating": null,
    "review_count": null,
    "reviews_summary": null,
    "scraped_at": "2026-02-05T16:56:47.781558Z",
    "scrape_success": true,
    "scrape_errors": [],
    "embedding_text": "Product: Koplat MDF Vochtwerend (model B) 12x37mm met schuine kanten wit voorgelakt per 10 stuks\nBrand: HouthandelOnline\nCategory: Douglas hout > Toon alles in Douglas hout > Douglas hout palen > Douglas hout balken > Douglas hout latten en regels\nDescription: Deze vochtwerende V313 koplat (model B) met schuine kanten is geschikt voor de afwerking van een vloer of wand van de aansluiting van kozijnstijl en afgewerkte wand. De koplatten zijn wit voorgelakt en zijn voor de sierlijke afwerking rond deuren of ramen. Deze koplat heeft een afmeting van 12x37mm en is wit voorgelakt. De koplatten zijn verpakt per 10 stuks en hebben een lengte van 488cm.\nSpecifications: Levertijd: 2-7 werkdagen, Kopmaat: 12x37 mm, Dikte: 12 mm, Breedte: 37, Materiaal: MDF, Toepassing: Lijstwerk voor het afwerken van de aansluiting tussen wand en kozijn\nPrice: EUR 70.86"
  },
  {
    "id": "c405e0a046e6",
    "source_url": "https://www.houthandelonline.nl/koplat-mdf-halve-e-10st",
    "name": "Koplat MDF Vochtwerend (model halve E) 12x45mm wit voorgelakt per 10 stuks",
    "description": "Deze vochtwerende V313 koplat (model halve E) is geschikt voor de afwerking van een vloer of wand van de aansluiting van kozijnstijl en afgewerkte wand. De koplatten zijn wit voorgelakt en zijn voor de sierlijke afwerking rond deuren of ramen. Deze koplat heeft een afmeting van 12x45mm en is wit voorgelakt. De koplatten zijn verpakt per 10 stuks en hebben een lengte van 488cm.",
    "brand": "HouthandelOnline",
    "category": "Douglas hout > Toon alles in Douglas hout > Douglas hout palen > Douglas hout balken > Douglas hout latten en regels",
    "price": 81.48,
    "currency": "EUR",
    "price_raw": "€1,67/m1",
    "specs": {
      "raw": {
        "Levertijd": "2-7 werkdagen",
        "Kopmaat": "12x45 mm",
        "Dikte": "12 mm",
        "Breedte": "45",
        "Materiaal": "MDF",
        "Toepassing": "Lijstwerk voor het afwerken van de aansluiting tussen wand en kozijn"
      }
    },
    "images": [
      "https://www.houthandelonline.nl/cdn/resize-extended/el:true/rs:fill/w:1500/h:1068/extend:true/background:255:255:255/path/media/catalog/product/k/o/koplat-mdf-halve-e-10st-v_01_main.jpg"
    ],
    "rating": null,
    "review_count": null,
    "reviews_summary": null,
    "scraped_at": "2026-02-05T16:56:47.781569Z",
    "scrape_success": true,
    "scrape_errors": [],
    "embedding_text": "Product: Koplat MDF Vochtwerend (model halve E) 12x45mm wit voorgelakt per 10 stuks\nBrand: HouthandelOnline\nCategory: Douglas hout > Toon alles in Douglas hout > Douglas hout palen > Douglas hout balken > Douglas hout latten en regels\nDescription: Deze vochtwerende V313 koplat (model halve E) is geschikt voor de afwerking van een vloer of wand van de aansluiting van kozijnstijl en afgewerkte wand. De koplatten zijn wit voorgelakt en zijn voor de sierlijke afwerking rond deuren of ramen. Deze koplat heeft een afmeting van 12x45mm en is wit voorgelakt. De koplatten zijn verpakt per 10 stuks en hebben een lengte van 488cm.\nSpecifications: Levertijd: 2-7 werkdagen, Kopmaat: 12x45 mm, Dikte: 12 mm, Breedte: 45, Materiaal: MDF, Toepassing: Lijstwerk voor het afwerken van de aansluiting tussen wand en kozijn\nPrice: EUR 81.48"
  },
  {
    "id": "dbf6a321eb10",
    "source_url": "https://www.houthandelonline.nl/koplat-grenen-model-b-16x45",
    "name": "Koplat Grenen (Model B) 16x45mm met schuine kanten wit gegrond per 10 stuks",
    "description": "Koplat ter afwerking van de aansluiting van kozijnstijl en afgewerkte wand",
    "brand": "HouthandelOnline",
    "category": "Douglas hout > Toon alles in Douglas hout > Douglas hout palen > Douglas hout balken > Douglas hout latten en regels",
    "price": 142.3,
    "currency": "EUR",
    "price_raw": "€2,90/m1",
    "specs": {
      "raw": {
        "Levertijd": "2-7 werkdagen",
        "Kopmaat": "16x45 mm",
        "Dikte": "16 mm",
        "Breedte": "45",
        "Materiaal": "Grenen",
        "Toepassing": "Lijstwerk voor het afwerken van de aansluiting tussen wand en kozijn"
      }
    },
    "images": [
      "https://www.houthandelonline.nl/cdn/resize-extended/el:true/rs:fill/w:1500/h:1068/extend:true/background:255:255:255/path/media/catalog/product/k/o/koplat-grenen-model-b-16x45-v_01_main.jpg",
      "https://www.houthandelonline.nl/cdn/resize-extended/el:true/rs:fill/w:1500/h:1068/extend:true/background:255:255:255/path/media/catalog/product/k/o/koplat-grenen-model-b-16x45-v_02_view.jpg",
      "https://www.houthandelonline.nl/cdn/resize-extended/el:true/rs:fill/w:1500/h:1068/extend:true/background:255:255:255/path/media/catalog/product/k/o/koplat-grenen-model-b-16x45-v_03_view.jpg"
    ],
    "rating": null,
    "review_count": null,
    "reviews_summary": null,
    "scraped_at": "2026-02-05T16:56:47.781579Z",
    "scrape_success": true,
    "scrape_errors": [],
    "embedding_text": "Product: Koplat Grenen (Model B) 16x45mm met schuine kanten wit gegrond per 10 stuks\nBrand: HouthandelOnline\nCategory: Douglas hout > Toon alles in Douglas hout > Douglas hout palen > Douglas hout balken > Douglas hout latten en regels\nDescription: Koplat ter afwerking van de aansluiting van kozijnstijl en afgewerkte wand\nSpecifications: Levertijd: 2-7 werkdagen, Kopmaat: 16x45 mm, Dikte: 16 mm, Breedte: 45, Materiaal: Grenen, Toepassing: Lijstwerk voor het afwerken van de aansluiting tussen wand en kozijn\nPrice: EUR 142.3"
  },
  {
    "id": "0b9b038c7aea",
    "source_url": "https://www.houthandelonline.nl/hollat-meranti-18x18-10st",
    "name": "Hollat Meranti 18x18mm geschaafd per 10 stuks",
    "description": "Hardhouten hollatten zijn geschaafd en onbehandeld. Houten afwerklijsten zorgen voor een nette hoekafwerking binnenshuis. Deze hollatten zijn geschikt voor het afwerken van binnenhoeken van wanden, meubels of voor een decoratieve overgang van de muur naar het plafond of kozijn. Deze Hardhouten afwerklijst is zeer sterk en gaat lang mee. Verpakt per 10 stuks.",
    "brand": "HouthandelOnline",
    "category": "Douglas hout > Toon alles in Douglas hout > Douglas hout palen > Douglas hout balken > Douglas hout latten en regels",
    "price": 78.53,
    "currency": "EUR",
    "price_raw": "€2,86/m1",
    "specs": {
      "raw": {
        "Levertijd": "2-7 werkdagen",
        "Kopmaat": "18x18 mm",
        "Dikte": "18 mm",
        "Breedte": "18",
        "Materiaal": "Meranti"
      }
    },
    "images": [
      "https://www.houthandelonline.nl/cdn/resize-extended/el:true/rs:fill/w:1500/h:1068/extend:true/background:255:255:255/path/media/catalog/product/h/o/hollat-meranti-18x18-10st-v_01_main.jpg"
    ],
    "rating": null,
    "review_count": null,
    "reviews_summary": null,
    "scraped_at": "2026-02-05T16:56:47.781589Z",
    "scrape_success": true,
    "scrape_errors": [],
    "embedding_text": "Product: Hollat Meranti 18x18mm geschaafd per 10 stuks\nBrand: HouthandelOnline\nCategory: Douglas hout > Toon alles in Douglas hout > Douglas hout palen > Douglas hout balken > Douglas hout latten en regels\nDescription: Hardhouten hollatten zijn geschaafd en onbehandeld. Houten afwerklijsten zorgen voor een nette hoekafwerking binnenshuis. Deze hollatten zijn geschikt voor het afwerken van binnenhoeken van wanden, meubels of voor een decoratieve overgang van de muur naar het plafond of kozijn. Deze Hardhouten afwerklijst is zeer sterk en gaat lang mee. Verpakt per 10 stuks.\nSpecifications: Levertijd: 2-7 werkdagen, Kopmaat: 18x18 mm, Dikte: 18 mm, Breedte: 18, Materiaal: Meranti\nPrice: EUR 78.53"
  },
  {
    "id": "e40b6fc13273",
    "source_url": "https://www.houthandelonline.nl/hollat-grenen-18x28-10st",
    "name": "Hollat Grenen 18x28mm geschaafd per 10 stuks",
    "description": "Grenen hollatten zijn geschaafd en onbehandeld. Houten afwerklijsten zorgen voor een nette hoekafwerking binnenshuis. Deze hollatten zijn geschikt voor het afwerken van binnenhoeken van wanden, meubels of voor een decoratieve overgang van de muur naar het plafond of kozijn. Deze Grenen houten afwerklijst is licht van gewicht en kan makkelijk bewerkt worden. Verpakt per 10 stuks.",
    "brand": "HouthandelOnline",
    "category": "Douglas hout > Toon alles in Douglas hout > Douglas hout palen > Douglas hout balken > Douglas hout latten en regels",
    "price": 63.71,
    "currency": "EUR",
    "price_raw": "€2,36/m1",
    "specs": {
      "raw": {
        "Levertijd": "2-7 werkdagen",
        "Kopmaat": "18x28 mm",
        "Dikte": "18 mm",
        "Breedte": "28",
        "Materiaal": "Grenen"
      }
    },
    "images": [
      "https://www.houthandelonline.nl/cdn/resize-extended/el:true/rs:fill/w:1500/h:1068/extend:true/background:255:255:255/path/media/catalog/product/h/o/hollat-grenen-18x28-10st-v_01_main.jpg"
    ],
    "rating": null,
    "review_count": null,
    "reviews_summary": null,
    "scraped_at": "2026-02-05T16:56:47.781599Z",
    "scrape_success": true,
    "scrape_errors": [],
    "embedding_text": "Product: Hollat Grenen 18x28mm geschaafd per 10 stuks\nBrand: HouthandelOnline\nCategory: Douglas hout > Toon alles in Douglas hout > Douglas hout palen > Douglas hout balken > Douglas hout latten en regels\nDescription: Grenen hollatten zijn geschaafd en onbehandeld. Houten afwerklijsten zorgen voor een nette hoekafwerking binnenshuis. Deze hollatten zijn geschikt voor het afwerken van binnenhoeken van wanden, meubels of voor een decoratieve overgang van de muur naar het plafond of kozijn. Deze Grenen houten afwerklijst is licht van gewicht en kan makkelijk bewerkt worden. Verpakt per 10 stuks.\nSpecifications: Levertijd: 2-7 werkdagen, Kopmaat: 18x28 mm, Dikte: 18 mm, Breedte: 28, Materiaal: Grenen\nPrice: EUR 63.71"
  },
  {
    "id": "c32e96073520",
    "source_url": "https://www.houthandelonline.nl/hoeklat-grenen-28x28-10st",
    "name": "Hoeklat Grenen 28x28mm geschaafd per 10 stuks",
    "description": "Grenen hoeklatten zijn geschaafd en onbehandeld. Houten hoekprofielen zorgen voor een nette hoekafwerking binnenshuis. Deze hoeklatten zijn geschikt voor het afwerken van hoeken van wanden, meubels of voor een decoratieve overgang van de ene naar de andere wand. Deze Grenen houten afwerklijst is licht van gewicht en kan makkelijk bewerkt worden. Verpakt per 10 stuks.",
    "brand": "HouthandelOnline",
    "category": "Douglas hout > Toon alles in Douglas hout > Douglas hout palen > Douglas hout balken > Douglas hout latten en regels",
    "price": 145.38,
    "currency": "EUR",
    "price_raw": "€5,38/m1",
    "specs": {
      "raw": {
        "Levertijd": "2-7 werkdagen",
        "Kopmaat": "28x28 mm",
        "Dikte": "28 mm",
        "Breedte": "28",
        "Materiaal": "Grenen",
        "Toepassing": "Deze Grenen houten hoeklat is binnen toepasbaar voor het afwerken van verschillende binnen- en buitenhoeken van bijvoorbeeld wanden, meubels, vloeren of andere klussen. Ook voorzien hoekprofielen in het maken van een decoratieve overgang van wanden. Let op: niet buiten toepasbaar"
      }
    },
    "images": [
      "https://www.houthandelonline.nl/cdn/resize-extended/el:true/rs:fill/w:1500/h:1068/extend:true/background:255:255:255/path/media/catalog/product/h/o/hoeklat-grenen-28x28-10st-v_01_main.jpg"
    ],
    "rating": null,
    "review_count": null,
    "reviews_summary": null,
    "scraped_at": "2026-02-05T16:56:47.781612Z",
    "scrape_success": true,
    "scrape_errors": [],
    "embedding_text": "Product: Hoeklat Grenen 28x28mm geschaafd per 10 stuks\nBrand: HouthandelOnline\nCategory: Douglas hout > Toon alles in Douglas hout > Douglas hout palen > Douglas hout balken > Douglas hout latten en regels\nDescription: Grenen hoeklatten zijn geschaafd en onbehandeld. Houten hoekprofielen zorgen voor een nette hoekafwerking binnenshuis. Deze hoeklatten zijn geschikt voor het afwerken van hoeken van wanden, meubels of voor een decoratieve overgang van de ene naar de andere wand. Deze Grenen houten afwerklijst is licht van gewicht en kan makkelijk bewerkt worden. Verpakt per 10 stuks.\nSpecifications: Levertijd: 2-7 werkdagen, Kopmaat: 28x28 mm, Dikte: 28 mm, Breedte: 28, Materiaal: Grenen, Toepassing: Deze Grenen houten hoeklat is binnen toepasbaar voor het afwerken van verschillende binnen- en buitenhoeken van bijvoorbeeld wanden, meubels, vloeren of andere klussen. Ook voorzien hoekprofielen in het maken van een decoratieve overgang van wanden. Let op: niet buiten toepasbaar\nPrice: EUR 145.38"
  },
  {
    "id": "3321b080c0c1",
    "source_url": "https://www.houthandelonline.nl/hoeklat-grenen-18x18-gegr-10st",
    "name": "Hoeklat Grenen 18x18mm geschaafd wit gegrond per 10 stuks",
    "description": "Grenen hoeklatten zijn geschaafd en onbehandeld. Houten hoekprofielen zorgen voor een nette hoekafwerking binnenshuis. Deze hoeklatten zijn geschikt voor het afwerken van hoeken van wanden, meubels of voor een decoratieve overgang van de ene naar de andere wand. Deze Grenen houten afwerklijst is licht van gewicht en kan makkelijk bewerkt worden. Verpakt per 10 stuks.",
    "brand": "HouthandelOnline",
    "category": "Douglas hout > Toon alles in Douglas hout > Douglas hout palen > Douglas hout balken > Douglas hout latten en regels",
    "price": 126.54,
    "currency": "EUR",
    "price_raw": "€3,01/m1",
    "specs": {
      "raw": {
        "Levertijd": "2-7 werkdagen",
        "Kopmaat": "18x18 mm",
        "Dikte": "18 mm",
        "Breedte": "18",
        "Materiaal": "Grenen",
        "Toepassing": "Deze Grenen houten hoeklat is binnen toepasbaar voor het afwerken van verschillende binnen- en buitenhoeken van bijvoorbeeld wanden, meubels, vloeren of andere klussen. Ook voorzien hoekprofielen in het maken van een decoratieve overgang van wanden. Let op: niet buiten toepasbaar"
      }
    },
    "images": [
      "https://www.houthandelonline.nl/cdn/resize-extended/el:true/rs:fill/w:1500/h:1068/extend:true/background:255:255:255/path/media/catalog/product/h/o/hoeklat-grenen-18x18-gegr-10st-v_01_main.jpg"
    ],
    "rating": null,
    "review_count": null,
    "reviews_summary": null,
    "scraped_at": "2026-02-05T16:56:47.781622Z",
    "scrape_success": true,
    "scrape_errors": [],
    "embedding_text": "Product: Hoeklat Grenen 18x18mm geschaafd wit gegrond per 10 stuks\nBrand: HouthandelOnline\nCategory: Douglas hout > Toon alles in Douglas hout > Douglas hout palen > Douglas hout balken > Douglas hout latten en regels\nDescription: Grenen hoeklatten zijn geschaafd en onbehandeld. Houten hoekprofielen zorgen voor een nette hoekafwerking binnenshuis. Deze hoeklatten zijn geschikt voor het afwerken van hoeken van wanden, meubels of voor een decoratieve overgang van de ene naar de andere wand. Deze Grenen houten afwerklijst is licht van gewicht en kan makkelijk bewerkt worden. Verpakt per 10 stuks.\nSpecifications: Levertijd: 2-7 werkdagen, Kopmaat: 18x18 mm, Dikte: 18 mm, Breedte: 18, Materiaal: Grenen, Toepassing: Deze Grenen houten hoeklat is binnen toepasbaar voor het afwerken van verschillende binnen- en buitenhoeken van bijvoorbeeld wanden, meubels, vloeren of andere klussen. Ook voorzien hoekprofielen in het maken van een decoratieve overgang van wanden. Let op: niet buiten toepasbaar\nPrice: EUR 126.54"
  },
  {
    "id": "e7ba02bffa63",
    "source_url": "https://www.houthandelonline.nl/engelse-plint-mdf-vochtw",
    "name": "Plint (Engels) MDF 18x95mm geschaafd vochtwerend wit voorgelakt per 4 stuks",
    "description": "Deze stijlvolle Engelse MDF V313 sierplinten zijn wit voorgelakt en zijn vochtwerend. Toepassing van deze witte plint op de muur zorgt voor een mooie en klassieke afwerking en overgang naar de vloer. Verpakt per 4 stuks.",
    "brand": "HouthandelOnline",
    "category": "Douglas hout > Toon alles in Douglas hout > Douglas hout palen > Douglas hout balken > Douglas hout latten en regels",
    "price": 119.04,
    "currency": "EUR",
    "price_raw": "€6,10/m1",
    "specs": {
      "raw": {
        "Levertijd": "2-7 werkdagen",
        "Kopmaat": "18x95 mm",
        "Dikte": "18 mm",
        "Breedte": "95",
        "Materiaal": "MDF"
      }
    },
    "images": [
      "https://www.houthandelonline.nl/cdn/resize-extended/el:true/rs:fill/w:1500/h:1068/extend:true/background:255:255:255/path/media/catalog/product/e/n/engelse-plint-mdf-vochtw-v_01_main.jpg",
      "https://www.houthandelonline.nl/cdn/resize-extended/el:true/rs:fill/w:1500/h:1068/extend:true/background:255:255:255/path/media/catalog/product/e/n/engelse-plint-mdf-vochtw-v_02_view.jpg"
    ],
    "rating": null,
    "review_count": null,
    "reviews_summary": null,
    "scraped_at": "2026-02-05T16:56:47.781634Z",
    "scrape_success": true,
    "scrape_errors": [],
    "embedding_text": "Product: Plint (Engels) MDF 18x95mm geschaafd vochtwerend wit voorgelakt per 4 stuks\nBrand: HouthandelOnline\nCategory: Douglas hout > Toon alles in Douglas hout > Douglas hout palen > Douglas hout balken > Douglas hout latten en regels\nDescription: Deze stijlvolle Engelse MDF V313 sierplinten zijn wit voorgelakt en zijn vochtwerend. Toepassing van deze witte plint op de muur zorgt voor een mooie en klassieke afwerking en overgang naar de vloer. Verpakt per 4 stuks.\nSpecifications: Levertijd: 2-7 werkdagen, Kopmaat: 18x95 mm, Dikte: 18 mm, Breedte: 95, Materiaal: MDF\nPrice: EUR 119.04"
  },
  {
    "id": "0ffd193f29bd",
    "source_url": "https://www.houthandelonline.nl/ronde-stok-meranti-45-275cm-5st",
    "name": "Ronde stok Meranti 45mm geschaafd per 5 stuks",
    "description": "De Hardhouten ronde stokken zijn geschaafd en onbehandeld waardoor rondhout vele toepassingen binnenshuis kent. De stok wordt veel toegepast als trapleuning of voor het opvullen van ronde gaten. Deze Hardhouten trapleuning is licht van gewicht en kan makkelijk bewerkt worden. Verpakt per 5 stuks.",
    "brand": "HouthandelOnline",
    "category": "Douglas hout > Toon alles in Douglas hout > Douglas hout palen > Douglas hout balken > Douglas hout latten en regels",
    "price": 255.38,
    "currency": "EUR",
    "price_raw": "€18,57/m1",
    "specs": {
      "raw": {
        "Levertijd": "2-7 werkdagen",
        "Dikte": "45 mm",
        "Materiaal": "Meranti",
        "Toepassing": "Rond houten stokken worden veel toegepast als trapleuning, worden gebruikt in de interieurbouw of zijn geschikt voor het opvullen van ronde gaten. Let op: niet buiten toepasbaar"
      }
    },
    "images": [
      "https://www.houthandelonline.nl/cdn/resize-extended/el:true/rs:fill/w:1500/h:1068/extend:true/background:255:255:255/path/media/catalog/product/r/o/ronde-stok-meranti-45-275cm-5st-v_01_main.jpg"
    ],
    "rating": null,
    "review_count": null,
    "reviews_summary": null,
    "scraped_at": "2026-02-05T16:56:47.781645Z",
    "scrape_success": true,
    "scrape_errors": [],
    "embedding_text": "Product: Ronde stok Meranti 45mm geschaafd per 5 stuks\nBrand: HouthandelOnline\nCategory: Douglas hout > Toon alles in Douglas hout > Douglas hout palen > Douglas hout balken > Douglas hout latten en regels\nDescription: De Hardhouten ronde stokken zijn geschaafd en onbehandeld waardoor rondhout vele toepassingen binnenshuis kent. De stok wordt veel toegepast als trapleuning of voor het opvullen van ronde gaten. Deze Hardhouten trapleuning is licht van gewicht en kan makkelijk bewerkt worden. Verpakt per 5 stuks.\nSpecifications: Levertijd: 2-7 werkdagen, Dikte: 45 mm, Materiaal: Meranti, Toepassing: Rond houten stokken worden veel toegepast als trapleuning, worden gebruikt in de interieurbouw of zijn geschikt voor het opvullen van ronde gaten. Let op: niet buiten toepasbaar\nPrice: EUR 255.38"
  },
  {
    "id": "3849a1550f4c",
    "source_url": "https://www.houthandelonline.nl/ronde-stok-grenen-18-10st",
    "name": "Stok Grenen 18mm geschaafd per 10 stuks",
    "description": "Grenen ronde stokken zijn geschaafd en onbehandeld waardoor rondhout vele toepassingen binnenshuis kent. De stok wordt veel toegepast als gordijnroede in kleine kozijnen, in de interieurbouw of voor het opvullen van ronde gaten. Deze Grenen interieurlijst rond is licht van gewicht en kan makkelijk bewerkt worden. Verpakt per 10 stuks.",
    "brand": "HouthandelOnline",
    "category": "Douglas hout > Toon alles in Douglas hout > Douglas hout palen > Douglas hout balken > Douglas hout latten en regels",
    "price": 79.71,
    "currency": "EUR",
    "price_raw": "€2,95/m1",
    "specs": {
      "raw": {
        "Levertijd": "2-7 werkdagen",
        "Dikte": "18 mm",
        "Breedte": "18",
        "Materiaal": "Grenen",
        "Toepassing": "Rond houten stokken zijn binnen toepasbaar als gordijnroedes voor kleine kozijnen, knutselwerk, interieurbouw en voor het opvullen van ronde gaten. Let op: niet buiten toepasbaar"
      }
    },
    "images": [
      "https://www.houthandelonline.nl/cdn/resize-extended/el:true/rs:fill/w:1500/h:1068/extend:true/background:255:255:255/path/media/catalog/product/r/o/ronde-stok-grenen-18-10st-v_01_main.jpg"
    ],
    "rating": null,
    "review_count": null,
    "reviews_summary": null,
    "scraped_at": "2026-02-05T16:56:47.781658Z",
    "scrape_success": true,
    "scrape_errors": [],
    "embedding_text": "Product: Stok Grenen 18mm geschaafd per 10 stuks\nBrand: HouthandelOnline\nCategory: Douglas hout > Toon alles in Douglas hout > Douglas hout palen > Douglas hout balken > Douglas hout latten en regels\nDescription: Grenen ronde stokken zijn geschaafd en onbehandeld waardoor rondhout vele toepassingen binnenshuis kent. De stok wordt veel toegepast als gordijnroede in kleine kozijnen, in de interieurbouw of voor het opvullen van ronde gaten. Deze Grenen interieurlijst rond is licht van gewicht en kan makkelijk bewerkt worden. Verpakt per 10 stuks.\nSpecifications: Levertijd: 2-7 werkdagen, Dikte: 18 mm, Breedte: 18, Materiaal: Grenen, Toepassing: Rond houten stokken zijn binnen toepasbaar als gordijnroedes voor kleine kozijnen, knutselwerk, interieurbouw en voor het opvullen van ronde gaten. Let op: niet buiten toepasbaar\nPrice: EUR 79.71"
  },
  {
    "id": "9dd1fbaf967f",
    "source_url": "https://www.houthandelonline.nl/neuslat-tricoya-mdf-k80-5st",
    "name": "Neuslat Tricoya MDF K80 18x94mm (sponning 80mm) geschaafd wit gegrond per 5 stuks",
    "description": "Tricoya MDF neuslat, een glaslat met 80mm sponning, is geschaafd en rondom 60mu gegrond. Deze raamafwerklijst is binnen en buiten toepasbaar als geventileerde neuslat voor het afvoeren van vuil en vocht en het beschermen van het kozijnhout. De neuslat is 18x94mm. Verpakt per 5 stuks.",
    "brand": "HouthandelOnline",
    "category": "Douglas hout > Toon alles in Douglas hout > Douglas hout palen > Douglas hout balken > Douglas hout latten en regels",
    "price": 671.67,
    "currency": "EUR",
    "price_raw": "€27,53/m1",
    "specs": {
      "raw": {
        "Levertijd": "2-7 werkdagen",
        "Kopmaat": "18x94 mm",
        "Dikte": "18 mm",
        "Breedte": "94",
        "Materiaal": "MDF Tricoya"
      }
    },
    "images": [
      "https://www.houthandelonline.nl/cdn/resize-extended/el:true/rs:fill/w:1500/h:1068/extend:true/background:255:255:255/path/media/catalog/product/n/e/neuslat-tricoya-mdf-k80-5st-v_01_main.jpg",
      "https://www.houthandelonline.nl/cdn/resize-extended/el:true/rs:fill/w:1500/h:1068/extend:true/background:255:255:255/path/media/catalog/product/n/e/neuslat-tricoya-mdf-k80-5st-v_02_view.jpg"
    ],
    "rating": null,
    "review_count": null,
    "reviews_summary": null,
    "scraped_at": "2026-02-05T16:56:47.781668Z",
    "scrape_success": true,
    "scrape_errors": [],
    "embedding_text": "Product: Neuslat Tricoya MDF K80 18x94mm (sponning 80mm) geschaafd wit gegrond per 5 stuks\nBrand: HouthandelOnline\nCategory: Douglas hout > Toon alles in Douglas hout > Douglas hout palen > Douglas hout balken > Douglas hout latten en regels\nDescription: Tricoya MDF neuslat, een glaslat met 80mm sponning, is geschaafd en rondom 60mu gegrond. Deze raamafwerklijst is binnen en buiten toepasbaar als geventileerde neuslat voor het afvoeren van vuil en vocht en het beschermen van het kozijnhout. De neuslat is 18x94mm. Verpakt per 5 stuks.\nSpecifications: Levertijd: 2-7 werkdagen, Kopmaat: 18x94 mm, Dikte: 18 mm, Breedte: 94, Materiaal: MDF Tricoya\nPrice: EUR 671.67"
  },
  {
    "id": "5bb709e60bd0",
    "source_url": "https://www.houthandelonline.nl/neuslat-meranti-mdf-k80-5st",
    "name": "Neuslat Meranti K80 18x94mm (sponning 80mm) geschaafd wit gegrond per 5 stuks",
    "description": "Meranti houten neuslat, een glaslat met 80mm sponning, is geschaafd en rondom 80mu gegrond. Deze raamafwerklijst is buiten toepasbaar als geventileerde neuslat voor het afvoeren van vocht en het beschermen van het kozijnhout. Verpakt per 5 stuks.",
    "brand": "HouthandelOnline",
    "category": "Douglas hout > Toon alles in Douglas hout > Douglas hout palen > Douglas hout balken > Douglas hout latten en regels",
    "price": 461.87,
    "currency": "EUR",
    "price_raw": "€18,85/m1",
    "specs": {
      "raw": {
        "Levertijd": "2-7 werkdagen",
        "Kopmaat": "18x94 mm",
        "Dikte": "18 mm",
        "Breedte": "94",
        "Materiaal": "Meranti"
      }
    },
    "images": [
      "https://www.houthandelonline.nl/cdn/resize-extended/el:true/rs:fill/w:1500/h:1068/extend:true/background:255:255:255/path/media/catalog/product/n/e/neuslat-meranti-mdf-k80-5st-v_01_main.jpg",
      "https://www.houthandelonline.nl/cdn/resize-extended/el:true/rs:fill/w:1500/h:1068/extend:true/background:255:255:255/path/media/catalog/product/n/e/neuslat-meranti-mdf-k80-5st-v_02_view.jpg"
    ],
    "rating": null,
    "review_count": null,
    "reviews_summary": null,
    "scraped_at": "2026-02-05T16:56:47.781679Z",
    "scrape_success": true,
    "scrape_errors": [],
    "embedding_text": "Product: Neuslat Meranti K80 18x94mm (sponning 80mm) geschaafd wit gegrond per 5 stuks\nBrand: HouthandelOnline\nCategory: Douglas hout > Toon alles in Douglas hout > Douglas hout palen > Douglas hout balken > Douglas hout latten en regels\nDescription: Meranti houten neuslat, een glaslat met 80mm sponning, is geschaafd en rondom 80mu gegrond. Deze raamafwerklijst is buiten toepasbaar als geventileerde neuslat voor het afvoeren van vocht en het beschermen van het kozijnhout. Verpakt per 5 stuks.\nSpecifications: Levertijd: 2-7 werkdagen, Kopmaat: 18x94 mm, Dikte: 18 mm, Breedte: 94, Materiaal: Meranti\nPrice: EUR 461.87"
  },
  {
    "id": "84b2ce3e0b23",
    "source_url": "https://www.houthandelonline.nl/kraalplint-mdf-vochtw-18x140-3st",
    "name": "Kraalplint MDF 18x140mm vochtwerend wit voorgelakt bos a 3 stuks",
    "description": "Deze vochtwerende V313 vloerplint met een kraalmodel aan de bovenzijde ter afwerking van de aansluiting van de vloer en wand. Deze kraalplint heeft een afmeting van 18x140mm en is wit voorgelakt. De plinten zijn verpakt per 3 stuks.",
    "brand": "HouthandelOnline",
    "category": "Douglas hout > Toon alles in Douglas hout > Douglas hout palen > Douglas hout balken > Douglas hout latten en regels",
    "price": 95.3,
    "currency": "EUR",
    "price_raw": "€6,51/m1",
    "specs": {
      "raw": {
        "Levertijd": "2-7 werkdagen",
        "Kopmaat": "18x140 mm",
        "Dikte": "18 mm",
        "Breedte": "140",
        "Materiaal": "MDF",
        "Toepassing": "Kraalplinten voor het afwerken van de aansluiting tussen vloer en wand"
      }
    },
    "images": [
      "https://www.houthandelonline.nl/cdn/resize-extended/el:true/rs:fill/w:1500/h:1068/extend:true/background:255:255:255/path/media/catalog/product/k/r/kraalplint-mdf-vochtw-18x140-3st-v_01_main.jpg",
      "https://www.houthandelonline.nl/cdn/resize-extended/el:true/rs:fill/w:1500/h:1068/extend:true/background:255:255:255/path/media/catalog/product/k/r/kraalplint-mdf-vochtw-18x140-3st-v_02_view.jpg"
    ],
    "rating": null,
    "review_count": null,
    "reviews_summary": null,
    "scraped_at": "2026-02-05T16:56:47.781717Z",
    "scrape_success": true,
    "scrape_errors": [],
    "embedding_text": "Product: Kraalplint MDF 18x140mm vochtwerend wit voorgelakt bos a 3 stuks\nBrand: HouthandelOnline\nCategory: Douglas hout > Toon alles in Douglas hout > Douglas hout palen > Douglas hout balken > Douglas hout latten en regels\nDescription: Deze vochtwerende V313 vloerplint met een kraalmodel aan de bovenzijde ter afwerking van de aansluiting van de vloer en wand. Deze kraalplint heeft een afmeting van 18x140mm en is wit voorgelakt. De plinten zijn verpakt per 3 stuks.\nSpecifications: Levertijd: 2-7 werkdagen, Kopmaat: 18x140 mm, Dikte: 18 mm, Breedte: 140, Materiaal: MDF, Toepassing: Kraalplinten voor het afwerken van de aansluiting tussen vloer en wand\nPrice: EUR 95.3"
  },
  {
    "id": "1fb2a204ca0f",
    "source_url": "https://www.houthandelonline.nl/kraalplint-mdf-vochtw-18x120-4st",
    "name": "Kraalplint MDF 18x120mm vochtwerend wit voorgelakt bos a 4 stuks",
    "description": "Deze vochtwerende V313 vloerplint met een kraalmodel aan de bovenzijde ter afwerking van de aansluiting van de vloer en wand. Deze kraalplint heeft een afmeting van 18x120mm en is wit voorgelakt. De plinten zijn verpakt per 4 stuks en hebben een lengte van 488cm.",
    "brand": "HouthandelOnline",
    "category": "Douglas hout > Toon alles in Douglas hout > Douglas hout palen > Douglas hout balken > Douglas hout latten en regels",
    "price": 110.78,
    "currency": "EUR",
    "price_raw": "€5,67/m1",
    "specs": {
      "raw": {
        "Levertijd": "2-7 werkdagen",
        "Kopmaat": "18x120 mm",
        "Dikte": "18 mm",
        "Breedte": "120",
        "Materiaal": "MDF",
        "Toepassing": "Kraalplinten voor het afwerken van de aansluiting tussen vloer en wand"
      }
    },
    "images": [
      "https://www.houthandelonline.nl/cdn/resize-extended/el:true/rs:fill/w:1500/h:1068/extend:true/background:255:255:255/path/media/catalog/product/k/r/kraalplint-mdf-vochtw-18x120-4st-v_01_main.jpg",
      "https://www.houthandelonline.nl/cdn/resize-extended/el:true/rs:fill/w:1500/h:1068/extend:true/background:255:255:255/path/media/catalog/product/k/r/kraalplint-mdf-vochtw-18x120-4st-v_02_view.jpg"
    ],
    "rating": null,
    "review_count": null,
    "reviews_summary": null,
    "scraped_at": "2026-02-05T16:56:47.781728Z",
    "scrape_success": true,
    "scrape_errors": [],
    "embedding_text": "Product: Kraalplint MDF 18x120mm vochtwerend wit voorgelakt bos a 4 stuks\nBrand: HouthandelOnline\nCategory: Douglas hout > Toon alles in Douglas hout > Douglas hout palen > Douglas hout balken > Douglas hout latten en regels\nDescription: Deze vochtwerende V313 vloerplint met een kraalmodel aan de bovenzijde ter afwerking van de aansluiting van de vloer en wand. Deze kraalplint heeft een afmeting van 18x120mm en is wit voorgelakt. De plinten zijn verpakt per 4 stuks en hebben een lengte van 488cm.\nSpecifications: Levertijd: 2-7 werkdagen, Kopmaat: 18x120 mm, Dikte: 18 mm, Breedte: 120, Materiaal: MDF, Toepassing: Kraalplinten voor het afwerken van de aansluiting tussen vloer en wand\nPrice: EUR 110.78"
  },
  {
    "id": "b51cc4f49ba4",
    "source_url": "https://www.houthandelonline.nl/koplat-grenen-model-b-12x36",
    "name": "Koplat Grenen (Model B) 12x36mm met schuine kanten wit gegrond per 10 stuks",
    "description": "Koplat ter afwerking van de aansluiting van kozijnstijl en afgewerkte wand",
    "brand": "HouthandelOnline",
    "category": "Douglas hout > Toon alles in Douglas hout > Douglas hout palen > Douglas hout balken > Douglas hout latten en regels",
    "price": 92.49,
    "currency": "EUR",
    "price_raw": "€1,89/m1",
    "specs": {
      "raw": {
        "Levertijd": "2-7 werkdagen",
        "Kopmaat": "12x36 mm",
        "Dikte": "12 mm",
        "Breedte": "36",
        "Materiaal": "Grenen",
        "Toepassing": "Lijstwerk voor het afwerken van de aansluiting tussen wand en kozijn"
      }
    },
    "images": [
      "https://www.houthandelonline.nl/cdn/resize-extended/el:true/rs:fill/w:1500/h:1068/extend:true/background:255:255:255/path/media/catalog/product/k/o/koplat-grenen-model-b-12x36-v_01_main.jpg",
      "https://www.houthandelonline.nl/cdn/resize-extended/el:true/rs:fill/w:1500/h:1068/extend:true/background:255:255:255/path/media/catalog/product/k/o/koplat-grenen-model-b-12x36-v_02_view.jpg",
      "https://www.houthandelonline.nl/cdn/resize-extended/el:true/rs:fill/w:1500/h:1068/extend:true/background:255:255:255/path/media/catalog/product/k/o/koplat-grenen-model-b-12x36-v_03_view.jpg"
    ],
    "rating": null,
    "review_count": null,
    "reviews_summary": null,
    "scraped_at": "2026-02-05T16:56:47.781739Z",
    "scrape_success": true,
    "scrape_errors": [],
    "embedding_text": "Product: Koplat Grenen (Model B) 12x36mm met schuine kanten wit gegrond per 10 stuks\nBrand: HouthandelOnline\nCategory: Douglas hout > Toon alles in Douglas hout > Douglas hout palen > Douglas hout balken > Douglas hout latten en regels\nDescription: Koplat ter afwerking van de aansluiting van kozijnstijl en afgewerkte wand\nSpecifications: Levertijd: 2-7 werkdagen, Kopmaat: 12x36 mm, Dikte: 12 mm, Breedte: 36, Materiaal: Grenen, Toepassing: Lijstwerk voor het afwerken van de aansluiting tussen wand en kozijn\nPrice: EUR 92.49"
  },
  {
    "id": "d8cda1856832",
    "source_url": "https://www.houthandelonline.nl/plint-mdf-12x140-4st",
    "name": "",
    "description": "",
    "brand": null,
    "category": null,
    "price": null,
    "currency": null,
    "price_raw": null,
    "specs": {
      "raw": {}
    },
    "images": [],
    "rating": null,
    "review_count": null,
    "reviews_summary": null,
    "scraped_at": "2026-02-05T16:56:47.781763Z",
    "scrape_success": false,
    "scrape_errors": [
      "Page.goto: Timeout 20000ms exceeded.\nCall log:\n  - navigating to \"https://www.houthandelonline.nl/plint-mdf-12x140-4st\", waiting until \"networkidle\"\n"
    ],
    "embedding_text": ""
  },
  {
    "id": "4e8a3a1c4990",
    "source_url": "https://www.houthandelonline.nl/neuslijst-vuren28x120-gegr",
    "name": "Neuslijst Vuren 28x120mm geschaafd wit gegrond",
    "description": "Deze Vuren houten neuslijst is wit voorgelakt en heeft afgeronde geschaafde hoeken. Een neuslijst dient ter afwerking en verfraaiing van goten, gevels of schouwen.",
    "brand": "HouthandelOnline",
    "category": "Douglas hout > Toon alles in Douglas hout > Douglas hout palen > Douglas hout balken > Douglas hout latten en regels",
    "price": 54.6,
    "currency": "EUR",
    "price_raw": "€11,37/m1",
    "specs": {
      "raw": {
        "Kopmaat": "28x120 mm",
        "Dikte": "28 mm",
        "Breedte": "120",
        "Materiaal": "Vuren",
        "Toepassing": "Deze witte neuslijst is geschaafd en rondom 60mu wit gegrond. Deze neuslijst zorgt voor een mooie klassieke uitstraling van de buitengevel als goot"
      }
    },
    "images": [
      "https://www.houthandelonline.nl/cdn/resize-extended/el:true/rs:fill/w:1500/h:1068/extend:true/background:255:255:255/path/media/catalog/product/n/e/neuslijst-vuren28x120-gegr-v_01_main.jpg"
    ],
    "rating": null,
    "review_count": null,
    "reviews_summary": null,
    "scraped_at": "2026-02-05T16:56:47.781782Z",
    "scrape_success": true,
    "scrape_errors": [],
    "embedding_text": "Product: Neuslijst Vuren 28x120mm geschaafd wit gegrond\nBrand: HouthandelOnline\nCategory: Douglas hout > Toon alles in Douglas hout > Douglas hout palen > Douglas hout balken > Douglas hout latten en regels\nDescription: Deze Vuren houten neuslijst is wit voorgelakt en heeft afgeronde geschaafde hoeken. Een neuslijst dient ter afwerking en verfraaiing van goten, gevels of schouwen.\nSpecifications: Kopmaat: 28x120 mm, Dikte: 28 mm, Breedte: 120, Materiaal: Vuren, Toepassing: Deze witte neuslijst is geschaafd en rondom 60mu wit gegrond. Deze neuslijst zorgt voor een mooie klassieke uitstraling van de buitengevel als goot\nPrice: EUR 54.6"
  },
  {
    "id": "d67236da2ae0",
    "source_url": "https://www.houthandelonline.nl/plint-grenen-12x90-10st",
    "name": "",
    "description": "",
    "brand": null,
    "category": null,
    "price": null,
    "currency": null,
    "price_raw": null,
    "specs": {
      "raw": {}
    },
    "images": [],
    "rating": null,
    "review_count": null,
    "reviews_summary": null,
    "scraped_at": "2026-02-05T16:56:47.781793Z",
    "scrape_success": false,
    "scrape_errors": [
      "Page.goto: Timeout 20000ms exceeded.\nCall log:\n  - navigating to \"https://www.houthandelonline.nl/plint-grenen-12x90-10st\", waiting until \"networkidle\"\n"
    ],
    "embedding_text": ""
  },
  {
    "id": "c8b204efffed",
    "source_url": "https://www.houthandelonline.nl/plint-grenen-12x120-5st",
    "name": "Plint Grenen 12x120mm zichtzijde wit afgelakt per 5 stuks",
    "description": "Vloerplint ter afwerking van de aansluiting van de vloer en wand",
    "brand": "HouthandelOnline",
    "category": "Douglas hout > Toon alles in Douglas hout > Douglas hout palen > Douglas hout balken > Douglas hout latten en regels",
    "price": 252.88,
    "currency": "EUR",
    "price_raw": "€10,32/m1",
    "specs": {
      "raw": {
        "Levertijd": "2-7 werkdagen",
        "Kopmaat": "12x120 mm",
        "Dikte": "12 mm",
        "Breedte": "120",
        "Materiaal": "Grenen",
        "Toepassing": "Lijstwerk voor het afwerken van de aansluiting tussen vloer en wand"
      }
    },
    "images": [
      "https://www.houthandelonline.nl/cdn/resize-extended/el:true/rs:fill/w:1500/h:1068/extend:true/background:255:255:255/path/media/catalog/product/p/l/plint-grenen-12x120-5st-v_01_main.jpg",
      "https://www.houthandelonline.nl/cdn/resize-extended/el:true/rs:fill/w:1500/h:1068/extend:true/background:255:255:255/path/media/catalog/product/p/l/plint-grenen-12x120-5st-v_02_view.jpg",
      "https://www.houthandelonline.nl/cdn/resize-extended/el:true/rs:fill/w:1500/h:1068/extend:true/background:255:255:255/path/media/catalog/product/p/l/plint-grenen-12x120-5st-v_03_view.jpg",
      "https://www.houthandelonline.nl/cdn/resize-extended/el:true/rs:fill/w:1500/h:1068/extend:true/background:255:255:255/path/media/catalog/product/p/l/plint-grenen-12x120-5st-v_04_view.jpg"
    ],
    "rating": null,
    "review_count": null,
    "reviews_summary": null,
    "scraped_at": "2026-02-05T16:56:47.781805Z",
    "scrape_success": true,
    "scrape_errors": [],
    "embedding_text": "Product: Plint Grenen 12x120mm zichtzijde wit afgelakt per 5 stuks\nBrand: HouthandelOnline\nCategory: Douglas hout > Toon alles in Douglas hout > Douglas hout palen > Douglas hout balken > Douglas hout latten en regels\nDescription: Vloerplint ter afwerking van de aansluiting van de vloer en wand\nSpecifications: Levertijd: 2-7 werkdagen, Kopmaat: 12x120 mm, Dikte: 12 mm, Breedte: 120, Materiaal: Grenen, Toepassing: Lijstwerk voor het afwerken van de aansluiting tussen vloer en wand\nPrice: EUR 252.88"
  },
  {
    "id": "c0bde46981cb",
    "source_url": "https://www.houthandelonline.nl/plint-mdf-12x70-4st",
    "name": "Plint MDF 12x70mm vochtwerend wit voorgelakt per 4 stuks",
    "description": "Deze vochtwerende V313 plint is geschikt voor de afwerking van een vloer of wand. De plint is wit voorgelakt en heeft een afmeting van 12x70mm. De plinten zijn verpakt per 4 stuks en hebben een lengte van 488cm.",
    "brand": "HouthandelOnline",
    "category": "Douglas hout > Toon alles in Douglas hout > Douglas hout palen > Douglas hout balken > Douglas hout latten en regels",
    "price": 45.11,
    "currency": "EUR",
    "price_raw": "€2,31/m1",
    "specs": {
      "raw": {
        "Levertijd": "2-7 werkdagen",
        "Kopmaat": "12x70 mm",
        "Dikte": "12 mm",
        "Breedte": "70",
        "Materiaal": "MDF",
        "Toepassing": "Lijstwerk voor het afwerken van de aansluiting tussen vloer en wand"
      }
    },
    "images": [
      "https://www.houthandelonline.nl/cdn/resize-extended/el:true/rs:fill/w:1500/h:1068/extend:true/background:255:255:255/path/media/catalog/product/p/l/plint-mdf-12x70-4st-v_01_main.jpg",
      "https://www.houthandelonline.nl/cdn/resize-extended/el:true/rs:fill/w:1500/h:1068/extend:true/background:255:255:255/path/media/catalog/product/p/l/plint-mdf-12x70-4st-v_02_view.jpg",
      "https://www.houthandelonline.nl/cdn/resize-extended/el:true/rs:fill/w:1500/h:1068/extend:true/background:255:255:255/path/media/catalog/product/p/l/plint-mdf-12x70-4st-v_03_view.jpg",
      "https://www.houthandelonline.nl/cdn/resize-extended/el:true/rs:fill/w:1500/h:1068/extend:true/background:255:255:255/path/media/catalog/product/p/l/plint-mdf-12x70-4st-v_04_view.jpg"
    ],
    "rating": null,
    "review_count": null,
    "reviews_summary": null,
    "scraped_at": "2026-02-05T16:56:47.781816Z",
    "scrape_success": true,
    "scrape_errors": [],
    "embedding_text": "Product: Plint MDF 12x70mm vochtwerend wit voorgelakt per 4 stuks\nBrand: HouthandelOnline\nCategory: Douglas hout > Toon alles in Douglas hout > Douglas hout palen > Douglas hout balken > Douglas hout latten en regels\nDescription: Deze vochtwerende V313 plint is geschikt voor de afwerking van een vloer of wand. De plint is wit voorgelakt en heeft een afmeting van 12x70mm. De plinten zijn verpakt per 4 stuks en hebben een lengte van 488cm.\nSpecifications: Levertijd: 2-7 werkdagen, Kopmaat: 12x70 mm, Dikte: 12 mm, Breedte: 70, Materiaal: MDF, Toepassing: Lijstwerk voor het afwerken van de aansluiting tussen vloer en wand\nPrice: EUR 45.11"
  },
  {
    "id": "c7ab25f8ccee",
    "source_url": "https://www.houthandelonline.nl/hollat-grenen-28x28-10st",
    "name": "Hollat Grenen 28x28mm geschaafd per 10 stuks",
    "description": "Grenen hollatten zijn geschaafd en onbehandeld. Houten afwerklijsten zorgen voor een nette hoekafwerking binnenshuis. Deze hollatten zijn geschikt voor het afwerken van binnenhoeken van wanden, meubels of voor een decoratieve overgang van de muur naar het plafond of kozijn. Deze Grenen houten afwerklijst is licht van gewicht en kan makkelijk bewerkt worden. Verpakt per 10 stuks.",
    "brand": "HouthandelOnline",
    "category": "Douglas hout > Toon alles in Douglas hout > Douglas hout palen > Douglas hout balken > Douglas hout latten en regels",
    "price": 76.12,
    "currency": "EUR",
    "price_raw": "€2,82/m1",
    "specs": {
      "raw": {
        "Levertijd": "2-7 werkdagen",
        "Kopmaat": "28x28 mm",
        "Dikte": "28 mm",
        "Breedte": "28",
        "Materiaal": "Grenen"
      }
    },
    "images": [
      "https://www.houthandelonline.nl/cdn/resize-extended/el:true/rs:fill/w:1500/h:1068/extend:true/background:255:255:255/path/media/catalog/product/h/o/hollat-grenen-28x28-10st-v_01_main.jpg"
    ],
    "rating": null,
    "review_count": null,
    "reviews_summary": null,
    "scraped_at": "2026-02-05T16:56:47.781827Z",
    "scrape_success": true,
    "scrape_errors": [],
    "embedding_text": "Product: Hollat Grenen 28x28mm geschaafd per 10 stuks\nBrand: HouthandelOnline\nCategory: Douglas hout > Toon alles in Douglas hout > Douglas hout palen > Douglas hout balken > Douglas hout latten en regels\nDescription: Grenen hollatten zijn geschaafd en onbehandeld. Houten afwerklijsten zorgen voor een nette hoekafwerking binnenshuis. Deze hollatten zijn geschikt voor het afwerken van binnenhoeken van wanden, meubels of voor een decoratieve overgang van de muur naar het plafond of kozijn. Deze Grenen houten afwerklijst is licht van gewicht en kan makkelijk bewerkt worden. Verpakt per 10 stuks.\nSpecifications: Levertijd: 2-7 werkdagen, Kopmaat: 28x28 mm, Dikte: 28 mm, Breedte: 28, Materiaal: Grenen\nPrice: EUR 76.12"
  },
  {
    "id": "3e78194a5c2b",
    "source_url": "https://www.houthandelonline.nl/plint-mdf-18x140-3st",
    "name": "Plint MDF 18x140mm vochtwerend wit voorgelakt per 3 stuks",
    "description": "Deze vochtwerende V313 plint is geschikt voor de afwerking van een vloer of wand. De plint is wit voorgelakt en heeft een afmeting van 18x140mm. De plinten zijn verpakt per 3 stuks.",
    "brand": "HouthandelOnline",
    "category": "Douglas hout > Toon alles in Douglas hout > Douglas hout palen > Douglas hout balken > Douglas hout latten en regels",
    "price": 95.3,
    "currency": "EUR",
    "price_raw": "€6,51/m1",
    "specs": {
      "raw": {
        "Levertijd": "2-7 werkdagen",
        "Kopmaat": "18x140 mm",
        "Dikte": "18 mm",
        "Breedte": "140",
        "Materiaal": "MDF",
        "Toepassing": "Lijstwerk voor het afwerken van de aansluiting tussen vloer en wand"
      }
    },
    "images": [
      "https://www.houthandelonline.nl/cdn/resize-extended/el:true/rs:fill/w:1500/h:1068/extend:true/background:255:255:255/path/media/catalog/product/p/l/plint-mdf-18x140-3st-v_01_main.jpg",
      "https://www.houthandelonline.nl/cdn/resize-extended/el:true/rs:fill/w:1500/h:1068/extend:true/background:255:255:255/path/media/catalog/product/p/l/plint-mdf-18x140-3st-v_02_view.jpg"
    ],
    "rating": null,
    "review_count": null,
    "reviews_summary": null,
    "scraped_at": "2026-02-05T16:56:47.781838Z",
    "scrape_success": true,
    "scrape_errors": [],
    "embedding_text": "Product: Plint MDF 18x140mm vochtwerend wit voorgelakt per 3 stuks\nBrand: HouthandelOnline\nCategory: Douglas hout > Toon alles in Douglas hout > Douglas hout palen > Douglas hout balken > Douglas hout latten en regels\nDescription: Deze vochtwerende V313 plint is geschikt voor de afwerking van een vloer of wand. De plint is wit voorgelakt en heeft een afmeting van 18x140mm. De plinten zijn verpakt per 3 stuks.\nSpecifications: Levertijd: 2-7 werkdagen, Kopmaat: 18x140 mm, Dikte: 18 mm, Breedte: 140, Materiaal: MDF, Toepassing: Lijstwerk voor het afwerken van de aansluiting tussen vloer en wand\nPrice: EUR 95.3"
  },
  {
    "id": "addc53ae779d",
    "source_url": "https://www.houthandelonline.nl/meranti-ventilatieglaslat-l2-gegr",
    "name": "Meranti Ventilatieglaslat L2 20x25,5mm bovenzijde afgeschuind Komo 80 mu gegrond",
    "description": "Meranti ventilatieglaslat met een afgeschuinde bovenzijde en ventilatie holletjes aan de onderzijde",
    "brand": "HouthandelOnline",
    "category": "Douglas hout > Toon alles in Douglas hout > Douglas hout palen > Douglas hout balken > Douglas hout latten en regels",
    "price": 288.32,
    "currency": "EUR",
    "price_raw": "€6,27/m1",
    "specs": {
      "raw": {
        "Levertijd": "2-7 werkdagen",
        "Dikte": "20 mm",
        "Breedte": "25",
        "Materiaal": "Meranti",
        "Toepassing": "Glaslatten voor het opsluiten van glas in een kozijn, raam of deur"
      }
    },
    "images": [
      "https://www.houthandelonline.nl/cdn/resize-extended/el:true/rs:fill/w:1500/h:1068/extend:true/background:255:255:255/path/media/catalog/product/m/e/meranti-ventilatieglaslat-l2-gegr-v_01_main.jpg",
      "https://www.houthandelonline.nl/cdn/resize-extended/el:true/rs:fill/w:1500/h:1068/extend:true/background:255:255:255/path/media/catalog/product/m/e/meranti-ventilatieglaslat-l2-gegr-v_02_view.jpg"
    ],
    "rating": null,
    "review_count": null,
    "reviews_summary": null,
    "scraped_at": "2026-02-05T16:56:47.781847Z",
    "scrape_success": true,
    "scrape_errors": [],
    "embedding_text": "Product: Meranti Ventilatieglaslat L2 20x25,5mm bovenzijde afgeschuind Komo 80 mu gegrond\nBrand: HouthandelOnline\nCategory: Douglas hout > Toon alles in Douglas hout > Douglas hout palen > Douglas hout balken > Douglas hout latten en regels\nDescription: Meranti ventilatieglaslat met een afgeschuinde bovenzijde en ventilatie holletjes aan de onderzijde\nSpecifications: Levertijd: 2-7 werkdagen, Dikte: 20 mm, Breedte: 25, Materiaal: Meranti, Toepassing: Glaslatten voor het opsluiten van glas in een kozijn, raam of deur\nPrice: EUR 288.32"
  },
  {
    "id": "4af13c6d9f0a",
    "source_url": "https://www.houthandelonline.nl/meranti-ventglaslat-los-l2-gegr",
    "name": "Meranti Ventilatieglaslat L2 20x25,5mm bovenzijde afgeschuind Komo 80 mu gegrond 1st.",
    "description": "Meranti ventilatieglaslat met een afgeschuinde bovenzijde en ventilatie holletjes aan de onderzijde",
    "brand": "HouthandelOnline",
    "category": "Douglas hout > Toon alles in Douglas hout > Douglas hout palen > Douglas hout balken > Douglas hout latten en regels",
    "price": 28.83,
    "currency": "EUR",
    "price_raw": "€6,27/m1",
    "specs": {
      "raw": {
        "Levertijd": "2-7 werkdagen",
        "Dikte": "20 mm",
        "Breedte": "25",
        "Materiaal": "Meranti",
        "Toepassing": "Glaslatten voor het opsluiten van glas in een kozijn, raam of deur"
      }
    },
    "images": [
      "https://www.houthandelonline.nl/cdn/resize-extended/el:true/rs:fill/w:1500/h:1068/extend:true/background:255:255:255/path/media/catalog/product/m/e/meranti-ventglaslat-los-l2-gegr-v_01_main.jpg",
      "https://www.houthandelonline.nl/cdn/resize-extended/el:true/rs:fill/w:1500/h:1068/extend:true/background:255:255:255/path/media/catalog/product/m/e/meranti-ventglaslat-los-l2-gegr-v_02_view.jpg"
    ],
    "rating": null,
    "review_count": null,
    "reviews_summary": null,
    "scraped_at": "2026-02-05T16:56:47.781857Z",
    "scrape_success": true,
    "scrape_errors": [],
    "embedding_text": "Product: Meranti Ventilatieglaslat L2 20x25,5mm bovenzijde afgeschuind Komo 80 mu gegrond 1st.\nBrand: HouthandelOnline\nCategory: Douglas hout > Toon alles in Douglas hout > Douglas hout palen > Douglas hout balken > Douglas hout latten en regels\nDescription: Meranti ventilatieglaslat met een afgeschuinde bovenzijde en ventilatie holletjes aan de onderzijde\nSpecifications: Levertijd: 2-7 werkdagen, Dikte: 20 mm, Breedte: 25, Materiaal: Meranti, Toepassing: Glaslatten voor het opsluiten van glas in een kozijn, raam of deur\nPrice: EUR 28.83"
  },
  {
    "id": "dee89251ba5c",
    "source_url": "https://www.houthandelonline.nl/hoeklat-meranti-28x28-10st",
    "name": "Hoeklat Meranti 28x28mm geschaafd per 10 stuks",
    "description": "Hardhouten hoeklatten zijn geschaafd en onbehandeld. Houten hoekprofielen zorgen voor een nette hoekafwerking binnenshuis. Deze hoekprofielen zijn geschikt voor het afwerken van hoeken van wanden, meubels of voor een decoratieve overgang van de ene naar de andere wand. Deze Hardhouten afwerklijst is zeer sterk en gaat lang mee. Verpakt per 10 stuks.",
    "brand": "HouthandelOnline",
    "category": "Douglas hout > Toon alles in Douglas hout > Douglas hout palen > Douglas hout balken > Douglas hout latten en regels",
    "price": 167.04,
    "currency": "EUR",
    "price_raw": "€6,07/m1",
    "specs": {
      "raw": {
        "Levertijd": "2-7 werkdagen",
        "Kopmaat": "28x28 mm",
        "Dikte": "28 mm",
        "Breedte": "28",
        "Materiaal": "Meranti",
        "Toepassing": "Deze Hardhouten buitenhoeklat is binnen toepasbaar voor het afwerken van verschillende hoeken van bijvoorbeeld wanden, meubels, vloeren of andere klussen. Ook voorzien hoekprofielen in het maken van een decoratieve overgang van wanden. Let op: niet buiten toepasbaar"
      }
    },
    "images": [
      "https://www.houthandelonline.nl/cdn/resize-extended/el:true/rs:fill/w:1500/h:1068/extend:true/background:255:255:255/path/media/catalog/product/h/o/hoeklat-meranti-28x28-10st-v_01_main.jpg"
    ],
    "rating": null,
    "review_count": null,
    "reviews_summary": null,
    "scraped_at": "2026-02-05T16:56:47.781878Z",
    "scrape_success": true,
    "scrape_errors": [],
    "embedding_text": "Product: Hoeklat Meranti 28x28mm geschaafd per 10 stuks\nBrand: HouthandelOnline\nCategory: Douglas hout > Toon alles in Douglas hout > Douglas hout palen > Douglas hout balken > Douglas hout latten en regels\nDescription: Hardhouten hoeklatten zijn geschaafd en onbehandeld. Houten hoekprofielen zorgen voor een nette hoekafwerking binnenshuis. Deze hoekprofielen zijn geschikt voor het afwerken van hoeken van wanden, meubels of voor een decoratieve overgang van de ene naar de andere wand. Deze Hardhouten afwerklijst is zeer sterk en gaat lang mee. Verpakt per 10 stuks.\nSpecifications: Levertijd: 2-7 werkdagen, Kopmaat: 28x28 mm, Dikte: 28 mm, Breedte: 28, Materiaal: Meranti, Toepassing: Deze Hardhouten buitenhoeklat is binnen toepasbaar voor het afwerken van verschillende hoeken van bijvoorbeeld wanden, meubels, vloeren of andere klussen. Ook voorzien hoekprofielen in het maken van een decoratieve overgang van wanden. Let op: niet buiten toepasbaar\nPrice: EUR 167.04"
  },
  {
    "id": "170175497bfd",
    "source_url": "https://www.houthandelonline.nl/schilderijlijst-mdf-vochtw-18x45-wit-4st",
    "name": "Schilderijlijst MDF Vochtwerend 18x45mm wit voorgelakt per 4 stuks",
    "description": "MDF V313 vochtwerende decorlijsten zijn wit voorgelakt en vochtwerend. Deze houten schilderijlijst kan toegepast worden als schilderij omlijsting. Daarnaast is deze decorlijst ook geschikt als fraaie afwerking van deuren, wanden en plafonds binnenshuis. Verpakt per 4 stuks.",
    "brand": "HouthandelOnline",
    "category": "Douglas hout > Toon alles in Douglas hout > Douglas hout palen > Douglas hout balken > Douglas hout latten en regels",
    "price": 77.71,
    "currency": "EUR",
    "price_raw": "€3,98/m1",
    "specs": {
      "raw": {
        "Levertijd": "2-7 werkdagen",
        "Kopmaat": "18x45 mm",
        "Dikte": "18 mm",
        "Breedte": "45",
        "Materiaal": "MDF"
      }
    },
    "images": [
      "https://www.houthandelonline.nl/cdn/resize-extended/el:true/rs:fill/w:1500/h:1068/extend:true/background:255:255:255/path/media/catalog/product/s/c/schilderijlijst-mdf-vochtw-18x45-wit-4st-v_01_main_1.jpg"
    ],
    "rating": null,
    "review_count": null,
    "reviews_summary": null,
    "scraped_at": "2026-02-05T16:56:47.781888Z",
    "scrape_success": true,
    "scrape_errors": [],
    "embedding_text": "Product: Schilderijlijst MDF Vochtwerend 18x45mm wit voorgelakt per 4 stuks\nBrand: HouthandelOnline\nCategory: Douglas hout > Toon alles in Douglas hout > Douglas hout palen > Douglas hout balken > Douglas hout latten en regels\nDescription: MDF V313 vochtwerende decorlijsten zijn wit voorgelakt en vochtwerend. Deze houten schilderijlijst kan toegepast worden als schilderij omlijsting. Daarnaast is deze decorlijst ook geschikt als fraaie afwerking van deuren, wanden en plafonds binnenshuis. Verpakt per 4 stuks.\nSpecifications: Levertijd: 2-7 werkdagen, Kopmaat: 18x45 mm, Dikte: 18 mm, Breedte: 45, Materiaal: MDF\nPrice: EUR 77.71"
  },
  {
    "id": "3828c770ce88",
    "source_url": "https://www.houthandelonline.nl/neuslijst-vuren28x140-gegr",
    "name": "Neuslijst Vuren 28x140mm geschaafd wit gegrond",
    "description": "Deze Vuren houten neuslijst is wit voorgelakt en heeft afgeronde geschaafde hoeken. Een neuslijst dient ter afwerking en verfraaiing van goten, gevels of schouwen.",
    "brand": "HouthandelOnline",
    "category": "Douglas hout > Toon alles in Douglas hout > Douglas hout palen > Douglas hout balken > Douglas hout latten en regels",
    "price": 63.89,
    "currency": "EUR",
    "price_raw": "€13,31/m1",
    "specs": {
      "raw": {
        "Kopmaat": "28x140 mm",
        "Dikte": "28 mm",
        "Breedte": "140",
        "Materiaal": "Vuren",
        "Toepassing": "Deze witte neuslijst is geschaafd en rondom 60mu wit gegrond. Deze neuslijst zorgt voor een mooie klassieke uitstraling van de buitengevel als goot"
      }
    },
    "images": [
      "https://www.houthandelonline.nl/cdn/resize-extended/el:true/rs:fill/w:1500/h:1068/extend:true/background:255:255:255/path/media/catalog/product/n/e/neuslijst-vuren28x140-gegr-v_01_main.jpg"
    ],
    "rating": null,
    "review_count": null,
    "reviews_summary": null,
    "scraped_at": "2026-02-05T16:56:47.781906Z",
    "scrape_success": true,
    "scrape_errors": [],
    "embedding_text": "Product: Neuslijst Vuren 28x140mm geschaafd wit gegrond\nBrand: HouthandelOnline\nCategory: Douglas hout > Toon alles in Douglas hout > Douglas hout palen > Douglas hout balken > Douglas hout latten en regels\nDescription: Deze Vuren houten neuslijst is wit voorgelakt en heeft afgeronde geschaafde hoeken. Een neuslijst dient ter afwerking en verfraaiing van goten, gevels of schouwen.\nSpecifications: Kopmaat: 28x140 mm, Dikte: 28 mm, Breedte: 140, Materiaal: Vuren, Toepassing: Deze witte neuslijst is geschaafd en rondom 60mu wit gegrond. Deze neuslijst zorgt voor een mooie klassieke uitstraling van de buitengevel als goot\nPrice: EUR 63.89"
  },
  {
    "id": "59a1cd8a7c76",
    "source_url": "https://www.houthandelonline.nl/deurlijst-90-4st",
    "name": "Deurlijst 90 MDF Vochtwerend Chambrant 16x90mm wit voorgelakt per 4 stuks",
    "description": "Deze houten MDF V313 architraven, ook wel koplijsten of deurlijsten genoemd, zijn wit voorgelakt en vochtwerend. Toepassing van een afdeklijst als sier architraaf zorgt voor een nette afwerking van het deurkozijn en de afgewerkte wand. Verpakt per 4 stuks.",
    "brand": "HouthandelOnline",
    "category": "Douglas hout > Toon alles in Douglas hout > Douglas hout palen > Douglas hout balken > Douglas hout latten en regels",
    "price": 100.38,
    "currency": "EUR",
    "price_raw": "€5,14/m1",
    "specs": {
      "raw": {
        "Levertijd": "2-7 werkdagen",
        "Kopmaat": "16x90 mm",
        "Dikte": "16 mm",
        "Breedte": "90",
        "Materiaal": "MDF"
      }
    },
    "images": [
      "https://www.houthandelonline.nl/cdn/resize-extended/el:true/rs:fill/w:1500/h:1068/extend:true/background:255:255:255/path/media/catalog/product/d/e/deurlijst-90-4st-v_01_main.jpg"
    ],
    "rating": null,
    "review_count": null,
    "reviews_summary": null,
    "scraped_at": "2026-02-05T16:56:47.781916Z",
    "scrape_success": true,
    "scrape_errors": [],
    "embedding_text": "Product: Deurlijst 90 MDF Vochtwerend Chambrant 16x90mm wit voorgelakt per 4 stuks\nBrand: HouthandelOnline\nCategory: Douglas hout > Toon alles in Douglas hout > Douglas hout palen > Douglas hout balken > Douglas hout latten en regels\nDescription: Deze houten MDF V313 architraven, ook wel koplijsten of deurlijsten genoemd, zijn wit voorgelakt en vochtwerend. Toepassing van een afdeklijst als sier architraaf zorgt voor een nette afwerking van het deurkozijn en de afgewerkte wand. Verpakt per 4 stuks.\nSpecifications: Levertijd: 2-7 werkdagen, Kopmaat: 16x90 mm, Dikte: 16 mm, Breedte: 90, Materiaal: MDF\nPrice: EUR 100.38"
  },
  {
    "id": "1b96b67a3386",
    "source_url": "https://www.houthandelonline.nl/meranti-12x120-geschaafd-6st",
    "name": "Timmerhout Meranti 12x120mm geschaafd per 6 stuks",
    "description": "Vierzijdig geschaafd Meranti aftimmerhout is onbehandeld. Deze schaaflat van hardhoutsoort Meranti is geschikt voor het maken van meubels, een afwerkprofiel voor het wegwerken van kieren of voor constructiewerk. Verpakt per 6 stuks.",
    "brand": "HouthandelOnline",
    "category": "Douglas hout > Toon alles in Douglas hout > Douglas hout palen > Douglas hout balken > Douglas hout latten en regels",
    "price": 169.91,
    "currency": "EUR",
    "price_raw": "€10,30/m1",
    "specs": {
      "raw": {
        "Levertijd": "2-7 werkdagen",
        "Kopmaat": "12x120 mm",
        "Dikte": "12 mm",
        "Breedte": "120",
        "Materiaal": "Meranti",
        "Toepassing": "Deze 4-zijden geschaafde Meranti lat is binnen toepasbaar als aftimmerlat of constructielat. Deze schaaflat kan toegepast worden om openingen af te dekken, voor het maken van meubels of als (achter)constructie of rasterwerk voor wanden, plafonds en ander constructiewerk"
      }
    },
    "images": [
      "https://www.houthandelonline.nl/cdn/resize-extended/el:true/rs:fill/w:1500/h:1068/extend:true/background:255:255:255/path/media/catalog/product/m/e/meranti-12x120-geschaafd-6st-v_01_main.jpg"
    ],
    "rating": null,
    "review_count": null,
    "reviews_summary": null,
    "scraped_at": "2026-02-05T16:56:47.781928Z",
    "scrape_success": true,
    "scrape_errors": [],
    "embedding_text": "Product: Timmerhout Meranti 12x120mm geschaafd per 6 stuks\nBrand: HouthandelOnline\nCategory: Douglas hout > Toon alles in Douglas hout > Douglas hout palen > Douglas hout balken > Douglas hout latten en regels\nDescription: Vierzijdig geschaafd Meranti aftimmerhout is onbehandeld. Deze schaaflat van hardhoutsoort Meranti is geschikt voor het maken van meubels, een afwerkprofiel voor het wegwerken van kieren of voor constructiewerk. Verpakt per 6 stuks.\nSpecifications: Levertijd: 2-7 werkdagen, Kopmaat: 12x120 mm, Dikte: 12 mm, Breedte: 120, Materiaal: Meranti, Toepassing: Deze 4-zijden geschaafde Meranti lat is binnen toepasbaar als aftimmerlat of constructielat. Deze schaaflat kan toegepast worden om openingen af te dekken, voor het maken van meubels of als (achter)constructie of rasterwerk voor wanden, plafonds en ander constructiewerk\nPrice: EUR 169.91"
  },
  {
    "id": "b2febb353b1f",
    "source_url": "https://www.houthandelonline.nl/deurlijst-88-4st",
    "name": "Deurlijst 88 MDF Vochtwerend Chambrant 18x88mm wit voorgelakt per 4 stuks",
    "description": "Deze houten MDF V313 architraven, ook wel koplijsten of deurlijsten genoemd, zijn wit voorgelakt en vochtwerend. Toepassing van een afdeklijst als sier architraaf zorgt voor een nette afwerking van het deurkozijn en de afgewerkte wand. Verpakt per 4 stuks.",
    "brand": "HouthandelOnline",
    "category": "Douglas hout > Toon alles in Douglas hout > Douglas hout palen > Douglas hout balken > Douglas hout latten en regels",
    "price": 100.38,
    "currency": "EUR",
    "price_raw": "€5,14/m1",
    "specs": {
      "raw": {
        "Levertijd": "2-7 werkdagen",
        "Kopmaat": "18x88 mm",
        "Dikte": "18 mm",
        "Breedte": "88",
        "Materiaal": "MDF"
      }
    },
    "images": [
      "https://www.houthandelonline.nl/cdn/resize-extended/el:true/rs:fill/w:1500/h:1068/extend:true/background:255:255:255/path/media/catalog/product/d/e/deurlijst-88-4st-v_01_main.jpg"
    ],
    "rating": null,
    "review_count": null,
    "reviews_summary": null,
    "scraped_at": "2026-02-05T16:56:47.781949Z",
    "scrape_success": true,
    "scrape_errors": [],
    "embedding_text": "Product: Deurlijst 88 MDF Vochtwerend Chambrant 18x88mm wit voorgelakt per 4 stuks\nBrand: HouthandelOnline\nCategory: Douglas hout > Toon alles in Douglas hout > Douglas hout palen > Douglas hout balken > Douglas hout latten en regels\nDescription: Deze houten MDF V313 architraven, ook wel koplijsten of deurlijsten genoemd, zijn wit voorgelakt en vochtwerend. Toepassing van een afdeklijst als sier architraaf zorgt voor een nette afwerking van het deurkozijn en de afgewerkte wand. Verpakt per 4 stuks.\nSpecifications: Levertijd: 2-7 werkdagen, Kopmaat: 18x88 mm, Dikte: 18 mm, Breedte: 88, Materiaal: MDF\nPrice: EUR 100.38"
  },
  {
    "id": "5f833fae25e2",
    "source_url": "https://www.houthandelonline.nl/deurlijst-68-4st",
    "name": "Deurlijst 68 MDF Vochtwerend Chambrant 12x68mm wit voorgelakt per 4 stuks",
    "description": "Deze houten MDF V313 architraven, ook wel koplijsten of deurlijsten genoemd, zijn wit voorgelakt en vochtwerend. Toepassing van een afdeklijst als sier architraaf zorgt voor een nette afwerking van het deurkozijn en de afgewerkte wand. Verpakt per 4 stuks.",
    "brand": "HouthandelOnline",
    "category": "Douglas hout > Toon alles in Douglas hout > Douglas hout palen > Douglas hout balken > Douglas hout latten en regels",
    "price": 54.56,
    "currency": "EUR",
    "price_raw": "€2,79/m1",
    "specs": {
      "raw": {
        "Levertijd": "2-7 werkdagen",
        "Kopmaat": "12x68 mm",
        "Dikte": "12 mm",
        "Breedte": "68",
        "Materiaal": "MDF"
      }
    },
    "images": [
      "https://www.houthandelonline.nl/cdn/resize-extended/el:true/rs:fill/w:1500/h:1068/extend:true/background:255:255:255/path/media/catalog/product/d/e/deurlijst-68-4st-v_01_main.jpg"
    ],
    "rating": null,
    "review_count": null,
    "reviews_summary": null,
    "scraped_at": "2026-02-05T16:56:47.781960Z",
    "scrape_success": true,
    "scrape_errors": [],
    "embedding_text": "Product: Deurlijst 68 MDF Vochtwerend Chambrant 12x68mm wit voorgelakt per 4 stuks\nBrand: HouthandelOnline\nCategory: Douglas hout > Toon alles in Douglas hout > Douglas hout palen > Douglas hout balken > Douglas hout latten en regels\nDescription: Deze houten MDF V313 architraven, ook wel koplijsten of deurlijsten genoemd, zijn wit voorgelakt en vochtwerend. Toepassing van een afdeklijst als sier architraaf zorgt voor een nette afwerking van het deurkozijn en de afgewerkte wand. Verpakt per 4 stuks.\nSpecifications: Levertijd: 2-7 werkdagen, Kopmaat: 12x68 mm, Dikte: 12 mm, Breedte: 68, Materiaal: MDF\nPrice: EUR 54.56"
  },
  {
    "id": "30a8d5cc027e",
    "source_url": "https://www.houthandelonline.nl/deurlijst-70-4st",
    "name": "Deurlijst 70 MDF Vochtwerend Chambrant 12x70mm wit voorgelakt per 4 stuks",
    "description": "Deze houten MDF V313 architraven, ook wel koplijsten of deurlijsten genoemd, zijn wit voorgelakt en vochtwerend. Toepassing van een afdeklijst als sier architraaf zorgt voor een nette afwerking van het deurkozijn en de afgewerkte wand. Verpakt per 4 stuks.",
    "brand": "HouthandelOnline",
    "category": "Douglas hout > Toon alles in Douglas hout > Douglas hout palen > Douglas hout balken > Douglas hout latten en regels",
    "price": 54.56,
    "currency": "EUR",
    "price_raw": "€2,79/m1",
    "specs": {
      "raw": {
        "Levertijd": "2-7 werkdagen",
        "Kopmaat": "12x70 mm",
        "Dikte": "12 mm",
        "Breedte": "70",
        "Materiaal": "MDF"
      }
    },
    "images": [
      "https://www.houthandelonline.nl/cdn/resize-extended/el:true/rs:fill/w:1500/h:1068/extend:true/background:255:255:255/path/media/catalog/product/d/e/deurlijst-70-4st-v_01_main.jpg"
    ],
    "rating": null,
    "review_count": null,
    "reviews_summary": null,
    "scraped_at": "2026-02-05T16:56:47.781979Z",
    "scrape_success": true,
    "scrape_errors": [],
    "embedding_text": "Product: Deurlijst 70 MDF Vochtwerend Chambrant 12x70mm wit voorgelakt per 4 stuks\nBrand: HouthandelOnline\nCategory: Douglas hout > Toon alles in Douglas hout > Douglas hout palen > Douglas hout balken > Douglas hout latten en regels\nDescription: Deze houten MDF V313 architraven, ook wel koplijsten of deurlijsten genoemd, zijn wit voorgelakt en vochtwerend. Toepassing van een afdeklijst als sier architraaf zorgt voor een nette afwerking van het deurkozijn en de afgewerkte wand. Verpakt per 4 stuks.\nSpecifications: Levertijd: 2-7 werkdagen, Kopmaat: 12x70 mm, Dikte: 12 mm, Breedte: 70, Materiaal: MDF\nPrice: EUR 54.56"
  },
  {
    "id": "ebc99debc1df",
    "source_url": "https://www.houthandelonline.nl/vensterb-kantband-sneeuw-wit",
    "name": "Kantband vensterbank sneeuw wit",
    "description": "Dit kantband wordt toegepast bij de vensterbank met een sneeuw wit uitstraling voor een nette afwerking van de kopse kanten.",
    "brand": "HouthandelOnline",
    "category": "Douglas hout > Toon alles in Douglas hout > Douglas hout palen > Douglas hout balken > Douglas hout latten en regels",
    "price": 3.32,
    "currency": "EUR",
    "price_raw": null,
    "specs": {
      "raw": {
        "Levertijd": "2-7 werkdagen",
        "Materiaal": "Overig",
        "Toepassing": "Dit kantband is geschikt voor vensterbank geplastificeerd spaanplaat sneeuw wit decor",
        "Afwerking": "De kantstrook is"
      }
    },
    "images": [
      "https://www.houthandelonline.nl/cdn/resize-extended/el:true/rs:fill/w:1500/h:1068/extend:true/background:255:255:255/path/media/catalog/product/v/e/vensterb-kantband-sneeuw-wit-v_01_main.jpg"
    ],
    "rating": null,
    "review_count": null,
    "reviews_summary": null,
    "scraped_at": "2026-02-05T16:56:47.781991Z",
    "scrape_success": true,
    "scrape_errors": [],
    "embedding_text": "Product: Kantband vensterbank sneeuw wit\nBrand: HouthandelOnline\nCategory: Douglas hout > Toon alles in Douglas hout > Douglas hout palen > Douglas hout balken > Douglas hout latten en regels\nDescription: Dit kantband wordt toegepast bij de vensterbank met een sneeuw wit uitstraling voor een nette afwerking van de kopse kanten.\nSpecifications: Levertijd: 2-7 werkdagen, Materiaal: Overig, Toepassing: Dit kantband is geschikt voor vensterbank geplastificeerd spaanplaat sneeuw wit decor, Afwerking: De kantstrook is\nPrice: EUR 3.32"
  },
  {
    "id": "e153f53e308c",
    "source_url": "https://www.houthandelonline.nl/koplat-mdf-klassiek-18x68-4",
    "name": "Koplat MDF Vochtwerend (klassiek model) 18x68mm wit voorgelakt per 4 stuks",
    "description": "Deze vochtwerende V313 koplat (klassiek model) is geschikt voor de afwerking van een vloer of wand van de aansluiting van kozijnstijl en afgewerkte wand. De koplatten zijn wit voorgelakt en zijn voor de sierlijke afwerking rond deuren of ramen. Deze koplat heeft een afmeting van 18x68mm en is wit voorgelakt. De koplatten zijn verpakt per 4 stuks.",
    "brand": "HouthandelOnline",
    "category": "Douglas hout > Toon alles in Douglas hout > Douglas hout palen > Douglas hout balken > Douglas hout latten en regels",
    "price": 89.76,
    "currency": "EUR",
    "price_raw": "€4,60/m1",
    "specs": {
      "raw": {
        "Levertijd": "2-7 werkdagen",
        "Kopmaat": "18x68 mm",
        "Dikte": "18 mm",
        "Breedte": "68",
        "Materiaal": "MDF",
        "Toepassing": "Lijstwerk voor het afwerken van de aansluiting tussen wand en kozijn"
      }
    },
    "images": [
      "https://www.houthandelonline.nl/cdn/resize-extended/el:true/rs:fill/w:1500/h:1068/extend:true/background:255:255:255/path/media/catalog/product/k/o/koplat18.jpg"
    ],
    "rating": null,
    "review_count": null,
    "reviews_summary": null,
    "scraped_at": "2026-02-05T16:56:47.782002Z",
    "scrape_success": true,
    "scrape_errors": [],
    "embedding_text": "Product: Koplat MDF Vochtwerend (klassiek model) 18x68mm wit voorgelakt per 4 stuks\nBrand: HouthandelOnline\nCategory: Douglas hout > Toon alles in Douglas hout > Douglas hout palen > Douglas hout balken > Douglas hout latten en regels\nDescription: Deze vochtwerende V313 koplat (klassiek model) is geschikt voor de afwerking van een vloer of wand van de aansluiting van kozijnstijl en afgewerkte wand. De koplatten zijn wit voorgelakt en zijn voor de sierlijke afwerking rond deuren of ramen. Deze koplat heeft een afmeting van 18x68mm en is wit voorgelakt. De koplatten zijn verpakt per 4 stuks.\nSpecifications: Levertijd: 2-7 werkdagen, Kopmaat: 18x68 mm, Dikte: 18 mm, Breedte: 68, Materiaal: MDF, Toepassing: Lijstwerk voor het afwerken van de aansluiting tussen wand en kozijn\nPrice: EUR 89.76"
  },
  {
    "id": "44e899045747",
    "source_url": "https://www.houthandelonline.nl/koplat-mdf-klassiek-12x68-4",
    "name": "Koplat MDF Vochtwerend (klassiek model) 12x68mm wit voorgelakt per 4 stuks",
    "description": "Deze vochtwerende V313 koplat (klassiek model) is geschikt voor de afwerking van een vloer of wand van de aansluiting van kozijnstijl en afgewerkte wand. De koplatten zijn wit voorgelakt en zijn voor de sierlijke afwerking rond deuren of ramen. Deze koplat heeft een afmeting van 12x68mm en is wit voorgelakt. De koplatten zijn verpakt per 4 stuks.",
    "brand": "HouthandelOnline",
    "category": "Douglas hout > Toon alles in Douglas hout > Douglas hout palen > Douglas hout balken > Douglas hout latten en regels",
    "price": 65.9,
    "currency": "EUR",
    "price_raw": "€3,38/m1",
    "specs": {
      "raw": {
        "Levertijd": "2-7 werkdagen",
        "Kopmaat": "12x68 mm",
        "Dikte": "12 mm",
        "Breedte": "68",
        "Materiaal": "MDF",
        "Toepassing": "Lijstwerk voor het afwerken van de aansluiting tussen wand en kozijn"
      }
    },
    "images": [
      "https://www.houthandelonline.nl/cdn/resize-extended/el:true/rs:fill/w:1500/h:1068/extend:true/background:255:255:255/path/media/catalog/product/k/o/koplat12.jpg"
    ],
    "rating": null,
    "review_count": null,
    "reviews_summary": null,
    "scraped_at": "2026-02-05T16:56:47.782014Z",
    "scrape_success": true,
    "scrape_errors": [],
    "embedding_text": "Product: Koplat MDF Vochtwerend (klassiek model) 12x68mm wit voorgelakt per 4 stuks\nBrand: HouthandelOnline\nCategory: Douglas hout > Toon alles in Douglas hout > Douglas hout palen > Douglas hout balken > Douglas hout latten en regels\nDescription: Deze vochtwerende V313 koplat (klassiek model) is geschikt voor de afwerking van een vloer of wand van de aansluiting van kozijnstijl en afgewerkte wand. De koplatten zijn wit voorgelakt en zijn voor de sierlijke afwerking rond deuren of ramen. Deze koplat heeft een afmeting van 12x68mm en is wit voorgelakt. De koplatten zijn verpakt per 4 stuks.\nSpecifications: Levertijd: 2-7 werkdagen, Kopmaat: 12x68 mm, Dikte: 12 mm, Breedte: 68, Materiaal: MDF, Toepassing: Lijstwerk voor het afwerken van de aansluiting tussen wand en kozijn\nPrice: EUR 65.9"
  },
  {
    "id": "02b896be0073",
    "source_url": "https://www.houthandelonline.nl/neuslijst-vuren28x140-ongegr",
    "name": "Neuslijst Vuren 28x140mm geschaafd ongegrond",
    "description": "Deze Vuren houten neuslijst heeft afgeronde geschaafde hoeken. Een neuslijst dient ter afwerking en verfraaiing van goten, gevels of schouwen.",
    "brand": "HouthandelOnline",
    "category": "Douglas hout > Toon alles in Douglas hout > Douglas hout palen > Douglas hout balken > Douglas hout latten en regels",
    "price": 42.05,
    "currency": "EUR",
    "price_raw": "€8,76/m1",
    "specs": {
      "raw": {
        "Levertijd": "2-7 werkdagen",
        "Kopmaat": "28x140 mm",
        "Dikte": "28 mm",
        "Breedte": "140",
        "Materiaal": "Vuren",
        "Toepassing": "Deze neuslijst is geschaafd en ongegrond. Deze neuslijst zorgt voor een mooie klassieke uitstraling van de buitengevel als goot"
      }
    },
    "images": [
      "https://www.houthandelonline.nl/cdn/resize-extended/el:true/rs:fill/w:1500/h:1068/extend:true/background:255:255:255/path/media/catalog/product/n/e/neuslijst_vuren_ongegrond_1.jpg"
    ],
    "rating": null,
    "review_count": null,
    "reviews_summary": null,
    "scraped_at": "2026-02-05T16:56:47.782032Z",
    "scrape_success": true,
    "scrape_errors": [],
    "embedding_text": "Product: Neuslijst Vuren 28x140mm geschaafd ongegrond\nBrand: HouthandelOnline\nCategory: Douglas hout > Toon alles in Douglas hout > Douglas hout palen > Douglas hout balken > Douglas hout latten en regels\nDescription: Deze Vuren houten neuslijst heeft afgeronde geschaafde hoeken. Een neuslijst dient ter afwerking en verfraaiing van goten, gevels of schouwen.\nSpecifications: Levertijd: 2-7 werkdagen, Kopmaat: 28x140 mm, Dikte: 28 mm, Breedte: 140, Materiaal: Vuren, Toepassing: Deze neuslijst is geschaafd en ongegrond. Deze neuslijst zorgt voor een mooie klassieke uitstraling van de buitengevel als goot\nPrice: EUR 42.05"
  },
  {
    "id": "a13110e9723c",
    "source_url": "https://www.houthandelonline.nl/neuslijst-vuren28x120-ongegr",
    "name": "Neuslijst Vuren 28x120mm geschaafd ongegrond",
    "description": "Deze Vuren houten neuslijst heeft afgeronde geschaafde hoeken. Een neuslijst dient ter afwerking en verfraaiing van goten, gevels of schouwen.",
    "brand": "HouthandelOnline",
    "category": "Douglas hout > Toon alles in Douglas hout > Douglas hout palen > Douglas hout balken > Douglas hout latten en regels",
    "price": 42.05,
    "currency": "EUR",
    "price_raw": "€8,76/m1",
    "specs": {
      "raw": {
        "Levertijd": "2-7 werkdagen",
        "Kopmaat": "28x120 mm",
        "Dikte": "28 mm",
        "Breedte": "120",
        "Materiaal": "Vuren",
        "Toepassing": "Deze neuslijst is geschaafd en ongegrond. Deze neuslijst zorgt voor een mooie klassieke uitstraling van de buitengevel als goot"
      }
    },
    "images": [
      "https://www.houthandelonline.nl/cdn/resize-extended/el:true/rs:fill/w:1500/h:1068/extend:true/background:255:255:255/path/media/catalog/product/n/e/neuslijst_vuren_ongegrond.jpg"
    ],
    "rating": null,
    "review_count": null,
    "reviews_summary": null,
    "scraped_at": "2026-02-05T16:56:47.782043Z",
    "scrape_success": true,
    "scrape_errors": [],
    "embedding_text": "Product: Neuslijst Vuren 28x120mm geschaafd ongegrond\nBrand: HouthandelOnline\nCategory: Douglas hout > Toon alles in Douglas hout > Douglas hout palen > Douglas hout balken > Douglas hout latten en regels\nDescription: Deze Vuren houten neuslijst heeft afgeronde geschaafde hoeken. Een neuslijst dient ter afwerking en verfraaiing van goten, gevels of schouwen.\nSpecifications: Levertijd: 2-7 werkdagen, Kopmaat: 28x120 mm, Dikte: 28 mm, Breedte: 120, Materiaal: Vuren, Toepassing: Deze neuslijst is geschaafd en ongegrond. Deze neuslijst zorgt voor een mooie klassieke uitstraling van de buitengevel als goot\nPrice: EUR 42.05"
  },
  {
    "id": "e3e0c3949c9b",
    "source_url": "https://www.houthandelonline.nl/neuslijst-meranti-27x120-ongegr",
    "name": "Neuslijst Meranti 27x120mm geschaafd ongegrond",
    "description": "Deze Meranti houten neuslijst is ongegrond en heeft afgeronde geschaafde hoeken. Een neuslijst dient ter afwerking en verfraaiing van goten, gevels of schouwen. Verpakt per stuk.",
    "brand": "HouthandelOnline",
    "category": "Douglas hout > Toon alles in Douglas hout > Douglas hout palen > Douglas hout balken > Douglas hout latten en regels",
    "price": 123.63,
    "currency": "EUR",
    "price_raw": "€25,23/m1",
    "specs": {
      "raw": {
        "Levertijd": "2-7 werkdagen",
        "Kopmaat": "27x120 mm",
        "Dikte": "27 mm",
        "Breedte": "120",
        "Materiaal": "Meranti",
        "Toepassing": "Deze neuslijst is geschaafd en ongegrond. Deze neuslijst zorgt voor een mooie klassieke uitstraling van de buitengevel als goot"
      }
    },
    "images": [
      "https://www.houthandelonline.nl/cdn/resize-extended/el:true/rs:fill/w:1500/h:1068/extend:true/background:255:255:255/path/media/catalog/product/n/e/neuslijst_meranti_ongegrond.jpg"
    ],
    "rating": null,
    "review_count": null,
    "reviews_summary": null,
    "scraped_at": "2026-02-05T16:56:47.782060Z",
    "scrape_success": true,
    "scrape_errors": [],
    "embedding_text": "Product: Neuslijst Meranti 27x120mm geschaafd ongegrond\nBrand: HouthandelOnline\nCategory: Douglas hout > Toon alles in Douglas hout > Douglas hout palen > Douglas hout balken > Douglas hout latten en regels\nDescription: Deze Meranti houten neuslijst is ongegrond en heeft afgeronde geschaafde hoeken. Een neuslijst dient ter afwerking en verfraaiing van goten, gevels of schouwen. Verpakt per stuk.\nSpecifications: Levertijd: 2-7 werkdagen, Kopmaat: 27x120 mm, Dikte: 27 mm, Breedte: 120, Materiaal: Meranti, Toepassing: Deze neuslijst is geschaafd en ongegrond. Deze neuslijst zorgt voor een mooie klassieke uitstraling van de buitengevel als goot\nPrice: EUR 123.63"
  },
  {
    "id": "9dd9ae96688b",
    "source_url": "https://www.houthandelonline.nl/neuslijst-meranti-27x140-ongegr",
    "name": "Neuslijst Meranti 27x140mm geschaafd ongegrond",
    "description": "Deze Meranti houten neuslijst is ongegrond en heeft afgeronde geschaafde hoeken. Een neuslijst dient ter afwerking en verfraaiing van goten, gevels of schouwen. Verpakt per stuk.",
    "brand": "HouthandelOnline",
    "category": "Douglas hout > Toon alles in Douglas hout > Douglas hout palen > Douglas hout balken > Douglas hout latten en regels",
    "price": 145.56,
    "currency": "EUR",
    "price_raw": "€29,71/m1",
    "specs": {
      "raw": {
        "Levertijd": "2-7 werkdagen",
        "Kopmaat": "27x140 mm",
        "Dikte": "27 mm",
        "Breedte": "140",
        "Materiaal": "Meranti",
        "Toepassing": "Deze neuslijst is geschaafd en ongegrond. Deze neuslijst zorgt voor een mooie klassieke uitstraling van de buitengevel als goot"
      }
    },
    "images": [
      "https://www.houthandelonline.nl/cdn/resize-extended/el:true/rs:fill/w:1500/h:1068/extend:true/background:255:255:255/path/media/catalog/product/n/e/neuslijst_meranti_ongegrond_1.jpg"
    ],
    "rating": null,
    "review_count": null,
    "reviews_summary": null,
    "scraped_at": "2026-02-05T16:56:47.782070Z",
    "scrape_success": true,
    "scrape_errors": [],
    "embedding_text": "Product: Neuslijst Meranti 27x140mm geschaafd ongegrond\nBrand: HouthandelOnline\nCategory: Douglas hout > Toon alles in Douglas hout > Douglas hout palen > Douglas hout balken > Douglas hout latten en regels\nDescription: Deze Meranti houten neuslijst is ongegrond en heeft afgeronde geschaafde hoeken. Een neuslijst dient ter afwerking en verfraaiing van goten, gevels of schouwen. Verpakt per stuk.\nSpecifications: Levertijd: 2-7 werkdagen, Kopmaat: 27x140 mm, Dikte: 27 mm, Breedte: 140, Materiaal: Meranti, Toepassing: Deze neuslijst is geschaafd en ongegrond. Deze neuslijst zorgt voor een mooie klassieke uitstraling van de buitengevel als goot\nPrice: EUR 145.56"
  }
]