[
  {
    "id": "56c396a685d3",
    "source_url": "https://www.houthandelonline.nl/betonpoer-antraciet-20x20",
    "name": "Betonpoer met draadeind en stelplaat 20x20cm (boven maat) 60cm antraciet",
    "description": "Deze rechte betonpoer van 200x200mm in de kleur antraciet heeft een hoogte van 600mm. Deze betonpoer wordt gebruikt om palen te stellen en ervoor te zorgen dat het hout niet in contact komt met de grond. Hierdoor wordt de levensduur verlengd. Daarnaast biedt het een stevige fundering voor het creëren van bouwprojecten zoals veranda's, carports of overkappingen. Deze poer wordt geleverd inclusief: M16 draadeind van 14cm, stelplaat van 90x90mm met opgelaste moer en M16 huls waar het draadeind ingedraaid wordt. Let op: separaat dienen 4 stuks van de 8x80mm tellerkopschroeven mee besteld te worden ter bevestiging van de stelplaat.",
    "brand": "HouthandelOnline",
    "category": "Douglas hout > Toon alles in Douglas hout > Douglas hout palen > Douglas hout balken > Douglas hout latten en regels",
    "price": 30.19,
    "currency": "EUR",
    "price_raw": "€28,92/m1",
    "specs": {
      "raw": {
        "Levertijd": "2-7 werkdagen",
        "Kopmaat": "200x200 mm",
        "Dikte": "200 mm",
        "Breedte": "200",
        "Materiaal": "Beton"
      }
    },
    "images": [
      "https://www.houthandelonline.nl/cdn/resize-extended/el:true/rs:fill/w:1500/h:1068/extend:true/background:255:255:255/path/media/catalog/product/b/e/betonpoer-antraciet-20x20-v_01_main.jpg",
      "https://www.houthandelonline.nl/cdn/resize-extended/el:true/rs:fill/w:1500/h:1068/extend:true/background:255:255:255/path/media/catalog/product/b/e/betonpoer-antraciet-20x20-v_02_view.jpg",
      "https://www.houthandelonline.nl/cdn/resize-extended/el:true/rs:fill/w:1500/h:1068/extend:true/background:255:255:255/path/media/catalog/product/b/e/betonpoer-antraciet-20x20-v_03_view.jpg",
      "https://www.houthandelonline.nl/cdn/resize-extended/el:true/rs:fill/w:1500/h:1068/extend:true/background:255:255:255/path/media/catalog/product/b/e/betonpoer-antraciet-20x20-v_04_view.JPG",
      "https://www.houthandelonline.nl/cdn/resize-extended/el:true/rs:fill/w:1500/h:1068/extend:true/background:255:255:255/path/media/catalog/product/b/e/betonpoer-antraciet-20x20-v_05_view.JPG",
      "https://www.houthandelonline.nl/cdn/resize-extended/el:true/rs:fill/w:1500/h:1068/extend:true/background:255:255:255/path/media/catalog/product/b/e/betonpoer-antraciet-20x20-v_06_view.JPG",
      "https://www.houthandelonline.nl/cdn/resize-extended/el:true/rs:fill/w:1500/h:1068/extend:true/background:255:255:255/path/media/catalog/product/b/e/betonpoer-antraciet-20x20-v_07_view.JPG",
      "https://www.houthandelonline.nl/cdn/resize-extended/el:true/rs:fill/w:1500/h:1068/extend:true/background:255:255:255/path/media/catalog/product/b/e/betonpoer-antraciet-20x20-v_08_view.jpg"
    ],
    "rating": null,
    "review_count": null,
    "reviews_summary": null,
    "scraped_at": "2026-02-05T15:04:10.176601Z",
    "scrape_success": true,
    "scrape_errors": [],
    "embedding_text": "Product: Betonpoer met draadeind en stelplaat 20x20cm (boven maat) 60cm antraciet\nBrand: HouthandelOnline\nCategory: Douglas hout > Toon alles in Douglas hout > Douglas hout palen > Douglas hout balken > Douglas hout latten en regels\nDescription: Deze rechte betonpoer van 200x200mm in de kleur antraciet heeft een hoogte van 600mm. Deze betonpoer wordt gebruikt om palen te stellen en ervoor te zorgen dat het hout niet in contact komt met de grond. Hierdoor wordt de levensduur verlengd. Daarnaast biedt het een stevige fundering voor het creëren van bouwprojecten zoals veranda's, carports of overkappingen. Deze poer wordt geleverd inclusief: M16 draadeind van 14cm, stelplaat van 90x90mm met opgelaste moer en M16 huls waar het draadeind ingedraaid wordt. Let op: separaat dienen 4 stuks van de 8x80mm tellerkopschroeven mee besteld te worden ter bevestiging van de stelplaat.\nSpecifications: Levertijd: 2-7 werkdagen, Kopmaat: 200x200 mm, Dikte: 200 mm, Breedte: 200, Materiaal: Beton\nPrice: EUR 30.19"
  },
  {
    "id": "27cdcbd0ab7c",
    "source_url": "https://www.houthandelonline.nl/snelbeton",
    "name": "Snelbeton",
    "description": "Het snelbeton van Houthandelonline is ideaal voor het snel vastzetten van palen, hekwerken, masten en betonpoeren. 1 Zak snelbeton is goed voor 13 liter beton. Het gemiddelde gebruik is 1 zak per vast te zetten paal of per betonpoer. Snelbeton is een mengsel van cement, zand, grind, hulp- en vulstoffen. Deze snelbeton hoeft niet gemengd te worden en is na het aanmaken met water in ca. 15 minuten verankerd.",
    "brand": "HouthandelOnline",
    "category": "Douglas hout > Toon alles in Douglas hout > Douglas hout palen > Douglas hout balken > Douglas hout latten en regels",
    "price": 12.04,
    "currency": "EUR",
    "price_raw": null,
    "specs": {
      "raw": {
        "Levertijd": "2-7 werkdagen",
        "Materiaal": "Beton"
      }
    },
    "images": [
      "https://www.houthandelonline.nl/cdn/resize-extended/el:true/rs:fill/w:1500/h:1068/extend:true/background:255:255:255/path/media/catalog/product/s/n/snelbeton-v_01_main.jpg"
    ],
    "rating": null,
    "review_count": null,
    "reviews_summary": null,
    "scraped_at": "2026-02-05T15:04:10.176663Z",
    "scrape_success": true,
    "scrape_errors": [],
    "embedding_text": "Product: Snelbeton\nBrand: HouthandelOnline\nCategory: Douglas hout > Toon alles in Douglas hout > Douglas hout palen > Douglas hout balken > Douglas hout latten en regels\nDescription: Het snelbeton van Houthandelonline is ideaal voor het snel vastzetten van palen, hekwerken, masten en betonpoeren. 1 Zak snelbeton is goed voor 13 liter beton. Het gemiddelde gebruik is 1 zak per vast te zetten paal of per betonpoer. Snelbeton is een mengsel van cement, zand, grind, hulp- en vulstoffen. Deze snelbeton hoeft niet gemengd te worden en is na het aanmaken met water in ca. 15 minuten verankerd.\nSpecifications: Levertijd: 2-7 werkdagen, Materiaal: Beton\nPrice: EUR 12.04"
  },
  {
    "id": "a9565ffdb5f6",
    "source_url": "https://www.houthandelonline.nl/gips-stucplaten-9-5",
    "name": "Gips Stucplaten 9,5mm",
    "description": "Gipsplaten Stucplaten. 9,5mm dik. Er kan rechtstreeks op gestukadoord worden",
    "brand": "HouthandelOnline",
    "category": "Douglas hout > Toon alles in Douglas hout > Douglas hout palen > Douglas hout balken > Douglas hout latten en regels",
    "price": 6.66,
    "currency": "EUR",
    "price_raw": "€0,68/m1",
    "specs": {
      "raw": {
        "Levertijd": "2-7 werkdagen",
        "Materiaal": "Gips",
        "Toepassing": "Gipsplaten zijn geschikt voor wand- en plafonbekleding. De platen gips worden gemonteerd op een onderconstructie van stijl- en regelwerk welke soms is voorzien van een constructieplaat als Elliotis Pine of OSB",
        "Afwerking": "Gips Stuc karton"
      }
    },
    "images": [
      "https://www.houthandelonline.nl/cdn/resize-extended/el:true/rs:fill/w:1500/h:1068/extend:true/background:255:255:255/path/media/catalog/product/g/i/gips-stucplaten-9-5-v_01_main.jpg"
    ],
    "rating": null,
    "review_count": null,
    "reviews_summary": null,
    "scraped_at": "2026-02-05T15:04:10.176682Z",
    "scrape_success": true,
    "scrape_errors": [],
    "embedding_text": "Product: Gips Stucplaten 9,5mm\nBrand: HouthandelOnline\nCategory: Douglas hout > Toon alles in Douglas hout > Douglas hout palen > Douglas hout balken > Douglas hout latten en regels\nDescription: Gipsplaten Stucplaten. 9,5mm dik. Er kan rechtstreeks op gestukadoord worden\nSpecifications: Levertijd: 2-7 werkdagen, Materiaal: Gips, Toepassing: Gipsplaten zijn geschikt voor wand- en plafonbekleding. De platen gips worden gemonteerd op een onderconstructie van stijl- en regelwerk welke soms is voorzien van een constructieplaat als Elliotis Pine of OSB, Afwerking: Gips Stuc karton\nPrice: EUR 6.66"
  },
  {
    "id": "881f4d16fe43",
    "source_url": "https://www.houthandelonline.nl/gipsplaten-plafond-rond-9-5",
    "name": "Gipsplaten Plafond 9,5mm ronde kanten",
    "description": "Gipsplaten 9,5mm dik. De lange kanten hebben een afgeronde kant. (toepassing veelal plafond)",
    "brand": "HouthandelOnline",
    "category": "Douglas hout > Toon alles in Douglas hout > Douglas hout palen > Douglas hout balken > Douglas hout latten en regels",
    "price": 8.69,
    "currency": "EUR",
    "price_raw": null,
    "specs": {
      "raw": {
        "Levertijd": "2-7 werkdagen",
        "Materiaal": "Gips",
        "Toepassing": "Gipsplaten zijn geschikt voor wand- en plafonbekleding. De platen gips worden gemonteerd op een onderconstructie van stijl- en regelwerk",
        "Afwerking": "Gipskarton RK"
      }
    },
    "images": [
      "https://www.houthandelonline.nl/cdn/resize-extended/el:true/rs:fill/w:1500/h:1068/extend:true/background:255:255:255/path/media/catalog/product/g/i/gipsplaten-plafond-rond-9-5-v_01_main_1.jpg"
    ],
    "rating": null,
    "review_count": null,
    "reviews_summary": null,
    "scraped_at": "2026-02-05T15:04:10.176694Z",
    "scrape_success": true,
    "scrape_errors": [],
    "embedding_text": "Product: Gipsplaten Plafond 9,5mm ronde kanten\nBrand: HouthandelOnline\nCategory: Douglas hout > Toon alles in Douglas hout > Douglas hout palen > Douglas hout balken > Douglas hout latten en regels\nDescription: Gipsplaten 9,5mm dik. De lange kanten hebben een afgeronde kant. (toepassing veelal plafond)\nSpecifications: Levertijd: 2-7 werkdagen, Materiaal: Gips, Toepassing: Gipsplaten zijn geschikt voor wand- en plafonbekleding. De platen gips worden gemonteerd op een onderconstructie van stijl- en regelwerk, Afwerking: Gipskarton RK\nPrice: EUR 8.69"
  },
  {
    "id": "9504845dc1aa",
    "source_url": "https://www.houthandelonline.nl/gipsplaten-wand-4-ak-12-5",
    "name": "Gipsplaten Wand 12,5mm 4-zijden afgeschuinde kanten",
    "description": "Gipsplaten met 4-afgeschuinde kanten 12,5mm dik. Voor het bekleden van grotere vlakken zonder aanzettingen.",
    "brand": "HouthandelOnline",
    "category": "Douglas hout > Toon alles in Douglas hout > Douglas hout palen > Douglas hout balken > Douglas hout latten en regels",
    "price": 28.96,
    "currency": "EUR",
    "price_raw": null,
    "specs": {
      "raw": {
        "Levertijd": "2-7 werkdagen",
        "Materiaal": "Gips",
        "Toepassing": "Gipsplaten zijn geschikt voor wand- en plafonbekleding. De platen gips worden gemonteerd op een onderconstructie van stijl- en regelwerk welke soms is voorzien van een constructieplaat als Elliotis Pine of OSB",
        "Afwerking": "Gipskarton"
      }
    },
    "images": [
      "https://www.houthandelonline.nl/cdn/resize-extended/el:true/rs:fill/w:1500/h:1068/extend:true/background:255:255:255/path/media/catalog/product/g/i/gipsplaten-wand-4-ak-12-5-v_01_main_1.jpg"
    ],
    "rating": null,
    "review_count": null,
    "reviews_summary": null,
    "scraped_at": "2026-02-05T15:04:10.176704Z",
    "scrape_success": true,
    "scrape_errors": [],
    "embedding_text": "Product: Gipsplaten Wand 12,5mm 4-zijden afgeschuinde kanten\nBrand: HouthandelOnline\nCategory: Douglas hout > Toon alles in Douglas hout > Douglas hout palen > Douglas hout balken > Douglas hout latten en regels\nDescription: Gipsplaten met 4-afgeschuinde kanten 12,5mm dik. Voor het bekleden van grotere vlakken zonder aanzettingen.\nSpecifications: Levertijd: 2-7 werkdagen, Materiaal: Gips, Toepassing: Gipsplaten zijn geschikt voor wand- en plafonbekleding. De platen gips worden gemonteerd op een onderconstructie van stijl- en regelwerk welke soms is voorzien van een constructieplaat als Elliotis Pine of OSB, Afwerking: Gipskarton\nPrice: EUR 28.96"
  },
  {
    "id": "6abc960ddb42",
    "source_url": "https://www.houthandelonline.nl/gipsplaten-wand-ak-12-5",
    "name": "Gipsplaten Wand 12,5mm afgeschuinde kanten",
    "description": "Gipsplaten 12,5mm dik. De lange kanten hebben een afgeschuinde kant. (toepassing veelal voor de wand)",
    "brand": "HouthandelOnline",
    "category": "Douglas hout > Toon alles in Douglas hout > Douglas hout palen > Douglas hout balken > Douglas hout latten en regels",
    "price": 8.47,
    "currency": "EUR",
    "price_raw": null,
    "specs": {
      "raw": {
        "Levertijd": "2-7 werkdagen",
        "Materiaal": "Gips",
        "Toepassing": "Gipsplaten zijn geschikt voor wand- en plafonbekleding. De platen gips worden gemonteerd op een onderconstructie van stijl- en regelwerk welke soms is voorzien van een constructieplaat als Elliotis Pine of OSB",
        "Afwerking": "Gipskarton"
      }
    },
    "images": [
      "https://www.houthandelonline.nl/cdn/resize-extended/el:true/rs:fill/w:1500/h:1068/extend:true/background:255:255:255/path/media/catalog/product/g/i/gipsplaten-wand-ak-12-5-v_01_main.jpg"
    ],
    "rating": null,
    "review_count": null,
    "reviews_summary": null,
    "scraped_at": "2026-02-05T15:04:10.176713Z",
    "scrape_success": true,
    "scrape_errors": [],
    "embedding_text": "Product: Gipsplaten Wand 12,5mm afgeschuinde kanten\nBrand: HouthandelOnline\nCategory: Douglas hout > Toon alles in Douglas hout > Douglas hout palen > Douglas hout balken > Douglas hout latten en regels\nDescription: Gipsplaten 12,5mm dik. De lange kanten hebben een afgeschuinde kant. (toepassing veelal voor de wand)\nSpecifications: Levertijd: 2-7 werkdagen, Materiaal: Gips, Toepassing: Gipsplaten zijn geschikt voor wand- en plafonbekleding. De platen gips worden gemonteerd op een onderconstructie van stijl- en regelwerk welke soms is voorzien van een constructieplaat als Elliotis Pine of OSB, Afwerking: Gipskarton\nPrice: EUR 8.47"
  },
  {
    "id": "d8623bd5651c",
    "source_url": "https://www.houthandelonline.nl/gipsplaten-hydro-ak-12-5",
    "name": "Gipsplaten Wand Hydro (natte ruimtes) 12,5mm afgeschuinde kanten",
    "description": "Gipsplaten Hydro vezel versterkt (voor natte ruimtes) 12,5mm dik. De lange kanten hebben een afgeschuinde kant. (toepassing veelal voor de wand)",
    "brand": "HouthandelOnline",
    "category": "Douglas hout > Toon alles in Douglas hout > Douglas hout palen > Douglas hout balken > Douglas hout latten en regels",
    "price": 16.14,
    "currency": "EUR",
    "price_raw": null,
    "specs": {
      "raw": {
        "Levertijd": "2-7 werkdagen",
        "Materiaal": "Gips",
        "Toepassing": "Gipsplaten zijn geschikt voor wand- en plafonbekleding in natte ruimten. De platen gips worden gemonteerd op een onderconstructie van stijl- en regelwerk welke soms is voorzien van een constructieplaat als Elliotis Pine of OSB",
        "Afwerking": "Gipskarton Hydro"
      }
    },
    "images": [
      "https://www.houthandelonline.nl/cdn/resize-extended/el:true/rs:fill/w:1500/h:1068/extend:true/background:255:255:255/path/media/catalog/product/g/i/gipsplaten-hydro-ak-12-5-v_01_main_1.jpg"
    ],
    "rating": null,
    "review_count": null,
    "reviews_summary": null,
    "scraped_at": "2026-02-05T15:04:10.176722Z",
    "scrape_success": true,
    "scrape_errors": [],
    "embedding_text": "Product: Gipsplaten Wand Hydro (natte ruimtes) 12,5mm afgeschuinde kanten\nBrand: HouthandelOnline\nCategory: Douglas hout > Toon alles in Douglas hout > Douglas hout palen > Douglas hout balken > Douglas hout latten en regels\nDescription: Gipsplaten Hydro vezel versterkt (voor natte ruimtes) 12,5mm dik. De lange kanten hebben een afgeschuinde kant. (toepassing veelal voor de wand)\nSpecifications: Levertijd: 2-7 werkdagen, Materiaal: Gips, Toepassing: Gipsplaten zijn geschikt voor wand- en plafonbekleding in natte ruimten. De platen gips worden gemonteerd op een onderconstructie van stijl- en regelwerk welke soms is voorzien van een constructieplaat als Elliotis Pine of OSB, Afwerking: Gipskarton Hydro\nPrice: EUR 16.14"
  },
  {
    "id": "a1aa0608261b",
    "source_url": "https://www.houthandelonline.nl/knauf-naturoll-140-38",
    "name": "Knauf isolatie 140mm Naturoll type 037 (2,12m2) isolatiewaarde 3,75m2K/W 38cm",
    "description": "Deze isolatie rol (op basis van Ecose) is bestemd voor de thermische, akoestische en brandveilige isolatie van hellende daken, houten gevelconstructies, houten vloeren, plafonds en voorzetwanden.",
    "brand": "HouthandelOnline",
    "category": "Douglas hout > Toon alles in Douglas hout > Douglas hout palen > Douglas hout balken > Douglas hout latten en regels",
    "price": 19.49,
    "currency": "EUR",
    "price_raw": null,
    "specs": {
      "raw": {
        "Levertijd": "2-7 werkdagen",
        "Dikte": "140 mm",
        "Materiaal": "Isolatie",
        "Toepassing": "Thermische-, akoestische- en brandveilige isolatie van hellende daken, houten gevelconstructies, houten vloeren, plafonds en voorzetwanden"
      }
    },
    "images": [
      "https://www.houthandelonline.nl/cdn/resize-extended/el:true/rs:fill/w:1500/h:1068/extend:true/background:255:255:255/path/media/catalog/product/k/n/knauf-naturoll-140-38-v_01_main.jpg"
    ],
    "rating": null,
    "review_count": null,
    "reviews_summary": null,
    "scraped_at": "2026-02-05T15:04:10.176731Z",
    "scrape_success": true,
    "scrape_errors": [],
    "embedding_text": "Product: Knauf isolatie 140mm Naturoll type 037 (2,12m2) isolatiewaarde 3,75m2K/W 38cm\nBrand: HouthandelOnline\nCategory: Douglas hout > Toon alles in Douglas hout > Douglas hout palen > Douglas hout balken > Douglas hout latten en regels\nDescription: Deze isolatie rol (op basis van Ecose) is bestemd voor de thermische, akoestische en brandveilige isolatie van hellende daken, houten gevelconstructies, houten vloeren, plafonds en voorzetwanden.\nSpecifications: Levertijd: 2-7 werkdagen, Dikte: 140 mm, Materiaal: Isolatie, Toepassing: Thermische-, akoestische- en brandveilige isolatie van hellende daken, houten gevelconstructies, houten vloeren, plafonds en voorzetwanden\nPrice: EUR 19.49"
  },
  {
    "id": "8c916af5bfa9",
    "source_url": "https://www.houthandelonline.nl/knauf-acoustifit-70mm",
    "name": "Isolatieplaat Knauf Acoustifit 70mm isolatiewaarde 1,85m2K/W 1 pak a 10 platen (8,1m2)",
    "description": "Veerkrachtige, isolatieplaat op basis van Ecose welke prettig verwerkt in wanden en plafonds met houten of metalen staanders en liggers. Vooral geschikt als wand- en plafondisolatie met eisen op het gebied van thermische-en geluidsisolatie.",
    "brand": "HouthandelOnline",
    "category": "Douglas hout > Toon alles in Douglas hout > Douglas hout palen > Douglas hout balken > Douglas hout latten en regels",
    "price": 45.58,
    "currency": "EUR",
    "price_raw": null,
    "specs": {
      "raw": {
        "Levertijd": "2-7 werkdagen",
        "Dikte": "70 mm",
        "Materiaal": "Isolatie",
        "Toepassing": "Vooral geschikt als wand- en plafondisolatie met eisen op het gebied van thermische-en geluidsisolatie"
      }
    },
    "images": [
      "https://www.houthandelonline.nl/cdn/resize-extended/el:true/rs:fill/w:1500/h:1068/extend:true/background:255:255:255/path/media/catalog/product/k/n/knauf-acoustifit-70mm-v_01_main.jpg"
    ],
    "rating": null,
    "review_count": null,
    "reviews_summary": null,
    "scraped_at": "2026-02-05T15:04:10.176739Z",
    "scrape_success": true,
    "scrape_errors": [],
    "embedding_text": "Product: Isolatieplaat Knauf Acoustifit 70mm isolatiewaarde 1,85m2K/W 1 pak a 10 platen (8,1m2)\nBrand: HouthandelOnline\nCategory: Douglas hout > Toon alles in Douglas hout > Douglas hout palen > Douglas hout balken > Douglas hout latten en regels\nDescription: Veerkrachtige, isolatieplaat op basis van Ecose welke prettig verwerkt in wanden en plafonds met houten of metalen staanders en liggers. Vooral geschikt als wand- en plafondisolatie met eisen op het gebied van thermische-en geluidsisolatie.\nSpecifications: Levertijd: 2-7 werkdagen, Dikte: 70 mm, Materiaal: Isolatie, Toepassing: Vooral geschikt als wand- en plafondisolatie met eisen op het gebied van thermische-en geluidsisolatie\nPrice: EUR 45.58"
  },
  {
    "id": "0a9449cbae79",
    "source_url": "https://www.houthandelonline.nl/knauf-spijkerflensdeken-80",
    "name": "Knauf spijkerflensdeken type TR312 80mm (6,6m2) isolatiewaarde 2,00m2K/W",
    "description": "Knauf Spijkerflensdeken is perfect als thermische-, akoestische- en brandwerende isolatie voor hellende daken. De steenwoldeken is aan 1-zijde voorzien van een dampremmend en luchtdicht alulaminaat en in de lengterichting voorzien van draad versterkte hechtranden. Deze duurzame, milieuvriendelijke en recyclebare deken valt onder brandklasse A1 en heeft een RD-waarde van 2,00m2K/W.",
    "brand": "HouthandelOnline",
    "category": "Douglas hout > Toon alles in Douglas hout > Douglas hout palen > Douglas hout balken > Douglas hout latten en regels",
    "price": 104.3,
    "currency": "EUR",
    "price_raw": null,
    "specs": {
      "raw": {
        "Levertijd": "2-7 werkdagen",
        "Dikte": "80 mm",
        "Materiaal": "Isolatie",
        "Toepassing": "Deze spijkerflensdeken is geschikt voor thermische isolatie van onder andere verdiepingsvloeren en (hellende) daken waar een verdere"
      }
    },
    "images": [
      "https://www.houthandelonline.nl/cdn/resize-extended/el:true/rs:fill/w:1500/h:1068/extend:true/background:255:255:255/path/media/catalog/product/k/n/knauf-spijkerflensdeken-80-v_01_main.jpg"
    ],
    "rating": null,
    "review_count": null,
    "reviews_summary": null,
    "scraped_at": "2026-02-05T15:04:10.176748Z",
    "scrape_success": true,
    "scrape_errors": [],
    "embedding_text": "Product: Knauf spijkerflensdeken type TR312 80mm (6,6m2) isolatiewaarde 2,00m2K/W\nBrand: HouthandelOnline\nCategory: Douglas hout > Toon alles in Douglas hout > Douglas hout palen > Douglas hout balken > Douglas hout latten en regels\nDescription: Knauf Spijkerflensdeken is perfect als thermische-, akoestische- en brandwerende isolatie voor hellende daken. De steenwoldeken is aan 1-zijde voorzien van een dampremmend en luchtdicht alulaminaat en in de lengterichting voorzien van draad versterkte hechtranden. Deze duurzame, milieuvriendelijke en recyclebare deken valt onder brandklasse A1 en heeft een RD-waarde van 2,00m2K/W.\nSpecifications: Levertijd: 2-7 werkdagen, Dikte: 80 mm, Materiaal: Isolatie, Toepassing: Deze spijkerflensdeken is geschikt voor thermische isolatie van onder andere verdiepingsvloeren en (hellende) daken waar een verdere\nPrice: EUR 104.3"
  },
  {
    "id": "9f12da599b1f",
    "source_url": "https://www.houthandelonline.nl/knauf-naturoll-90-58",
    "name": "Knauf isolatie 90mm Naturoll type 037 (4,75m2) isolatiewaarde 2,80m2K/W 58cm",
    "description": "Deze isolatie rol (op basis van Ecose) is bestemd voor de thermische-, akoestische- en brandveilige isolatie van hellende daken, houten gevelconstructies, houten vloeren, plafonds en voorzetwanden.",
    "brand": "HouthandelOnline",
    "category": "Douglas hout > Toon alles in Douglas hout > Douglas hout palen > Douglas hout balken > Douglas hout latten en regels",
    "price": 28.31,
    "currency": "EUR",
    "price_raw": null,
    "specs": {
      "raw": {
        "Levertijd": "2-7 werkdagen",
        "Dikte": "90 mm",
        "Materiaal": "Isolatie",
        "Toepassing": "Thermische-, akoestische- en brandveilige isolatie van hellende daken, houten gevelconstructies, houten vloeren, plafonds en voorzetwanden"
      }
    },
    "images": [
      "https://www.houthandelonline.nl/cdn/resize-extended/el:true/rs:fill/w:1500/h:1068/extend:true/background:255:255:255/path/media/catalog/product/k/n/knauf-naturoll-90-58-v_01_main.jpg"
    ],
    "rating": null,
    "review_count": null,
    "reviews_summary": null,
    "scraped_at": "2026-02-05T15:04:10.176757Z",
    "scrape_success": true,
    "scrape_errors": [],
    "embedding_text": "Product: Knauf isolatie 90mm Naturoll type 037 (4,75m2) isolatiewaarde 2,80m2K/W 58cm\nBrand: HouthandelOnline\nCategory: Douglas hout > Toon alles in Douglas hout > Douglas hout palen > Douglas hout balken > Douglas hout latten en regels\nDescription: Deze isolatie rol (op basis van Ecose) is bestemd voor de thermische-, akoestische- en brandveilige isolatie van hellende daken, houten gevelconstructies, houten vloeren, plafonds en voorzetwanden.\nSpecifications: Levertijd: 2-7 werkdagen, Dikte: 90 mm, Materiaal: Isolatie, Toepassing: Thermische-, akoestische- en brandveilige isolatie van hellende daken, houten gevelconstructies, houten vloeren, plafonds en voorzetwanden\nPrice: EUR 28.31"
  },
  {
    "id": "1ac040c34a19",
    "source_url": "https://www.houthandelonline.nl/knauf-acoustifit-90mm",
    "name": "Isolatieplaat Knauf Acoustifit 90mm isolatiewaarde 2,40m2K/W 1 pak a 8 platen (6,48m2)",
    "description": "Veerkrachtige, isolatieplaat op basis van Ecose welke prettig verwerkt in wanden en plafonds met houten of metalen staanders en liggers. Vooral geschikt als wand- en plafondisolatie met eisen op het gebied van thermische-en geluidsisolatie.",
    "brand": "HouthandelOnline",
    "category": "Douglas hout > Toon alles in Douglas hout > Douglas hout palen > Douglas hout balken > Douglas hout latten en regels",
    "price": 46.42,
    "currency": "EUR",
    "price_raw": null,
    "specs": {
      "raw": {
        "Levertijd": "2-7 werkdagen",
        "Dikte": "90 mm",
        "Materiaal": "Isolatie",
        "Toepassing": "Vooral geschikt als wand- en plafondisolatie met eisen op het gebied van thermische-en geluidsisolatie"
      }
    },
    "images": [
      "https://www.houthandelonline.nl/cdn/resize-extended/el:true/rs:fill/w:1500/h:1068/extend:true/background:255:255:255/path/media/catalog/product/k/n/knauf-acoustifit-90mm-v_01_main.jpg"
    ],
    "rating": null,
    "review_count": null,
    "reviews_summary": null,
    "scraped_at": "2026-02-05T15:04:10.176765Z",
    "scrape_success": true,
    "scrape_errors": [],
    "embedding_text": "Product: Isolatieplaat Knauf Acoustifit 90mm isolatiewaarde 2,40m2K/W 1 pak a 8 platen (6,48m2)\nBrand: HouthandelOnline\nCategory: Douglas hout > Toon alles in Douglas hout > Douglas hout palen > Douglas hout balken > Douglas hout latten en regels\nDescription: Veerkrachtige, isolatieplaat op basis van Ecose welke prettig verwerkt in wanden en plafonds met houten of metalen staanders en liggers. Vooral geschikt als wand- en plafondisolatie met eisen op het gebied van thermische-en geluidsisolatie.\nSpecifications: Levertijd: 2-7 werkdagen, Dikte: 90 mm, Materiaal: Isolatie, Toepassing: Vooral geschikt als wand- en plafondisolatie met eisen op het gebied van thermische-en geluidsisolatie\nPrice: EUR 46.42"
  },
  {
    "id": "b076c5bb4ac6",
    "source_url": "https://www.houthandelonline.nl/knauf-naturoll-90-38",
    "name": "Knauf isolatie 90mm Naturoll type 037 (3,11m2) isolatiewaarde 2,40m2K/W 38cm",
    "description": "Deze isolatie rol (op basis van Ecose) is bestemd voor de thermische-, akoestische- en brandveilige isolatie van hellende daken, houten gevelconstructies, houten vloeren, plafonds en voorzetwanden.",
    "brand": "HouthandelOnline",
    "category": "Douglas hout > Toon alles in Douglas hout > Douglas hout palen > Douglas hout balken > Douglas hout latten en regels",
    "price": 18.55,
    "currency": "EUR",
    "price_raw": null,
    "specs": {
      "raw": {
        "Levertijd": "2-7 werkdagen",
        "Dikte": "90 mm",
        "Materiaal": "Isolatie",
        "Toepassing": "Thermische-, akoestische- en brandveilige isolatie van hellende daken, houten gevelconstructies, houten vloeren, plafonds en voorzetwanden"
      }
    },
    "images": [
      "https://www.houthandelonline.nl/cdn/resize-extended/el:true/rs:fill/w:1500/h:1068/extend:true/background:255:255:255/path/media/catalog/product/k/n/knauf-naturoll-90-38-v_01_main.jpg"
    ],
    "rating": null,
    "review_count": null,
    "reviews_summary": null,
    "scraped_at": "2026-02-05T15:04:10.176774Z",
    "scrape_success": true,
    "scrape_errors": [],
    "embedding_text": "Product: Knauf isolatie 90mm Naturoll type 037 (3,11m2) isolatiewaarde 2,40m2K/W 38cm\nBrand: HouthandelOnline\nCategory: Douglas hout > Toon alles in Douglas hout > Douglas hout palen > Douglas hout balken > Douglas hout latten en regels\nDescription: Deze isolatie rol (op basis van Ecose) is bestemd voor de thermische-, akoestische- en brandveilige isolatie van hellende daken, houten gevelconstructies, houten vloeren, plafonds en voorzetwanden.\nSpecifications: Levertijd: 2-7 werkdagen, Dikte: 90 mm, Materiaal: Isolatie, Toepassing: Thermische-, akoestische- en brandveilige isolatie van hellende daken, houten gevelconstructies, houten vloeren, plafonds en voorzetwanden\nPrice: EUR 18.55"
  },
  {
    "id": "10f78e2aee06",
    "source_url": "https://www.houthandelonline.nl/pir-alu-afschot-100-120",
    "name": "PIR isolatie Enertherm ALU afschot 100-120mm isolatiewaarde (Rd=4,0m2K/W)",
    "description": "PIR-isolatieplaat (Rd=4,50m2K/W) geschikt voor platdak. De plaat verloopt in dikte zodat deze afschot in het dakvlak creëert. Deze PIR plaat is voorzien van een ingebouwd aluminium dampscherm en optimaal voor het wind- en vochtdicht isoleren.",
    "brand": "HouthandelOnline",
    "category": "Douglas hout > Toon alles in Douglas hout > Douglas hout palen > Douglas hout balken > Douglas hout latten en regels",
    "price": 65.27,
    "currency": "EUR",
    "price_raw": null,
    "specs": {
      "raw": {
        "Levertijd": "2-7 werkdagen",
        "Materiaal": "PIR"
      }
    },
    "images": [
      "https://www.houthandelonline.nl/cdn/resize-extended/el:true/rs:fill/w:1500/h:1068/extend:true/background:255:255:255/path/media/catalog/product/p/i/pir-alu-afschot-100-120-v_001.png",
      "https://www.houthandelonline.nl/cdn/resize-extended/el:true/rs:fill/w:1500/h:1068/extend:true/background:255:255:255/path/media/catalog/product/p/i/pir-alu-afschot-100-120-v_002.jpg",
      "https://www.houthandelonline.nl/cdn/resize-extended/el:true/rs:fill/w:1500/h:1068/extend:true/background:255:255:255/path/media/catalog/product/p/i/pir-alu-afschot-100-120-v_01_main.jpg",
      "https://www.houthandelonline.nl/cdn/resize-extended/el:true/rs:fill/w:1500/h:1068/extend:true/background:255:255:255/path/media/catalog/product/p/i/pir-alu-afschot-100-120-v_02_view.jpg"
    ],
    "rating": null,
    "review_count": null,
    "reviews_summary": null,
    "scraped_at": "2026-02-05T15:04:10.176782Z",
    "scrape_success": true,
    "scrape_errors": [],
    "embedding_text": "Product: PIR isolatie Enertherm ALU afschot 100-120mm isolatiewaarde (Rd=4,0m2K/W)\nBrand: HouthandelOnline\nCategory: Douglas hout > Toon alles in Douglas hout > Douglas hout palen > Douglas hout balken > Douglas hout latten en regels\nDescription: PIR-isolatieplaat (Rd=4,50m2K/W) geschikt voor platdak. De plaat verloopt in dikte zodat deze afschot in het dakvlak creëert. Deze PIR plaat is voorzien van een ingebouwd aluminium dampscherm en optimaal voor het wind- en vochtdicht isoleren.\nSpecifications: Levertijd: 2-7 werkdagen, Materiaal: PIR\nPrice: EUR 65.27"
  },
  {
    "id": "65c31d62e92c",
    "source_url": "https://www.houthandelonline.nl/knauf-naturoll-120-38",
    "name": "Knauf isolatie 120mm Naturoll type 037 (2,47m2) isolatiewaarde 3,20m2K/W 38cm",
    "description": "Deze isolatie rol (op basis van Ecose) is bestemd voor de thermische-, akoestische- en brandveilige isolatie van hellende daken, houten gevelconstructies, houten vloeren, plafonds en voorzetwanden.",
    "brand": "HouthandelOnline",
    "category": "Douglas hout > Toon alles in Douglas hout > Douglas hout palen > Douglas hout balken > Douglas hout latten en regels",
    "price": 19.54,
    "currency": "EUR",
    "price_raw": null,
    "specs": {
      "raw": {
        "Levertijd": "2-7 werkdagen",
        "Dikte": "120 mm",
        "Materiaal": "Isolatie",
        "Toepassing": "Thermische-, akoestische- en brandveilige isolatie van hellende daken, houten gevelconstructies, houten vloeren, plafonds en voorzetwanden"
      }
    },
    "images": [
      "https://www.houthandelonline.nl/cdn/resize-extended/el:true/rs:fill/w:1500/h:1068/extend:true/background:255:255:255/path/media/catalog/product/k/n/knauf-naturoll-120-38-v_01_main.jpg"
    ],
    "rating": null,
    "review_count": null,
    "reviews_summary": null,
    "scraped_at": "2026-02-05T15:04:10.176791Z",
    "scrape_success": true,
    "scrape_errors": [],
    "embedding_text": "Product: Knauf isolatie 120mm Naturoll type 037 (2,47m2) isolatiewaarde 3,20m2K/W 38cm\nBrand: HouthandelOnline\nCategory: Douglas hout > Toon alles in Douglas hout > Douglas hout palen > Douglas hout balken > Douglas hout latten en regels\nDescription: Deze isolatie rol (op basis van Ecose) is bestemd voor de thermische-, akoestische- en brandveilige isolatie van hellende daken, houten gevelconstructies, houten vloeren, plafonds en voorzetwanden.\nSpecifications: Levertijd: 2-7 werkdagen, Dikte: 120 mm, Materiaal: Isolatie, Toepassing: Thermische-, akoestische- en brandveilige isolatie van hellende daken, houten gevelconstructies, houten vloeren, plafonds en voorzetwanden\nPrice: EUR 19.54"
  },
  {
    "id": "b16984ec17e3",
    "source_url": "https://www.houthandelonline.nl/knauf-naturoll-120-58",
    "name": "Knauf isolatie 120mm Naturoll type 037 (3,77m2) isolatiewaarde 3,20m2K/W 58cm",
    "description": "Deze isolatie rol (op basis van Ecose) is bestemd voor de thermische-, akoestische- en brandveilige isolatie van hellende daken, houten gevelconstructies, houten vloeren, plafonds en voorzetwanden.",
    "brand": "HouthandelOnline",
    "category": "Douglas hout > Toon alles in Douglas hout > Douglas hout palen > Douglas hout balken > Douglas hout latten en regels",
    "price": 29.84,
    "currency": "EUR",
    "price_raw": null,
    "specs": {
      "raw": {
        "Levertijd": "2-7 werkdagen",
        "Dikte": "120 mm",
        "Materiaal": "Isolatie",
        "Toepassing": "Thermische-, akoestische- en brandveilige isolatie van hellende daken, houten gevelconstructies, houten vloeren, plafonds en voorzetwanden"
      }
    },
    "images": [
      "https://www.houthandelonline.nl/cdn/resize-extended/el:true/rs:fill/w:1500/h:1068/extend:true/background:255:255:255/path/media/catalog/product/k/n/knauf-naturoll-120-58-v_01_main.jpg"
    ],
    "rating": null,
    "review_count": null,
    "reviews_summary": null,
    "scraped_at": "2026-02-05T15:04:10.176800Z",
    "scrape_success": true,
    "scrape_errors": [],
    "embedding_text": "Product: Knauf isolatie 120mm Naturoll type 037 (3,77m2) isolatiewaarde 3,20m2K/W 58cm\nBrand: HouthandelOnline\nCategory: Douglas hout > Toon alles in Douglas hout > Douglas hout palen > Douglas hout balken > Douglas hout latten en regels\nDescription: Deze isolatie rol (op basis van Ecose) is bestemd voor de thermische-, akoestische- en brandveilige isolatie van hellende daken, houten gevelconstructies, houten vloeren, plafonds en voorzetwanden.\nSpecifications: Levertijd: 2-7 werkdagen, Dikte: 120 mm, Materiaal: Isolatie, Toepassing: Thermische-, akoestische- en brandveilige isolatie van hellende daken, houten gevelconstructies, houten vloeren, plafonds en voorzetwanden\nPrice: EUR 29.84"
  },
  {
    "id": "c5f8f63535d7",
    "source_url": "https://www.houthandelonline.nl/knauf-acoustifit-120mm",
    "name": "Knauf Acoustifit Isolatieplaat 120mm, 1 pak a 6 platen (4,86m2) Isolatiewaarde 3,20m2K/W",
    "description": "Veerkrachtige, isolatieplaat op basis van Ecose welke prettig verwerkt in wanden en plafonds met houten of metalen staanders en liggers. Vooral geschikt als wand- en plafondisolatie met eisen op het gebied van thermische-en geluidsisolatie.",
    "brand": "HouthandelOnline",
    "category": "Douglas hout > Toon alles in Douglas hout > Douglas hout palen > Douglas hout balken > Douglas hout latten en regels",
    "price": 46.4,
    "currency": "EUR",
    "price_raw": null,
    "specs": {
      "raw": {
        "Levertijd": "2-7 werkdagen",
        "Dikte": "120 mm",
        "Materiaal": "Isolatie",
        "Toepassing": "Vooral geschikt als wand- en plafondisolatie met eisen op het gebied van thermische-en geluidsisolatie"
      }
    },
    "images": [
      "https://www.houthandelonline.nl/cdn/resize-extended/el:true/rs:fill/w:1500/h:1068/extend:true/background:255:255:255/path/media/catalog/product/k/n/knauf-acoustifit-120mm-v_01_main.jpg"
    ],
    "rating": null,
    "review_count": null,
    "reviews_summary": null,
    "scraped_at": "2026-02-05T15:04:10.176813Z",
    "scrape_success": true,
    "scrape_errors": [],
    "embedding_text": "Product: Knauf Acoustifit Isolatieplaat 120mm, 1 pak a 6 platen (4,86m2) Isolatiewaarde 3,20m2K/W\nBrand: HouthandelOnline\nCategory: Douglas hout > Toon alles in Douglas hout > Douglas hout palen > Douglas hout balken > Douglas hout latten en regels\nDescription: Veerkrachtige, isolatieplaat op basis van Ecose welke prettig verwerkt in wanden en plafonds met houten of metalen staanders en liggers. Vooral geschikt als wand- en plafondisolatie met eisen op het gebied van thermische-en geluidsisolatie.\nSpecifications: Levertijd: 2-7 werkdagen, Dikte: 120 mm, Materiaal: Isolatie, Toepassing: Vooral geschikt als wand- en plafondisolatie met eisen op het gebied van thermische-en geluidsisolatie\nPrice: EUR 46.4"
  },
  {
    "id": "7ff1f523d867",
    "source_url": "https://www.houthandelonline.nl/pir-alu-100",
    "name": "PIR isolatie Enertherm ALU 100mm isolatiewaarde 4,0m2K/W per 5 stuks",
    "description": "PIR-isolatieplaat (Rd=4,50m2K/W) uitermate geschikt voor: platdak, hellend dak, wanden, gevels, zoldervloer en zolderdak. Deze PIR plaat is voorzien van een ingebouwd aluminium dampscherm en optimaal voor het wind- en vochtdicht isoleren.",
    "brand": "HouthandelOnline",
    "category": "Douglas hout > Toon alles in Douglas hout > Douglas hout palen > Douglas hout balken > Douglas hout latten en regels",
    "price": 67.74,
    "currency": "EUR",
    "price_raw": null,
    "specs": {
      "raw": {
        "Levertijd": "2-7 werkdagen",
        "Dikte": "100 mm",
        "Materiaal": "PIR"
      }
    },
    "images": [
      "https://www.houthandelonline.nl/cdn/resize-extended/el:true/rs:fill/w:1500/h:1068/extend:true/background:255:255:255/path/media/catalog/product/p/i/pir-alu-100-v_001.jpg",
      "https://www.houthandelonline.nl/cdn/resize-extended/el:true/rs:fill/w:1500/h:1068/extend:true/background:255:255:255/path/media/catalog/product/p/i/pir-alu-100-v_02_view.jpg",
      "https://www.houthandelonline.nl/cdn/resize-extended/el:true/rs:fill/w:1500/h:1068/extend:true/background:255:255:255/path/media/catalog/product/p/i/pir-alu-100-v_01_main.jpg"
    ],
    "rating": null,
    "review_count": null,
    "reviews_summary": null,
    "scraped_at": "2026-02-05T15:04:10.176820Z",
    "scrape_success": true,
    "scrape_errors": [],
    "embedding_text": "Product: PIR isolatie Enertherm ALU 100mm isolatiewaarde 4,0m2K/W per 5 stuks\nBrand: HouthandelOnline\nCategory: Douglas hout > Toon alles in Douglas hout > Douglas hout palen > Douglas hout balken > Douglas hout latten en regels\nDescription: PIR-isolatieplaat (Rd=4,50m2K/W) uitermate geschikt voor: platdak, hellend dak, wanden, gevels, zoldervloer en zolderdak. Deze PIR plaat is voorzien van een ingebouwd aluminium dampscherm en optimaal voor het wind- en vochtdicht isoleren.\nSpecifications: Levertijd: 2-7 werkdagen, Dikte: 100 mm, Materiaal: PIR\nPrice: EUR 67.74"
  },
  {
    "id": "df0be9628bbc",
    "source_url": "https://www.houthandelonline.nl/pir-alu-140",
    "name": "PIR isolatie Enertherm ALU 140mm isolatiewaarde 6,35m2K/W per 3 stuks",
    "description": "PIR-isolatieplaat (Rd=6,35m2K/W) uitermate geschikt voor: platdak, hellend dak, wanden, gevels, zoldervloer en zolderdak. Deze PIR plaat is voorzien van een ingebouwd aluminium dampscherm en optimaal voor het wind- en vochtdicht isoleren.",
    "brand": "HouthandelOnline",
    "category": "Douglas hout > Toon alles in Douglas hout > Douglas hout palen > Douglas hout balken > Douglas hout latten en regels",
    "price": 51.85,
    "currency": "EUR",
    "price_raw": null,
    "specs": {
      "raw": {
        "Levertijd": "2-7 werkdagen",
        "Dikte": "140 mm",
        "Materiaal": "PIR"
      }
    },
    "images": [
      "https://www.houthandelonline.nl/cdn/resize-extended/el:true/rs:fill/w:1500/h:1068/extend:true/background:255:255:255/path/media/catalog/product/p/i/pir-alu-140-v_001.jpg",
      "https://www.houthandelonline.nl/cdn/resize-extended/el:true/rs:fill/w:1500/h:1068/extend:true/background:255:255:255/path/media/catalog/product/p/i/pir-alu-140-v_02_view.jpg",
      "https://www.houthandelonline.nl/cdn/resize-extended/el:true/rs:fill/w:1500/h:1068/extend:true/background:255:255:255/path/media/catalog/product/p/i/pir-alu-140-v_01_main.jpg"
    ],
    "rating": null,
    "review_count": null,
    "reviews_summary": null,
    "scraped_at": "2026-02-05T15:04:10.176827Z",
    "scrape_success": true,
    "scrape_errors": [],
    "embedding_text": "Product: PIR isolatie Enertherm ALU 140mm isolatiewaarde 6,35m2K/W per 3 stuks\nBrand: HouthandelOnline\nCategory: Douglas hout > Toon alles in Douglas hout > Douglas hout palen > Douglas hout balken > Douglas hout latten en regels\nDescription: PIR-isolatieplaat (Rd=6,35m2K/W) uitermate geschikt voor: platdak, hellend dak, wanden, gevels, zoldervloer en zolderdak. Deze PIR plaat is voorzien van een ingebouwd aluminium dampscherm en optimaal voor het wind- en vochtdicht isoleren.\nSpecifications: Levertijd: 2-7 werkdagen, Dikte: 140 mm, Materiaal: PIR\nPrice: EUR 51.85"
  },
  {
    "id": "f18ebff5a6d4",
    "source_url": "https://www.houthandelonline.nl/pir-alu-90",
    "name": "PIR isolatie Enertherm ALU 90mm isolatiewaarde 4,05m2K/W per 4 stuks",
    "description": "PIR-isolatieplaat (Rd=4,05m2K/W) uitermate geschikt voor: platdak, hellend dak, wanden, gevels, zoldervloer en zolderdak. Deze PIR plaat is voorzien van een ingebouwd aluminium dampscherm en optimaal voor het wind- en vochtdicht isoleren.",
    "brand": "HouthandelOnline",
    "category": "Douglas hout > Toon alles in Douglas hout > Douglas hout palen > Douglas hout balken > Douglas hout latten en regels",
    "price": 49.17,
    "currency": "EUR",
    "price_raw": null,
    "specs": {
      "raw": {
        "Levertijd": "2-7 werkdagen",
        "Dikte": "90 mm",
        "Materiaal": "PIR"
      }
    },
    "images": [
      "https://www.houthandelonline.nl/cdn/resize-extended/el:true/rs:fill/w:1500/h:1068/extend:true/background:255:255:255/path/media/catalog/product/p/i/pir-alu-90-v_001.jpg",
      "https://www.houthandelonline.nl/cdn/resize-extended/el:true/rs:fill/w:1500/h:1068/extend:true/background:255:255:255/path/media/catalog/product/p/i/pir-alu-90-v_02_view.jpg",
      "https://www.houthandelonline.nl/cdn/resize-extended/el:true/rs:fill/w:1500/h:1068/extend:true/background:255:255:255/path/media/catalog/product/p/i/pir-alu-90-v_01_main.jpg"
    ],
    "rating": null,
    "review_count": null,
    "reviews_summary": null,
    "scraped_at": "2026-02-05T15:04:10.176833Z",
    "scrape_success": true,
    "scrape_errors": [],
    "embedding_text": "Product: PIR isolatie Enertherm ALU 90mm isolatiewaarde 4,05m2K/W per 4 stuks\nBrand: HouthandelOnline\nCategory: Douglas hout > Toon alles in Douglas hout > Douglas hout palen > Douglas hout balken > Douglas hout latten en regels\nDescription: PIR-isolatieplaat (Rd=4,05m2K/W) uitermate geschikt voor: platdak, hellend dak, wanden, gevels, zoldervloer en zolderdak. Deze PIR plaat is voorzien van een ingebouwd aluminium dampscherm en optimaal voor het wind- en vochtdicht isoleren.\nSpecifications: Levertijd: 2-7 werkdagen, Dikte: 90 mm, Materiaal: PIR\nPrice: EUR 49.17"
  },
  {
    "id": "6846447b6937",
    "source_url": "https://www.houthandelonline.nl/pir-alu-80",
    "name": "PIR isolatie Enertherm ALU 80mm isolatiewaarde 3,6m2K/W per 6 stuks",
    "description": "PIR-isolatieplaat (Rd=3,6m2K/W) uitermate geschikt voor: platdak, hellend dak, wanden, gevels, zoldervloer en zolderdak. Deze PIR plaat is aan 2-zijden voorzien van een ingebouwd aluminium dampscherm en optimaal voor het wind- en vochtdicht isoleren.",
    "brand": "HouthandelOnline",
    "category": "Douglas hout > Toon alles in Douglas hout > Douglas hout palen > Douglas hout balken > Douglas hout latten en regels",
    "price": 66.38,
    "currency": "EUR",
    "price_raw": null,
    "specs": {
      "raw": {
        "Levertijd": "2-7 werkdagen",
        "Dikte": "80 mm",
        "Materiaal": "PIR"
      }
    },
    "images": [
      "https://www.houthandelonline.nl/cdn/resize-extended/el:true/rs:fill/w:1500/h:1068/extend:true/background:255:255:255/path/media/catalog/product/p/i/pir-alu-80-v_001.jpg",
      "https://www.houthandelonline.nl/cdn/resize-extended/el:true/rs:fill/w:1500/h:1068/extend:true/background:255:255:255/path/media/catalog/product/p/i/pir-alu-80-v_02_view.jpg",
      "https://www.houthandelonline.nl/cdn/resize-extended/el:true/rs:fill/w:1500/h:1068/extend:true/background:255:255:255/path/media/catalog/product/p/i/pir-alu-80-v_01_main.jpg"
    ],
    "rating": null,
    "review_count": null,
    "reviews_summary": null,
    "scraped_at": "2026-02-05T15:04:10.176840Z",
    "scrape_success": true,
    "scrape_errors": [],
    "embedding_text": "Product: PIR isolatie Enertherm ALU 80mm isolatiewaarde 3,6m2K/W per 6 stuks\nBrand: HouthandelOnline\nCategory: Douglas hout > Toon alles in Douglas hout > Douglas hout palen > Douglas hout balken > Douglas hout latten en regels\nDescription: PIR-isolatieplaat (Rd=3,6m2K/W) uitermate geschikt voor: platdak, hellend dak, wanden, gevels, zoldervloer en zolderdak. Deze PIR plaat is aan 2-zijden voorzien van een ingebouwd aluminium dampscherm en optimaal voor het wind- en vochtdicht isoleren.\nSpecifications: Levertijd: 2-7 werkdagen, Dikte: 80 mm, Materiaal: PIR\nPrice: EUR 66.38"
  },
  {
    "id": "ee0ae9cac314",
    "source_url": "https://www.houthandelonline.nl/pir-alu-30",
    "name": "PIR isolatie Enertherm ALU 30mm isolatiewaarde 1,35m2K/W per 16 stuks",
    "description": "PIR-isolatieplaat (Rd=1,35m2K/W) uitermate geschikt voor: platdak, hellend dak, wanden, gevels, zoldervloer en zolderdak. Deze PIR plaat is aan 2-zijden voorzien van een ingebouwd aluminium dampscherm en optimaal voor het wind- en vochtdicht isoleren. verpakkingseenheden: 30mm 16 stuks, 40mm 12 stuks, 50mm 10 stuks, 60mm 8 stuks, 70mm 7 stuks, 80mm 6 stuks. 90mm 4 stuks, 100mm 5 stuks, 120mm 4 stuks, 140mm 3 stuks.",
    "brand": "HouthandelOnline",
    "category": "Douglas hout > Toon alles in Douglas hout > Douglas hout palen > Douglas hout balken > Douglas hout latten en regels",
    "price": 94.51,
    "currency": "EUR",
    "price_raw": null,
    "specs": {
      "raw": {
        "Levertijd": "2-7 werkdagen",
        "Dikte": "30 mm",
        "Materiaal": "PIR"
      }
    },
    "images": [
      "https://www.houthandelonline.nl/cdn/resize-extended/el:true/rs:fill/w:1500/h:1068/extend:true/background:255:255:255/path/media/catalog/product/p/i/pir-alu-30-v_001.jpg",
      "https://www.houthandelonline.nl/cdn/resize-extended/el:true/rs:fill/w:1500/h:1068/extend:true/background:255:255:255/path/media/catalog/product/p/i/pir-alu-30-v_02_view.jpg",
      "https://www.houthandelonline.nl/cdn/resize-extended/el:true/rs:fill/w:1500/h:1068/extend:true/background:255:255:255/path/media/catalog/product/p/i/pir-alu-30-v_01_main.jpg"
    ],
    "rating": null,
    "review_count": null,
    "reviews_summary": null,
    "scraped_at": "2026-02-05T15:04:10.176846Z",
    "scrape_success": true,
    "scrape_errors": [],
    "embedding_text": "Product: PIR isolatie Enertherm ALU 30mm isolatiewaarde 1,35m2K/W per 16 stuks\nBrand: HouthandelOnline\nCategory: Douglas hout > Toon alles in Douglas hout > Douglas hout palen > Douglas hout balken > Douglas hout latten en regels\nDescription: PIR-isolatieplaat (Rd=1,35m2K/W) uitermate geschikt voor: platdak, hellend dak, wanden, gevels, zoldervloer en zolderdak. Deze PIR plaat is aan 2-zijden voorzien van een ingebouwd aluminium dampscherm en optimaal voor het wind- en vochtdicht isoleren. verpakkingseenheden: 30mm 16 stuks, 40mm 12 stuks, 50mm 10 stuks, 60mm 8 stuks, 70mm 7 stuks, 80mm 6 stuks. 90mm 4 stuks, 100mm 5 stuks, 120mm 4 stuks, 140mm 3 stuks.\nSpecifications: Levertijd: 2-7 werkdagen, Dikte: 30 mm, Materiaal: PIR\nPrice: EUR 94.51"
  },
  {
    "id": "9df823b080d6",
    "source_url": "https://www.houthandelonline.nl/pir-alu-60",
    "name": "PIR isolatie enertherm ALU 60mm isolatiewaarde 2,7m2K/W per 8 stuks",
    "description": "PIR-isolatieplaat (Rd=2,70m2K/W) uitermate geschikt voor: platdak, hellend dak, wanden, gevels, zoldervloer en zolderdak. Deze PIR plaat is voorzien van een ingebouwd aluminium dampscherm en optimaal voor het wind- en vochtdicht isoleren.",
    "brand": "HouthandelOnline",
    "category": "Douglas hout > Toon alles in Douglas hout > Douglas hout palen > Douglas hout balken > Douglas hout latten en regels",
    "price": 69.14,
    "currency": "EUR",
    "price_raw": null,
    "specs": {
      "raw": {
        "Levertijd": "2-7 werkdagen",
        "Dikte": "60 mm",
        "Materiaal": "PIR"
      }
    },
    "images": [
      "https://www.houthandelonline.nl/cdn/resize-extended/el:true/rs:fill/w:1500/h:1068/extend:true/background:255:255:255/path/media/catalog/product/p/i/pir-alu-60-v_001.jpg",
      "https://www.houthandelonline.nl/cdn/resize-extended/el:true/rs:fill/w:1500/h:1068/extend:true/background:255:255:255/path/media/catalog/product/p/i/pir-alu-60-v_02_view.jpg",
      "https://www.houthandelonline.nl/cdn/resize-extended/el:true/rs:fill/w:1500/h:1068/extend:true/background:255:255:255/path/media/catalog/product/p/i/pir-alu-60-v_01_main.jpg"
    ],
    "rating": null,
    "review_count": null,
    "reviews_summary": null,
    "scraped_at": "2026-02-05T15:04:10.176852Z",
    "scrape_success": true,
    "scrape_errors": [],
    "embedding_text": "Product: PIR isolatie enertherm ALU 60mm isolatiewaarde 2,7m2K/W per 8 stuks\nBrand: HouthandelOnline\nCategory: Douglas hout > Toon alles in Douglas hout > Douglas hout palen > Douglas hout balken > Douglas hout latten en regels\nDescription: PIR-isolatieplaat (Rd=2,70m2K/W) uitermate geschikt voor: platdak, hellend dak, wanden, gevels, zoldervloer en zolderdak. Deze PIR plaat is voorzien van een ingebouwd aluminium dampscherm en optimaal voor het wind- en vochtdicht isoleren.\nSpecifications: Levertijd: 2-7 werkdagen, Dikte: 60 mm, Materiaal: PIR\nPrice: EUR 69.14"
  },
  {
    "id": "e8ef469ce8f0",
    "source_url": "https://www.houthandelonline.nl/pir-alu-50",
    "name": "PIR isolatie Enertherm ALU 50mm isolatiewaarde 2,25m2K/W per 10 stuks",
    "description": "PIR-isolatieplaat (Rd=2,25m2K/W) uitermate geschikt voor: platdak, hellend dak, wanden, gevels, zoldervloer en zolderdak. Deze PIR plaat is 2-zijden voorzien van een ingebouwd aluminium dampscherm en optimaal voor het wind- en vochtdicht isoleren.",
    "brand": "HouthandelOnline",
    "category": "Douglas hout > Toon alles in Douglas hout > Douglas hout palen > Douglas hout balken > Douglas hout latten en regels",
    "price": 77.89,
    "currency": "EUR",
    "price_raw": null,
    "specs": {
      "raw": {
        "Levertijd": "2-7 werkdagen",
        "Dikte": "50 mm",
        "Materiaal": "PIR"
      }
    },
    "images": [
      "https://www.houthandelonline.nl/cdn/resize-extended/el:true/rs:fill/w:1500/h:1068/extend:true/background:255:255:255/path/media/catalog/product/p/i/pir-alu-50-v_001.jpg",
      "https://www.houthandelonline.nl/cdn/resize-extended/el:true/rs:fill/w:1500/h:1068/extend:true/background:255:255:255/path/media/catalog/product/p/i/pir-alu-50-v_02_view.jpg",
      "https://www.houthandelonline.nl/cdn/resize-extended/el:true/rs:fill/w:1500/h:1068/extend:true/background:255:255:255/path/media/catalog/product/p/i/pir-alu-50-v_01_main.jpg"
    ],
    "rating": null,
    "review_count": null,
    "reviews_summary": null,
    "scraped_at": "2026-02-05T15:04:10.176857Z",
    "scrape_success": true,
    "scrape_errors": [],
    "embedding_text": "Product: PIR isolatie Enertherm ALU 50mm isolatiewaarde 2,25m2K/W per 10 stuks\nBrand: HouthandelOnline\nCategory: Douglas hout > Toon alles in Douglas hout > Douglas hout palen > Douglas hout balken > Douglas hout latten en regels\nDescription: PIR-isolatieplaat (Rd=2,25m2K/W) uitermate geschikt voor: platdak, hellend dak, wanden, gevels, zoldervloer en zolderdak. Deze PIR plaat is 2-zijden voorzien van een ingebouwd aluminium dampscherm en optimaal voor het wind- en vochtdicht isoleren.\nSpecifications: Levertijd: 2-7 werkdagen, Dikte: 50 mm, Materiaal: PIR\nPrice: EUR 77.89"
  },
  {
    "id": "3ad7c0fd4741",
    "source_url": "https://www.houthandelonline.nl/pir-alu-40",
    "name": "PIR isolatie Enertherm ALU 40mm isolatiewaarde 1,8m2K/W per 12 stuks",
    "description": "PIR-isolatieplaat (Rd=1,8m2K/W) uitermate geschikt voor: platdak, hellend dak, wanden, gevels, zoldervloer en zolderdak. Deze PIR plaat is aan 2-zijden voorzien van een ingebouwd aluminium dampscherm dit is optimaal voor het wind- en vochtdicht isoleren.",
    "brand": "HouthandelOnline",
    "category": "Douglas hout > Toon alles in Douglas hout > Douglas hout palen > Douglas hout balken > Douglas hout latten en regels",
    "price": 82.38,
    "currency": "EUR",
    "price_raw": null,
    "specs": {
      "raw": {
        "Levertijd": "2-7 werkdagen",
        "Dikte": "40 mm",
        "Materiaal": "PIR"
      }
    },
    "images": [
      "https://www.houthandelonline.nl/cdn/resize-extended/el:true/rs:fill/w:1500/h:1068/extend:true/background:255:255:255/path/media/catalog/product/p/i/pir-alu-40-v_001.jpg",
      "https://www.houthandelonline.nl/cdn/resize-extended/el:true/rs:fill/w:1500/h:1068/extend:true/background:255:255:255/path/media/catalog/product/p/i/pir-alu-40-v_02_view.jpg",
      "https://www.houthandelonline.nl/cdn/resize-extended/el:true/rs:fill/w:1500/h:1068/extend:true/background:255:255:255/path/media/catalog/product/p/i/pir-alu-40-v_01_main.jpg"
    ],
    "rating": null,
    "review_count": null,
    "reviews_summary": null,
    "scraped_at": "2026-02-05T15:04:10.176863Z",
    "scrape_success": true,
    "scrape_errors": [],
    "embedding_text": "Product: PIR isolatie Enertherm ALU 40mm isolatiewaarde 1,8m2K/W per 12 stuks\nBrand: HouthandelOnline\nCategory: Douglas hout > Toon alles in Douglas hout > Douglas hout palen > Douglas hout balken > Douglas hout latten en regels\nDescription: PIR-isolatieplaat (Rd=1,8m2K/W) uitermate geschikt voor: platdak, hellend dak, wanden, gevels, zoldervloer en zolderdak. Deze PIR plaat is aan 2-zijden voorzien van een ingebouwd aluminium dampscherm dit is optimaal voor het wind- en vochtdicht isoleren.\nSpecifications: Levertijd: 2-7 werkdagen, Dikte: 40 mm, Materiaal: PIR\nPrice: EUR 82.38"
  },
  {
    "id": "5424ae0fc6cd",
    "source_url": "https://www.houthandelonline.nl/pir-alu-120",
    "name": "PIR isolatie Enertherm ALU 120mm isolatiewaarde 5,45m2K/W per 4 stuks",
    "description": "PIR-isolatieplaat (Rd=5,45m2K/W) uitermate geschikt voor: platdak, hellend dak, wanden, gevels, zoldervloer en zolderdak. Deze PIR plaat is 2-zijden voorzien van een ingebouwd aluminium dampscherm en optimaal voor het wind- en vochtdicht isoleren.",
    "brand": "HouthandelOnline",
    "category": "Douglas hout > Toon alles in Douglas hout > Douglas hout palen > Douglas hout balken > Douglas hout latten en regels",
    "price": 61.09,
    "currency": "EUR",
    "price_raw": null,
    "specs": {
      "raw": {
        "Levertijd": "2-7 werkdagen",
        "Dikte": "120 mm",
        "Materiaal": "PIR"
      }
    },
    "images": [
      "https://www.houthandelonline.nl/cdn/resize-extended/el:true/rs:fill/w:1500/h:1068/extend:true/background:255:255:255/path/media/catalog/product/p/i/pir-alu-120-v_001.jpg",
      "https://www.houthandelonline.nl/cdn/resize-extended/el:true/rs:fill/w:1500/h:1068/extend:true/background:255:255:255/path/media/catalog/product/p/i/pir-alu-120-v_02_view.jpg",
      "https://www.houthandelonline.nl/cdn/resize-extended/el:true/rs:fill/w:1500/h:1068/extend:true/background:255:255:255/path/media/catalog/product/p/i/pir-alu-120-v_01_main.jpg"
    ],
    "rating": null,
    "review_count": null,
    "reviews_summary": null,
    "scraped_at": "2026-02-05T15:04:10.176869Z",
    "scrape_success": true,
    "scrape_errors": [],
    "embedding_text": "Product: PIR isolatie Enertherm ALU 120mm isolatiewaarde 5,45m2K/W per 4 stuks\nBrand: HouthandelOnline\nCategory: Douglas hout > Toon alles in Douglas hout > Douglas hout palen > Douglas hout balken > Douglas hout latten en regels\nDescription: PIR-isolatieplaat (Rd=5,45m2K/W) uitermate geschikt voor: platdak, hellend dak, wanden, gevels, zoldervloer en zolderdak. Deze PIR plaat is 2-zijden voorzien van een ingebouwd aluminium dampscherm en optimaal voor het wind- en vochtdicht isoleren.\nSpecifications: Levertijd: 2-7 werkdagen, Dikte: 120 mm, Materiaal: PIR\nPrice: EUR 61.09"
  },
  {
    "id": "bf597fe90832",
    "source_url": "https://www.houthandelonline.nl/pir-alu-70",
    "name": "PIR isolatie Enertherm ALU 70mm isolatiewaarde 3,15m2K/W per 7 stuks",
    "description": "PIR-isolatieplaat (Rd=3,15m2K/W) uitermate geschikt voor: platdak, hellend dak, wanden, gevels, zoldervloer en zolderdak. Deze PIR plaat is voorzien van een ingebouwd aluminium dampscherm en optimaal voor het wind- en vochtdicht isoleren.",
    "brand": "HouthandelOnline",
    "category": "Douglas hout > Toon alles in Douglas hout > Douglas hout palen > Douglas hout balken > Douglas hout latten en regels",
    "price": 71.11,
    "currency": "EUR",
    "price_raw": null,
    "specs": {
      "raw": {
        "Levertijd": "2-7 werkdagen",
        "Dikte": "70 mm",
        "Materiaal": "PIR"
      }
    },
    "images": [
      "https://www.houthandelonline.nl/cdn/resize-extended/el:true/rs:fill/w:1500/h:1068/extend:true/background:255:255:255/path/media/catalog/product/p/i/pir-alu-70-v_001.jpg",
      "https://www.houthandelonline.nl/cdn/resize-extended/el:true/rs:fill/w:1500/h:1068/extend:true/background:255:255:255/path/media/catalog/product/p/i/pir-alu-70-v_02_view.jpg",
      "https://www.houthandelonline.nl/cdn/resize-extended/el:true/rs:fill/w:1500/h:1068/extend:true/background:255:255:255/path/media/catalog/product/p/i/pir-alu-70-v_01_main.jpg"
    ],
    "rating": null,
    "review_count": null,
    "reviews_summary": null,
    "scraped_at": "2026-02-05T15:04:10.176875Z",
    "scrape_success": true,
    "scrape_errors": [],
    "embedding_text": "Product: PIR isolatie Enertherm ALU 70mm isolatiewaarde 3,15m2K/W per 7 stuks\nBrand: HouthandelOnline\nCategory: Douglas hout > Toon alles in Douglas hout > Douglas hout palen > Douglas hout balken > Douglas hout latten en regels\nDescription: PIR-isolatieplaat (Rd=3,15m2K/W) uitermate geschikt voor: platdak, hellend dak, wanden, gevels, zoldervloer en zolderdak. Deze PIR plaat is voorzien van een ingebouwd aluminium dampscherm en optimaal voor het wind- en vochtdicht isoleren.\nSpecifications: Levertijd: 2-7 werkdagen, Dikte: 70 mm, Materiaal: PIR\nPrice: EUR 71.11"
  },
  {
    "id": "fc7b1eb494b1",
    "source_url": "https://www.houthandelonline.nl/pir-pur-tg4-80",
    "name": "PIR-PUR platen ALU 4 zijden mes en groef 80mm isolatiewaarde 3,7m2K/W per 6 platen (4,32m2)",
    "description": "Deze isolatieplaat is uitermate geschikt voor de isolatie van een spouwmuur, gevel of vloer om de thermische prestaties van het gebouw te verbeteren. Deze plaat is bedekt met een meerlaagse aluminium bekleding aan beide zijden, hierdoor zijn de platen dampdicht. De kern van deze isolatieplaat bestaat uit PUR schuim. Dit heeft een hoge isolatiewaarde en is ook nog eens sterk en duurzaam. Isolatiewaarde R=3,70 m2K/W.",
    "brand": "HouthandelOnline",
    "category": "Douglas hout > Toon alles in Douglas hout > Douglas hout palen > Douglas hout balken > Douglas hout latten en regels",
    "price": 84.26,
    "currency": "EUR",
    "price_raw": null,
    "specs": {
      "raw": {
        "Levertijd": "2-7 werkdagen",
        "Dikte": "80 mm",
        "Toepassing": "De isolatieplaat kan worden aangebracht in zowel nieuwbouw als renovatieprojecten. De plaat is vrij van Cfk's, hierdoor is het materiaal veilig voor zowel de gebruiker als het milieu"
      }
    },
    "images": [
      "https://www.houthandelonline.nl/cdn/resize-extended/el:true/rs:fill/w:1500/h:1068/extend:true/background:255:255:255/path/media/catalog/product/p/i/pir-pur-tg4-80-v_01_main.jpg",
      "https://www.houthandelonline.nl/cdn/resize-extended/el:true/rs:fill/w:1500/h:1068/extend:true/background:255:255:255/path/media/catalog/product/p/i/pir-pur-tg4-80-v_02_view.jpg"
    ],
    "rating": null,
    "review_count": null,
    "reviews_summary": null,
    "scraped_at": "2026-02-05T15:04:10.176881Z",
    "scrape_success": true,
    "scrape_errors": [],
    "embedding_text": "Product: PIR-PUR platen ALU 4 zijden mes en groef 80mm isolatiewaarde 3,7m2K/W per 6 platen (4,32m2)\nBrand: HouthandelOnline\nCategory: Douglas hout > Toon alles in Douglas hout > Douglas hout palen > Douglas hout balken > Douglas hout latten en regels\nDescription: Deze isolatieplaat is uitermate geschikt voor de isolatie van een spouwmuur, gevel of vloer om de thermische prestaties van het gebouw te verbeteren. Deze plaat is bedekt met een meerlaagse aluminium bekleding aan beide zijden, hierdoor zijn de platen dampdicht. De kern van deze isolatieplaat bestaat uit PUR schuim. Dit heeft een hoge isolatiewaarde en is ook nog eens sterk en duurzaam. Isolatiewaarde R=3,70 m2K/W.\nSpecifications: Levertijd: 2-7 werkdagen, Dikte: 80 mm, Toepassing: De isolatieplaat kan worden aangebracht in zowel nieuwbouw als renovatieprojecten. De plaat is vrij van Cfk's, hierdoor is het materiaal veilig voor zowel de gebruiker als het milieu\nPrice: EUR 84.26"
  },
  {
    "id": "01643ef2ca17",
    "source_url": "https://www.houthandelonline.nl/pir-alu-afschot-40-60",
    "name": "PIR isolatie Enertherm ALU afschot 40-60mm isolatiewaarde (Rd=1,8m2K/W)",
    "description": "PIR-isolatieplaat (Rd=1,8m2K/W) geschikt voor platdak. De plaat verloopt in dikte zodat deze afschot in het dakvlak creëert. Deze PIR plaat is voorzien van een ingebouwd aluminium dampscherm en optimaal voor het wind- en vochtdicht isoleren.",
    "brand": "HouthandelOnline",
    "category": "Douglas hout > Toon alles in Douglas hout > Douglas hout palen > Douglas hout balken > Douglas hout latten en regels",
    "price": 32.2,
    "currency": "EUR",
    "price_raw": null,
    "specs": {
      "raw": {
        "Levertijd": "2-7 werkdagen",
        "Materiaal": "PIR"
      }
    },
    "images": [
      "https://www.houthandelonline.nl/cdn/resize-extended/el:true/rs:fill/w:1500/h:1068/extend:true/background:255:255:255/path/media/catalog/product/p/i/pir-alu-afschot-40-60-v_001.png",
      "https://www.houthandelonline.nl/cdn/resize-extended/el:true/rs:fill/w:1500/h:1068/extend:true/background:255:255:255/path/media/catalog/product/p/i/pir-alu-afschot-40-60-v_002.jpg",
      "https://www.houthandelonline.nl/cdn/resize-extended/el:true/rs:fill/w:1500/h:1068/extend:true/background:255:255:255/path/media/catalog/product/p/i/pir-alu-afschot-40-60-v_01_main.jpg",
      "https://www.houthandelonline.nl/cdn/resize-extended/el:true/rs:fill/w:1500/h:1068/extend:true/background:255:255:255/path/media/catalog/product/p/i/pir-alu-afschot-40-60-v_02_view.jpg"
    ],
    "rating": null,
    "review_count": null,
    "reviews_summary": null,
    "scraped_at": "2026-02-05T15:04:10.176887Z",
    "scrape_success": true,
    "scrape_errors": [],
    "embedding_text": "Product: PIR isolatie Enertherm ALU afschot 40-60mm isolatiewaarde (Rd=1,8m2K/W)\nBrand: HouthandelOnline\nCategory: Douglas hout > Toon alles in Douglas hout > Douglas hout palen > Douglas hout balken > Douglas hout latten en regels\nDescription: PIR-isolatieplaat (Rd=1,8m2K/W) geschikt voor platdak. De plaat verloopt in dikte zodat deze afschot in het dakvlak creëert. Deze PIR plaat is voorzien van een ingebouwd aluminium dampscherm en optimaal voor het wind- en vochtdicht isoleren.\nSpecifications: Levertijd: 2-7 werkdagen, Materiaal: PIR\nPrice: EUR 32.2"
  },
  {
    "id": "1c2ddfc12cc6",
    "source_url": "https://www.houthandelonline.nl/pir-alu-afschot-75-90",
    "name": "PIR isolatie Enertherm ALU afschot 75-90mm isolatiewaarde (Rd=3,15m2K/W)",
    "description": "PIR-isolatieplaat (Rd=3,15m2K/W) geschikt voor platdak. De plaat verloopt in dikte zodat deze afschot in het dakvlak creëert. Deze PIR plaat is voorzien van een ingebouwd aluminium dampscherm en optimaal voor het wind- en vochtdicht isoleren.",
    "brand": "HouthandelOnline",
    "category": "Douglas hout > Toon alles in Douglas hout > Douglas hout palen > Douglas hout balken > Douglas hout latten en regels",
    "price": 47.21,
    "currency": "EUR",
    "price_raw": null,
    "specs": {
      "raw": {
        "Levertijd": "2-7 werkdagen",
        "Materiaal": "PIR"
      }
    },
    "images": [
      "https://www.houthandelonline.nl/cdn/resize-extended/el:true/rs:fill/w:1500/h:1068/extend:true/background:255:255:255/path/media/catalog/product/p/i/pir-alu-afschot-75-90-v_001.png",
      "https://www.houthandelonline.nl/cdn/resize-extended/el:true/rs:fill/w:1500/h:1068/extend:true/background:255:255:255/path/media/catalog/product/p/i/pir-alu-afschot-75-90-v_002.jpg",
      "https://www.houthandelonline.nl/cdn/resize-extended/el:true/rs:fill/w:1500/h:1068/extend:true/background:255:255:255/path/media/catalog/product/p/i/pir-alu-afschot-75-90-v_01_main.jpg",
      "https://www.houthandelonline.nl/cdn/resize-extended/el:true/rs:fill/w:1500/h:1068/extend:true/background:255:255:255/path/media/catalog/product/p/i/pir-alu-afschot-75-90-v_02_view.jpg"
    ],
    "rating": null,
    "review_count": null,
    "reviews_summary": null,
    "scraped_at": "2026-02-05T15:04:10.176893Z",
    "scrape_success": true,
    "scrape_errors": [],
    "embedding_text": "Product: PIR isolatie Enertherm ALU afschot 75-90mm isolatiewaarde (Rd=3,15m2K/W)\nBrand: HouthandelOnline\nCategory: Douglas hout > Toon alles in Douglas hout > Douglas hout palen > Douglas hout balken > Douglas hout latten en regels\nDescription: PIR-isolatieplaat (Rd=3,15m2K/W) geschikt voor platdak. De plaat verloopt in dikte zodat deze afschot in het dakvlak creëert. Deze PIR plaat is voorzien van een ingebouwd aluminium dampscherm en optimaal voor het wind- en vochtdicht isoleren.\nSpecifications: Levertijd: 2-7 werkdagen, Materiaal: PIR\nPrice: EUR 47.21"
  },
  {
    "id": "a8b9189232cf",
    "source_url": "https://www.houthandelonline.nl/pir-alu-afschot-105-120",
    "name": "PIR isolatie Enertherm ALU afschot 105-120mm isolatiewaarde (Rd=4,0m2K/W)",
    "description": "PIR-isolatieplaat (Rd=4,50m2K/W) geschikt voor platdak. De plaat verloopt in dikte zodat deze afschot in het dakvlak creëert. Deze PIR plaat is voorzien van een ingebouwd aluminium dampscherm en optimaal voor het wind- en vochtdicht isoleren.",
    "brand": "HouthandelOnline",
    "category": "Douglas hout > Toon alles in Douglas hout > Douglas hout palen > Douglas hout balken > Douglas hout latten en regels",
    "price": 63.37,
    "currency": "EUR",
    "price_raw": null,
    "specs": {
      "raw": {
        "Levertijd": "2-7 werkdagen",
        "Materiaal": "PIR"
      }
    },
    "images": [
      "https://www.houthandelonline.nl/cdn/resize-extended/el:true/rs:fill/w:1500/h:1068/extend:true/background:255:255:255/path/media/catalog/product/p/i/pir-alu-afschot-105-120-v_001.png",
      "https://www.houthandelonline.nl/cdn/resize-extended/el:true/rs:fill/w:1500/h:1068/extend:true/background:255:255:255/path/media/catalog/product/p/i/pir-alu-afschot-105-120-v_002.jpg",
      "https://www.houthandelonline.nl/cdn/resize-extended/el:true/rs:fill/w:1500/h:1068/extend:true/background:255:255:255/path/media/catalog/product/p/i/pir-alu-afschot-105-120-v_01_main.jpg",
      "https://www.houthandelonline.nl/cdn/resize-extended/el:true/rs:fill/w:1500/h:1068/extend:true/background:255:255:255/path/media/catalog/product/p/i/pir-alu-afschot-105-120-v_02_view.jpg"
    ],
    "rating": null,
    "review_count": null,
    "reviews_summary": null,
    "scraped_at": "2026-02-05T15:04:10.176898Z",
    "scrape_success": true,
    "scrape_errors": [],
    "embedding_text": "Product: PIR isolatie Enertherm ALU afschot 105-120mm isolatiewaarde (Rd=4,0m2K/W)\nBrand: HouthandelOnline\nCategory: Douglas hout > Toon alles in Douglas hout > Douglas hout palen > Douglas hout balken > Douglas hout latten en regels\nDescription: PIR-isolatieplaat (Rd=4,50m2K/W) geschikt voor platdak. De plaat verloopt in dikte zodat deze afschot in het dakvlak creëert. Deze PIR plaat is voorzien van een ingebouwd aluminium dampscherm en optimaal voor het wind- en vochtdicht isoleren.\nSpecifications: Levertijd: 2-7 werkdagen, Materiaal: PIR\nPrice: EUR 63.37"
  },
  {
    "id": "88592e502ae1",
    "source_url": "https://www.houthandelonline.nl/pir-alu-afschot-60-70",
    "name": "PIR isolatie Enertherm ALU afschot 60-70mm isolatiewaarde (Rd=2,7m2K/W)",
    "description": "PIR-isolatieplaat (Rd=2,70m2K/W) geschikt voor platdak. De plaat verloopt in dikte zodat deze afschot in het dakvlak creëert. Deze PIR plaat is voorzien van een ingebouwd aluminium dampscherm en optimaal voor het wind- en vochtdicht isoleren.",
    "brand": "HouthandelOnline",
    "category": "Douglas hout > Toon alles in Douglas hout > Douglas hout palen > Douglas hout balken > Douglas hout latten en regels",
    "price": 36.59,
    "currency": "EUR",
    "price_raw": null,
    "specs": {
      "raw": {
        "Levertijd": "2-7 werkdagen",
        "Materiaal": "PIR"
      }
    },
    "images": [
      "https://www.houthandelonline.nl/cdn/resize-extended/el:true/rs:fill/w:1500/h:1068/extend:true/background:255:255:255/path/media/catalog/product/p/i/pir-alu-afschot-60-70-v_001.png",
      "https://www.houthandelonline.nl/cdn/resize-extended/el:true/rs:fill/w:1500/h:1068/extend:true/background:255:255:255/path/media/catalog/product/p/i/pir-alu-afschot-60-70-v_002.jpg",
      "https://www.houthandelonline.nl/cdn/resize-extended/el:true/rs:fill/w:1500/h:1068/extend:true/background:255:255:255/path/media/catalog/product/p/i/pir-alu-afschot-60-70-v_01_main_1.jpg",
      "https://www.houthandelonline.nl/cdn/resize-extended/el:true/rs:fill/w:1500/h:1068/extend:true/background:255:255:255/path/media/catalog/product/p/i/pir-alu-afschot-60-70-v_02_view_1.jpg"
    ],
    "rating": null,
    "review_count": null,
    "reviews_summary": null,
    "scraped_at": "2026-02-05T15:04:10.176907Z",
    "scrape_success": true,
    "scrape_errors": [],
    "embedding_text": "Product: PIR isolatie Enertherm ALU afschot 60-70mm isolatiewaarde (Rd=2,7m2K/W)\nBrand: HouthandelOnline\nCategory: Douglas hout > Toon alles in Douglas hout > Douglas hout palen > Douglas hout balken > Douglas hout latten en regels\nDescription: PIR-isolatieplaat (Rd=2,70m2K/W) geschikt voor platdak. De plaat verloopt in dikte zodat deze afschot in het dakvlak creëert. Deze PIR plaat is voorzien van een ingebouwd aluminium dampscherm en optimaal voor het wind- en vochtdicht isoleren.\nSpecifications: Levertijd: 2-7 werkdagen, Materiaal: PIR\nPrice: EUR 36.59"
  },
  {
    "id": "d3417322edc8",
    "source_url": "https://www.houthandelonline.nl/pir-alu-afschot-50-60",
    "name": "PIR isolatie Enertherm ALU afschot 50-60mm isolatiewaarde (Rd=2,25m2K/W)",
    "description": "PIR-isolatieplaat (Rd=2,25m2K/W) geschikt voor platdak. De plaat verloopt in dikte zodat deze afschot in het dakvlak creëert. Deze PIR plaat is voorzien van een ingebouwd aluminium dampscherm en optimaal voor het wind- en vochtdicht isoleren.",
    "brand": "HouthandelOnline",
    "category": "Douglas hout > Toon alles in Douglas hout > Douglas hout palen > Douglas hout balken > Douglas hout latten en regels",
    "price": 31.88,
    "currency": "EUR",
    "price_raw": null,
    "specs": {
      "raw": {
        "Levertijd": "2-7 werkdagen",
        "Materiaal": "PIR"
      }
    },
    "images": [
      "https://www.houthandelonline.nl/cdn/resize-extended/el:true/rs:fill/w:1500/h:1068/extend:true/background:255:255:255/path/media/catalog/product/p/i/pir-alu-afschot-50-60-v_001.png",
      "https://www.houthandelonline.nl/cdn/resize-extended/el:true/rs:fill/w:1500/h:1068/extend:true/background:255:255:255/path/media/catalog/product/p/i/pir-alu-afschot-50-60-v_002.jpg",
      "https://www.houthandelonline.nl/cdn/resize-extended/el:true/rs:fill/w:1500/h:1068/extend:true/background:255:255:255/path/media/catalog/product/p/i/pir-alu-afschot-50-60-v_01_main.jpg",
      "https://www.houthandelonline.nl/cdn/resize-extended/el:true/rs:fill/w:1500/h:1068/extend:true/background:255:255:255/path/media/catalog/product/p/i/pir-alu-afschot-50-60-v_02_view.jpg"
    ],
    "rating": null,
    "review_count": null,
    "reviews_summary": null,
    "scraped_at": "2026-02-05T15:04:10.177225Z",
    "scrape_success": true,
    "scrape_errors": [],
    "embedding_text": "Product: PIR isolatie Enertherm ALU afschot 50-60mm isolatiewaarde (Rd=2,25m2K/W)\nBrand: HouthandelOnline\nCategory: Douglas hout > Toon alles in Douglas hout > Douglas hout palen > Douglas hout balken > Douglas hout latten en regels\nDescription: PIR-isolatieplaat (Rd=2,25m2K/W) geschikt voor platdak. De plaat verloopt in dikte zodat deze afschot in het dakvlak creëert. Deze PIR plaat is voorzien van een ingebouwd aluminium dampscherm en optimaal voor het wind- en vochtdicht isoleren.\nSpecifications: Levertijd: 2-7 werkdagen, Materiaal: PIR\nPrice: EUR 31.88"
  },
  {
    "id": "4e3d821f55e2",
    "source_url": "https://www.houthandelonline.nl/pir-alu-afschot-80-100",
    "name": "PIR isolatie Enertherm ALU afschot 80-100mm  isolatiewaarde (Rd=3,6m2K/W)",
    "description": "PIR-isolatieplaat (Rd=3,6m2K/W) geschikt voor platdak. De plaat verloopt in dikte zodat deze afschot in het dakvlak creëert. Deze PIR plaat is voorzien van een ingebouwd aluminium dampscherm en optimaal voor het wind- en vochtdicht isoleren.",
    "brand": "HouthandelOnline",
    "category": "Douglas hout > Toon alles in Douglas hout > Douglas hout palen > Douglas hout balken > Douglas hout latten en regels",
    "price": 54.73,
    "currency": "EUR",
    "price_raw": null,
    "specs": {
      "raw": {
        "Levertijd": "2-7 werkdagen",
        "Materiaal": "PIR"
      }
    },
    "images": [
      "https://www.houthandelonline.nl/cdn/resize-extended/el:true/rs:fill/w:1500/h:1068/extend:true/background:255:255:255/path/media/catalog/product/p/i/pir-alu-afschot-80-100-v_001.png",
      "https://www.houthandelonline.nl/cdn/resize-extended/el:true/rs:fill/w:1500/h:1068/extend:true/background:255:255:255/path/media/catalog/product/p/i/pir-alu-afschot-80-100-v_002.jpg",
      "https://www.houthandelonline.nl/cdn/resize-extended/el:true/rs:fill/w:1500/h:1068/extend:true/background:255:255:255/path/media/catalog/product/p/i/pir-alu-afschot-80-100-v_01_main.jpg",
      "https://www.houthandelonline.nl/cdn/resize-extended/el:true/rs:fill/w:1500/h:1068/extend:true/background:255:255:255/path/media/catalog/product/p/i/pir-alu-afschot-80-100-v_02_view.jpg"
    ],
    "rating": null,
    "review_count": null,
    "reviews_summary": null,
    "scraped_at": "2026-02-05T15:04:10.177241Z",
    "scrape_success": true,
    "scrape_errors": [],
    "embedding_text": "Product: PIR isolatie Enertherm ALU afschot 80-100mm  isolatiewaarde (Rd=3,6m2K/W)\nBrand: HouthandelOnline\nCategory: Douglas hout > Toon alles in Douglas hout > Douglas hout palen > Douglas hout balken > Douglas hout latten en regels\nDescription: PIR-isolatieplaat (Rd=3,6m2K/W) geschikt voor platdak. De plaat verloopt in dikte zodat deze afschot in het dakvlak creëert. Deze PIR plaat is voorzien van een ingebouwd aluminium dampscherm en optimaal voor het wind- en vochtdicht isoleren.\nSpecifications: Levertijd: 2-7 werkdagen, Materiaal: PIR\nPrice: EUR 54.73"
  },
  {
    "id": "a9d5c42ec7f8",
    "source_url": "https://www.houthandelonline.nl/pir-alu-afschot-60-80",
    "name": "PIR isolatie Enertherm ALU afschot 60-80mm isolatiewaarde (Rd=2,7m2K/W)",
    "description": "PIR-isolatieplaat (Rd=2,70m2K/W) geschikt voor platdak. De plaat verloopt in dikte zodat deze afschot in het dakvlak creëert. Deze PIR plaat is voorzien van een ingebouwd aluminium dampscherm en optimaal voor het wind- en vochtdicht isoleren.",
    "brand": "HouthandelOnline",
    "category": "Douglas hout > Toon alles in Douglas hout > Douglas hout palen > Douglas hout balken > Douglas hout latten en regels",
    "price": 43.32,
    "currency": "EUR",
    "price_raw": null,
    "specs": {
      "raw": {
        "Levertijd": "2-7 werkdagen",
        "Materiaal": "PIR"
      }
    },
    "images": [
      "https://www.houthandelonline.nl/cdn/resize-extended/el:true/rs:fill/w:1500/h:1068/extend:true/background:255:255:255/path/media/catalog/product/p/i/pir-alu-afschot-60-80-v_001.png",
      "https://www.houthandelonline.nl/cdn/resize-extended/el:true/rs:fill/w:1500/h:1068/extend:true/background:255:255:255/path/media/catalog/product/p/i/pir-alu-afschot-60-80-v_002.jpg",
      "https://www.houthandelonline.nl/cdn/resize-extended/el:true/rs:fill/w:1500/h:1068/extend:true/background:255:255:255/path/media/catalog/product/p/i/pir-alu-afschot-60-80-v_01_main.jpg",
      "https://www.houthandelonline.nl/cdn/resize-extended/el:true/rs:fill/w:1500/h:1068/extend:true/background:255:255:255/path/media/catalog/product/p/i/pir-alu-afschot-60-80-v_02_view.jpg"
    ],
    "rating": null,
    "review_count": null,
    "reviews_summary": null,
    "scraped_at": "2026-02-05T15:04:10.177248Z",
    "scrape_success": true,
    "scrape_errors": [],
    "embedding_text": "Product: PIR isolatie Enertherm ALU afschot 60-80mm isolatiewaarde (Rd=2,7m2K/W)\nBrand: HouthandelOnline\nCategory: Douglas hout > Toon alles in Douglas hout > Douglas hout palen > Douglas hout balken > Douglas hout latten en regels\nDescription: PIR-isolatieplaat (Rd=2,70m2K/W) geschikt voor platdak. De plaat verloopt in dikte zodat deze afschot in het dakvlak creëert. Deze PIR plaat is voorzien van een ingebouwd aluminium dampscherm en optimaal voor het wind- en vochtdicht isoleren.\nSpecifications: Levertijd: 2-7 werkdagen, Materiaal: PIR\nPrice: EUR 43.32"
  },
  {
    "id": "4075576fbe36",
    "source_url": "https://www.houthandelonline.nl/pir-alu-afschot-30-40",
    "name": "PIR isolatie Enertherm ALU afschot 30-40mm isolatiewaarde (Rd=1,35m2K/W)",
    "description": "PIR-isolatieplaat (Rd=1,35m2K/W) geschikt voor platdak. De plaat verloopt in dikte zodat deze afschot in het dakvlak creëert. Deze PIR plaat is voorzien van een ingebouwd aluminium dampscherm en optimaal voor het wind- en vochtdicht isoleren.",
    "brand": "HouthandelOnline",
    "category": "Douglas hout > Toon alles in Douglas hout > Douglas hout palen > Douglas hout balken > Douglas hout latten en regels",
    "price": 21.66,
    "currency": "EUR",
    "price_raw": null,
    "specs": {
      "raw": {
        "Levertijd": "2-7 werkdagen",
        "Materiaal": "PIR"
      }
    },
    "images": [
      "https://www.houthandelonline.nl/cdn/resize-extended/el:true/rs:fill/w:1500/h:1068/extend:true/background:255:255:255/path/media/catalog/product/p/i/pir-alu-afschot-30-40-v_001.png",
      "https://www.houthandelonline.nl/cdn/resize-extended/el:true/rs:fill/w:1500/h:1068/extend:true/background:255:255:255/path/media/catalog/product/p/i/pir-alu-afschot-30-40-v_002.jpg",
      "https://www.houthandelonline.nl/cdn/resize-extended/el:true/rs:fill/w:1500/h:1068/extend:true/background:255:255:255/path/media/catalog/product/p/i/pir-alu-afschot-30-40-v_01_main.jpg",
      "https://www.houthandelonline.nl/cdn/resize-extended/el:true/rs:fill/w:1500/h:1068/extend:true/background:255:255:255/path/media/catalog/product/p/i/pir-alu-afschot-30-40-v_02_view.jpg"
    ],
    "rating": null,
    "review_count": null,
    "reviews_summary": null,
    "scraped_at": "2026-02-05T15:04:10.177254Z",
    "scrape_success": true,
    "scrape_errors": [],
    "embedding_text": "Product: PIR isolatie Enertherm ALU afschot 30-40mm isolatiewaarde (Rd=1,35m2K/W)\nBrand: HouthandelOnline\nCategory: Douglas hout > Toon alles in Douglas hout > Douglas hout palen > Douglas hout balken > Douglas hout latten en regels\nDescription: PIR-isolatieplaat (Rd=1,35m2K/W) geschikt voor platdak. De plaat verloopt in dikte zodat deze afschot in het dakvlak creëert. Deze PIR plaat is voorzien van een ingebouwd aluminium dampscherm en optimaal voor het wind- en vochtdicht isoleren.\nSpecifications: Levertijd: 2-7 werkdagen, Materiaal: PIR\nPrice: EUR 21.66"
  },
  {
    "id": "3ae3007a98c6",
    "source_url": "https://www.houthandelonline.nl/damp-open-morgofassade",
    "name": "Damp-open spinvliesfolie MorgoFassade 1,50x50 meter",
    "description": "Deze Fassadefolie wordt aangebracht aan de buitenzijde van de houten constructie bij een gedeeltelijk open gevel tot maximaal 20% UV-belasting. Deze antraciet kleurige folie voorkomt dat er vocht van buitenaf in de wandconstructie en isolatiemateriaal terecht komt en is in staat om het aanwezige vocht in de constructie af te staan aan de buitenlucht d.m.v. verdamping. Deze folie wordt geleverd op rol van 1,5 meter breed en heeft een totaal oppervlak van 75m2. Let op: Deze folie is niet geschikt voor daken.",
    "brand": "HouthandelOnline",
    "category": "Douglas hout > Toon alles in Douglas hout > Douglas hout palen > Douglas hout balken > Douglas hout latten en regels",
    "price": 461.62,
    "currency": "EUR",
    "price_raw": null,
    "specs": {
      "raw": {
        "Levertijd": "2-7 werkdagen",
        "Breedte": "1500",
        "Materiaal": "Spinvliesfolie"
      }
    },
    "images": [
      "https://www.houthandelonline.nl/cdn/resize-extended/el:true/rs:fill/w:1500/h:1068/extend:true/background:255:255:255/path/media/catalog/product/d/a/damp-open-morgofassade-v_01_main.jpg",
      "https://www.houthandelonline.nl/cdn/resize-extended/el:true/rs:fill/w:1500/h:1068/extend:true/background:255:255:255/path/media/catalog/product/d/a/damp-open-morgofassade-v_02_view.jpg"
    ],
    "rating": null,
    "review_count": null,
    "reviews_summary": null,
    "scraped_at": "2026-02-05T15:04:10.177260Z",
    "scrape_success": true,
    "scrape_errors": [],
    "embedding_text": "Product: Damp-open spinvliesfolie MorgoFassade 1,50x50 meter\nBrand: HouthandelOnline\nCategory: Douglas hout > Toon alles in Douglas hout > Douglas hout palen > Douglas hout balken > Douglas hout latten en regels\nDescription: Deze Fassadefolie wordt aangebracht aan de buitenzijde van de houten constructie bij een gedeeltelijk open gevel tot maximaal 20% UV-belasting. Deze antraciet kleurige folie voorkomt dat er vocht van buitenaf in de wandconstructie en isolatiemateriaal terecht komt en is in staat om het aanwezige vocht in de constructie af te staan aan de buitenlucht d.m.v. verdamping. Deze folie wordt geleverd op rol van 1,5 meter breed en heeft een totaal oppervlak van 75m2. Let op: Deze folie is niet geschikt voor daken.\nSpecifications: Levertijd: 2-7 werkdagen, Breedte: 1500, Materiaal: Spinvliesfolie\nPrice: EUR 461.62"
  },
  {
    "id": "8d39943595fa",
    "source_url": "https://www.houthandelonline.nl/dampdoorlatende-gewapende-folie",
    "name": "Dampdoorlatende gewapende folie 1,50x50 meter",
    "description": "Deze damp-doorlatende plastic folie met blauwe wapening wordt aangebracht aan de koude (buiten)kant van een constructie en is waterkerend. Deze transparante folie voorkomt dat er vocht van buitenaf in de wand- of dakconstructie terecht komt. Deze micro-geperforeerde folie is in staat om het aanwezige vocht in de constructie af te staan aan de buitenlucht d.m.v. verdamping. Deze folie wordt geleverd op rol van 1,5 meter breed en heeft een totaal oppervlak van 75m2.",
    "brand": "HouthandelOnline",
    "category": "Douglas hout > Toon alles in Douglas hout > Douglas hout palen > Douglas hout balken > Douglas hout latten en regels",
    "price": 100.49,
    "currency": "EUR",
    "price_raw": null,
    "specs": {
      "raw": {
        "Levertijd": "2-7 werkdagen",
        "Breedte": "1500",
        "Materiaal": "Folie"
      }
    },
    "images": [
      "https://www.houthandelonline.nl/cdn/resize-extended/el:true/rs:fill/w:1500/h:1068/extend:true/background:255:255:255/path/media/catalog/product/d/a/dampdoorlatende-gewapende-folie-v_01_main.jpg",
      "https://www.houthandelonline.nl/cdn/resize-extended/el:true/rs:fill/w:1500/h:1068/extend:true/background:255:255:255/path/media/catalog/product/d/a/dampdoorlatende-gewapende-folie-v_02_view.jpg"
    ],
    "rating": null,
    "review_count": null,
    "reviews_summary": null,
    "scraped_at": "2026-02-05T15:04:10.177265Z",
    "scrape_success": true,
    "scrape_errors": [],
    "embedding_text": "Product: Dampdoorlatende gewapende folie 1,50x50 meter\nBrand: HouthandelOnline\nCategory: Douglas hout > Toon alles in Douglas hout > Douglas hout palen > Douglas hout balken > Douglas hout latten en regels\nDescription: Deze damp-doorlatende plastic folie met blauwe wapening wordt aangebracht aan de koude (buiten)kant van een constructie en is waterkerend. Deze transparante folie voorkomt dat er vocht van buitenaf in de wand- of dakconstructie terecht komt. Deze micro-geperforeerde folie is in staat om het aanwezige vocht in de constructie af te staan aan de buitenlucht d.m.v. verdamping. Deze folie wordt geleverd op rol van 1,5 meter breed en heeft een totaal oppervlak van 75m2.\nSpecifications: Levertijd: 2-7 werkdagen, Breedte: 1500, Materiaal: Folie\nPrice: EUR 100.49"
  },
  {
    "id": "1b890509d86b",
    "source_url": "https://www.houthandelonline.nl/pir-alu-afschot-70-80",
    "name": "PIR isolatie enertherm ALU afschot 70-80mm isolatiewaarde (Rd=3,15m2K/W)",
    "description": "PIR-isolatieplaat (Rd=3,15m2K/W) geschikt voor platdak. De plaat verloopt in dikte zodat deze afschot in het dakvlak creëert. Deze PIR plaat is 2-zijden voorzien van een ingebouwd aluminium dampscherm en optimaal voor het wind- en vochtdicht isoleren.",
    "brand": "HouthandelOnline",
    "category": "Douglas hout > Toon alles in Douglas hout > Douglas hout palen > Douglas hout balken > Douglas hout latten en regels",
    "price": 41.59,
    "currency": "EUR",
    "price_raw": null,
    "specs": {
      "raw": {
        "Levertijd": "2-7 werkdagen",
        "Materiaal": "PIR"
      }
    },
    "images": [
      "https://www.houthandelonline.nl/cdn/resize-extended/el:true/rs:fill/w:1500/h:1068/extend:true/background:255:255:255/path/media/catalog/product/p/i/pir-alu-afschot-70-80-v_001.png",
      "https://www.houthandelonline.nl/cdn/resize-extended/el:true/rs:fill/w:1500/h:1068/extend:true/background:255:255:255/path/media/catalog/product/p/i/pir-alu-afschot-70-80-v_002.jpg",
      "https://www.houthandelonline.nl/cdn/resize-extended/el:true/rs:fill/w:1500/h:1068/extend:true/background:255:255:255/path/media/catalog/product/p/i/pir-alu-afschot-70-80-v_01_main.jpg",
      "https://www.houthandelonline.nl/cdn/resize-extended/el:true/rs:fill/w:1500/h:1068/extend:true/background:255:255:255/path/media/catalog/product/p/i/pir-alu-afschot-70-80-v_02_view.jpg"
    ],
    "rating": null,
    "review_count": null,
    "reviews_summary": null,
    "scraped_at": "2026-02-05T15:04:10.177271Z",
    "scrape_success": true,
    "scrape_errors": [],
    "embedding_text": "Product: PIR isolatie enertherm ALU afschot 70-80mm isolatiewaarde (Rd=3,15m2K/W)\nBrand: HouthandelOnline\nCategory: Douglas hout > Toon alles in Douglas hout > Douglas hout palen > Douglas hout balken > Douglas hout latten en regels\nDescription: PIR-isolatieplaat (Rd=3,15m2K/W) geschikt voor platdak. De plaat verloopt in dikte zodat deze afschot in het dakvlak creëert. Deze PIR plaat is 2-zijden voorzien van een ingebouwd aluminium dampscherm en optimaal voor het wind- en vochtdicht isoleren.\nSpecifications: Levertijd: 2-7 werkdagen, Materiaal: PIR\nPrice: EUR 41.59"
  },
  {
    "id": "3073f55cfb72",
    "source_url": "https://www.houthandelonline.nl/pir-alu-afschot-90-100",
    "name": "PIR isolatie Enertherm ALU afschot 90-100mm isolatiewaarde (Rd=4,05m2K/W)",
    "description": "PIR-isolatieplaat (Rd=4,05m2K/W) geschikt voor platdak. De plaat verloopt in dikte zodat deze afschot in het dakvlak creëert. Deze PIR plaat is voorzien van een ingebouwd aluminium dampscherm en optimaal voor het wind- en vochtdicht isoleren.",
    "brand": "HouthandelOnline",
    "category": "Douglas hout > Toon alles in Douglas hout > Douglas hout palen > Douglas hout balken > Douglas hout latten en regels",
    "price": 53.93,
    "currency": "EUR",
    "price_raw": null,
    "specs": {
      "raw": {
        "Levertijd": "2-7 werkdagen",
        "Materiaal": "PIR"
      }
    },
    "images": [
      "https://www.houthandelonline.nl/cdn/resize-extended/el:true/rs:fill/w:1500/h:1068/extend:true/background:255:255:255/path/media/catalog/product/p/i/pir-alu-afschot-90-100-v_001.png",
      "https://www.houthandelonline.nl/cdn/resize-extended/el:true/rs:fill/w:1500/h:1068/extend:true/background:255:255:255/path/media/catalog/product/p/i/pir-alu-afschot-90-100-v_002.jpg",
      "https://www.houthandelonline.nl/cdn/resize-extended/el:true/rs:fill/w:1500/h:1068/extend:true/background:255:255:255/path/media/catalog/product/p/i/pir-alu-afschot-90-100-v_01_main.jpg",
      "https://www.houthandelonline.nl/cdn/resize-extended/el:true/rs:fill/w:1500/h:1068/extend:true/background:255:255:255/path/media/catalog/product/p/i/pir-alu-afschot-90-100-v_02_view.jpg"
    ],
    "rating": null,
    "review_count": null,
    "reviews_summary": null,
    "scraped_at": "2026-02-05T15:04:10.177279Z",
    "scrape_success": true,
    "scrape_errors": [],
    "embedding_text": "Product: PIR isolatie Enertherm ALU afschot 90-100mm isolatiewaarde (Rd=4,05m2K/W)\nBrand: HouthandelOnline\nCategory: Douglas hout > Toon alles in Douglas hout > Douglas hout palen > Douglas hout balken > Douglas hout latten en regels\nDescription: PIR-isolatieplaat (Rd=4,05m2K/W) geschikt voor platdak. De plaat verloopt in dikte zodat deze afschot in het dakvlak creëert. Deze PIR plaat is voorzien van een ingebouwd aluminium dampscherm en optimaal voor het wind- en vochtdicht isoleren.\nSpecifications: Levertijd: 2-7 werkdagen, Materiaal: PIR\nPrice: EUR 53.93"
  },
  {
    "id": "788ebbf0d61b",
    "source_url": "https://www.houthandelonline.nl/pir-alu-afschot-80-90",
    "name": "PIR isolatie Enertherm ALU afschot 80-90mm isolatiewaarde (Rd=3,6m2K/W)",
    "description": "PIR-isolatieplaat (Rd=3,6m2K/W) geschikt voor platdak. De plaat verloopt in dikte zodat deze afschot in het dakvlak creëert. Deze PIR plaat is voorzien van een ingebouwd aluminium dampscherm en optimaal voor het wind- en vochtdicht isoleren.",
    "brand": "HouthandelOnline",
    "category": "Douglas hout > Toon alles in Douglas hout > Douglas hout palen > Douglas hout balken > Douglas hout latten en regels",
    "price": 47.32,
    "currency": "EUR",
    "price_raw": null,
    "specs": {
      "raw": {
        "Levertijd": "2-7 werkdagen",
        "Materiaal": "PIR"
      }
    },
    "images": [
      "https://www.houthandelonline.nl/cdn/resize-extended/el:true/rs:fill/w:1500/h:1068/extend:true/background:255:255:255/path/media/catalog/product/p/i/pir-alu-afschot-80-90-v_001.png",
      "https://www.houthandelonline.nl/cdn/resize-extended/el:true/rs:fill/w:1500/h:1068/extend:true/background:255:255:255/path/media/catalog/product/p/i/pir-alu-afschot-80-90-v_002.jpg",
      "https://www.houthandelonline.nl/cdn/resize-extended/el:true/rs:fill/w:1500/h:1068/extend:true/background:255:255:255/path/media/catalog/product/p/i/pir-alu-afschot-80-90-v_01_main.jpg",
      "https://www.houthandelonline.nl/cdn/resize-extended/el:true/rs:fill/w:1500/h:1068/extend:true/background:255:255:255/path/media/catalog/product/p/i/pir-alu-afschot-80-90-v_02_view.jpg"
    ],
    "rating": null,
    "review_count": null,
    "reviews_summary": null,
    "scraped_at": "2026-02-05T15:04:10.177285Z",
    "scrape_success": true,
    "scrape_errors": [],
    "embedding_text": "Product: PIR isolatie Enertherm ALU afschot 80-90mm isolatiewaarde (Rd=3,6m2K/W)\nBrand: HouthandelOnline\nCategory: Douglas hout > Toon alles in Douglas hout > Douglas hout palen > Douglas hout balken > Douglas hout latten en regels\nDescription: PIR-isolatieplaat (Rd=3,6m2K/W) geschikt voor platdak. De plaat verloopt in dikte zodat deze afschot in het dakvlak creëert. Deze PIR plaat is voorzien van een ingebouwd aluminium dampscherm en optimaal voor het wind- en vochtdicht isoleren.\nSpecifications: Levertijd: 2-7 werkdagen, Materiaal: PIR\nPrice: EUR 47.32"
  },
  {
    "id": "6107a626d3b4",
    "source_url": "https://www.houthandelonline.nl/pir-alu-afschot-90-105",
    "name": "PIR isolatie Enertherm ALU afschot 90-105mm isolatiewaarde (Rd=4,05m2K/W)",
    "description": "PIR-isolatieplaat (Rd=4,05m2K/W) geschikt voor platdak. De plaat verloopt in dikte zodat deze afschot in het dakvlak creëert. Deze PIR plaat is voorzien van een ingebouwd aluminium dampscherm en optimaal voor het wind- en vochtdicht isoleren.",
    "brand": "HouthandelOnline",
    "category": "Douglas hout > Toon alles in Douglas hout > Douglas hout palen > Douglas hout balken > Douglas hout latten en regels",
    "price": 54.73,
    "currency": "EUR",
    "price_raw": null,
    "specs": {
      "raw": {
        "Levertijd": "2-7 werkdagen",
        "Materiaal": "PIR"
      }
    },
    "images": [
      "https://www.houthandelonline.nl/cdn/resize-extended/el:true/rs:fill/w:1500/h:1068/extend:true/background:255:255:255/path/media/catalog/product/p/i/pir-alu-afschot-90-105-v_001.png",
      "https://www.houthandelonline.nl/cdn/resize-extended/el:true/rs:fill/w:1500/h:1068/extend:true/background:255:255:255/path/media/catalog/product/p/i/pir-alu-afschot-90-105-v_002.jpg",
      "https://www.houthandelonline.nl/cdn/resize-extended/el:true/rs:fill/w:1500/h:1068/extend:true/background:255:255:255/path/media/catalog/product/p/i/pir-alu-afschot-90-105-v_01_main.jpg",
      "https://www.houthandelonline.nl/cdn/resize-extended/el:true/rs:fill/w:1500/h:1068/extend:true/background:255:255:255/path/media/catalog/product/p/i/pir-alu-afschot-90-105-v_02_view.jpg"
    ],
    "rating": null,
    "review_count": null,
    "reviews_summary": null,
    "scraped_at": "2026-02-05T15:04:10.177290Z",
    "scrape_success": true,
    "scrape_errors": [],
    "embedding_text": "Product: PIR isolatie Enertherm ALU afschot 90-105mm isolatiewaarde (Rd=4,05m2K/W)\nBrand: HouthandelOnline\nCategory: Douglas hout > Toon alles in Douglas hout > Douglas hout palen > Douglas hout balken > Douglas hout latten en regels\nDescription: PIR-isolatieplaat (Rd=4,05m2K/W) geschikt voor platdak. De plaat verloopt in dikte zodat deze afschot in het dakvlak creëert. Deze PIR plaat is voorzien van een ingebouwd aluminium dampscherm en optimaal voor het wind- en vochtdicht isoleren.\nSpecifications: Levertijd: 2-7 werkdagen, Materiaal: PIR\nPrice: EUR 54.73"
  },
  {
    "id": "4fdeed6ef1f0",
    "source_url": "https://www.houthandelonline.nl/pir-alu-afschot-40-50",
    "name": "PIR isolatie enertherm ALU afschot 40-50mm isolatiewaarde (Rd=1,8m2K/W)",
    "description": "PIR-isolatieplaat (Rd=1,8m2K/W) geschikt voor platdak. De plaat verloopt in dikte zodat deze afschot in het dakvlak creëert. Deze PIR plaat is voorzien van een ingebouwd aluminium dampscherm en optimaal voor het wind- en vochtdicht isoleren.",
    "brand": "HouthandelOnline",
    "category": "Douglas hout > Toon alles in Douglas hout > Douglas hout palen > Douglas hout balken > Douglas hout latten en regels",
    "price": 26.46,
    "currency": "EUR",
    "price_raw": null,
    "specs": {
      "raw": {
        "Levertijd": "2-7 werkdagen",
        "Materiaal": "PIR"
      }
    },
    "images": [
      "https://www.houthandelonline.nl/cdn/resize-extended/el:true/rs:fill/w:1500/h:1068/extend:true/background:255:255:255/path/media/catalog/product/p/i/pir-alu-afschot-40-50-v_001.png",
      "https://www.houthandelonline.nl/cdn/resize-extended/el:true/rs:fill/w:1500/h:1068/extend:true/background:255:255:255/path/media/catalog/product/p/i/pir-alu-afschot-40-50-v_002.jpg",
      "https://www.houthandelonline.nl/cdn/resize-extended/el:true/rs:fill/w:1500/h:1068/extend:true/background:255:255:255/path/media/catalog/product/p/i/pir-alu-afschot-40-50-v_01_main.jpg",
      "https://www.houthandelonline.nl/cdn/resize-extended/el:true/rs:fill/w:1500/h:1068/extend:true/background:255:255:255/path/media/catalog/product/p/i/pir-alu-afschot-40-50-v_02_view.jpg"
    ],
    "rating": null,
    "review_count": null,
    "reviews_summary": null,
    "scraped_at": "2026-02-05T15:04:10.177296Z",
    "scrape_success": true,
    "scrape_errors": [],
    "embedding_text": "Product: PIR isolatie enertherm ALU afschot 40-50mm isolatiewaarde (Rd=1,8m2K/W)\nBrand: HouthandelOnline\nCategory: Douglas hout > Toon alles in Douglas hout > Douglas hout palen > Douglas hout balken > Douglas hout latten en regels\nDescription: PIR-isolatieplaat (Rd=1,8m2K/W) geschikt voor platdak. De plaat verloopt in dikte zodat deze afschot in het dakvlak creëert. Deze PIR plaat is voorzien van een ingebouwd aluminium dampscherm en optimaal voor het wind- en vochtdicht isoleren.\nSpecifications: Levertijd: 2-7 werkdagen, Materiaal: PIR\nPrice: EUR 26.46"
  },
  {
    "id": "df9e0b9c317d",
    "source_url": "https://www.houthandelonline.nl/douglas-schoor-70x150mm",
    "name": "Schoor Douglas hout recht 70x150mm fijnbezaagd 60cm (langste lengte)",
    "description": "Fijnbezaagde Schoor recht met twee 45 graden afschuiningen 70x150mm. Lengte 60cm (langste lengte)",
    "brand": "HouthandelOnline",
    "category": "Douglas hout > Toon alles in Douglas hout > Douglas hout palen > Douglas hout balken > Douglas hout latten en regels",
    "price": 10.89,
    "currency": "EUR",
    "price_raw": null,
    "specs": {
      "raw": {
        "Levertijd": "2-7 werkdagen",
        "Kopmaat": "70x150 mm",
        "Dikte": "70 mm",
        "Breedte": "150",
        "Materiaal": "Douglas hout",
        "Toepassing": "Deze geschaafde schoor kan gebruikt worden als verbinding tussen een staander en bovenligger. Dit wordt veelal toegepast voor de stevigheid of ter decoratie voor de uitstraling van een kapschuur, overkapping, pergola, veranda of ander bouwwerk"
      }
    },
    "images": [
      "https://www.houthandelonline.nl/cdn/resize-extended/el:true/rs:fill/w:1500/h:1068/extend:true/background:255:255:255/path/media/catalog/product/d/o/douglas-schoor-70x150mm-v_01_main.jpg",
      "https://www.houthandelonline.nl/cdn/resize-extended/el:true/rs:fill/w:1500/h:1068/extend:true/background:255:255:255/path/media/catalog/product/d/o/douglas-schoor-70x150mm-v_02_view.jpg",
      "https://www.houthandelonline.nl/cdn/resize-extended/el:true/rs:fill/w:1500/h:1068/extend:true/background:255:255:255/path/media/catalog/product/d/o/douglas-schoor-70x150mm-v_03_view.jpg",
      "https://www.houthandelonline.nl/cdn/resize-extended/el:true/rs:fill/w:1500/h:1068/extend:true/background:255:255:255/path/media/catalog/product/d/o/douglas-schoor-70x150mm-v_04_view.jpg"
    ],
    "rating": null,
    "review_count": null,
    "reviews_summary": null,
    "scraped_at": "2026-02-05T15:04:10.177301Z",
    "scrape_success": true,
    "scrape_errors": [],
    "embedding_text": "Product: Schoor Douglas hout recht 70x150mm fijnbezaagd 60cm (langste lengte)\nBrand: HouthandelOnline\nCategory: Douglas hout > Toon alles in Douglas hout > Douglas hout palen > Douglas hout balken > Douglas hout latten en regels\nDescription: Fijnbezaagde Schoor recht met twee 45 graden afschuiningen 70x150mm. Lengte 60cm (langste lengte)\nSpecifications: Levertijd: 2-7 werkdagen, Kopmaat: 70x150 mm, Dikte: 70 mm, Breedte: 150, Materiaal: Douglas hout, Toepassing: Deze geschaafde schoor kan gebruikt worden als verbinding tussen een staander en bovenligger. Dit wordt veelal toegepast voor de stevigheid of ter decoratie voor de uitstraling van een kapschuur, overkapping, pergola, veranda of ander bouwwerk\nPrice: EUR 10.89"
  },
  {
    "id": "93c4667e7e49",
    "source_url": "https://www.houthandelonline.nl/douglas-schoor-50x150mm",
    "name": "Schoor Douglas hout recht 50x150mm fijnbezaagd 60cm (langste lengte)",
    "description": "Fijnbezaagde Schoor recht met twee 45 graden afschuiningen 50x150mm. Lengte 60cm (langste lengte)",
    "brand": "HouthandelOnline",
    "category": "Douglas hout > Toon alles in Douglas hout > Douglas hout palen > Douglas hout balken > Douglas hout latten en regels",
    "price": 9.68,
    "currency": "EUR",
    "price_raw": null,
    "specs": {
      "raw": {
        "Levertijd": "2-7 werkdagen",
        "Kopmaat": "50x150 mm",
        "Dikte": "50 mm",
        "Breedte": "150",
        "Materiaal": "Douglas hout",
        "Toepassing": "Deze fijnbezaagde schoor kan gebruikt worden als verbinding tussen een staander en bovenligger. Dit wordt veelal toegepast voor de stevigheid of ter decoratie voor de uitstraling van een kapschuur, overkapping, pergola, veranda of ander bouwwerk"
      }
    },
    "images": [
      "https://www.houthandelonline.nl/cdn/resize-extended/el:true/rs:fill/w:1500/h:1068/extend:true/background:255:255:255/path/media/catalog/product/d/o/douglas-schoor-50x150mm-v_01_main.jpg",
      "https://www.houthandelonline.nl/cdn/resize-extended/el:true/rs:fill/w:1500/h:1068/extend:true/background:255:255:255/path/media/catalog/product/d/o/douglas-schoor-50x150mm-v_02_view.jpg",
      "https://www.houthandelonline.nl/cdn/resize-extended/el:true/rs:fill/w:1500/h:1068/extend:true/background:255:255:255/path/media/catalog/product/d/o/douglas-schoor-50x150mm-v_03_view.jpg"
    ],
    "rating": null,
    "review_count": null,
    "reviews_summary": null,
    "scraped_at": "2026-02-05T15:04:10.177306Z",
    "scrape_success": true,
    "scrape_errors": [],
    "embedding_text": "Product: Schoor Douglas hout recht 50x150mm fijnbezaagd 60cm (langste lengte)\nBrand: HouthandelOnline\nCategory: Douglas hout > Toon alles in Douglas hout > Douglas hout palen > Douglas hout balken > Douglas hout latten en regels\nDescription: Fijnbezaagde Schoor recht met twee 45 graden afschuiningen 50x150mm. Lengte 60cm (langste lengte)\nSpecifications: Levertijd: 2-7 werkdagen, Kopmaat: 50x150 mm, Dikte: 50 mm, Breedte: 150, Materiaal: Douglas hout, Toepassing: Deze fijnbezaagde schoor kan gebruikt worden als verbinding tussen een staander en bovenligger. Dit wordt veelal toegepast voor de stevigheid of ter decoratie voor de uitstraling van een kapschuur, overkapping, pergola, veranda of ander bouwwerk\nPrice: EUR 9.68"
  },
  {
    "id": "b512478ed20a",
    "source_url": "https://www.houthandelonline.nl/dampremmende-folie-3m",
    "name": "Dampremmende ongewapende folie 3,00x50 meter",
    "description": "Deze transparante dampremmende bouwfolie wordt gebruikt voor het afdekken van vloeren en wanden, het afschermen van schoonmetselwerk, onder betonnen vloeren en voor tijdelijke beglazing in de open-bouwfase. Deze folie heeft een totale breedte van 3 meter, is 50 meter lang en heeft een totaal oppervlak van 150m2.",
    "brand": "HouthandelOnline",
    "category": "Douglas hout > Toon alles in Douglas hout > Douglas hout palen > Douglas hout balken > Douglas hout latten en regels",
    "price": 40.23,
    "currency": "EUR",
    "price_raw": null,
    "specs": {
      "raw": {
        "Levertijd": "2-7 werkdagen",
        "Kopmaat": "3x50 mm",
        "Breedte": "3000",
        "Materiaal": "Folie"
      }
    },
    "images": [
      "https://www.houthandelonline.nl/cdn/resize-extended/el:true/rs:fill/w:1500/h:1068/extend:true/background:255:255:255/path/media/catalog/product/d/a/dampremmende-folie-3m-v_01_main.jpg",
      "https://www.houthandelonline.nl/cdn/resize-extended/el:true/rs:fill/w:1500/h:1068/extend:true/background:255:255:255/path/media/catalog/product/d/a/dampremmende-folie-3m-v_02_view.jpg"
    ],
    "rating": null,
    "review_count": null,
    "reviews_summary": null,
    "scraped_at": "2026-02-05T15:04:10.177312Z",
    "scrape_success": true,
    "scrape_errors": [],
    "embedding_text": "Product: Dampremmende ongewapende folie 3,00x50 meter\nBrand: HouthandelOnline\nCategory: Douglas hout > Toon alles in Douglas hout > Douglas hout palen > Douglas hout balken > Douglas hout latten en regels\nDescription: Deze transparante dampremmende bouwfolie wordt gebruikt voor het afdekken van vloeren en wanden, het afschermen van schoonmetselwerk, onder betonnen vloeren en voor tijdelijke beglazing in de open-bouwfase. Deze folie heeft een totale breedte van 3 meter, is 50 meter lang en heeft een totaal oppervlak van 150m2.\nSpecifications: Levertijd: 2-7 werkdagen, Kopmaat: 3x50 mm, Breedte: 3000, Materiaal: Folie\nPrice: EUR 40.23"
  },
  {
    "id": "e8821bd7156a",
    "source_url": "https://www.houthandelonline.nl/damp-open-spinvliesfolie",
    "name": "Damp-open Spinvliesfolie 1,50x50 meter",
    "description": "Deze grijze Spinvliesfolie voorkomt dat er vocht van buitenaf in de wand- en dakconstructie en het isolatiemateriaal terecht komt. Deze folie is in staat om het aanwezige vocht in de constructie af te staan aan de buitenlucht d.m.v. verdamping. Damp-open folie wordt aangebracht aan de koude zijde van een wandconstructie en is waterkerend maar sterk dampdoorlatend. Deze folie wordt geleverd op rol van 1,5 meter breed en heeft een totaal oppervlak van 75m2. De folie is voorzien van het KOMO en CE keurmerk.",
    "brand": "HouthandelOnline",
    "category": "Douglas hout > Toon alles in Douglas hout > Douglas hout palen > Douglas hout balken > Douglas hout latten en regels",
    "price": 108.84,
    "currency": "EUR",
    "price_raw": null,
    "specs": {
      "raw": {
        "Levertijd": "2-7 werkdagen",
        "Breedte": "1500",
        "Materiaal": "Folie"
      }
    },
    "images": [
      "https://www.houthandelonline.nl/cdn/resize-extended/el:true/rs:fill/w:1500/h:1068/extend:true/background:255:255:255/path/media/catalog/product/d/a/damp-open-spinvliesfolie-v_01_main.jpg",
      "https://www.houthandelonline.nl/cdn/resize-extended/el:true/rs:fill/w:1500/h:1068/extend:true/background:255:255:255/path/media/catalog/product/d/a/damp-open-spinvliesfolie-v_02_view.jpg"
    ],
    "rating": null,
    "review_count": null,
    "reviews_summary": null,
    "scraped_at": "2026-02-05T15:04:10.177317Z",
    "scrape_success": true,
    "scrape_errors": [],
    "embedding_text": "Product: Damp-open Spinvliesfolie 1,50x50 meter\nBrand: HouthandelOnline\nCategory: Douglas hout > Toon alles in Douglas hout > Douglas hout palen > Douglas hout balken > Douglas hout latten en regels\nDescription: Deze grijze Spinvliesfolie voorkomt dat er vocht van buitenaf in de wand- en dakconstructie en het isolatiemateriaal terecht komt. Deze folie is in staat om het aanwezige vocht in de constructie af te staan aan de buitenlucht d.m.v. verdamping. Damp-open folie wordt aangebracht aan de koude zijde van een wandconstructie en is waterkerend maar sterk dampdoorlatend. Deze folie wordt geleverd op rol van 1,5 meter breed en heeft een totaal oppervlak van 75m2. De folie is voorzien van het KOMO en CE keurmerk.\nSpecifications: Levertijd: 2-7 werkdagen, Breedte: 1500, Materiaal: Folie\nPrice: EUR 108.84"
  },
  {
    "id": "5149f774702c",
    "source_url": "https://www.houthandelonline.nl/pir-alu-afschot-30-45",
    "name": "PIR isolatie Enertherm ALU afschot 30-45mm isolatiewaarde (Rd=1,35m2K/W)",
    "description": "PIR-isolatieplaat (Rd=1,35m2K/W) geschikt voor platdak. De plaat verloopt in dikte zodat deze afschot in het dakvlak creëert. Deze PIR plaat is voorzien van een ingebouwd aluminium dampscherm en optimaal voor het wind- en vochtdicht isoleren.",
    "brand": "HouthandelOnline",
    "category": "Douglas hout > Toon alles in Douglas hout > Douglas hout palen > Douglas hout balken > Douglas hout latten en regels",
    "price": 24.76,
    "currency": "EUR",
    "price_raw": null,
    "specs": {
      "raw": {
        "Levertijd": "2-7 werkdagen",
        "Materiaal": "PIR"
      }
    },
    "images": [
      "https://www.houthandelonline.nl/cdn/resize-extended/el:true/rs:fill/w:1500/h:1068/extend:true/background:255:255:255/path/media/catalog/product/p/i/pir-alu-afschot-30-45-v_001.png",
      "https://www.houthandelonline.nl/cdn/resize-extended/el:true/rs:fill/w:1500/h:1068/extend:true/background:255:255:255/path/media/catalog/product/p/i/pir-alu-afschot-30-45-v_002.jpg",
      "https://www.houthandelonline.nl/cdn/resize-extended/el:true/rs:fill/w:1500/h:1068/extend:true/background:255:255:255/path/media/catalog/product/p/i/pir-alu-afschot-30-45-v_01_main.jpg",
      "https://www.houthandelonline.nl/cdn/resize-extended/el:true/rs:fill/w:1500/h:1068/extend:true/background:255:255:255/path/media/catalog/product/p/i/pir-alu-afschot-30-45-v_02_view.jpg"
    ],
    "rating": null,
    "review_count": null,
    "reviews_summary": null,
    "scraped_at": "2026-02-05T15:04:10.177323Z",
    "scrape_success": true,
    "scrape_errors": [],
    "embedding_text": "Product: PIR isolatie Enertherm ALU afschot 30-45mm isolatiewaarde (Rd=1,35m2K/W)\nBrand: HouthandelOnline\nCategory: Douglas hout > Toon alles in Douglas hout > Douglas hout palen > Douglas hout balken > Douglas hout latten en regels\nDescription: PIR-isolatieplaat (Rd=1,35m2K/W) geschikt voor platdak. De plaat verloopt in dikte zodat deze afschot in het dakvlak creëert. Deze PIR plaat is voorzien van een ingebouwd aluminium dampscherm en optimaal voor het wind- en vochtdicht isoleren.\nSpecifications: Levertijd: 2-7 werkdagen, Materiaal: PIR\nPrice: EUR 24.76"
  },
  {
    "id": "b168fea2d399",
    "source_url": "https://www.houthandelonline.nl/pir-alu-afschot-60-75",
    "name": "PIR isolatie Enertherm ALU afschot 60-75mm isolatiewaarde (Rd=2,7m2K/W)",
    "description": "PIR-isolatieplaat (Rd=2,70m2K/W) geschikt voor platdak. De plaat verloopt in dikte zodat deze afschot in het dakvlak creëert. Deze PIR plaat is voorzien van een ingebouwd aluminium dampscherm en optimaal voor het wind- en vochtdicht isoleren.",
    "brand": "HouthandelOnline",
    "category": "Douglas hout > Toon alles in Douglas hout > Douglas hout palen > Douglas hout balken > Douglas hout latten en regels",
    "price": 39.49,
    "currency": "EUR",
    "price_raw": null,
    "specs": {
      "raw": {
        "Levertijd": "2-7 werkdagen",
        "Materiaal": "PIR"
      }
    },
    "images": [
      "https://www.houthandelonline.nl/cdn/resize-extended/el:true/rs:fill/w:1500/h:1068/extend:true/background:255:255:255/path/media/catalog/product/p/i/pir-alu-afschot-60-75-v_002.png",
      "https://www.houthandelonline.nl/cdn/resize-extended/el:true/rs:fill/w:1500/h:1068/extend:true/background:255:255:255/path/media/catalog/product/p/i/pir-alu-afschot-60-75-v_001.jpg",
      "https://www.houthandelonline.nl/cdn/resize-extended/el:true/rs:fill/w:1500/h:1068/extend:true/background:255:255:255/path/media/catalog/product/p/i/pir-alu-afschot-60-75-v_01_main.jpg",
      "https://www.houthandelonline.nl/cdn/resize-extended/el:true/rs:fill/w:1500/h:1068/extend:true/background:255:255:255/path/media/catalog/product/p/i/pir-alu-afschot-60-75-v_02_view.jpg"
    ],
    "rating": null,
    "review_count": null,
    "reviews_summary": null,
    "scraped_at": "2026-02-05T15:04:10.177328Z",
    "scrape_success": true,
    "scrape_errors": [],
    "embedding_text": "Product: PIR isolatie Enertherm ALU afschot 60-75mm isolatiewaarde (Rd=2,7m2K/W)\nBrand: HouthandelOnline\nCategory: Douglas hout > Toon alles in Douglas hout > Douglas hout palen > Douglas hout balken > Douglas hout latten en regels\nDescription: PIR-isolatieplaat (Rd=2,70m2K/W) geschikt voor platdak. De plaat verloopt in dikte zodat deze afschot in het dakvlak creëert. Deze PIR plaat is voorzien van een ingebouwd aluminium dampscherm en optimaal voor het wind- en vochtdicht isoleren.\nSpecifications: Levertijd: 2-7 werkdagen, Materiaal: PIR\nPrice: EUR 39.49"
  },
  {
    "id": "07a0f33506b8",
    "source_url": "https://www.houthandelonline.nl/pir-alu-afschot-45-60",
    "name": "PIR isolatie Enertherm ALU afschot 45-60mm isolatiewaarde (Rd=1,8m2K/W)",
    "description": "PIR-isolatieplaat (Rd=1,8m2K/W)geschikt voor platdak. De plaat verloopt in dikte zodat deze afschot in het dakvlak creëert. Deze PIR plaat is voorzien van een ingebouwd aluminium dampscherm en optimaal voor het wind- en vochtdicht isoleren.",
    "brand": "HouthandelOnline",
    "category": "Douglas hout > Toon alles in Douglas hout > Douglas hout palen > Douglas hout balken > Douglas hout latten en regels",
    "price": 32.2,
    "currency": "EUR",
    "price_raw": null,
    "specs": {
      "raw": {
        "Levertijd": "2-7 werkdagen",
        "Materiaal": "PIR"
      }
    },
    "images": [
      "https://www.houthandelonline.nl/cdn/resize-extended/el:true/rs:fill/w:1500/h:1068/extend:true/background:255:255:255/path/media/catalog/product/p/i/pir-alu-afschot-45-60-v_001.png",
      "https://www.houthandelonline.nl/cdn/resize-extended/el:true/rs:fill/w:1500/h:1068/extend:true/background:255:255:255/path/media/catalog/product/p/i/pir-alu-afschot-45-60-v_002.jpg",
      "https://www.houthandelonline.nl/cdn/resize-extended/el:true/rs:fill/w:1500/h:1068/extend:true/background:255:255:255/path/media/catalog/product/p/i/pir-alu-afschot-45-60-v_01_main.jpg",
      "https://www.houthandelonline.nl/cdn/resize-extended/el:true/rs:fill/w:1500/h:1068/extend:true/background:255:255:255/path/media/catalog/product/p/i/pir-alu-afschot-45-60-v_02_view.jpg"
    ],
    "rating": null,
    "review_count": null,
    "reviews_summary": null,
    "scraped_at": "2026-02-05T15:04:10.177334Z",
    "scrape_success": true,
    "scrape_errors": [],
    "embedding_text": "Product: PIR isolatie Enertherm ALU afschot 45-60mm isolatiewaarde (Rd=1,8m2K/W)\nBrand: HouthandelOnline\nCategory: Douglas hout > Toon alles in Douglas hout > Douglas hout palen > Douglas hout balken > Douglas hout latten en regels\nDescription: PIR-isolatieplaat (Rd=1,8m2K/W)geschikt voor platdak. De plaat verloopt in dikte zodat deze afschot in het dakvlak creëert. Deze PIR plaat is voorzien van een ingebouwd aluminium dampscherm en optimaal voor het wind- en vochtdicht isoleren.\nSpecifications: Levertijd: 2-7 werkdagen, Materiaal: PIR\nPrice: EUR 32.2"
  },
  {
    "id": "088424575c0d",
    "source_url": "https://www.houthandelonline.nl/dampremmende-folie-2m",
    "name": "Dampremmende ongewapende folie 2,00x50 meter",
    "description": "Deze transparante dampremmende bouwfolie wordt gebruikt voor het afdekken van vloeren en wanden, het afschermen van schoonmetselwerk, onder betonnen vloeren en voor tijdelijke beglazing in de open-bouwfase. Deze folie heeft een totale breedte van 2 meter, is 50 meter lang en heeft een totaal oppervlak van 100m2.",
    "brand": "HouthandelOnline",
    "category": "Douglas hout > Toon alles in Douglas hout > Douglas hout palen > Douglas hout balken > Douglas hout latten en regels",
    "price": 26.8,
    "currency": "EUR",
    "price_raw": null,
    "specs": {
      "raw": {
        "Levertijd": "2-7 werkdagen",
        "Kopmaat": "2x50 mm",
        "Breedte": "2000",
        "Materiaal": "Folie"
      }
    },
    "images": [
      "https://www.houthandelonline.nl/cdn/resize-extended/el:true/rs:fill/w:1500/h:1068/extend:true/background:255:255:255/path/media/catalog/product/d/a/dampremmende-folie-2m-v_01_main.jpg",
      "https://www.houthandelonline.nl/cdn/resize-extended/el:true/rs:fill/w:1500/h:1068/extend:true/background:255:255:255/path/media/catalog/product/d/a/dampremmende-folie-2m-v_02_view.jpg"
    ],
    "rating": null,
    "review_count": null,
    "reviews_summary": null,
    "scraped_at": "2026-02-05T15:04:10.177339Z",
    "scrape_success": true,
    "scrape_errors": [],
    "embedding_text": "Product: Dampremmende ongewapende folie 2,00x50 meter\nBrand: HouthandelOnline\nCategory: Douglas hout > Toon alles in Douglas hout > Douglas hout palen > Douglas hout balken > Douglas hout latten en regels\nDescription: Deze transparante dampremmende bouwfolie wordt gebruikt voor het afdekken van vloeren en wanden, het afschermen van schoonmetselwerk, onder betonnen vloeren en voor tijdelijke beglazing in de open-bouwfase. Deze folie heeft een totale breedte van 2 meter, is 50 meter lang en heeft een totaal oppervlak van 100m2.\nSpecifications: Levertijd: 2-7 werkdagen, Kopmaat: 2x50 mm, Breedte: 2000, Materiaal: Folie\nPrice: EUR 26.8"
  },
  {
    "id": "ad28e4a7791a",
    "source_url": "https://www.houthandelonline.nl/dampremmende-gewapende-folie",
    "name": "Dampremmende gewapende folie 1,50x50 meter",
    "description": "Deze damp-remmende plastic folie met rode wapening wordt aangebracht aan de warme zijde van een constructie en voorkomt condensatie in het isolatiemateriaal. Deze transparante folie met rode wapening is dampremmend en dient aan de binnenzijde van daken, wanden en in vloeren toegepast te worden ter bescherming van de constructie en het isolatiemateriaal. Deze folie wordt geleverd op rol van 1,5 meter breed en heeft een totaal oppervlak van 75m2. Let op: Deze folie is niet geschikt voor zeer vochtige ruimtes zoals zwembaden en sauna's.",
    "brand": "HouthandelOnline",
    "category": "Douglas hout > Toon alles in Douglas hout > Douglas hout palen > Douglas hout balken > Douglas hout latten en regels",
    "price": 77.74,
    "currency": "EUR",
    "price_raw": null,
    "specs": {
      "raw": {
        "Levertijd": "2-7 werkdagen",
        "Breedte": "1500",
        "Materiaal": "Folie"
      }
    },
    "images": [
      "https://www.houthandelonline.nl/cdn/resize-extended/el:true/rs:fill/w:1500/h:1068/extend:true/background:255:255:255/path/media/catalog/product/d/a/dampremmende-gewapende-folie-v_01_main.jpg",
      "https://www.houthandelonline.nl/cdn/resize-extended/el:true/rs:fill/w:1500/h:1068/extend:true/background:255:255:255/path/media/catalog/product/d/a/dampremmende-gewapende-folie-v_02_view.jpg"
    ],
    "rating": null,
    "review_count": null,
    "reviews_summary": null,
    "scraped_at": "2026-02-05T15:04:10.177345Z",
    "scrape_success": true,
    "scrape_errors": [],
    "embedding_text": "Product: Dampremmende gewapende folie 1,50x50 meter\nBrand: HouthandelOnline\nCategory: Douglas hout > Toon alles in Douglas hout > Douglas hout palen > Douglas hout balken > Douglas hout latten en regels\nDescription: Deze damp-remmende plastic folie met rode wapening wordt aangebracht aan de warme zijde van een constructie en voorkomt condensatie in het isolatiemateriaal. Deze transparante folie met rode wapening is dampremmend en dient aan de binnenzijde van daken, wanden en in vloeren toegepast te worden ter bescherming van de constructie en het isolatiemateriaal. Deze folie wordt geleverd op rol van 1,5 meter breed en heeft een totaal oppervlak van 75m2. Let op: Deze folie is niet geschikt voor zeer vochtige ruimtes zoals zwembaden en sauna's.\nSpecifications: Levertijd: 2-7 werkdagen, Breedte: 1500, Materiaal: Folie\nPrice: EUR 77.74"
  },
  {
    "id": "e3f8528f009b",
    "source_url": "https://www.houthandelonline.nl/douglas-schoor-45x145mm",
    "name": "Schoor Douglas hout recht 45x145mm geschaafd 60cm (langste lengte)",
    "description": "Geschaafde schoor recht met twee 45 graden afschuiningen 45x145mm. Lengte 60cm (langste lengte)",
    "brand": "HouthandelOnline",
    "category": "Douglas hout > Toon alles in Douglas hout > Douglas hout palen > Douglas hout balken > Douglas hout latten en regels",
    "price": 11.47,
    "currency": "EUR",
    "price_raw": null,
    "specs": {
      "raw": {
        "Levertijd": "2-7 werkdagen",
        "Kopmaat": "45x145 mm",
        "Dikte": "45 mm",
        "Breedte": "145",
        "Materiaal": "Douglas hout",
        "Toepassing": "Deze geschaafde schoor kan gebruikt worden als verbinding tussen een staander en bovenligger. Dit wordt veelal toegepast voor de stevigheid of ter decoratie voor de uitstraling van een kapschuur, overkapping, pergola, veranda of ander bouwwerk"
      }
    },
    "images": [
      "https://www.houthandelonline.nl/cdn/resize-extended/el:true/rs:fill/w:1500/h:1068/extend:true/background:255:255:255/path/media/catalog/product/d/o/douglas-schoor-45x145mm-v_01_main.jpg",
      "https://www.houthandelonline.nl/cdn/resize-extended/el:true/rs:fill/w:1500/h:1068/extend:true/background:255:255:255/path/media/catalog/product/d/o/douglas-schoor-45x145mm-v_02_view.jpg",
      "https://www.houthandelonline.nl/cdn/resize-extended/el:true/rs:fill/w:1500/h:1068/extend:true/background:255:255:255/path/media/catalog/product/d/o/douglas-schoor-45x145mm-v_03_view.jpg"
    ],
    "rating": null,
    "review_count": null,
    "reviews_summary": null,
    "scraped_at": "2026-02-05T15:04:10.177350Z",
    "scrape_success": true,
    "scrape_errors": [],
    "embedding_text": "Product: Schoor Douglas hout recht 45x145mm geschaafd 60cm (langste lengte)\nBrand: HouthandelOnline\nCategory: Douglas hout > Toon alles in Douglas hout > Douglas hout palen > Douglas hout balken > Douglas hout latten en regels\nDescription: Geschaafde schoor recht met twee 45 graden afschuiningen 45x145mm. Lengte 60cm (langste lengte)\nSpecifications: Levertijd: 2-7 werkdagen, Kopmaat: 45x145 mm, Dikte: 45 mm, Breedte: 145, Materiaal: Douglas hout, Toepassing: Deze geschaafde schoor kan gebruikt worden als verbinding tussen een staander en bovenligger. Dit wordt veelal toegepast voor de stevigheid of ter decoratie voor de uitstraling van een kapschuur, overkapping, pergola, veranda of ander bouwwerk\nPrice: EUR 11.47"
  },
  {
    "id": "00358a1b3438",
    "source_url": "https://www.houthandelonline.nl/betonband-ant-5x15",
    "name": "Betonband 5x15cm antraciet",
    "description": "Deze opsluitband (betonband) van 50x150mm in de kleur antraciet heeft een lengte van 100cm. Zoals de naam ook aangeeft worden deze banden veelal gebruikt om (sier)bestrating op te sluiten en zo verzakking en kieren te voorkomen. Naast het opsluiten van bestrating zorgen deze betonbanden voor een nette afwerking tussen bijvoorbeeld tuin en grindpad, als afboording, of om hoogte verschillen in de tuin te accentueren. Daarnaast kunnen deze banden onder de wanden van een terrasoverkapping of veranda geplaatst worden. Dit zorgt ervoor dat het hout vrij is van de grond en zo droog blijft, maar ook voor een nette en luxe afwerking in de tuin.",
    "brand": "HouthandelOnline",
    "category": "Douglas hout > Toon alles in Douglas hout > Douglas hout palen > Douglas hout balken > Douglas hout latten en regels",
    "price": 3.87,
    "currency": "EUR",
    "price_raw": null,
    "specs": {
      "raw": {
        "Levertijd": "2-7 werkdagen",
        "Kopmaat": "50x150 mm",
        "Breedte": "50",
        "Materiaal": "Beton",
        "Toepassing": "Deze opsluitband 50x150 is zeer handzaam en geschikt voor lichtere werkzaamheden zoals een tuinpad of kleine verhoging/border"
      }
    },
    "images": [
      "https://www.houthandelonline.nl/cdn/resize-extended/el:true/rs:fill/w:1500/h:1068/extend:true/background:255:255:255/path/media/catalog/product/b/e/betonband-ant-5x15-v_01_main.jpg",
      "https://www.houthandelonline.nl/cdn/resize-extended/el:true/rs:fill/w:1500/h:1068/extend:true/background:255:255:255/path/media/catalog/product/b/e/betonband-ant-5x15-v_02_view.jpg"
    ],
    "rating": null,
    "review_count": null,
    "reviews_summary": null,
    "scraped_at": "2026-02-05T15:04:10.177355Z",
    "scrape_success": true,
    "scrape_errors": [],
    "embedding_text": "Product: Betonband 5x15cm antraciet\nBrand: HouthandelOnline\nCategory: Douglas hout > Toon alles in Douglas hout > Douglas hout palen > Douglas hout balken > Douglas hout latten en regels\nDescription: Deze opsluitband (betonband) van 50x150mm in de kleur antraciet heeft een lengte van 100cm. Zoals de naam ook aangeeft worden deze banden veelal gebruikt om (sier)bestrating op te sluiten en zo verzakking en kieren te voorkomen. Naast het opsluiten van bestrating zorgen deze betonbanden voor een nette afwerking tussen bijvoorbeeld tuin en grindpad, als afboording, of om hoogte verschillen in de tuin te accentueren. Daarnaast kunnen deze banden onder de wanden van een terrasoverkapping of veranda geplaatst worden. Dit zorgt ervoor dat het hout vrij is van de grond en zo droog blijft, maar ook voor een nette en luxe afwerking in de tuin.\nSpecifications: Levertijd: 2-7 werkdagen, Kopmaat: 50x150 mm, Breedte: 50, Materiaal: Beton, Toepassing: Deze opsluitband 50x150 is zeer handzaam en geschikt voor lichtere werkzaamheden zoals een tuinpad of kleine verhoging/border\nPrice: EUR 3.87"
  },
  {
    "id": "b8df2251fd20",
    "source_url": "https://www.houthandelonline.nl/betonband-ant-6x20",
    "name": "Betonband 6x20cm antraciet",
    "description": "Deze opsluitband (betonband) van 60x200mm in de kleur antraciet heeft een lengte van 100cm. Zoals de naam ook aangeeft worden deze banden veelal gebruikt om (sier)bestrating op te sluiten en zo verzakking en kieren te voorkomen. Naast het opsluiten van bestrating zorgen deze betonbanden voor een nette afwerking tussen bijvoorbeeld tuin en grindpad, als afboording, of om hoogte verschillen in de tuin te accentueren. Daarnaast kunnen deze banden onder de wanden van een terrasoverkapping of veranda geplaatst worden. Dit zorgt ervoor dat het hout vrij is van de grond en zo droog blijft, maar ook voor een nette en luxe afwerking in de tuin.",
    "brand": "HouthandelOnline",
    "category": "Douglas hout > Toon alles in Douglas hout > Douglas hout palen > Douglas hout balken > Douglas hout latten en regels",
    "price": 5.47,
    "currency": "EUR",
    "price_raw": null,
    "specs": {
      "raw": {
        "Levertijd": "2-7 werkdagen",
        "Kopmaat": "60x200 mm",
        "Breedte": "60",
        "Materiaal": "Beton",
        "Toepassing": "Deze opsluitband 60x200 is geschikt voor de gemiddelde werkzaamheden zoals het opsluiten van een terras"
      }
    },
    "images": [
      "https://www.houthandelonline.nl/cdn/resize-extended/el:true/rs:fill/w:1500/h:1068/extend:true/background:255:255:255/path/media/catalog/product/b/e/betonband-ant-6x20-v_01_main.jpg",
      "https://www.houthandelonline.nl/cdn/resize-extended/el:true/rs:fill/w:1500/h:1068/extend:true/background:255:255:255/path/media/catalog/product/b/e/betonband-ant-6x20-v_02_view.jpg"
    ],
    "rating": null,
    "review_count": null,
    "reviews_summary": null,
    "scraped_at": "2026-02-05T15:04:10.177361Z",
    "scrape_success": true,
    "scrape_errors": [],
    "embedding_text": "Product: Betonband 6x20cm antraciet\nBrand: HouthandelOnline\nCategory: Douglas hout > Toon alles in Douglas hout > Douglas hout palen > Douglas hout balken > Douglas hout latten en regels\nDescription: Deze opsluitband (betonband) van 60x200mm in de kleur antraciet heeft een lengte van 100cm. Zoals de naam ook aangeeft worden deze banden veelal gebruikt om (sier)bestrating op te sluiten en zo verzakking en kieren te voorkomen. Naast het opsluiten van bestrating zorgen deze betonbanden voor een nette afwerking tussen bijvoorbeeld tuin en grindpad, als afboording, of om hoogte verschillen in de tuin te accentueren. Daarnaast kunnen deze banden onder de wanden van een terrasoverkapping of veranda geplaatst worden. Dit zorgt ervoor dat het hout vrij is van de grond en zo droog blijft, maar ook voor een nette en luxe afwerking in de tuin.\nSpecifications: Levertijd: 2-7 werkdagen, Kopmaat: 60x200 mm, Breedte: 60, Materiaal: Beton, Toepassing: Deze opsluitband 60x200 is geschikt voor de gemiddelde werkzaamheden zoals het opsluiten van een terras\nPrice: EUR 5.47"
  },
  {
    "id": "9ce17ab96447",
    "source_url": "https://www.houthandelonline.nl/betonpoer-antraciet-15x15",
    "name": "Betonpoer met draadeind en stelplaat 15x15cm 60cm antraciet",
    "description": "Deze rechte betonpoer van 150x150mm, in de kleur antraciet en met een gladde afwerking, heeft een hoogte van 600mm. Deze betonpoer wordt gebruikt om palen te stellen en ervoor te zorgen dat het hout niet in contact komt met de grond. Hierdoor wordt de levensduur verlengd. De 15x15cm poer is voorzien van een M16 huls waar het draadeind ingedraaid kan worden. Deze poer wordt geleverd inclusief: M16 draadeind en stelplaat met opgelaste moer. Let op: separaat dienen 4 stuks van de 8x80mm tellerkopschroeven mee besteld te worden ter bevestiging van de stelplaat. Profiteer van zakelijke prijzen: Maak hier een account aan of log in voor jouw persoonlijke voordelen!",
    "brand": "HouthandelOnline",
    "category": "Douglas hout > Toon alles in Douglas hout > Douglas hout palen > Douglas hout balken > Douglas hout latten en regels",
    "price": 22.93,
    "currency": "EUR",
    "price_raw": "€15,06/m1",
    "specs": {
      "raw": {
        "Levertijd": "2-7 werkdagen",
        "Kopmaat": "150x150 mm",
        "Dikte": "150 mm",
        "Breedte": "150",
        "Materiaal": "Beton",
        "Toepassing": "Betonpoeren worden gebruikt om palen te stellen en een goede bovengrondse fundering te geven. De poeren zorgen ervoor dat het hout niet in de grond geplaatst wordt en hierdoor langer mee gaat"
      }
    },
    "images": [
      "https://www.houthandelonline.nl/cdn/resize-extended/el:true/rs:fill/w:1500/h:1068/extend:true/background:255:255:255/path/media/catalog/product/1/1/11793.jpg",
      "https://www.houthandelonline.nl/cdn/resize-extended/el:true/rs:fill/w:1500/h:1068/extend:true/background:255:255:255/path/media/catalog/product/2/0/20714_01_1.JPG"
    ],
    "rating": null,
    "review_count": null,
    "reviews_summary": null,
    "scraped_at": "2026-02-05T15:04:10.177366Z",
    "scrape_success": true,
    "scrape_errors": [],
    "embedding_text": "Product: Betonpoer met draadeind en stelplaat 15x15cm 60cm antraciet\nBrand: HouthandelOnline\nCategory: Douglas hout > Toon alles in Douglas hout > Douglas hout palen > Douglas hout balken > Douglas hout latten en regels\nDescription: Deze rechte betonpoer van 150x150mm, in de kleur antraciet en met een gladde afwerking, heeft een hoogte van 600mm. Deze betonpoer wordt gebruikt om palen te stellen en ervoor te zorgen dat het hout niet in contact komt met de grond. Hierdoor wordt de levensduur verlengd. De 15x15cm poer is voorzien van een M16 huls waar het draadeind ingedraaid kan worden. Deze poer wordt geleverd inclusief: M16 draadeind en stelplaat met opgelaste moer. Let op: separaat dienen 4 stuks van de 8x80mm tellerkopschroeven mee besteld te worden ter bevestiging van de stelplaat. Profiteer van zakelijke prijzen: Maak hier een account aan of log in voor jouw persoonlijke voordelen!\nSpecifications: Levertijd: 2-7 werkdagen, Kopmaat: 150x150 mm, Dikte: 150 mm, Breedte: 150, Materiaal: Beton, Toepassing: Betonpoeren worden gebruikt om palen te stellen en een goede bovengrondse fundering te geven. De poeren zorgen ervoor dat het hout niet in de grond geplaatst wordt en hierdoor langer mee gaat\nPrice: EUR 22.93"
  },
  {
    "id": "27522bc3baba",
    "source_url": "https://www.houthandelonline.nl/betonpoer-bruin-15x15",
    "name": "Betonpoer met draadeind en stelplaat 20x20cm (bovenmaat) 60cm roestbruin",
    "description": "Deze rechte betonpoer van 200x200mm in de unieke kleur roestbruin heeft een hoogte van 600mm. Deze betonpoer wordt gebruikt om palen te stellen en ervoor te zorgen dat het hout niet in contact komt met de grond. Hierdoor wordt de levensduur verlengd. De 20x20cm poer is voorzien van een M16 huls waar het draadeind ingedraaid kan worden. Deze poer wordt geleverd inclusief M16 draadeind en Stelplaat met opgelaste moer. Let op: separaat dienen 4 stuks van de 8x80mm tellerkopschroeven mee besteld te worden ter bevestiging van de stelplaat.",
    "brand": "HouthandelOnline",
    "category": "Douglas hout > Toon alles in Douglas hout > Douglas hout palen > Douglas hout balken > Douglas hout latten en regels",
    "price": 39.08,
    "currency": "EUR",
    "price_raw": null,
    "specs": {
      "raw": {
        "Levertijd": "2-7 werkdagen",
        "Kopmaat": "200x200 mm",
        "Dikte": "200 mm",
        "Breedte": "200",
        "Materiaal": "Beton",
        "Toepassing": "Betonpoeren worden gebruikt om palen te stellen en een goede bovengrondse fundering te geven. De poeren zorgen ervoor dat het hout niet in de grond geplaatst wordt en hierdoor langer mee gaat"
      }
    },
    "images": [
      "https://www.houthandelonline.nl/cdn/resize-extended/el:true/rs:fill/w:1500/h:1068/extend:true/background:255:255:255/path/media/catalog/product/b/e/betonpoer-bruin-15x15-v_01_main.jpg",
      "https://www.houthandelonline.nl/cdn/resize-extended/el:true/rs:fill/w:1500/h:1068/extend:true/background:255:255:255/path/media/catalog/product/b/e/betonpoer-bruin-15x15-v_02_view.JPG"
    ],
    "rating": null,
    "review_count": null,
    "reviews_summary": null,
    "scraped_at": "2026-02-05T15:04:10.177371Z",
    "scrape_success": true,
    "scrape_errors": [],
    "embedding_text": "Product: Betonpoer met draadeind en stelplaat 20x20cm (bovenmaat) 60cm roestbruin\nBrand: HouthandelOnline\nCategory: Douglas hout > Toon alles in Douglas hout > Douglas hout palen > Douglas hout balken > Douglas hout latten en regels\nDescription: Deze rechte betonpoer van 200x200mm in de unieke kleur roestbruin heeft een hoogte van 600mm. Deze betonpoer wordt gebruikt om palen te stellen en ervoor te zorgen dat het hout niet in contact komt met de grond. Hierdoor wordt de levensduur verlengd. De 20x20cm poer is voorzien van een M16 huls waar het draadeind ingedraaid kan worden. Deze poer wordt geleverd inclusief M16 draadeind en Stelplaat met opgelaste moer. Let op: separaat dienen 4 stuks van de 8x80mm tellerkopschroeven mee besteld te worden ter bevestiging van de stelplaat.\nSpecifications: Levertijd: 2-7 werkdagen, Kopmaat: 200x200 mm, Dikte: 200 mm, Breedte: 200, Materiaal: Beton, Toepassing: Betonpoeren worden gebruikt om palen te stellen en een goede bovengrondse fundering te geven. De poeren zorgen ervoor dat het hout niet in de grond geplaatst wordt en hierdoor langer mee gaat\nPrice: EUR 39.08"
  },
  {
    "id": "167119dc92a5",
    "source_url": "https://www.houthandelonline.nl/dpc-folie-900mm",
    "name": "DPC folie 280mu 900mm 50 meter op rol",
    "description": "DPC folie is geschikt voor het beschermen van muurlateien, funderingen en kozijnaansluitingen op het metselwerk tegen weersinvloeden. Deze 100% recyclebare en waterdichte folie heeft een stroeve wafelstructuur wat zorgt voor een optimale hechting. Doordat deze folie een hoge treksterkte en rek heeft, is deze zeer eenvoudig te verwerken. De DPC folie is 90cm breed, op een rol van 50 meter in de kleur: zwart/grijs. Let op: deze folie is niet Uv-bestendig en kan geen lange tijd blootgesteld worden aan zonlicht.",
    "brand": "HouthandelOnline",
    "category": "Douglas hout > Toon alles in Douglas hout > Douglas hout palen > Douglas hout balken > Douglas hout latten en regels",
    "price": 51.81,
    "currency": "EUR",
    "price_raw": null,
    "specs": {
      "raw": {
        "Levertijd": "2-7 werkdagen",
        "Breedte": "900",
        "Materiaal": "DPC"
      }
    },
    "images": [
      "https://www.houthandelonline.nl/cdn/resize-extended/el:true/rs:fill/w:1500/h:1068/extend:true/background:255:255:255/path/media/catalog/product/d/p/dpc-folie-900mm-v_01_main.jpg"
    ],
    "rating": null,
    "review_count": null,
    "reviews_summary": null,
    "scraped_at": "2026-02-05T15:04:10.177377Z",
    "scrape_success": true,
    "scrape_errors": [],
    "embedding_text": "Product: DPC folie 280mu 900mm 50 meter op rol\nBrand: HouthandelOnline\nCategory: Douglas hout > Toon alles in Douglas hout > Douglas hout palen > Douglas hout balken > Douglas hout latten en regels\nDescription: DPC folie is geschikt voor het beschermen van muurlateien, funderingen en kozijnaansluitingen op het metselwerk tegen weersinvloeden. Deze 100% recyclebare en waterdichte folie heeft een stroeve wafelstructuur wat zorgt voor een optimale hechting. Doordat deze folie een hoge treksterkte en rek heeft, is deze zeer eenvoudig te verwerken. De DPC folie is 90cm breed, op een rol van 50 meter in de kleur: zwart/grijs. Let op: deze folie is niet Uv-bestendig en kan geen lange tijd blootgesteld worden aan zonlicht.\nSpecifications: Levertijd: 2-7 werkdagen, Breedte: 900, Materiaal: DPC\nPrice: EUR 51.81"
  },
  {
    "id": "82b94b7cd7c2",
    "source_url": "https://www.houthandelonline.nl/alu-tape",
    "name": "Aluminium tape T303 50mmx45m",
    "description": "Deze enkelzijdig zelfklevende Aluminium tape is onmisbaar bij het verwerken van PIR isolatieplaten, Rockroof Sidefix en Knauf spijkerflensdeken type TR312. De tape is sterk, flexibel en eenvoudig toe te passen voor het luchtdicht afsluiten van de naden tussen de isolatieplaten. Deze ALU kleeftape heeft een breedte van 50mm en wordt geleverd per rol van 45 meter.",
    "brand": "HouthandelOnline",
    "category": "Douglas hout > Toon alles in Douglas hout > Douglas hout palen > Douglas hout balken > Douglas hout latten en regels",
    "price": 14.93,
    "currency": "EUR",
    "price_raw": null,
    "specs": {
      "raw": {
        "Levertijd": "2-7 werkdagen",
        "Breedte": "50",
        "Materiaal": "Aluminium",
        "Toepassing": "Aluminium tape is toepasbaar bij temperaturen van -30 graden C tot +100 graden C. Verder is de tape UV-, stof- en vochtbestendig. Deze tape, dikte 30mu, is goed te combineren met PIR isolatieplatenen RockwoolRockroof Sidefix en zorgt voor een luchtdichte afsluiting van de naden"
      }
    },
    "images": [
      "https://www.houthandelonline.nl/cdn/resize-extended/el:true/rs:fill/w:1500/h:1068/extend:true/background:255:255:255/path/media/catalog/product/a/l/alu-tape-v_01_main.jpg",
      "https://www.houthandelonline.nl/cdn/resize-extended/el:true/rs:fill/w:1500/h:1068/extend:true/background:255:255:255/path/media/catalog/product/a/l/alu-tape-v_02_view.jpg",
      "https://www.houthandelonline.nl/cdn/resize-extended/el:true/rs:fill/w:1500/h:1068/extend:true/background:255:255:255/path/media/catalog/product/a/l/alu-tape-v_03_view.jpg"
    ],
    "rating": null,
    "review_count": null,
    "reviews_summary": null,
    "scraped_at": "2026-02-05T15:04:10.177382Z",
    "scrape_success": true,
    "scrape_errors": [],
    "embedding_text": "Product: Aluminium tape T303 50mmx45m\nBrand: HouthandelOnline\nCategory: Douglas hout > Toon alles in Douglas hout > Douglas hout palen > Douglas hout balken > Douglas hout latten en regels\nDescription: Deze enkelzijdig zelfklevende Aluminium tape is onmisbaar bij het verwerken van PIR isolatieplaten, Rockroof Sidefix en Knauf spijkerflensdeken type TR312. De tape is sterk, flexibel en eenvoudig toe te passen voor het luchtdicht afsluiten van de naden tussen de isolatieplaten. Deze ALU kleeftape heeft een breedte van 50mm en wordt geleverd per rol van 45 meter.\nSpecifications: Levertijd: 2-7 werkdagen, Breedte: 50, Materiaal: Aluminium, Toepassing: Aluminium tape is toepasbaar bij temperaturen van -30 graden C tot +100 graden C. Verder is de tape UV-, stof- en vochtbestendig. Deze tape, dikte 30mu, is goed te combineren met PIR isolatieplatenen RockwoolRockroof Sidefix en zorgt voor een luchtdichte afsluiting van de naden\nPrice: EUR 14.93"
  },
  {
    "id": "ecf65566c4f8",
    "source_url": "https://www.houthandelonline.nl/knauf-naturoll-170-38",
    "name": "Knauf isolatie 170mm Naturoll type 037 (1,75m2) isolatiewaarde 4,55m2K/W 38cm",
    "description": "Deze isolatie rol (op basis van Ecose) is bestemd voor de thermische, akoestische en brandveilige isolatie van hellende daken, houten gevelconstructies, houten vloeren, plafonds en voorzetwanden.",
    "brand": "HouthandelOnline",
    "category": "Douglas hout > Toon alles in Douglas hout > Douglas hout palen > Douglas hout balken > Douglas hout latten en regels",
    "price": 19.43,
    "currency": "EUR",
    "price_raw": null,
    "specs": {
      "raw": {
        "Levertijd": "2-7 werkdagen",
        "Dikte": "170 mm",
        "Materiaal": "Isolatie",
        "Toepassing": "Thermische-, akoestische- en brandveilige isolatie van hellende daken, houten gevelconstructies, houten vloeren, plafonds en voorzetwanden"
      }
    },
    "images": [
      "https://www.houthandelonline.nl/cdn/resize-extended/el:true/rs:fill/w:1500/h:1068/extend:true/background:255:255:255/path/media/catalog/product/k/n/knauf-naturoll-170-38-v_001.jpg"
    ],
    "rating": null,
    "review_count": null,
    "reviews_summary": null,
    "scraped_at": "2026-02-05T15:04:10.177388Z",
    "scrape_success": true,
    "scrape_errors": [],
    "embedding_text": "Product: Knauf isolatie 170mm Naturoll type 037 (1,75m2) isolatiewaarde 4,55m2K/W 38cm\nBrand: HouthandelOnline\nCategory: Douglas hout > Toon alles in Douglas hout > Douglas hout palen > Douglas hout balken > Douglas hout latten en regels\nDescription: Deze isolatie rol (op basis van Ecose) is bestemd voor de thermische, akoestische en brandveilige isolatie van hellende daken, houten gevelconstructies, houten vloeren, plafonds en voorzetwanden.\nSpecifications: Levertijd: 2-7 werkdagen, Dikte: 170 mm, Materiaal: Isolatie, Toepassing: Thermische-, akoestische- en brandveilige isolatie van hellende daken, houten gevelconstructies, houten vloeren, plafonds en voorzetwanden\nPrice: EUR 19.43"
  },
  {
    "id": "c7c90233836b",
    "source_url": "https://www.houthandelonline.nl/knauf-naturoll-140-58",
    "name": "Knauf isolatie 140mm Naturoll type 037 (3,25m2) isolatiewaarde 3,75m2K/W 58cm",
    "description": "Deze isolatie rol (op basis van Ecose) is bestemd voor de thermische, akoestische en brandveilige isolatie van hellende daken, houten gevelconstructies, houten vloeren, plafonds en voorzetwanden.",
    "brand": "HouthandelOnline",
    "category": "Douglas hout > Toon alles in Douglas hout > Douglas hout palen > Douglas hout balken > Douglas hout latten en regels",
    "price": 45.44,
    "currency": "EUR",
    "price_raw": null,
    "specs": {
      "raw": {
        "Levertijd": "2-7 werkdagen",
        "Dikte": "140 mm",
        "Materiaal": "Isolatie",
        "Toepassing": "Thermische-, akoestische- en brandveilige isolatie van hellende daken, houten gevelconstructies, houten vloeren, plafonds en voorzetwanden"
      }
    },
    "images": [
      "https://www.houthandelonline.nl/cdn/resize-extended/el:true/rs:fill/w:1500/h:1068/extend:true/background:255:255:255/path/media/catalog/product/2/3/230810-knauf_naturoll_037_transparent_background.jpg"
    ],
    "rating": null,
    "review_count": null,
    "reviews_summary": null,
    "scraped_at": "2026-02-05T15:04:10.177409Z",
    "scrape_success": true,
    "scrape_errors": [],
    "embedding_text": "Product: Knauf isolatie 140mm Naturoll type 037 (3,25m2) isolatiewaarde 3,75m2K/W 58cm\nBrand: HouthandelOnline\nCategory: Douglas hout > Toon alles in Douglas hout > Douglas hout palen > Douglas hout balken > Douglas hout latten en regels\nDescription: Deze isolatie rol (op basis van Ecose) is bestemd voor de thermische, akoestische en brandveilige isolatie van hellende daken, houten gevelconstructies, houten vloeren, plafonds en voorzetwanden.\nSpecifications: Levertijd: 2-7 werkdagen, Dikte: 140 mm, Materiaal: Isolatie, Toepassing: Thermische-, akoestische- en brandveilige isolatie van hellende daken, houten gevelconstructies, houten vloeren, plafonds en voorzetwanden\nPrice: EUR 45.44"
  },
  {
    "id": "33346cfb5b4f",
    "source_url": "https://www.houthandelonline.nl/dpc-folie-100mm",
    "name": "DPC folie 280mu 100mm 50 meter op rol",
    "description": "DPC folie is geschikt voor het beschermen van muurlateien, funderingen en kozijnaansluitingen op het metselwerk tegen weersinvloeden. Deze 100% recyclebare en waterdichte folie heeft een stroeve wafelstructuur wat zorgt voor een optimale hechting. Doordat deze folie een hoge treksterkte en rek heeft, is deze zeer eenvoudig te verwerken. De DPC folie is 10cm breed, op een rol van 50 meter in de kleur: zwart/grijs. Let op: deze folie is niet Uv-bestendig en kan geen lange tijd blootgesteld worden aan zonlicht.",
    "brand": "HouthandelOnline",
    "category": "Douglas hout > Toon alles in Douglas hout > Douglas hout palen > Douglas hout balken > Douglas hout latten en regels",
    "price": 5.75,
    "currency": "EUR",
    "price_raw": null,
    "specs": {
      "raw": {
        "Levertijd": "2-7 werkdagen",
        "Breedte": "100",
        "Materiaal": "DPC"
      }
    },
    "images": [
      "https://www.houthandelonline.nl/cdn/resize-extended/el:true/rs:fill/w:1500/h:1068/extend:true/background:255:255:255/path/media/catalog/product/d/p/dpc-folie-100mm-v_01_main.jpg"
    ],
    "rating": null,
    "review_count": null,
    "reviews_summary": null,
    "scraped_at": "2026-02-05T15:04:10.177415Z",
    "scrape_success": true,
    "scrape_errors": [],
    "embedding_text": "Product: DPC folie 280mu 100mm 50 meter op rol\nBrand: HouthandelOnline\nCategory: Douglas hout > Toon alles in Douglas hout > Douglas hout palen > Douglas hout balken > Douglas hout latten en regels\nDescription: DPC folie is geschikt voor het beschermen van muurlateien, funderingen en kozijnaansluitingen op het metselwerk tegen weersinvloeden. Deze 100% recyclebare en waterdichte folie heeft een stroeve wafelstructuur wat zorgt voor een optimale hechting. Doordat deze folie een hoge treksterkte en rek heeft, is deze zeer eenvoudig te verwerken. De DPC folie is 10cm breed, op een rol van 50 meter in de kleur: zwart/grijs. Let op: deze folie is niet Uv-bestendig en kan geen lange tijd blootgesteld worden aan zonlicht.\nSpecifications: Levertijd: 2-7 werkdagen, Breedte: 100, Materiaal: DPC\nPrice: EUR 5.75"
  },
  {
    "id": "629b5ce0b6e8",
    "source_url": "https://www.houthandelonline.nl/douglas-schoor-60x140mm",
    "name": "Schoor Douglas hout recht 60x140mm geschaafd 77cm (langste lengte)",
    "description": "Geschaafde schoor recht met twee 45 graden afschuiningen 60x140mm. Lengte 77cm (langste lengte)",
    "brand": "HouthandelOnline",
    "category": "Douglas hout > Toon alles in Douglas hout > Douglas hout palen > Douglas hout balken > Douglas hout latten en regels",
    "price": 30.04,
    "currency": "EUR",
    "price_raw": null,
    "specs": {
      "raw": {
        "Levertijd": "2-7 werkdagen",
        "Dikte": "60 mm",
        "Breedte": "140",
        "Materiaal": "Douglas hout",
        "Toepassing": "Deze geschaafde schoor kan gebruikt worden als verbinding tussen een staander en bovenligger. Dit wordt veelal toegepast voor de stevigheid of ter decoratie voor de uitstraling van een kapschuur, overkapping, pergola, veranda of ander bouwwerk"
      }
    },
    "images": [
      "https://www.houthandelonline.nl/cdn/resize-extended/el:true/rs:fill/w:1500/h:1068/extend:true/background:255:255:255/path/media/catalog/product/2/5/25117.jpg",
      "https://www.houthandelonline.nl/cdn/resize-extended/el:true/rs:fill/w:1500/h:1068/extend:true/background:255:255:255/path/media/catalog/product/2/5/25117_01.jpg",
      "https://www.houthandelonline.nl/cdn/resize-extended/el:true/rs:fill/w:1500/h:1068/extend:true/background:255:255:255/path/media/catalog/product/2/5/25117_02.jpg"
    ],
    "rating": null,
    "review_count": null,
    "reviews_summary": null,
    "scraped_at": "2026-02-05T15:04:10.177420Z",
    "scrape_success": true,
    "scrape_errors": [],
    "embedding_text": "Product: Schoor Douglas hout recht 60x140mm geschaafd 77cm (langste lengte)\nBrand: HouthandelOnline\nCategory: Douglas hout > Toon alles in Douglas hout > Douglas hout palen > Douglas hout balken > Douglas hout latten en regels\nDescription: Geschaafde schoor recht met twee 45 graden afschuiningen 60x140mm. Lengte 77cm (langste lengte)\nSpecifications: Levertijd: 2-7 werkdagen, Dikte: 60 mm, Breedte: 140, Materiaal: Douglas hout, Toepassing: Deze geschaafde schoor kan gebruikt worden als verbinding tussen een staander en bovenligger. Dit wordt veelal toegepast voor de stevigheid of ter decoratie voor de uitstraling van een kapschuur, overkapping, pergola, veranda of ander bouwwerk\nPrice: EUR 30.04"
  },
  {
    "id": "0652d51b1140",
    "source_url": "https://www.houthandelonline.nl/douglas-schoor-70x170mm",
    "name": "Schoor Douglas hout recht 70x170mm fijnbezaagd 60cm (langste lengte)",
    "description": "Fijnbezaagde Schoor recht met twee 45 graden afschuiningen 70x170mm. Lengte 60cm (langste lengte)",
    "brand": "HouthandelOnline",
    "category": "Douglas hout > Toon alles in Douglas hout > Douglas hout palen > Douglas hout balken > Douglas hout latten en regels",
    "price": 12.1,
    "currency": "EUR",
    "price_raw": null,
    "specs": {
      "raw": {
        "Levertijd": "2-7 werkdagen",
        "Kopmaat": "70x170 mm",
        "Dikte": "70 mm",
        "Breedte": "150",
        "Materiaal": "Douglas hout",
        "Toepassing": "Deze geschaafde schoor kan gebruikt worden als verbinding tussen een staander en bovenligger. Dit wordt veelal toegepast voor de stevigheid of ter decoratie voor de uitstraling van een kapschuur, overkapping, pergola, veranda of ander bouwwerk"
      }
    },
    "images": [
      "https://www.houthandelonline.nl/cdn/resize-extended/el:true/rs:fill/w:1500/h:1068/extend:true/background:255:255:255/path/media/catalog/product/d/o/douglas-schoor-70x170mm.jpg",
      "https://www.houthandelonline.nl/cdn/resize-extended/el:true/rs:fill/w:1500/h:1068/extend:true/background:255:255:255/path/media/catalog/product/d/o/douglas-schoor-70x170mm_2.jpg",
      "https://www.houthandelonline.nl/cdn/resize-extended/el:true/rs:fill/w:1500/h:1068/extend:true/background:255:255:255/path/media/catalog/product/d/o/douglas-schoor-70x170mm_3.jpg",
      "https://www.houthandelonline.nl/cdn/resize-extended/el:true/rs:fill/w:1500/h:1068/extend:true/background:255:255:255/path/media/catalog/product/d/o/douglas-schoor-70x170mm_4.jpg"
    ],
    "rating": null,
    "review_count": null,
    "reviews_summary": null,
    "scraped_at": "2026-02-05T15:04:10.177425Z",
    "scrape_success": true,
    "scrape_errors": [],
    "embedding_text": "Product: Schoor Douglas hout recht 70x170mm fijnbezaagd 60cm (langste lengte)\nBrand: HouthandelOnline\nCategory: Douglas hout > Toon alles in Douglas hout > Douglas hout palen > Douglas hout balken > Douglas hout latten en regels\nDescription: Fijnbezaagde Schoor recht met twee 45 graden afschuiningen 70x170mm. Lengte 60cm (langste lengte)\nSpecifications: Levertijd: 2-7 werkdagen, Kopmaat: 70x170 mm, Dikte: 70 mm, Breedte: 150, Materiaal: Douglas hout, Toepassing: Deze geschaafde schoor kan gebruikt worden als verbinding tussen een staander en bovenligger. Dit wordt veelal toegepast voor de stevigheid of ter decoratie voor de uitstraling van een kapschuur, overkapping, pergola, veranda of ander bouwwerk\nPrice: EUR 12.1"
  },
  {
    "id": "a27261f44a13",
    "source_url": "https://www.houthandelonline.nl/dpc-folie-300mm",
    "name": "DPC folie 280mu 300mm 50 meter op rol",
    "description": "DPC folie is geschikt voor het beschermen van muurlateien, funderingen en kozijnaansluitingen op het metselwerk tegen weersinvloeden. Deze 100% recyclebare en waterdichte folie heeft een stroeve wafelstructuur wat zorgt voor een optimale hechting. Doordat deze folie een hoge treksterkte en rek heeft, is deze zeer eenvoudig te verwerken. De DPC folie is 30cm breed, op een rol van 50 meter in de kleur: zwart/grijs. Let op: deze folie is niet Uv-bestendig en kan geen lange tijd blootgesteld worden aan zonlicht.",
    "brand": "HouthandelOnline",
    "category": "Douglas hout > Toon alles in Douglas hout > Douglas hout palen > Douglas hout balken > Douglas hout latten en regels",
    "price": 17.28,
    "currency": "EUR",
    "price_raw": null,
    "specs": {
      "raw": {
        "Levertijd": "2-7 werkdagen",
        "Breedte": "300",
        "Materiaal": "DPC"
      }
    },
    "images": [
      "https://www.houthandelonline.nl/cdn/resize-extended/el:true/rs:fill/w:1500/h:1068/extend:true/background:255:255:255/path/media/catalog/product/d/p/dpc-folie-300mm-v_01_main.jpg"
    ],
    "rating": null,
    "review_count": null,
    "reviews_summary": null,
    "scraped_at": "2026-02-05T15:04:10.177431Z",
    "scrape_success": true,
    "scrape_errors": [],
    "embedding_text": "Product: DPC folie 280mu 300mm 50 meter op rol\nBrand: HouthandelOnline\nCategory: Douglas hout > Toon alles in Douglas hout > Douglas hout palen > Douglas hout balken > Douglas hout latten en regels\nDescription: DPC folie is geschikt voor het beschermen van muurlateien, funderingen en kozijnaansluitingen op het metselwerk tegen weersinvloeden. Deze 100% recyclebare en waterdichte folie heeft een stroeve wafelstructuur wat zorgt voor een optimale hechting. Doordat deze folie een hoge treksterkte en rek heeft, is deze zeer eenvoudig te verwerken. De DPC folie is 30cm breed, op een rol van 50 meter in de kleur: zwart/grijs. Let op: deze folie is niet Uv-bestendig en kan geen lange tijd blootgesteld worden aan zonlicht.\nSpecifications: Levertijd: 2-7 werkdagen, Breedte: 300, Materiaal: DPC\nPrice: EUR 17.28"
  },
  {
    "id": "b4ce45aafe46",
    "source_url": "https://www.houthandelonline.nl/betonpoer-antraciet-20x20-50cm",
    "name": "Betonpoer met draadeind en stelplaat 20x20cm (boven maat) 50cm antraciet",
    "description": "Deze rechte betonpoer van 200x200mm in de kleur antraciet heeft een hoogte van 500mm. Deze betonpoer wordt gebruikt om palen te stellen en ervoor te zorgen dat het hout niet in contact komt met de grond. Hierdoor wordt de levensduur verlengd. Daarnaast biedt het een stevige fundering voor het creëren van bouwprojecten zoals veranda's, carports of overkappingen. Deze poer wordt geleverd inclusief: M16 draadeind van 14cm, stelplaat van 90x90mm met opgelaste moer en M16 huls waar het draadeind ingedraaid wordt. Let op: separaat dienen 4 stuks van de 8x80mm tellerkopschroeven mee besteld te worden ter bevestiging van de stelplaat.",
    "brand": "HouthandelOnline",
    "category": "Douglas hout > Toon alles in Douglas hout > Douglas hout palen > Douglas hout balken > Douglas hout latten en regels",
    "price": 24.7,
    "currency": "EUR",
    "price_raw": null,
    "specs": {
      "raw": {
        "Levertijd": "2-7 werkdagen",
        "Kopmaat": "200x200 mm",
        "Dikte": "200 mm",
        "Breedte": "200",
        "Materiaal": "Beton"
      }
    },
    "images": [],
    "rating": null,
    "review_count": null,
    "reviews_summary": null,
    "scraped_at": "2026-02-05T15:04:10.177437Z",
    "scrape_success": true,
    "scrape_errors": [],
    "embedding_text": "Product: Betonpoer met draadeind en stelplaat 20x20cm (boven maat) 50cm antraciet\nBrand: HouthandelOnline\nCategory: Douglas hout > Toon alles in Douglas hout > Douglas hout palen > Douglas hout balken > Douglas hout latten en regels\nDescription: Deze rechte betonpoer van 200x200mm in de kleur antraciet heeft een hoogte van 500mm. Deze betonpoer wordt gebruikt om palen te stellen en ervoor te zorgen dat het hout niet in contact komt met de grond. Hierdoor wordt de levensduur verlengd. Daarnaast biedt het een stevige fundering voor het creëren van bouwprojecten zoals veranda's, carports of overkappingen. Deze poer wordt geleverd inclusief: M16 draadeind van 14cm, stelplaat van 90x90mm met opgelaste moer en M16 huls waar het draadeind ingedraaid wordt. Let op: separaat dienen 4 stuks van de 8x80mm tellerkopschroeven mee besteld te worden ter bevestiging van de stelplaat.\nSpecifications: Levertijd: 2-7 werkdagen, Kopmaat: 200x200 mm, Dikte: 200 mm, Breedte: 200, Materiaal: Beton\nPrice: EUR 24.7"
  },
  {
    "id": "75cf50217be3",
    "source_url": "https://www.houthandelonline.nl/dpc-folie-150mm",
    "name": "DPC folie 280mu 150mm 50 meter op rol",
    "description": "DPC folie is geschikt voor het beschermen van muurlateien, funderingen en kozijnaansluitingen op het metselwerk tegen weersinvloeden. Deze 100% recyclebare en waterdichte folie heeft een stroeve wafelstructuur wat zorgt voor een optimale hechting. Doordat deze folie een hoge treksterkte en rek heeft, is deze zeer eenvoudig te verwerken. De DPC folie is 15cm breed, op een rol van 50 meter in de kleur: zwart/grijs. Let op: deze folie is niet Uv-bestendig en kan geen lange tijd blootgesteld worden aan zonlicht.",
    "brand": "HouthandelOnline",
    "category": "Douglas hout > Toon alles in Douglas hout > Douglas hout palen > Douglas hout balken > Douglas hout latten en regels",
    "price": 8.63,
    "currency": "EUR",
    "price_raw": null,
    "specs": {
      "raw": {
        "Levertijd": "2-7 werkdagen",
        "Breedte": "150",
        "Materiaal": "DPC"
      }
    },
    "images": [
      "https://www.houthandelonline.nl/cdn/resize-extended/el:true/rs:fill/w:1500/h:1068/extend:true/background:255:255:255/path/media/catalog/product/d/p/dpc-folie-150mm-v_01_main.jpg"
    ],
    "rating": null,
    "review_count": null,
    "reviews_summary": null,
    "scraped_at": "2026-02-05T15:04:10.177442Z",
    "scrape_success": true,
    "scrape_errors": [],
    "embedding_text": "Product: DPC folie 280mu 150mm 50 meter op rol\nBrand: HouthandelOnline\nCategory: Douglas hout > Toon alles in Douglas hout > Douglas hout palen > Douglas hout balken > Douglas hout latten en regels\nDescription: DPC folie is geschikt voor het beschermen van muurlateien, funderingen en kozijnaansluitingen op het metselwerk tegen weersinvloeden. Deze 100% recyclebare en waterdichte folie heeft een stroeve wafelstructuur wat zorgt voor een optimale hechting. Doordat deze folie een hoge treksterkte en rek heeft, is deze zeer eenvoudig te verwerken. De DPC folie is 15cm breed, op een rol van 50 meter in de kleur: zwart/grijs. Let op: deze folie is niet Uv-bestendig en kan geen lange tijd blootgesteld worden aan zonlicht.\nSpecifications: Levertijd: 2-7 werkdagen, Breedte: 150, Materiaal: DPC\nPrice: EUR 8.63"
  },
  {
    "id": "dce080f10024",
    "source_url": "https://www.houthandelonline.nl/knauf-acoustifit-60mm",
    "name": "Isolatieplaat Knauf Acoustifit 60mm isolatiewaarde 1,60m2K/W 1 pak a 12 platen (9,72m2)",
    "description": "Veerkrachtige, isolatieplaat op basis van Ecose welke prettig verwerkt in wanden en plafonds met houten of metalen staanders en liggers. Vooral geschikt als wand- en plafondisolatie met eisen op het gebied van thermische-en geluidsisolatie.",
    "brand": "HouthandelOnline",
    "category": "Douglas hout > Toon alles in Douglas hout > Douglas hout palen > Douglas hout balken > Douglas hout latten en regels",
    "price": 46.69,
    "currency": "EUR",
    "price_raw": null,
    "specs": {
      "raw": {
        "Levertijd": "2-7 werkdagen",
        "Dikte": "60 mm",
        "Breedte": "600",
        "Materiaal": "Isolatie",
        "Toepassing": "Vooral geschikt als wand- en plafondisolatie met eisen op het gebied van thermische-en geluidsisolatie"
      }
    },
    "images": [
      "https://www.houthandelonline.nl/cdn/resize-extended/el:true/rs:fill/w:1500/h:1068/extend:true/background:255:255:255/path/media/catalog/product/k/n/knauf-acoustifit-60mm-v_01_main.jpg"
    ],
    "rating": null,
    "review_count": null,
    "reviews_summary": null,
    "scraped_at": "2026-02-05T15:04:10.177448Z",
    "scrape_success": true,
    "scrape_errors": [],
    "embedding_text": "Product: Isolatieplaat Knauf Acoustifit 60mm isolatiewaarde 1,60m2K/W 1 pak a 12 platen (9,72m2)\nBrand: HouthandelOnline\nCategory: Douglas hout > Toon alles in Douglas hout > Douglas hout palen > Douglas hout balken > Douglas hout latten en regels\nDescription: Veerkrachtige, isolatieplaat op basis van Ecose welke prettig verwerkt in wanden en plafonds met houten of metalen staanders en liggers. Vooral geschikt als wand- en plafondisolatie met eisen op het gebied van thermische-en geluidsisolatie.\nSpecifications: Levertijd: 2-7 werkdagen, Dikte: 60 mm, Breedte: 600, Materiaal: Isolatie, Toepassing: Vooral geschikt als wand- en plafondisolatie met eisen op het gebied van thermische-en geluidsisolatie\nPrice: EUR 46.69"
  },
  {
    "id": "4f1efe0c2630",
    "source_url": "https://www.houthandelonline.nl/knauf-acoustifit-45mm",
    "name": "Isolatieplaat Knauf Acoustifit 45mm isolatiewaarde 1,20m2K/W 1 pak a 16 platen (12,96m2)",
    "description": "Veerkrachtige, isolatieplaat op basis van Ecose welke prettig verwerkt in wanden en plafonds met houten of metalen staanders en liggers. Vooral geschikt als wand- en plafondisolatie met eisen op het gebied van thermische-en geluidsisolatie.",
    "brand": "HouthandelOnline",
    "category": "Douglas hout > Toon alles in Douglas hout > Douglas hout palen > Douglas hout balken > Douglas hout latten en regels",
    "price": 46.73,
    "currency": "EUR",
    "price_raw": null,
    "specs": {
      "raw": {
        "Levertijd": "2-7 werkdagen",
        "Dikte": "45 mm",
        "Breedte": "600",
        "Materiaal": "Isolatie",
        "Toepassing": "Vooral geschikt als wand- en plafondisolatie met eisen op het gebied van thermische-en geluidsisolatie"
      }
    },
    "images": [
      "https://www.houthandelonline.nl/cdn/resize-extended/el:true/rs:fill/w:1500/h:1068/extend:true/background:255:255:255/path/media/catalog/product/k/n/knauf-acoustifit-45mm-v_01_main.jpg"
    ],
    "rating": null,
    "review_count": null,
    "reviews_summary": null,
    "scraped_at": "2026-02-05T15:04:10.177453Z",
    "scrape_success": true,
    "scrape_errors": [],
    "embedding_text": "Product: Isolatieplaat Knauf Acoustifit 45mm isolatiewaarde 1,20m2K/W 1 pak a 16 platen (12,96m2)\nBrand: HouthandelOnline\nCategory: Douglas hout > Toon alles in Douglas hout > Douglas hout palen > Douglas hout balken > Douglas hout latten en regels\nDescription: Veerkrachtige, isolatieplaat op basis van Ecose welke prettig verwerkt in wanden en plafonds met houten of metalen staanders en liggers. Vooral geschikt als wand- en plafondisolatie met eisen op het gebied van thermische-en geluidsisolatie.\nSpecifications: Levertijd: 2-7 werkdagen, Dikte: 45 mm, Breedte: 600, Materiaal: Isolatie, Toepassing: Vooral geschikt als wand- en plafondisolatie met eisen op het gebied van thermische-en geluidsisolatie\nPrice: EUR 46.73"
  },
  {
    "id": "539fe8002a76",
    "source_url": "https://www.houthandelonline.nl/verstelbaar-anker-m20-verzinkt",
    "name": "Verstelbare paalhouder M20 verzinkt 110x110x160mm",
    "description": "Maak het plaatsen van palen op een houten of betonnen ondergrond nog eenvoudiger met dit verstelbare anker. De paalhouder M20 is gemaakt van verzinkt staal en heeft een verstelbare hoogte tussen 40 en 160mm. De platen hebben een afmeting van 110x110x6mm en zijn voorzien van 4 schroefgaten voor de bevestiging.",
    "brand": "HouthandelOnline",
    "category": "Douglas hout > Toon alles in Douglas hout > Douglas hout palen > Douglas hout balken > Douglas hout latten en regels",
    "price": 15.14,
    "currency": "EUR",
    "price_raw": null,
    "specs": {
      "raw": {
        "Levertijd": "2-7 werkdagen",
        "Breedte": "110",
        "Materiaal": "Verzinkt staal"
      }
    },
    "images": [
      "https://www.houthandelonline.nl/cdn/resize-extended/el:true/rs:fill/w:1500/h:1068/extend:true/background:255:255:255/path/media/catalog/product/v/e/verstelbaar-anker-m20-verzinkt-v_01_main.jpg",
      "https://www.houthandelonline.nl/cdn/resize-extended/el:true/rs:fill/w:1500/h:1068/extend:true/background:255:255:255/path/media/catalog/product/v/e/verstelbaar-anker-m20-verzinkt-v_02_view.jpg",
      "https://www.houthandelonline.nl/cdn/resize-extended/el:true/rs:fill/w:1500/h:1068/extend:true/background:255:255:255/path/media/catalog/product/v/e/verstelbaar-anker-m20-verzinkt-v_03_view_1.JPG"
    ],
    "rating": null,
    "review_count": null,
    "reviews_summary": null,
    "scraped_at": "2026-02-05T15:04:10.177459Z",
    "scrape_success": true,
    "scrape_errors": [],
    "embedding_text": "Product: Verstelbare paalhouder M20 verzinkt 110x110x160mm\nBrand: HouthandelOnline\nCategory: Douglas hout > Toon alles in Douglas hout > Douglas hout palen > Douglas hout balken > Douglas hout latten en regels\nDescription: Maak het plaatsen van palen op een houten of betonnen ondergrond nog eenvoudiger met dit verstelbare anker. De paalhouder M20 is gemaakt van verzinkt staal en heeft een verstelbare hoogte tussen 40 en 160mm. De platen hebben een afmeting van 110x110x6mm en zijn voorzien van 4 schroefgaten voor de bevestiging.\nSpecifications: Levertijd: 2-7 werkdagen, Breedte: 110, Materiaal: Verzinkt staal\nPrice: EUR 15.14"
  },
  {
    "id": "85bd75302d0e",
    "source_url": "https://www.houthandelonline.nl/gaasband",
    "name": "Gips gaasband 90m (zelfklevend 50mm breed)",
    "description": "Gipsplaat wapeningsband is een 1-zijdig zelfklevende glasvezelgaasband voor het wapenen van voegen tijdens het stucen van naden bij gipsplaten met een afgeschuinde kant. Het gebruik van de wapeningsband voorkomt scheurvorming.",
    "brand": "HouthandelOnline",
    "category": "Douglas hout > Toon alles in Douglas hout > Douglas hout palen > Douglas hout balken > Douglas hout latten en regels",
    "price": 9.28,
    "currency": "EUR",
    "price_raw": null,
    "specs": {
      "raw": {
        "Levertijd": "2-7 werkdagen",
        "Breedte": "50",
        "Materiaal": "Overig",
        "Toepassing": "Gaasband gebruik je om de naden van de gipsplaat af te plakken voordat de naden worden afgesmeerd, met als doel om scheurvorming op de naden te voorkomen"
      }
    },
    "images": [
      "https://www.houthandelonline.nl/cdn/resize-extended/el:true/rs:fill/w:1500/h:1068/extend:true/background:255:255:255/path/media/catalog/product/g/a/gaasband-v_01_main.jpg",
      "https://www.houthandelonline.nl/cdn/resize-extended/el:true/rs:fill/w:1500/h:1068/extend:true/background:255:255:255/path/media/catalog/product/g/a/gaasband-v_02_view.jpg",
      "https://www.houthandelonline.nl/cdn/resize-extended/el:true/rs:fill/w:1500/h:1068/extend:true/background:255:255:255/path/media/catalog/product/g/a/gaasband-v_03_view.jpg"
    ],
    "rating": null,
    "review_count": null,
    "reviews_summary": null,
    "scraped_at": "2026-02-05T15:04:10.177465Z",
    "scrape_success": true,
    "scrape_errors": [],
    "embedding_text": "Product: Gips gaasband 90m (zelfklevend 50mm breed)\nBrand: HouthandelOnline\nCategory: Douglas hout > Toon alles in Douglas hout > Douglas hout palen > Douglas hout balken > Douglas hout latten en regels\nDescription: Gipsplaat wapeningsband is een 1-zijdig zelfklevende glasvezelgaasband voor het wapenen van voegen tijdens het stucen van naden bij gipsplaten met een afgeschuinde kant. Het gebruik van de wapeningsband voorkomt scheurvorming.\nSpecifications: Levertijd: 2-7 werkdagen, Breedte: 50, Materiaal: Overig, Toepassing: Gaasband gebruik je om de naden van de gipsplaat af te plakken voordat de naden worden afgesmeerd, met als doel om scheurvorming op de naden te voorkomen\nPrice: EUR 9.28"
  },
  {
    "id": "30bf468f754b",
    "source_url": "https://www.houthandelonline.nl/filler-b45",
    "name": "Filler B45",
    "description": "Deze voegenvuller wordt in poedervorm geleverd en dient gemengd te worden met water. Deze filler kan gebruikt worden voor het afwerken van gipsplaten, gipsplaatnaden en schroefgaten. Hierbij wordt aangeraden alle naden te voorzien van gips gaasband tegen mogelijke scheurtjes.",
    "brand": "HouthandelOnline",
    "category": "Douglas hout > Toon alles in Douglas hout > Douglas hout palen > Douglas hout balken > Douglas hout latten en regels",
    "price": 6.41,
    "currency": "EUR",
    "price_raw": null,
    "specs": {
      "raw": {
        "Levertijd": "2-7 werkdagen",
        "Materiaal": "Gips",
        "Toepassing": "Per kilo poeder is 0,55 liter water benodigd, zie ook de beschrijving op de zak"
      }
    },
    "images": [
      "https://www.houthandelonline.nl/cdn/resize-extended/el:true/rs:fill/w:1500/h:1068/extend:true/background:255:255:255/path/media/catalog/product/f/i/filler-b45-v_01_main.jpg"
    ],
    "rating": null,
    "review_count": null,
    "reviews_summary": null,
    "scraped_at": "2026-02-05T15:04:10.177483Z",
    "scrape_success": true,
    "scrape_errors": [],
    "embedding_text": "Product: Filler B45\nBrand: HouthandelOnline\nCategory: Douglas hout > Toon alles in Douglas hout > Douglas hout palen > Douglas hout balken > Douglas hout latten en regels\nDescription: Deze voegenvuller wordt in poedervorm geleverd en dient gemengd te worden met water. Deze filler kan gebruikt worden voor het afwerken van gipsplaten, gipsplaatnaden en schroefgaten. Hierbij wordt aangeraden alle naden te voorzien van gips gaasband tegen mogelijke scheurtjes.\nSpecifications: Levertijd: 2-7 werkdagen, Materiaal: Gips, Toepassing: Per kilo poeder is 0,55 liter water benodigd, zie ook de beschrijving op de zak\nPrice: EUR 6.41"
  },
  {
    "id": "c2e10cdb83d4",
    "source_url": "https://www.houthandelonline.nl/dpc-folie-600mm",
    "name": "DPC folie 280mu 600mm 50meter op rol",
    "description": "DPC folie is geschikt voor het beschermen van muurlateien, funderingen en kozijnaansluitingen op het metselwerk tegen weersinvloeden. Deze 100% recyclebare en waterdichte folie heeft een stroeve wafelstructuur wat zorgt voor een optimale hechting. Doordat deze folie een hoge treksterkte en rek heeft, is deze zeer eenvoudig te verwerken. De DPC folie is 60cm breed, op een rol van 50 meter in de kleur: zwart/grijs. Let op: deze folie is niet Uv-bestendig en kan geen lange tijd blootgesteld worden aan zonlicht.",
    "brand": "HouthandelOnline",
    "category": "Douglas hout > Toon alles in Douglas hout > Douglas hout palen > Douglas hout balken > Douglas hout latten en regels",
    "price": 34.56,
    "currency": "EUR",
    "price_raw": null,
    "specs": {
      "raw": {
        "Levertijd": "2-7 werkdagen",
        "Breedte": "600",
        "Materiaal": "DPC"
      }
    },
    "images": [
      "https://www.houthandelonline.nl/cdn/resize-extended/el:true/rs:fill/w:1500/h:1068/extend:true/background:255:255:255/path/media/catalog/product/d/p/dpc-folie-600mm-v_01_main.jpg"
    ],
    "rating": null,
    "review_count": null,
    "reviews_summary": null,
    "scraped_at": "2026-02-05T15:05:06.948208Z",
    "scrape_success": true,
    "scrape_errors": [],
    "embedding_text": "Product: DPC folie 280mu 600mm 50meter op rol\nBrand: HouthandelOnline\nCategory: Douglas hout > Toon alles in Douglas hout > Douglas hout palen > Douglas hout balken > Douglas hout latten en regels\nDescription: DPC folie is geschikt voor het beschermen van muurlateien, funderingen en kozijnaansluitingen op het metselwerk tegen weersinvloeden. Deze 100% recyclebare en waterdichte folie heeft een stroeve wafelstructuur wat zorgt voor een optimale hechting. Doordat deze folie een hoge treksterkte en rek heeft, is deze zeer eenvoudig te verwerken. De DPC folie is 60cm breed, op een rol van 50 meter in de kleur: zwart/grijs. Let op: deze folie is niet Uv-bestendig en kan geen lange tijd blootgesteld worden aan zonlicht.\nSpecifications: Levertijd: 2-7 werkdagen, Breedte: 600, Materiaal: DPC\nPrice: EUR 34.56"
  },
  {
    "id": "18545b66a142",
    "source_url": "https://www.houthandelonline.nl/dpc-folie-500mm",
    "name": "DPC folie 280mu 500mm 50 meter op rol",
    "description": "DPC folie is geschikt voor het beschermen van muurlateien, funderingen en kozijnaansluitingen op het metselwerk tegen weersinvloeden. Deze 100% recyclebare en waterdichte folie heeft een stroeve wafelstructuur wat zorgt voor een optimale hechting. Doordat deze folie een hoge treksterkte en rek heeft, is deze zeer eenvoudig te verwerken. De DPC folie is 50cm breed, op een rol van 50 meter in de kleur: zwart/grijs. Let op: deze folie is niet Uv-bestendig en kan geen lange tijd blootgesteld worden aan zonlicht.",
    "brand": "HouthandelOnline",
    "category": "Douglas hout > Toon alles in Douglas hout > Douglas hout palen > Douglas hout balken > Douglas hout latten en regels",
    "price": 28.8,
    "currency": "EUR",
    "price_raw": null,
    "specs": {
      "raw": {
        "Levertijd": "2-7 werkdagen",
        "Breedte": "500",
        "Materiaal": "DPC"
      }
    },
    "images": [
      "https://www.houthandelonline.nl/cdn/resize-extended/el:true/rs:fill/w:1500/h:1068/extend:true/background:255:255:255/path/media/catalog/product/d/p/dpc-folie-500mm-v_01_main_1.jpg"
    ],
    "rating": null,
    "review_count": null,
    "reviews_summary": null,
    "scraped_at": "2026-02-05T15:05:06.948272Z",
    "scrape_success": true,
    "scrape_errors": [],
    "embedding_text": "Product: DPC folie 280mu 500mm 50 meter op rol\nBrand: HouthandelOnline\nCategory: Douglas hout > Toon alles in Douglas hout > Douglas hout palen > Douglas hout balken > Douglas hout latten en regels\nDescription: DPC folie is geschikt voor het beschermen van muurlateien, funderingen en kozijnaansluitingen op het metselwerk tegen weersinvloeden. Deze 100% recyclebare en waterdichte folie heeft een stroeve wafelstructuur wat zorgt voor een optimale hechting. Doordat deze folie een hoge treksterkte en rek heeft, is deze zeer eenvoudig te verwerken. De DPC folie is 50cm breed, op een rol van 50 meter in de kleur: zwart/grijs. Let op: deze folie is niet Uv-bestendig en kan geen lange tijd blootgesteld worden aan zonlicht.\nSpecifications: Levertijd: 2-7 werkdagen, Breedte: 500, Materiaal: DPC\nPrice: EUR 28.8"
  },
  {
    "id": "fffdef2c4d8e",
    "source_url": "https://www.houthandelonline.nl/dpc-folie-400mm",
    "name": "DPC folie 280mu 400mm 50meter op rol",
    "description": "DPC folie is geschikt voor het beschermen van muurlateien, funderingen en kozijnaansluitingen op het metselwerk tegen weersinvloeden. Deze 100% recyclebare en waterdichte folie heeft een stroeve wafelstructuur wat zorgt voor een optimale hechting. Doordat deze folie een hoge treksterkte en rek heeft, is deze zeer eenvoudig te verwerken. De DPC folie is 40cm breed, op een rol van 50 meter in de kleur: zwart/grijs. Let op: deze folie is niet Uv-bestendig en kan geen lange tijd blootgesteld worden aan zonlicht.",
    "brand": "HouthandelOnline",
    "category": "Douglas hout > Toon alles in Douglas hout > Douglas hout palen > Douglas hout balken > Douglas hout latten en regels",
    "price": 23.03,
    "currency": "EUR",
    "price_raw": null,
    "specs": {
      "raw": {
        "Levertijd": "2-7 werkdagen",
        "Breedte": "400",
        "Materiaal": "DPC"
      }
    },
    "images": [
      "https://www.houthandelonline.nl/cdn/resize-extended/el:true/rs:fill/w:1500/h:1068/extend:true/background:255:255:255/path/media/catalog/product/d/p/dpc-folie-400mm-v_01_main.jpg"
    ],
    "rating": null,
    "review_count": null,
    "reviews_summary": null,
    "scraped_at": "2026-02-05T15:05:06.948292Z",
    "scrape_success": true,
    "scrape_errors": [],
    "embedding_text": "Product: DPC folie 280mu 400mm 50meter op rol\nBrand: HouthandelOnline\nCategory: Douglas hout > Toon alles in Douglas hout > Douglas hout palen > Douglas hout balken > Douglas hout latten en regels\nDescription: DPC folie is geschikt voor het beschermen van muurlateien, funderingen en kozijnaansluitingen op het metselwerk tegen weersinvloeden. Deze 100% recyclebare en waterdichte folie heeft een stroeve wafelstructuur wat zorgt voor een optimale hechting. Doordat deze folie een hoge treksterkte en rek heeft, is deze zeer eenvoudig te verwerken. De DPC folie is 40cm breed, op een rol van 50 meter in de kleur: zwart/grijs. Let op: deze folie is niet Uv-bestendig en kan geen lange tijd blootgesteld worden aan zonlicht.\nSpecifications: Levertijd: 2-7 werkdagen, Breedte: 400, Materiaal: DPC\nPrice: EUR 23.03"
  },
  {
    "id": "19fb08c5dc13",
    "source_url": "https://www.houthandelonline.nl/dpc-folie-225mm",
    "name": "DPC folie 280mu 225mm 50meter op rol",
    "description": "DPC folie is geschikt voor het beschermen van muurlateien, funderingen en kozijnaansluitingen op het metselwerk tegen weersinvloeden. Deze 100% recyclebare en waterdichte folie heeft een stroeve wafelstructuur wat zorgt voor een optimale hechting. Doordat deze folie een hoge treksterkte en rek heeft, is deze zeer eenvoudig te verwerken. De DPC folie is 22,5cm breed, op een rol van 50 meter in de kleur: zwart/grijs. Let op: deze folie is niet Uv-bestendig en kan geen lange tijd blootgesteld worden aan zonlicht.",
    "brand": "HouthandelOnline",
    "category": "Douglas hout > Toon alles in Douglas hout > Douglas hout palen > Douglas hout balken > Douglas hout latten en regels",
    "price": 12.97,
    "currency": "EUR",
    "price_raw": null,
    "specs": {
      "raw": {
        "Levertijd": "2-7 werkdagen",
        "Breedte": "225",
        "Materiaal": "DPC"
      }
    },
    "images": [
      "https://www.houthandelonline.nl/cdn/resize-extended/el:true/rs:fill/w:1500/h:1068/extend:true/background:255:255:255/path/media/catalog/product/d/p/dpc-folie-225mm-v_01_main_1.jpg"
    ],
    "rating": null,
    "review_count": null,
    "reviews_summary": null,
    "scraped_at": "2026-02-05T15:05:06.948309Z",
    "scrape_success": true,
    "scrape_errors": [],
    "embedding_text": "Product: DPC folie 280mu 225mm 50meter op rol\nBrand: HouthandelOnline\nCategory: Douglas hout > Toon alles in Douglas hout > Douglas hout palen > Douglas hout balken > Douglas hout latten en regels\nDescription: DPC folie is geschikt voor het beschermen van muurlateien, funderingen en kozijnaansluitingen op het metselwerk tegen weersinvloeden. Deze 100% recyclebare en waterdichte folie heeft een stroeve wafelstructuur wat zorgt voor een optimale hechting. Doordat deze folie een hoge treksterkte en rek heeft, is deze zeer eenvoudig te verwerken. De DPC folie is 22,5cm breed, op een rol van 50 meter in de kleur: zwart/grijs. Let op: deze folie is niet Uv-bestendig en kan geen lange tijd blootgesteld worden aan zonlicht.\nSpecifications: Levertijd: 2-7 werkdagen, Breedte: 225, Materiaal: DPC\nPrice: EUR 12.97"
  },
  {
    "id": "a5ba4f4edd35",
    "source_url": "https://www.houthandelonline.nl/airseal-tape-60mmx25m-zwart",
    "name": "Airseal folie tape 60mmx25m zwart",
    "description": "Deze zwarte luchtdichte, waterkerende en Uv-bestendige tape is geschikt als afdichtings- en reparatietape bij bouwfolie overlappingen en verbindingen aan de buitenzijde van de constructie. Deze tape is Uv-bestendig en geschikt voor (gedeeltelijk) open gevels. Toepassing van de folietape zorgt voor een betrouwbare lucht- en waterdichte afdichting. De tape is 60mm breed en 25 meter lang.",
    "brand": "HouthandelOnline",
    "category": "Douglas hout > Toon alles in Douglas hout > Douglas hout palen > Douglas hout balken > Douglas hout latten en regels",
    "price": 23.66,
    "currency": "EUR",
    "price_raw": null,
    "specs": {
      "raw": {
        "Levertijd": "2-7 werkdagen",
        "Breedte": "60",
        "Materiaal": "Overig"
      }
    },
    "images": [
      "https://www.houthandelonline.nl/cdn/resize-extended/el:true/rs:fill/w:1500/h:1068/extend:true/background:255:255:255/path/media/catalog/product/M/o/Morgo-Tape-Airseal-Black_11285_2.jpg"
    ],
    "rating": null,
    "review_count": null,
    "reviews_summary": null,
    "scraped_at": "2026-02-05T15:05:06.948324Z",
    "scrape_success": true,
    "scrape_errors": [],
    "embedding_text": "Product: Airseal folie tape 60mmx25m zwart\nBrand: HouthandelOnline\nCategory: Douglas hout > Toon alles in Douglas hout > Douglas hout palen > Douglas hout balken > Douglas hout latten en regels\nDescription: Deze zwarte luchtdichte, waterkerende en Uv-bestendige tape is geschikt als afdichtings- en reparatietape bij bouwfolie overlappingen en verbindingen aan de buitenzijde van de constructie. Deze tape is Uv-bestendig en geschikt voor (gedeeltelijk) open gevels. Toepassing van de folietape zorgt voor een betrouwbare lucht- en waterdichte afdichting. De tape is 60mm breed en 25 meter lang.\nSpecifications: Levertijd: 2-7 werkdagen, Breedte: 60, Materiaal: Overig\nPrice: EUR 23.66"
  },
  {
    "id": "fca545918989",
    "source_url": "https://www.houthandelonline.nl/drukverdeelplaat",
    "name": "Drukverdeelplaat ø70mm",
    "description": "Voor het vastmaken van de PIR isolatieplaten gebruik je deze drukverdeelplaten in combinatie met een Woodpecker universele houtschroef. De lengte van de schroeven moeten de dikte van het isolatiemateriaal zijn plus 2cm. Voor de schroef kijk je bij ons bevestigingsmateriaal. Bij een afmeting van de PIR plaat 120x60cm zijn er 6 drukverdeelplaten benodigd, bij een afmeting van de PIR plaat 120x120cm zijn er 9 drukverdeelplaten nodig.",
    "brand": "HouthandelOnline",
    "category": "Douglas hout > Toon alles in Douglas hout > Douglas hout palen > Douglas hout balken > Douglas hout latten en regels",
    "price": 21.59,
    "currency": "EUR",
    "price_raw": null,
    "specs": {
      "raw": {
        "Levertijd": "2-7 werkdagen",
        "Dikte": "70 mm",
        "Materiaal": "Gegalvaniseerd staal"
      }
    },
    "images": [
      "https://www.houthandelonline.nl/cdn/resize-extended/el:true/rs:fill/w:1500/h:1068/extend:true/background:255:255:255/path/media/catalog/product/d/r/drukverdeelplaat-v_01_main.jpg"
    ],
    "rating": null,
    "review_count": null,
    "reviews_summary": null,
    "scraped_at": "2026-02-05T15:05:06.948339Z",
    "scrape_success": true,
    "scrape_errors": [],
    "embedding_text": "Product: Drukverdeelplaat ø70mm\nBrand: HouthandelOnline\nCategory: Douglas hout > Toon alles in Douglas hout > Douglas hout palen > Douglas hout balken > Douglas hout latten en regels\nDescription: Voor het vastmaken van de PIR isolatieplaten gebruik je deze drukverdeelplaten in combinatie met een Woodpecker universele houtschroef. De lengte van de schroeven moeten de dikte van het isolatiemateriaal zijn plus 2cm. Voor de schroef kijk je bij ons bevestigingsmateriaal. Bij een afmeting van de PIR plaat 120x60cm zijn er 6 drukverdeelplaten benodigd, bij een afmeting van de PIR plaat 120x120cm zijn er 9 drukverdeelplaten nodig.\nSpecifications: Levertijd: 2-7 werkdagen, Dikte: 70 mm, Materiaal: Gegalvaniseerd staal\nPrice: EUR 21.59"
  }
]